URL,page_count,job_title,company,location,job_Description,post_date,reviews
https://www.indeed.com/viewjob?jk=a71f5d5ff33c74bd&from=web&vjs=3,200,Enterprise Data Architect,Ultimate Medical Academy,"3101 W Dr Martin Luther King Jr Blvd, Tampa, FL 33607","Job Posting: UMA is a nonprofit healthcare educational institution with a national presence. Headquartered in Tampa, Florida and founded in 1994, UMA offers content-rich, interactive online programs as well as hands-on training at our Clearwater, Florida campus. Medical (including prescription), Dental, Vision (UMA subsidized) FSA/HSA (Depending on Medical Plan chosen) $50,000 Life Insurance (UMA paid) Additional Voluntary Life Insurance (Team Member paid) Employee Assistance Program – EAP (UMA paid) Long Term Disability (UMA paid) Short Term Disability (Team Member paid) Supplemental Insurance such as Critical Illness, Accident, and Hospital (Team Member Paid) Paid Time Off – 15 days accrued in year 1, 9 holidays, and 1 day of Volunteering Time Off 401k (eligible upon completion of 90 days of employment and must be at least 21 years of age) Pet Insurance Identity Theft Protection Purpose of the Position: The Enterprise Data Architect, as a part of the Enterprise Architecture team, provides key leadership around how UMA defines, organizes, catalogs, moves, stores, accesses, and secures data. The Enterprise Data Architects serves as a data champion and will liaison with other key members of the Technology teams, and with business stakeholders to define and build UMA’s data architecture. In this hands-on role, the Enterprise Data Architect not only plans, but also executes and technically delivers. The Enterprise Data Architect reports to the Vice President, Enterprise Solutions and Architecture.  Key Responsibilities:  Functional: Works cross-functionally with IT and business stakeholders to communicate data vision and develop consensus and support for data strategy. Evangelizes the data vision. Becomes the data liaison between the data consumer representatives, Enterprise Data Management (EDM), Software Engineer, and Business Insights (BI)/Strategy teams for solution development, integration and governance as well as be able to serve as the lead data architect on major enterprise projects. Builds a framework for semantic and structural integrity and consistency of data across the UMA enterprise. Creates the standard for documenting development data requirements for enterprise projects. Provides consultation on complex projects and becomes the primary data subject matter expert (SME) for multiple applications or technologies. Ensures all data project and development efforts properly align to UMA's Enterprise Architecture and Vision, and Security Requirements. Drives project knowledge back to the enterprise data model and ensure that it evolves correctly. Utilizes the maturity to participate in multiple complex programs at the same time in an agile environment. Provides clear, continuous, and consistent data architecture leadership at a detailed level within assigned project. Practices continued personal development as the company's preeminent source of data information, focusing on new and evolving data and architectural concepts and frameworks, governance, and process. Attends conferences, lectures, online offerings, formal and informal training and identify executive certificate opportunities.in areas of focus that could include: ITIL, COBIT, SAFe, TOGAF, etc. Implements a set of process and procedures that ensure that all production level code goes through rigorous testing and proper stage gate processes before going live. Creates checklists that define the requirements must be adhered during the development life cycle. Ensures that all work is properly documented and that all stakeholders are informed of any changes made to the code, processes or data and their implications on future and previously reported data. Creates a consistent release cycle for new development projects, system maintenance, and bug fixes where and when possible. Provides process and procedures for daily monitoring and data validation to ensure consistency in the system and anticipate potential issues before they are reported by end users. Performs other duties as assigned. Technical: Modernizes and owns the data architecture and oversight of core data platform, to facilitate Master and Meta Data Management, Data Governance, Data Quality Management, Data Integration and Distribution, Data Security, and Reporting / Business Intelligence. Designs and builds strategy around cloud-first capabilities (Azure) and toolsets, accelerating innovation cycles and delivery times. Defines the vision, strategy and principles for enterprise data management across at UMA. Understands and aligns data capabilities across multiple 3rd party vendor enterprise platforms. (ERP, LMS, CRM, CDP, etc.). Builds the Enterprise Entity Relationship Diagram (ERD) Builds working proof of concepts (PoCs) to demonstrate capabilities and provide reference models to Software Engineering, BI/Strategy, and EDM teams. Defines the normalization and denormalization strategy for data across UMA. Understands and designs for Microsoft’s Dataverse platform as UMA’s universal Common Data Model. Defines publish/subscribe (Pub/Sub) vs Application Programming Interface (API) access use cases and strategy. Collaborates with Strategy teams on data science strategy for Machine Learning/ Artificial Intelligence (ML/AI) use cases at UMA. Designs, creates, and optimizes data assets across multiple business units for both tactical and strategic initiatives across UMA. Understands business drivers and works with Enterprise Architect (EA) team to develop of multi-year data roadmap that includes developing information management strategy, processes and tools, data technology opportunities, and data architecture and frameworks. Establishes and leads in the usage of world-class processes to achieve consistent results. Embeds Continuous Integration/Continuous Delivery (CI/CD) principles and delivery methodologies directly into UMA’s data architecture. In conjunction with business and key IT stakeholders, leads the definition of standards for naming, describing, governing, managing, modeling, cleansing, enriching, transforming, moving, storing, searching and delivering all data within the enterprise. Maintains a solid understanding of current and emerging tools and determine when to use them. Collaborates with other Architects on the evaluation of new tools, products, frameworks and technologies with the goal of ultimately providing direction and selection criteria that will be used to evaluate and select among other items an Enterprise Data Management Tool, Business Intelligence Tool, Storage Concepts, and Big Data Platform and Framework. Drives the customers' transformation to Modern Data Architecture and store technologies such as Database/Data Warehouse, NoSQL, and Hadoop. Business Leadership Champions UMA's enterprise data management strategy that will promote the growth of the organization capabilities, technical maturity, and the Enterprise Data Management team. Acts as SME for the data architecture, framework, development, tools and technologies, and design to assist the business/operations and IT with solutions. Develops a deep understanding of the current/future technical challenges of customers, and based on that understanding, formulates an aspirational data architecture and transformation roadmap. Coordinates with other Architects to provide technical leadership to drive data and technology choices, strategy, and implementation decisions to achieve high reliability and performance. Support Institutional Initiatives Manages, mentors, develops, and coaches all levels of the Enterprise Data Management Team. Responsible for creating, articulating, and enforcing UMA's overall Enterprise Data Management vision, architecture, and best practices and standards at multiple levels of the Enterprise Data Management Team. Provides data related mentoring and coaching for architects across the EDM Team. Keeps current on institutional goals, objectives, and progress. Engages in institutional sponsored activities and initiatives as appropriate. Leads with courage in support of change initiatives that impact organization. Manages and assists in coordinating efforts between departments within UMA. Compliance: Demonstrates knowledge of, and carefully follows all applicable federal and state compliance requirements and regulations including those prescribed by the Department of Education, accrediting agencies, CIE, and internal UMA policies and procedures. Effectively communicates compliance requirements to students and other staff as appropriate and quickly escalates any compliance concerns to the Compliance department. Work Experience, Skills & Abilities: Minimum Requirements: Bachelor’s Degree in Computer Science or related discipline, or the equivalent combination of education and work experience. 10 years of diverse experience in designing and managing innovative data solutions beyond ETL and Warehousing. 10 years of experience implementing strategic, technical, architectural, and governance solutions related to Enterprise Data and Business Intelligence. Including: Business and IT Strategy Development, IT and DW Assessments, Project Planning, Estimating and Management, Executive Dashboard Reporting, Business Intelligence/Data Analytics, Data Warehousing, Data Modeling, Data Architecture Development, Database Design, Development and Administration, and Enterprise Data Management and Governance. 15 years of broad experience in the information technology to include business architecture, information architecture and strategy, IT strategic planning in a medium to large corporations. 15 years of experience in master data management, business intelligence and data warehousing. Broad knowledge of vendor capabilities in data management solutions – Master Data Management, Data Warehousing, Big Data, Data Quality, Business Intelligence etc. Experience working with Chief Security Officers to ensure security requirements are met and safeguards are firmly in place. These safeguards would be based on the results of a Data Security Assessment and would align with applicable regulatory requirements that could include Sarbanes-Oxley and Gramm-Leach-Bliley Acts. Able to professionally communicate in verbal and written English. Proficient in MS Office (Word, Excel, PowerPoint) and other business tools such as Skype and Microsoft Teams. Technical Skills: Expert knowledge in Enterprise Data Management, Business Intelligence, and ETL Tools. Expert knowledge of Entity Relationship modeling, metadata systems, data quality tools and techniques. Current with data trends and opportunities that align with UMA's data objectives (e.g., Cloud, Big Data, Tools, etc.) Skilled at logical and physical data modeling, architecture, warehousing, strategy and query languages. Functional Skills: Expert knowledge in Data Architecture, Enterprise Data Management and Governance, Master Data Management, Data Warehousing and Business Analytics and Intelligence. Strong experience and a deep understanding of data usage and lifecycles across the corporate infrastructure. Proven experience in managing the complete SDLC from architecture to delivery. Deep understanding of various ETL, Data Management, and Business Intelligence tools is required. Broad knowledge of Big Data principles and tools that will enable data efforts beyond Relational Databases (e.g., JSON/XML, NoSQL, Hadoop, YARN, Azure SQL, AWS Aurora, etc.). Communication/Teamwork/Service Focus Excellent communication skills that enable the presenting of solid business cases, forming of partnerships, and framing of issues for a wide variety of stakeholders including executive management. Able to collaborate with relevant business and functional heads to ensure alignment with tactical and strategic goals. Able to deliver convincing and persuasive presentations to both technical and business teams. Able to build strong performing teams, that are capable of accomplishing objectives without supervision. Interpersonal skills to that allows for work with other data architects, other teams within IT, and functional heads of the business units. Strategy: Possess strong organizational, facilitation and critical thinking abilities, to assess complex problems, analyze options, navigate diverse perspectives and objectives and develop acceptable Enterprise application and governance solutions. Ability to understand and communicate the data requirements of any future infrastructure needs, working with the IT architects to develop an approach that fits the current and planned needs of the enterprise. Able to support a diverse and inclusive work environment. Preferred Requirements: Bachelor’s Degree or other Advanced Degree in Computer Science or related discipline. More than 10 years of diverse experience in designing and managing innovative data solutions beyond ETL and Warehousing. More than 10 years of experience implementing strategic, technical, architectural, and governance solutions related to Enterprise Data and Business Intelligence. Including: Business and IT Strategy Development, IT and DW Assessments, Project Planning, Estimating and Management, Executive Dashboard Reporting, Business Intelligence/Data Analytics, Data Warehousing, Data Modeling, Data Architecture Development, Database Design, Development and Administration, and Enterprise Data Management and Governance. More than 15 years of broad experience in the information technology to include business architecture, information architecture and strategy, IT strategic planning in a medium to large corporations. More than 15 years of experience in master data management, business intelligence and data warehousing. Working Environment: Ability to work full-remote, on-site, or a hybrid attendance model Flexibility to work evenings and weekends as needed. Physical Demands: Requires long periods of sitting at a desk working on a computer. Requires occasional bending, stooping and squatting Requires occasional lifting of up to 10 lbs.",30+ days ago,"1,206 reviews"
https://www.indeed.com/viewjob?jk=f745a7d7be547603&from=web&vjs=3,200,Otter.AI | Speaker Identification Engineer,Recruiting From Scratch,"Miami, FL","Who is Recruiting from Scratch: Recruiting from Scratch is a premier talent firm that focuses on placing the best product managers, software, and hardware talent at innovative companies. Our team is 100% remote and we work with teams across the United States to help them hire. About our Client Join our client in transforming the way remote teams work and communicate. Their AI-powered collaborative note-taking app works across Zoom, Google Meet, and Microsoft Teams to help teams record, transcribe, search and share meeting notes. In addition, we are making virtual meetings accessible to all employees - allowing team members with disabilities to participate in a world that is now dominated by virtual meetings.  With over 10M users experiencing their product, they are making an impact at scale and we are growing fast. The team is made up of top talent from companies like Google, Facebook, Yahoo!, Microsoft, Pinterest, Spotify, and Plaid. They are backed by leading investors that include David Cheriton (Google’s first investor), Tim Draper ( Draper Associates ), Spectrum Equity, Horizons Ventures, GGV Capital, and Duke University.  About this role Our client is seeking an experienced Speaker Identification Engineer (Junior | Senior | Staff) to join our technology team and solve challenging technical problems in processing collaborative voice conversations. Members of the technology team work as a group and with colleagues in engineering and product to devise and deploy new algorithms for speech recognition, speaker diarization, and recognition.  Qualifications M.S. in Computer Science or equivalent Strong programming skills with working knowledge of C++ and Python 1-3 years of experience working on DNN based speaker id and diarization system Experience with TensorFlow, PyTorch, or similar frameworks Experience working in a Linux environment Team player with good communication skills (oral and written)Qualifications Preferred Qualifications Ph.D. in Computer Science, Speech/Language Processing or Machine Learning Familiarity with the state of the art in deep learning Experience with end-to-end neural network based speaker recognition Experience with MapReduce, Spark, or similar frameworks Experience building crawlers Experience administering Linux clusters Experience developing web applications Employee Benefits Stock. Be a [literal] stakeholder in our company’s future.   Food. Enjoy catered meals and boundless snacks. Fun. We host team lunches weekly and team events bi-quarterly. People. Work with talented, collaborative, and friendly people who love what they do. Health and Saving. Receive the benefits of comprehensive health, dental, vision and disability insurance.",30+ days ago,
https://www.indeed.com/viewjob?jk=78bfab1690d273f4&from=web&vjs=3,200,Senior Manager Statistical Programming (Remote),MMS Holdings Inc.,"Miami, FL 33130","MMS is an award-winning, data-focused CRO that supports the pharmaceutical and biotech industries with a proven, scientific approach to complex trial data and regulatory submission challenges. Strong industry experience and a data-driven approach to drug development make MMS a valuable CRO partner, creating compelling submissions that meet rigorous regulatory standards. With a global footprint across four continents, MMS maintains a 97 percent customer satisfaction rating and was named as the Best Global Biotech CRO in the 2018 International Life Sciences Awards. For more information, visit www.mmsholdings.com or follow MMS on LinkedIn. Roles & Responsibilities: Departmental and Process Oversight Responsible for professional development of colleagues Provides leadership, mentors, and develops personnel by maintaining a positive work environment Defines program testing criteria, including debugging / troubleshooting, and preservation of source codes Leads and implements programming departmental process improvements Demonstrates a strong understanding of CDISC standards, GCP/ ICH guidelines, and FDA regulations and ensures incorporation into departmental process improvements as needed Creates department training exercises and ensures training occurs as required Responsible for hiring recommendations of personnel to meet the resourcing needs of the company; working with PM to understand forecasting of resourcing needs Responsible for planning and resourcing for on-time delivery of project deliverables that meet quality objectives; ensures clear communication with PM for ensuring assignment of the best fit resource Works with management in other departments to develop business initiatives and process improvements across the organization; solution focused Identifies future risks and provides solutions before the risks become a barrier to producing quality deliverables on time Ensures the departmental goals are met and are in line with company goals Deliverable Oversight Travels to client sites as necessary Defines and documents client specifications and ensures compliance to customer templates Confers with client to confirm all specification assumptions are correct Develops data and programming specifications jointly with other programmers and statisticians Responsible for quality assurance to ensure programming integrity Assists with resolving client concerns for programming issues as needed Responsible for implementation and execution of high quality clinical programming Trains via self-study and self-practice independently and explores advanced topics related to programming and/or drug development Interacts directly and independently with client to coordinate all facets of projects; expert communicator who has developed strong relationships with clients Works with statistical team to provide definitions, documentation and review of derived variables needed to produce planned tables, listings, and graphs (TLGs) Generates tables, listings, and graphs from clinical trial databases using SAS Develops programs, verifies, validates, and maintains clinical trial databases and data entry screens using SAS and related software Designs specific data presentations including creative summary tables, graphs, and patient listings Independently implements and validates QC findings in compliance with NC Handling Procedure Conducts thorough self-review of deliverables prior to releasing to client; serves as expert reviewer for others Demonstrates complete proficiency in client interactions Takes initiative to suggest and implement programming improvements and follows through to completion Leads projects, delegates tasks, and manages timelines, resources, budgets, clients, internal team, and deliverables independent of management Fully accountable for providing highest quality deliverables to satisfy or exceed client requirements Functions as a highly technical resource to the organization Produces and presents external company presentations providing industry visibility for the organization Builds and maintains strong client contacts and relationships Continually suggesting solutions to solve issues in tune with organizational direction Job Requirements: Bachelor’s or Master’s degree in computer science, health care, or clinical programming discipline with industry or relevant experience 6+ years SAS programming, SAS Base, SAS Macro experience Strong programming and logic skills, including ability to program data presentations and produce TLGs 2+ Year of experience leading a small team of Statistical Programmers Effectively communicates with senior level contributors and managers on the sponsor side Provides guidance and coaching to the individual contributor level colleagues on how to effectively resolve client's issues and concerns, while maintaining a high degree of customer service Drives focus on continuous improvement among direct reports. Helps team members identify and implement process improvement specific to the team and projects Decisions and problem-solving are guided by policies, procedures and business plan; receives guidance and oversight from higher level Manager Develops managerial, coaching and leadership skills. Accountable for results of a small team (1-3) of individual contributors. Sets priorities for the team based on service line objectives to ensure task completion; coordinates work activities with other managers. Coordinates and supervises the daily activities of a support or operations team Responsible for managing resourcing for existing projects and project pipelines. Requires significant oversight from more senior Manager to ensure resource alignment with team specific projects and project pipeline. Provides input on resource planning Strong problem-solving skills Experience with leading regulatory submission components is preferred Excellent understanding e-submission requirements Expertise in drug development as it pertains to programming; has the ability to apply drug development knowledge during production of high quality programs Extensive hands-on experience with clinical trials and pharmaceutical development Extensive experience with data and production of TLGs Excellent programming and logic skills Excellent understanding of CDISC standards and HL-7 standards Extensive SAS programming, SAS Base, SAS Macro experience Thorough and extensive knowledge of clinical database structures Strong capabilities in programming data presentations, using program such as SAS procedures Subject matter expert in SAS programming skills; willing to guide others in a variety of programming techniques Expert proficiency with MS Office applications Excellent organizational and communication skills Familiarity with ISO 9001:2015 and ISO 27001:2013 standards preferred. Familiarity with 21 CFR Part 11, FDA, and GCP requirements. Basic understanding of CROs and scientific & clinical data/terminology, & the drug development process.  HgOb2lPQjx",21 days ago,
