URL,page_count,job_title,company,location,job_Description,post_date,reviews
https://www.indeed.com/viewjob?jk=935db914d3be4512&from=web&vjs=3,200,Manager Statistical Programming (Remote),MMS Holdings Inc.,"Miami, FL 33130","MMS is an award-winning, data-focused CRO that supports the pharmaceutical and biotech industries with a proven, scientific approach to complex trial data and regulatory submission challenges. Strong industry experience and a data-driven approach to drug development make MMS a valuable CRO partner, creating compelling submissions that meet rigorous regulatory standards. With a global footprint across four continents, MMS maintains a 97 percent customer satisfaction rating and was named as the Best Global Biotech CRO in the 2018 International Life Sciences Awards. For more information, visit www.mmsholdings.com or follow MMS on LinkedIn. Roles & Responsibilities: Departmental and Process Oversight Responsible for professional development of colleagues Provides leadership, mentors, and develops personnel by maintaining a positive work environment Defines program testing criteria, including debugging / troubleshooting, and preservation of source codes Leads and implements programming departmental process improvements Demonstrates a strong understanding of CDISC standards, GCP/ ICH guidelines, and FDA regulations and ensures incorporation into departmental process improvements as needed Creates department training exercises and ensures training occurs as required Responsible for hiring recommendations of personnel to meet the resourcing needs of the company; working with PM to understand forecasting of resourcing needs Responsible for planning and resourcing for on-time delivery of project deliverables that meet quality objectives; ensures clear communication with PM for ensuring assignment of the best fit resource Works with management in other departments to develop business initiatives and process improvements across the organization; solution focused Identifies future risks and provides solutions before the risks become a barrier to producing quality deliverables on time Ensures the departmental goals are met and are in line with company goals Deliverable Oversight Travels to client sites as necessary Defines and documents client specifications and ensures compliance to customer templates Confers with client to confirm all specification assumptions are correct Develops data and programming specifications jointly with other programmers and statisticians Responsible for quality assurance to ensure programming integrity Assists with resolving client concerns for programming issues as needed Responsible for implementation and execution of high quality clinical programming Trains via self-study and self-practice independently and explores advanced topics related to programming and/or drug development Interacts directly and independently with client to coordinate all facets of projects; expert communicator who has developed strong relationships with clients Works with statistical team to provide definitions, documentation and review of derived variables needed to produce planned tables, listings, and graphs (TLGs) Generates tables, listings, and graphs from clinical trial databases using SAS Develops programs, verifies, validates, and maintains clinical trial databases and data entry screens using SAS and related software Designs specific data presentations including creative summary tables, graphs, and patient listings Independently implements and validates QC findings in compliance with NC Handling Procedure Conducts thorough self-review of deliverables prior to releasing to client; serves as expert reviewer for others Demonstrates complete proficiency in client interactions Takes initiative to suggest and implement programming improvements and follows through to completion Leads projects, delegates tasks, and manages timelines, resources, budgets, clients, internal team, and deliverables independent of management Fully accountable for providing highest quality deliverables to satisfy or exceed client requirements Functions as a highly technical resource to the organization Produces and presents external company presentations providing industry visibility for the organization Builds and maintains strong client contacts and relationships Continually suggesting solutions to solve issues in tune with organizational direction Job Requirements: Bachelor’s or Master’s degree in computer science, health care, or clinical programming discipline with industry or relevant experience 6+ years SAS programming, SAS Base, SAS Macro experience Strong programming and logic skills, including ability to program data presentations and produce TLGs 2+ Year of experience leading a small team of Statistical Programmers Effectively communicates with senior level contributors and managers on the sponsor side Provides guidance and coaching to the individual contributor level colleagues on how to effectively resolve client's issues and concerns, while maintaining a high degree of customer service Drives focus on continuous improvement among direct reports. Helps team members identify and implement process improvement specific to the team and projects Decisions and problem-solving are guided by policies, procedures and business plan; receives guidance and oversight from higher level Manager Develops managerial, coaching and leadership skills. Accountable for results of a small team (1-3) of individual contributors. Sets priorities for the team based on service line objectives to ensure task completion; coordinates work activities with other managers. Coordinates and supervises the daily activities of a support or operations team Responsible for managing resourcing for existing projects and project pipelines. Requires significant oversight from more senior Manager to ensure resource alignment with team specific projects and project pipeline. Provides input on resource planning Strong problem-solving skills Experience with leading regulatory submission components is preferred Excellent understanding e-submission requirements Expertise in drug development as it pertains to programming; has the ability to apply drug development knowledge during production of high quality programs Extensive hands-on experience with clinical trials and pharmaceutical development Extensive experience with data and production of TLGs Excellent programming and logic skills Excellent understanding of CDISC standards and HL-7 standards Extensive SAS programming, SAS Base, SAS Macro experience Thorough and extensive knowledge of clinical database structures Strong capabilities in programming data presentations, using program such as SAS procedures Subject matter expert in SAS programming skills; willing to guide others in a variety of programming techniques Expert proficiency with MS Office applications Excellent organizational and communication skills Familiarity with ISO 9001:2015 and ISO 27001:2013 standards preferred. Familiarity with 21 CFR Part 11, FDA, and GCP requirements. Basic understanding of CROs and scientific & clinical data/terminology, & the drug development process.  9tmJ7BFwqM",21 days ago,
https://www.indeed.com/viewjob?jk=2ea515680df0af86&from=web&vjs=3,210,Mathematical Statistics Content Writer (Contract),Study.com,United States,"As an Statistics Content Writer, you’ll be: Choosing from a large list of statistics topics & problem types Creating two to three example problems for a specific statistics skill Writing engaging, step-by-step explanations teaching students how to understand & solve your example problems (and any similar problems they may encounter) As an  Statistics  Content Writer, you’ll receive the following: Reliable payment: Timely, reliable payments twice a month via PayPal. All work is paid per piece. Per piece rates vary based on complexity and length of content. Flexibility: Work according to your own schedule with no waiting, no assignments, and productivity/hourly requirements Support: Access to an incredibly supportive in-house team to answer your questions Work satisfaction: The knowledge that you're helping millions of students achieve their academic goals! What we’re looking for: Experience teaching or tutoring high school or early college statistics A bachelor’s degree or higher in statistics, math, education or a related field Fluent English writing and reading skills Do you think you can be an Statistics Content Writer for Study.com? Click “ Apply Now ” at the bottom to fill out an application and submit your resume! About Study.com At Study.com, our goal is to make education accessible by providing fun, engaging video lessons and other learning resources for students, teachers, and parents. Today, over 30 million students use Study.com every month to achieve their educational and academic goals. To supplement our existing collection of statistics lessons, we are now developing an extensive library of example problems with clear, step-by-step explanations to help students develop and practice their statistics skills. We recently ranked 10th on Virtual Vocations' top 25 list of best partners for remote work in 2021, and we're growing our team of contractors even further! US123  Vn4CU1VJFX",30+ days ago,92 reviews
https://www.indeed.com/viewjob?jk=bf8a17a4a2203e13&from=web&vjs=3,200,Senior Architect (Voice Skills/AI/Machine Learning),Andor Health,"Orlando, FL 32839","Position Summary Andor Health is seeking an experienced  Senior Architect (Voice Skills/AI/Machine Learning) . The successful candidate will be joining our passionate team of professionals who are working to develop, market, sell, and support new healthcare technology solutions that transform the way clinical teams collaborate and coordinate care. At Andor Health, our mission is to deliver technology solutions that help healthcare organizations streamline clinical team collaboration, meet regulatory requirements and achieve better health outcomes for patients. Responsibilities   Architect, Design, Develop and Deploy enterprise solutions which include components such as Chatbots, Voice / Virtual Assistants, Machine Learning and Cognitive Services. Familiarity to voice skills SDK's, process flows, intents as well as an SDK (Alexa Skills, Google Actions, SiriKit). Experience delivering highly scalable solutions utilizing a cloud provider such as AWS, Azure or GCP. Provide end-to-end technical lead for complex application development projects which include requirements gathering analysis design planning development testing and implementation of technology solutions. The ideal candidate should be experienced with leading from a technical perspective for teams consisting of multiple technical practitioner areas, including applications, cloud providers, security, customer service, technical support, quality management, etc. The ideal candidate should understand product management and will work with customer engagement leads, sales staff, and executive management to ensure that solutions and delivery continue to meet customer requirements while adapting to ongoing market and competitive conditions. The successful candidate will work with new and existing customers to provide solution engineering expertise necessary to successfully design, build, and deliver solutions that meet customer requirements. Perform code reviews to ensure best practices are being followed. Provide guidance for new feature integration and key architectural decisions. Provide advanced technical consulting and advice to others on solution design. Create design documents, including existing modules. Quickly prototype new ideas/technologies to create proof of concept and demos. Qualifications Experience in the healthcare industry 5-7+ years of varied experience in Information Technology 2-4 years of experience in Machine Learning & Artificial Intelligence/Machine Learning/Deep Learning Experience with machine learning software, such as Azure ML, TensorFlow, Theano and Torch In-depth experience with the SDLC development lifecycle and software development methodologies Strong process development skills with the ability to learn and understand technical concepts in order to interpret document and formalize procedures Strong programming skills in SQL, C#, .NET, Java, JavaScript Background in speech algorithms, statistical probability, advanced machine learning techniques Experience in Natural Language Processing (NLP), Statistical Language Modeling (SLM), Text-to-Speech (TTS), Automatic Speech Recognition (ASR), Natural Language Understanding (NLU) and Signal Processing Named Entity, Keyword and Topic Extraction Deep-learning Chatbots and dialog modeling Intent detection, Query Parsing and Semantic mapping Preferred B.S. or B.A. in Computer Science or related discipline 2-4 years' experience in the Microsoft Azure technology stack Experience with SDK's like Slack or Microsoft Teams The preceding functions may not be comprehensive in scope regarding work performed by an employee assigned to this position classification. Management reserves the right to add, modify, change, or rescind the work assignments of this position. Management also reserves the right to make reasonable accommodations so that a qualified employee(s) can perform the essential functions of the position. At Andor Health, our greatest strength comes from bringing together talented people with diverse perspectives to support the technological needs of physicians, hospitals, and post-acute organizations across the globe. Andor Health offers a comprehensive compensation and benefits package, including holidays, vacation, medical, dental, and vision insurance, company paid life insurance and retirement savings. Andor Health's policy is to provide equal employment opportunity and affirmative action in all of its employment practices without regard to race, color, religion, sex, national origin, ancestry, marital status, protected veteran status, age, individuals with disabilities, sexual orientation, or gender identity or expression or any other legally protected category. Applicants for North American based positions with Andor Health must be legally authorized to work in the United States or Canada. Verification of employment eligibility will be required as a condition of hire. EOE Minorities/Females/Individuals with Disabilities/Protected Veterans Drug Free Workplace EEO Law Poster and Supplement",1 day ago,
https://www.indeed.com/viewjob?jk=fd731f847a16de8e&from=web&vjs=3,200,Senior Associate Data Science & Analytics,Razorfish,"2911 Grand Ave, Miami, FL 33133","Company Description Hi there! We’re Razorfish. We’ve been leading the marketing industry with our digital expertise since the start of the internet. But in 2020, we did a full reboot. What’s different? It all starts with people. Weird, wonderful, complex people - with diverse backgrounds in strategy, creative and technology. But no matter how different we are, we all have one thing in common. We believe our differences are our strength. So we push for inclusion, challenge convention and bring in new perspectives, to inspire new ideas. Because when we connect by understanding what makes people different, we can create unforgettable experiences that enrich lives. Join us at razorfish.com.   Job Description Razorfish is seeking a Senior Associate of Data Science & Analytics on an ongoing contract basis. This role will be responsible for campaign work including performance reporting, profiling, targeting, segmentation, and optimization and data work (SQL). The role combines experience with campaign targeting, segmentation, test design/learning plans, reporting and optimization of: Account data (first and 3rd party), including demographics Transactional data (product registrations, eComm, offer redemption) Engagement data (impressions, ad clicks, email opens/clicks, push notifications taps, web visits and clickstream) Responsibilities: Analysis & Insights Aggregate data from multiple sources to deliver reporting and analysis Analyze digital clickstream analytics to uncover meaningful insights for optimization recommendations Creating and maintaining reporting dashboards in data visualization resources Adept at performing statistical analysis, such as calculating statistical significance, forecasting, distributions, etc. Effectively communicate complex ideas to primary client contacts, both verbally and in writing Testing & Optimization Identify new ideas and opportunities for analytic projects Working with analysts, designers and product owners to design hypotheses and ideate on test ideas Bringing A/B test ideas to market, monitor performance and report on results Has or is interested in developing skills to be a hands-on practitioner of multivariate statistical analysis (regression and simple segmentation)   Qualifications Required Skills: Data Visualization with a tool such as Power BI, Data Studio, Tableau or other Digital Media Measurement SQL, experience with a data environment such as AWS, Azure, BigQuery Test Design, Implementation, & Measurement Advanced Excel & PowerPoint Preferred Skills: Marketing Automation CRM channels (email, Push Notifications) R or Python Adobe Analytics, Google Analytics, Optimize, Test & Target DMP/Digital media Social media Data Mining / Profiling Who are you? 3-5 years of experience in Data Science, Marketing Analytics, Digital Marketing, or a business-related field Bachelor’s degree, in Marketing, Business, Engineering or a related field Passion for digital analytics, working with data and deriving insights to answer client business questions Comfort with working in and contributing to a fast-paced, team-based environment Additional Information As part of our dedication to an inclusive and diverse workforce, Publicis Sapient is committed to Equal Employment Opportunity without regard for race, color, national origin, ethnicity, gender, protected veteran status, disability, sexual orientation, gender identity, or religion. We are also committed to providing reasonable accommodations for qualified individuals with disabilities and disabled veterans in our job application procedures. If you need assistance or an accommodation due to a disability, you may contact us at hiring@publicissapient.com or you may call us at  +1-617-621-0200 .",30+ days ago,79 reviews
https://www.indeed.com/viewjob?jk=e40f17707fc25916&from=web&vjs=3,210,Jr. Data Science Engineers,Enhance IT,United States,"Jr. Machine Learning Implementation Engineers Who We Are: Enhance IT is an IT/Management firm that specializes in training, placement and IT consultation. We are an industry leader in providing top-level skilled and experienced consultants in a variety of technologies to meet our client’s needs in today’s fast paced environment. What you will be doing: You will be joining our ever-expanding data scientist team as it grows to meet the needs of the market. We want individuals who think “outside the box” and are comfortable asking “why?” The ideal candidate for this role is highly analytical with a knack for analysis, math and statistics. They are a team player possessing critical thinking and problem-solving skills with a passion for machine-learning and research. They need to possess the technical skills to explain the “how” and “what” behind technical decisions to non-tech stakeholders. What you need for this position: Master's degree from an accredited college/university in Computer Science, Statistics, Mathematics, Engineering, Econometrics, or related fields, PhD is preferred. Alternatively, Bachelor’s Degree with at least 2 years’ experience as a Data Analyst, Data Scientist, or Research Assistant. Strong Proficiency in Python or Java programming language, or expertise with functional/object- oriented programming. Ability to translate objectives to a project plan with milestones, and resource/technology requirements, and teach, lead, and manage projects/people/clients to successful execution. Ability to work across multiple engagements with clients to assess needs, provide assistance, and resolve problems, using structured problem solving and communication to both technical and non- technical audiences. Availability to travel and live in the U.S. Bonus points: Experience with command-line scripting, data structures and algorithms and ability to work in a Linux environment, processing large amounts of data in a cloud environment. Experience in machine learning, artificial intelligence and/or artificial neural networks. Proficiency in applying various mathematical and statistical models to include, but not limited to: discrete event simulation, factor analysis, genetic algorithms, Bayesian probability models, hidden Markov models, sensitivity analysis, sampling, probability, multivariate data analysis, regression, PCA, time-series analysis. Broad understanding of databases (e.g. SQL, NoSQL, Lucene, Mongo), and high-performance or distributed processing (e.g. using MapReduce, Spark, Pig, and/or Hive). Experience with visualization software (Tableau, D3, MicroStrategy, PowerBI). Experience delivering solutions in an Agile environment. Experience with Tensorflow, Theano or Keras. Portfolio of public & private data science projects you’re proud of (GitHub, Kaggle, DrivenData, etc.) Publications in peer-reviewed journals. Other programming languages such as Scala, Java, R Benefits & Perks Full benefits including Medical/Dental/Vision Paid travel to and from the Atlanta HQ Paid Time Off 401(k) savings plan 8-week training in Atlanta, GA prior to going on live projects Please check us out... Instagram –  https://www.instagram.com/enhanceitcommunity/ LinkedIn –  https://www.linkedin.com/company/enhance-it-com/?viewAsMember=true Website + testimonials –  https://www.enhanceit.com/testimonials YouTube –  https://www.youtube.com/channel/UCYBe7WrZ8lM3MJInS1ZczvQ Facebook -  https://www.facebook.com/enhanceitcommunity Job Type: Full-time Pay: From $30.00 per hour Schedule: 8 hour shift Education: Bachelor's (Required) Work Location: Multiple locations Work Location: Multiple Locations",,11 reviews
https://www.indeed.com/viewjob?jk=fa2212eb9fccd73b&from=web&vjs=3,200,"Mgr, Data Science",CEDENT,"Tampa, FL","Title: Mgr, Data Science @ : Tampa, Fl Terms of Hire: Full time.  Job description : The ideal candidate will have strong business acumen, an innate ability to generate business value using analytics, and an entrepreneurial mindset. This person will love solving challenging business problems to increase sales and/or reduce expenses, and will be passionate about finding creative, practical ways to drive organizational strategy. Responsibilities: Identify opportunities in the organization where analytics and data science will generate value.  Meet with business partners to understand their most challenging business issues and design practical, yet impactful, data-driven solutions to help solve their business challenges.  Lead the development of data science and analytics solutions with business leaders in membership, insurance, travel, distribution and automotive services.  Develop data science project plans, manage deliverables, and measure ROI for data science initiatives.  Leverage your unique analytical abilities and business experience to distill complex analysis into actionable, compelling recommendations for business partners  Contribute to the success of the team by providing training, thought leadership, and mentorship.  Supervisory Responsibilities:  Manages a team of Data Scientists with varying levels of experience and skill sets.  Preferred Qualifications: :  MBA or Master’s degree preferred, or the equivalent combination of education and experience.  Qualifications: :  Required Qualifications: :  Education: Bachelor’s degree in Business, Economics, Marketing, Statistics or related field.  Experience: 3+ years managing direct reports  Proven experience leading high-performing teams.  Experience using creative and innovative analytical approaches to solve challenging business problems.  Experience in translating statistical analysis into compelling stories that inspire action  Knowledge and Skills: Proven ability to identify and cultivate new business opportunities  Ability to successfully communicate with Executives, Mid-Level Manager, Marketing Strategists and Business leaders to identify business problems and opportunities, design and implement the best analytics solution and communicate the results of analytics projects.  Excellent oral and written communication, with the ability to communicate technical concepts in the context of the business problem, using easy-to-understand business language.  You Will Enjoy: :  An opportunity to be a part of a great culture, an awesome team, a challenging work environment, and some fun along the way!  Apply today to learn more and be part of our Growth story.  All applications will be kept strictly confidential and once shortlisted, our team will be in touch with you for further discussions.",30+ days ago,
