URL,page_count,job_title,company,location,job_Description,post_date,reviews
https://www.indeed.com/viewjob?jk=1a2ec63af5517dc8&from=web&vjs=3,190,Natural Language Processing Engineer,Instasks App platform,"Miami, FL","Instasks App is a Professional Concierge Service. The app provides top-tiered professionals and clients with an online platform. Our unique approach to building an App is to give the client and the provider instant bookings and an easy process of all services: For example, client requests for quick tasks and large projects. Providers receive custom requests for their specialized skills. The app takes care of all invoicing between client and provider with a detailed invoice. And book all the confirmed jobs. We track providers' locations for the client's en route to any job. We created a portal platform to guide you in listing your professions. The platform provides you with schedules, invoicing and credit card processing are all part of the enhanced technology. Clients will have a choice to give the providers reviews and star ratings to ensure our elite services when booking on our app. Our mission is to help all providers strive to achieve their financial and independent goals. To have more time with their families and create a brighter future for all. The App offers opportunities to providers over the age of 18 and, by law, over the age of 21 for any tasks serving liquor. Build your future with a secure & safe platform. Be your own boss by choosing the TASKS that best suit your schedules and be available to work when you want to work. Build your income to help increase your revenue. Book tasks that are within a 15-mile radius. Our language preferred gives you better communication skills during your tasks. Our client's and providers' health & well-being are our highest priorities.  BACKGROUND CHECK POLICY:  All providers accountants go through an extensive (background check) through a third party company. The certificates they receive are in place to ensure the provider and client feel safe. The document you receive from the third-party background company can be given to any job you are applying for. Our policy states all providers must go through a third party background check only after you are confirmed for a job. We request you do not go through the background check link until you are confirmed for any jobs.  ETIQUETTE TRAINING POLICY:  Each provider will go through etiquette training to ensure that every provider is a friendly and well-mannered individual. We are poised to give our clients the very best in professional service. Our platform should leave no room for laxity as we work hard to bring the very best to our customers.  SKILLS AND ABILITIES:  Requires working from detailed instructions and occasional independent decision-making. Ability to read, analyze and interpret documents such as safety rules, operating and maintenance instructions, or procedural manuals. We are looking for a Natural Language Processing Engineer to help us improve our NLP products and create new NLP applications. NLP Engineer's responsibilities include transforming natural language data into useful features using NLP techniques to feed classification algorithms. To succeed in this role, you should possess outstanding skills in statistical analysis, machine learning methods and text representation techniques. Your ultimate goal is to develop efficient self-learning NLP applications. Responsibilities   Study and transform data science prototypes.  Design NLP applications.  Select appropriately annotated datasets for Supervised Learning methods.  Use effective text representations to transform natural language into useful features.  Find and implement the right algorithms and tools for NLP tasks.  Develop NLP systems according to requirements.  Train the developed model and run evaluation experiments.  Perform statistical analysis of results and refine models.  Extend ML libraries and frameworks to apply in NLP tasks.  Remain updated in the rapidly changing field of machine learning.  Requirements   Proven experience as an NLP Engineer or similar role.  Understanding of NLP techniques for text representation, semantic extraction techniques, data structures and modelling.  Ability to effectively design software architecture.  Deep understanding of text representation techniques (such as n-grams, a bag of words, sentiment analysis etc), statistics and classification algorithms.  Knowledge of Python, Java and R.  Ability to write robust and testable code.  Experience with machine learning frameworks (like Keras or PyTorch) and libraries (like scikit-learn).  Strong communication skills.  An analytical mind with problem-solving abilities.  Degree in Computer Science, Mathematics, Computational Linguistics or a similar field.  ",28 days ago,
https://www.indeed.com/viewjob?jk=e6475f1935c3e32d&from=web&vjs=3,190,Senior Data Analyst - ETL Lead,Capgemini,"Orlando, FL","Senior Data Analyst - ETL Lead 055713  Job Description:  ETL Lead – 9-10 years of Data Management Leadership experience in data lakes, data warehouses, data marts and semantic models. Experience leading teams or on-shore, off-shore, internal organization and external organization members Be able to create a plan or backlog and manage to it with the proper artifacts, and processes Waterfall Agile Must have experience in Software Engineering Techniques, Software Engineering Architecture, Software Engineering Lifecycle and Data Management. Should be proficient in Business Analysis, Business Knowledge, Software Engineering Leadership, Architecture Knowledge and Technical Solution Design Experience with Dev/OPS architecture, implementation and operation Experience with Data Management & data warehouse architecture best practices, patterns and guidelines in reference to Star schemas, Data Vaults, RDBMS, and ODS Change Data capture Slowly changing dimensions Data governance Data quality Partitioning and tuning Data Stewardship Survivorship Fuzzy Matching Concurrency Vertical and horizontal scaling ELT, ETL Spark, Hadoop, MPP, RDBMS Review code developed by other programmers, mentor, guide and monitor their work ensuring adherence to programming and documentation policies. Experience working on Data Migration projects Good Analytical Skills to solve the Data Related Queries & Issues. Proven expertise in performance tuning of sources, targets, mappings and sessions. . Previous Experience of Support / Development on data warehouse ETL projects Previous Experience of Analysis, Design , Build, Unit Testing, QA Testing, UAT TestProduction Deployment Expert SQL and data analysis skill, ability to debug and fix data issue Technologies (Select based on requirement) Databases - Oracle, Teradata, Postgres, SQL Server, Big Data, Snowflake, or Redshift Tools – Talend, Informatica, SSIS, Matillion, Glue, or Azure Data Factory Languages – SQL, PL-SQL, T-SQL, Python, Java, or Scala JDBC/ODBC, JSON Data Virtualization data services lead Service Delivery Leadership - REST, Web Services Data Virtualization Delivery Leadership - Denodo Required Skills (Top 3): ELT, ETL Cloud certification AWS, Azure or GoogleBuilding Complex SQL Queries Preferred Skills (Nice to Have Skills): SnowPro Certification Python/PySpark  Experience: 9 - 10 years  Candidates should be flexible / willing to work across this delivery landscape which includes and not limited to Agile Applications Development, Support and Deployment.  Applicants for employment in the US must have valid work authorization that does not now and/or will not in the future require sponsorship of a visa for employment authorization in the US by Capgemini. Responsible for importing, cleaning, transforming, validating and modeling data with the purpose of understanding and drawing conclusions from data (may be presented in charts, graphs, and/or tables). Also, design and develop relational databases for collecting and storing data and build and design data input and data collection mechanisms.   Required Skills and Experience:   You Supervise, mentor, guide other data analysts. Represent data analyst team in project team meetings.   Qualifications: 6-8 years (2 years min relevant experience in the role) experience, Bachelor’s Degree.  Must have experience in Software Engineering Techniques, Software Engineering Architecture, Software Engineering Lifecycle and Data Management.  Should be proficient in Business Analysis, Business Knowledge, Software Engineering Leadership, Architecture Knowledge and Technical Solution Design.   Capgemini is an Equal Opportunity Employer encouraging diversity in the workplace. All qualified applicants will receive consideration for employment without regard to race, national origin, gender identity/expression, age, religion, disability, sexual orientation, genetics, veteran status, marital status or any other characteristic protected by law.  This is a general description of the Duties, Responsibilities and Qualifications required for this position. Physical, mental, sensory or environmental demands may be referenced in an attempt to communicate the manner in which this position traditionally is performed. Whenever necessary to provide individuals with disabilities an equal employment opportunity, Capgemini will consider reasonable accommodations that might involve varying job requirements and/or changing the way this job is performed, provided that such accommodations do not pose an undue hardship.  Click the following link for more information on your rights as an Applicant - http://www.capgemini.com/resources/equal-employment-opportunity-is-the-law   About Capgemini   Capgemini is a global leader in consulting, digital transformation, technology and engineering services. The Group is at the forefront of innovation to address the entire breadth of clients’ opportunities in the evolving world of cloud, digital and platforms. Building on its strong 50-year+ heritage and deep industry-specific expertise, Capgemini enables organizations to realize their business ambitions through an array of services from strategy to operations. Capgemini is driven by the conviction that the business value of technology comes from and through people. Today, it is a multicultural company of 270,000 team members in almost 50 countries. With Altran, the Group reported 2019 combined revenues of €17billion.   Visit us at www.capgemini.com. People matter, results count.   Job  Developer Schedule  Full-time Primary Location  US-FL-Orlando Organization  I&D",30+ days ago,"8,360 reviews"
https://www.indeed.com/viewjob?jk=2623876d0e518a2c&from=web&vjs=3,190,Otter.AI | Speaker Identification Engineer,Recruiting From Scratch,"Clearwater, FL 33759","Who is Recruiting from Scratch:   Recruiting from Scratch is a premier talent firm that focuses on placing the best product managers, software, and hardware talent at innovative companies. Our team is 100% remote and we work with teams across the United States to help them hire.   About our Client   Join our client in transforming the way remote teams work and communicate. Their AI-powered collaborative note-taking app works across Zoom, Google Meet, and Microsoft Teams to help teams record, transcribe, search and share meeting notes. In addition, we are making virtual meetings accessible to all employees - allowing team members with disabilities to participate in a world that is now dominated by virtual meetings.  With over 10M users experiencing their product, they are making an impact at scale and we are growing fast. The team is made up of top talent from companies like Google, Facebook, Yahoo!, Microsoft, Pinterest, Spotify, and Plaid. They are backed by leading investors that include David Cheriton  (Google’s first investor), Tim Draper ( Draper Associates ), Spectrum Equity, Horizons Ventures, GGV Capital, and Duke University.  About this role   Our client is seeking an experienced Speaker Identification Engineer (Junior | Senior | Staff) to join our technology team and solve challenging technical problems in processing collaborative voice conversations. Members of the technology team work as a group and with colleagues in engineering and product to devise and deploy new algorithms for speech recognition, speaker diarization, and recognition.  Qualifications   M.S. in Computer Science or equivalent   Strong programming skills with working knowledge of C++ and Python   1-3 years of experience working on DNN based speaker id and diarization system   Experience with TensorFlow, PyTorch, or similar frameworks   Experience working in a Linux environment   Team player with good communication skills (oral and written)Qualifications   Preferred Qualifications   Ph.D. in Computer Science, Speech/Language Processing or Machine Learning   Familiarity with the state of the art in deep learning   Experience with end-to-end neural network based speaker recognition   Experience with MapReduce, Spark, or similar frameworks   Experience building crawlers   Experience administering Linux clusters   Experience developing web applications   Employee Benefits Stock. Be a [literal] stakeholder in our company’s future.    Food. Enjoy catered meals and boundless snacks.   Fun. We host team lunches weekly and team events bi-quarterly.   People. Work with talented, collaborative, and friendly people who love what they do.   Health and Saving. Receive the benefits of comprehensive health, dental, vision and disability insurance.",30+ days ago,
https://www.indeed.com/viewjob?jk=1589cdba8dd70979&from=web&vjs=3,190,Data Scientist,Envision,United States,"Basic Qualifications:   PhD with 1 year of experience or MS with 2 years of experience in Operations Research, Applied Mathematics, Statistics, Data Science, or another highly quantitative discipline.  Demonstrated experience in formulating MILP or MIQCP optimization models and/or deep reinforcement learning models for real world problems.  Strong Python coding skills for data analysis and modeling, including experience with standard data science packages (numpy, pandas, matplotlib, seaborn).  Ability to learn new quantitative domains and modeling techniques.  Self-motivated and able to work independently as well as part of a team.  Strong communication skills for interactions with team members.   Preferred Qualifications:   Demonstrated experience building optimization, reinforcement learning, predictive machine learning, simulation, and/or statistical models.  Experience with at least one or more of the following optimization software and modeling language: PuLP, GPLK, CBC, CPLEX, AMPL, GAMS, or GUROBI.  Passion for writing well-structured, well-tested, maintainable, performant, and well-documented code, with an emphasis on scientific code.  Experience translating scientific models into code.  Applied experience with agricultural science and/or agricultural datasets.  Experience using tools for big datasets, such as SQL and PySpark.  Experience using version control systems, e.g. git.  ",23 days ago,12 reviews
https://www.indeed.com/viewjob?jk=16f27112d9bad5df&from=web&vjs=3,200,Senior Statistical Programmer,Everest Clinical Research,United States,"Everest Clinical Research (“Everest”) is a full-service contract research organization (CRO) providing a broad range of expertise-based clinical research services to worldwide pharmaceutical, biotechnology, and medical device industries. We serve some of the best-known companies and work with many of the most advanced drugs, biologics, and medical devices in development today. Everest has been an independent CRO since 2004 with a strong foundation as a statistical and data management center of excellence. Building on this foundation, Everest has successfully developed and established itself as a full-service CRO. Everest’s headquarters are located in Markham (Greater Toronto Area), Ontario, Canada with additional sites in Little Falls (Greater New York City Area), New Jersey, USA, and Shanghai (Pudong Zhangjiang New District), China. Everest is known in the industry for its high quality deliverables, superior customer service, and flexibility in meeting clients’ needs. A dynamic organization with an entrepreneurial origin, Everest continues to experience exceptional growth and great success. Quality is our backbone, customer-focus is our tradition, flexibility is our strength…that’s us…that’s Everest. To drive continued success in this exciting clinical research field, we are seeking committed, skilled, and customer-focused individuals to join our winning team as  Senior Statistical Programmers  for our Little Falls, New Jersey, USA on-site location, or remotely from a home-based office anywhere in the USA in accordance with our Work from Home policy. Key Accountabilities: Design and specify study data tabulation models and analysis data models for clinical trials or for the integration of clinical trial data from multiple trials (e.g. ISS and ISE datasets). These designs and specifications are completed in accordance with common industry standards and conventions, statistical requirements and specifications, and/or clinical trial sponsor’s requirements. Generate complete and efficient analysis data models following approved dataset designs or specifications. Perform independent validation of datasets created by other programmers or statisticians. Develop SAS programming codes and generate complete and accurate statistical output reports of trial data in well-defined formats. Develop SAS programming codes to independently validate statistical output reports of trial data generated by other programmers or statisticians. Develop and test SAS codes for clinical trial database logical checks and reports for ongoing data review. Document data and programming information in accordance with corporate SOPs and guidelines. Archive clinical trial data (study data tabulation models and analysis data models) and programming information in accordance with corporate archival SOPs and guidelines. Develop and provide expertise in other programming and system administration areas when required. Provide technical guidance and support to less experienced Statistical Programmers. Contribute to the continuous improvement of the statistical programming processes and procedures. Contribute to the establishment of therapeutic area programming standards/conventions/procedures within assigned therapeutic areas as a lead programmer. Contribute to the establishment of client specific programming standards/conventions/procedures for assigned clients when required. Qualifications and Experience: A Master’s in Computer Science or Math/Statistics with at least five years experience To find out more about Everest Clinical Research and to review other opportunities, please visit our website at www.ecrscorp.com We thank all interested applicants, however, only those selected for an interview will be contacted. Everest is committed to upholding the principles of dignity, independence, integration, and equal opportunity. We welcome and encourage applications from people with disabilities, and upon request we will provide accommodations for candidates participating in any part of our recruitment and selection process. #LI-Remote #LI-MG1 Equal Opportunity Employer/Protected Veterans/Individuals with Disabilities The contractor will not discharge or in any other manner discriminate against employees or applicants because they have inquired about, discussed, or disclosed their own pay or the pay of another employee or applicant. However, employees who have access to the compensation information of other employees or applicants as a part of their essential job functions cannot disclose the pay of other employees or applicants to individuals who do not otherwise have access to compensation information, unless the disclosure is (a) in response to a formal complaint or charge, (b) in furtherance of an investigation, proceeding, hearing, or action, including an investigation conducted by the employer, or (c) consistent with the contractor’s legal duty to furnish information. 41 CFR 60-1.35(c)",15 days ago,10 reviews
