URL,page_count,job_title,company,location,job_Description,post_date,reviews
https://www.indeed.com/viewjob?jk=52aa24a9e7058aa2&from=web&vjs=3,190,"Manager, Data Science",Healthmap Solutions Inc,"4631 Woodland Corporate Blvd, Tampa, FL 33614","Company Background Healthmap Solutions (Healthmap) is an NCQA-accredited industry leading kidney population health management company. Healthmap uses big data resources, integrated advanced technology, clinical expertise, and complex care management to improve the lives of people living with kidney disease. Healthmap also helps healthcare providers and payers achieve the value-based results they need. Our company is a diverse and growing organization committed to our clients, the patients we support, and our employees. We are champions for better health, for those who need us most. Position Summary The Manager of Data Science will be responsible for supporting Healthmap’s sales, product, operational, and performance initiatives through data research, analytics, visualization, and modeling. This individual will develop benchmarks for Data Science individuals to ensure analyses are completed on time and accurately. Manager will be tasked with day-to-day concerns and require agility for quick and/or changing deadlines. Manager will review data findings and offer constructive criticism to guide individual employees towards success. This individual is responsible for motivating team members and dissolve barriers to advancement. The manager, like all Data Science teammates, is expected to have personal experience with data analytics. This individual is to have a thorough and current understanding of client data to successfully guide the team. Responsibilities Manages and motivates analysts towards strategic department goals Works with department director to properly implement strategic projects with employee skills and schedule Determines metrics to measure and evaluate individual and team performance Fosters an environment of intellectual curiosity and mentor analysts towards constant improvement Performs functions related to problem definition, data collection, interpretation and analysis, visualization, and presentation/communication of results and recommendations Maintains a working knowledge of healthcare coding and analytics techniques Manages personal and employee time appropriately to deliver results Identifies and reconciles roadblocks to success Ensures documentation of all processes, analyses, design, data definitions, and development Works with various cross-functional teams including sales, product development, clinical, and care services Discovers opportunities for team growth or change, and engages with department director to determine best course(s) of action Requires HIPAA understanding and complete confidentiality protocols: Associate must demonstrate understanding and sign confidentiality documents Employee is expected to comply with HIPAA privacy laws and all other federal, state, and local regulations Report suspected or detected security events via company provided communication channels Follow all company-defined operational policies and procedures Protect and maintain confidentiality of company and customer information, policies, and processes The responsibilities listed are a general overview; other responsibilities may be assigned Perform other related duties as assigned Requirements Bachelor’s degree (Master’s preferred) in mathematics, statistics, biostatistics, economics, public health, healthcare management and policy, or similar background 3-5 years’ work experience in analytics, preferably health analytics Minimum 3 years’ experience with SQL 5+ years’ experience with statistical software such as SAS or R preferred Management of large-scale projects and team lead experience Per Healthmap’s HR Security Policy, this position is considered HY (high risk for PHI and may require additional training/screening) Skills Excellent problem-solving abilities, critical thinking, strong quantitative capabilities, team contributor Oral and written communication, often adapted to non-analytical audiences Self-starter mentality: ability to take an idea from research to presentation and implementation Good project management, time management and organizational skills Ability to motivate team members towards department and company goals An interest in and desire to learn about the constantly evolving population health industry",30+ days ago,14 reviews
https://www.indeed.com/viewjob?jk=0435d3a842c74638&from=web&vjs=3,190,Algorithms/AI Engineer II,Elbit Systems of America,"Orlando, FL","Company Description Elbit Systems of America is a leading provider of high performance products, system solutions, and support services focusing on the defense, homeland security, commercial aviation, and medical instrumentation markets. With facilities throughout the United States, Elbit Systems of America is dedicated to supporting those who contribute daily to the safety and security of the United States. Elbit Systems of America, LLC is wholly owned by Elbit Systems Ltd. (NASDAQ: ESLT and TASE: ESLT), a global high technology company engaged in a wide range of programs for innovative defense and commercial applications. For additional information, visit: www.elbitsystems-us.com or follow us on Twitter.   Job Description The position is for an Algorithm/Artificial Intelligence (AI) Engineer I with 0-2 years’ experience, to work on Machine Learning & Artificial Intelligence R&D and Rapid Prototyping efforts at the Elbit Systems of America (ESA) Orlando site. The job is critical to developing, demonstrating, and quantifying AI capabilities across ESA’s product and market portfolio. Algorithm development and deployment are central to this job function.   Qualifications Knowledge, Skills, Abilities Required  (Unique and Measurable): 0 to 2 years of defense, academic, or industrial experience in artificial intelligence, statistical machine learning, deep learning, Computer Vision, and natural language processing. C, C++, Python, Matlab, Java experience Experience implementing algorithms in Cuda (Highly Desired) Unix/Linux OS experience (Highly Desired) Embedded Software experience (Highly Desired) Experience with Image processing / computer vision algorithm development Machine Learning (ML) Network optimization for tactical applications Hardware/software integration Simulation and Modeling User Interface development Experience creating and presenting model output and performance of data to stakeholders. Ability to read recent AI/ML research papers and adapt those into models to solve real world problems. Experience creating and applying advanced statistical methods and complex algorithms such as: regression, clustering, simulation, scenario analysis, neural networks, deep/reinforcement learning, genetic algorithms, and other machine learning techniques. Experience with any deep learning framework, including Tensorflow, Caffe, MxNet, Torch, Theano. Responsibilities & Tasks: Develop and analyze highly complex algorithms. Implementation of algorithms in hardware and an understanding of the system design architecture trade space. Provide technical support to customer, user lab, and on-aircraft testing Perform system/product integration. Verification and validation of highly complex system designs to ensure conformance with functional specifications and customer requirements. Produce and/or review technical documents, specifications and standards. Prepare Technical level presentations. Provide outside contact with ESA affiliates and other contractors. An ability to effectively document and communicate designs, results, reports, status and presentations. Work independently and with internal/external organizations Willingness to travel Domestically and Internationally. Authorities: Operates under the direct supervision of their supervisor. Business Relationships: Must support customer demonstrations Works closely with business unit program manager Minimum Qualifications: Bachelor's Degree is required. Specific Degree Field:  Computer Science, Software Engineering, Systems Engineering, Machine Learning, Artificial Intelligence, Data Science, or related Additional Information As a contractor to the U.S. federal government, all Elbit Systems of America employees are required to be fully vaccinated against COVID-19. As a result, full vaccination is required for this position unless you are legally entitled to an accommodation. All your information will be kept confidential according to EEO guidelines.",3 days ago,116 reviews
https://www.indeed.com/viewjob?jk=d5b6e36790f24c6d&from=web&vjs=3,190,Senior Data Analyst,ReedTMS Logistics,"ReedTMS Logistics in Tampa, FL 33619","The Senior Data Analyst supervises the data analysts by setting goals for performance and deadlines in ways that comply with company’s plans and vision, organize workflows, ensure that employees understand their duties and delegated tasks, monitor data analyst productivity, and provide constructive feedback and coaching. Additionally, the Senior Data Analyst manages data marts, develop reports, and troubleshoot data issues. This includes creating ETL pipelines, designing Tableau dashboards/Crystal reports and maintaining the data warehouse. The Senior Data Analyst will also develop integration solutions by using REST APIs. The role requires a deep understanding of data analysis, databases and predictive modeling. Attention to detail, creativity and the ability to troubleshoot are essential for this position. ESSENTIAL FUNCTIONS:  Managing and designing the reporting environment, including data sources, security and metadata. Developing predictive models for forecasting to foster decision-making analysis. Designing and publishing Tableau dashboards and Crystal reports on the server to provide KPIs. Creating and managing ETL pipelines for the data mart. Managing SQL Server databases including login, server role and security administration. Troubleshooting data issues in data marts and reporting. Administering user management on Tableau portal. Identifying, analyzing and interpreting trends or patterns in complex data sets. Supporting the data warehouse in identifying and revising reporting requirements. Providing technical expertise on data storage structures, data mining and data cleansing. Facilitating all levels of management by addressing questions related to the business. EXPERIENCE:  Three to five (3-5) years’ experience in data analysis and reporting. EDUCATION:  4 years college degree in Information Technology discipline. KNOWLEDGE, SKILLS, ABILITIES:  Strong knowledge of MS SQL server, SSMS, SSIS and Queries Knowledge of Tableau and Crystal Report Ability to design and implement ETL pipelines Hands-on experience with predictive modeling, forecasting and analytical skills Understanding of REST APIs and the ability to use them. Outstanding organizational and leadership skills Excellent communication and interpersonal skills Hands-on experience with Python is a plus Understanding of data warehousing concepts and data mart techniques. Good troubleshooting and problem-solving skills Ability to effectively present information and respond to questions from managers Capability to work with people at all levels of an organization Ability to meet deadlines and satisfy needs with multiple and conflicting priorities Able to develop and master new skills quickly The intent of this job description is to describe the major duties and responsibilities performed by incumbents of this job. Incumbents may be required to perform other job-related tasks other than those specifically included in this description. We are proud to be an EEO employer M/F/D/V. We maintain a drug-free workplace. Note to Recruiters and Placement Agencies:   We do not accept unsolicited resumes from outside recruiters /placement agencies. ReedTMS will not pay fees associated with resumes presented through unsolicited means. Job Type: Full-time Benefits: 401(k) 401(k) matching Dental insurance Flexible spending account Health insurance Health savings account Life insurance Paid time off Vision insurance Schedule: Day shift Monday to Friday Application Question(s): Will you require VISA sponsorship in the future? Work Location: One location Work Remotely: No Work Location: One location",,47 reviews
https://www.indeed.com/viewjob?jk=7bccc33e6f7290b3&from=web&vjs=3,180,Junior Data Scientist/Database Engineer - Technology,Arena Investors LP,"Jacksonville, FL","Arena Investors, LP (""Arena"") is a global investment management firm that seeks to generate attractive risk adjusted, consistent and uncorrelated returns by employing a fundamentals based, asset-oriented financing and investing strategy across the entire credit spectrum in areas where conventional sources of capital are scarce. Arena specializes in off-the-run, stressed, distressed, illiquid and esoteric special situation transactions through originations and acquisitions of asset-oriented investments across a wide array of asset types (including but not limited to private direct corporate credit, commercial real estate bridge lending, and commercial and consumer assets). Quaestor Advisors, LLC (“Quaestor”) is an affiliated Special Servicer, which provides mid and back office services, including asset management, to Arena Investors and external clients. Quaestor is looking to expand the Technology team, through the addition of a junior-to-mid-level database developer/data scientist who has a passion for coding, troubleshooting data and solving problems. The right candidate would be a key contributor to a proprietary financial data warehouse that is crucial to running its business. Responsivities would include analyzing data, troubleshooting logic problems, monitoring data health and developing data transformations/stored procedures while learning to interface with business-side sponsors from asset management, accounting, and operations. Ideal candidates will be organized, analytical, self-motivated, resourceful and able to work/communicate effectively with all internal functional groups. This is a great opportunity to be a part of a large-scale fintech platform while honing one’s technical skills and learning the private credit business. Responsibilities Analyze/Troubleshoot financial data of Arena’s Datawarehouse. Assist with projects/tasks related to data analysis, data visualization, and reporting for our Operations, Finance & Asset Management departments. Develop stored procedures and data transformations. Develop PowerBI visualizations. Requirements Bachelor’s degree in computer science from a top university. 3-5 years experience in technology – tech pure play, startup, fintech, etc. Internships/Co-ops experience is a plus. Strong Relational Database knowledge (MS SQL Server, etc). Fluency in SQL, T-SQL, Stored Procedures. Familiarity with PowerBI (or Tableau) for data visualizations. Familiarity with SSRS for reporting. Experience with accounting, fund-accounting, trading operations-related data a plus. Familiarity with web development (HTML5, Javascript, jQuery, CSS, REST, etc) a plus. Familiarity with OOP and at least one language (C#, Java, etc) a plus. Comfortable with Agile/Scrum SDLC. A positive attitude, strong work ethic and a desire to work collaboratively across the organization. Strong attention to detail. Benefits  Health Care Plan (Medical, Dental & Vision)  Retirement Plan (401k, IRA)  Life Insurance (Basic, Voluntary & AD&D)  Paid Time Off (Vacation, Sick & Public Holidays)  Family Leave (Maternity, Paternity)  Short Term & Long Term Disability  Training & Development  Work From Home  Free Food & Snacks  Wellness Resources",30+ days ago,
https://www.indeed.com/viewjob?jk=6a08ce7a1b81e504&from=web&vjs=3,190,"Machine Learning Engineer, Speech Synthesis",Recruiting From Scratch,"Clearwater, FL 33759","Who is Recruiting from Scratch: Recruiting from Scratch is a premier talent firm that focuses on placing the best product managers, software, and hardware talent at innovative companies. Our team is 100% remote and we work with teams across the United States to help them hire. We work with companies funded by the best investors including Sequoia Capital, Lightspeed Ventures, Tiger Global Management, A16Z, Accel, DFJ, and more. If you are a fit, the team will reach out to you about this role or any others that may be a fit for our clients.  Our  Client Our client recently raised a $5.5M seed round led by top investors including Human Capital, General Catalyst, and other tier-1 VCs. This role is 100% remote. They are building the next generation of speech software to help with voice conversion, particularly for those with accents. They are looking for Machine Learning Researchers to work in aspects of AI for speech and text-to-speech, including speech recognition and synthesis, speaker identification, and acoustic event detection. You should be up to date with the latest research and you will help influence the direction of the product and technology.  The Role  Provide direction on technology by understanding most up to date research in speech synthesis and speech recognition   Perform research to advance the science and technology of intelligent machines.   Develop novel and accurate speech algorithms and systems, leveraging deep learning and machine learning on speech-to-text resources.   Collaborate with team members from prototyping to production. Qualifications  A Ph.D. in a field relevant to speech synthesis or speech recognition, recent grads will be considered   A Bachelor's degree in Computer Science or related experience   Strong implementation skills (Python, C/C++, Java, MATLAB, or another prominent programming language)   Strong oral and written communication skills in English are required.   Experience with system evaluation of speaker, language, or other acoustic recognition systems is useful, as experiences successfully interacting with government and/or commercial customers.",28 days ago,
https://www.indeed.com/viewjob?jk=cb3d241c5f2797fa&from=web&vjs=3,190,Contact Center Business Analytics Manager,Percepta,"Melbourne, FL","Expect more than a job! Our values are the heartbeat of our organization and we live, breathe, and play by them every day. Join our team as a  Contact Center Business Analytics Manager  and experience the satisfaction of being part of a unique culture. As a Percepta team member, you can expect Culture of Service  - to be treated like you are the customer from day one Teamwork  – belonging to a supportive family team environment that encourages growth, fosters trust and open communication, and acknowledges value in your contributions Respect  – a team that is accountable, dependable and gives you their full attention Proactive  – to surround yourself with solution-oriented people who strive to improve themselves, others, and the organization Career  - growth and lots of learning opportunities for aspiring minds Diversity  - be a part of our growing diverse and community-minded organization that is all about having fun Competitive compensation  - we take care of family, which is why we offer more than just competitive wages and great benefits. Our programs include incentives and promote physical, mental, and financial wellness. Summary The Business Analytics Manager will leverage their extensive analytical expertise to develop analyses, improvement plans / roadmaps, and recommendations that will enable Percepta and our Clients to make informed data driven decisions. They will serve as an in-house consultant and collaborator, a trusted advisor to the business. They will be skilled in effective knowledge transfer and presentation to provide a foundation for data driven business plans for continuous improvement. They are a catalyst in identifying insights that explain the “what happened and why”, and most importantly, use those insights to determine what we can do going forward to improve. Responsibilities · Develop analysis on customer experience and service quality data to improve and optimize contact center performance · Apply expertise in quantitative and inferential analysis to see beyond the numbers and pull insights to identify trends & opportunities. · Apply statistical analysis techniques to examine structured and unstructured data from multiple disparate sources. · Consolidate customer feedback and experience data with other transactional, operational, and process data to paint a clear picture of the Voice of Customer (NPS) or Customer Experience (CX) drivers. · Create predictive data modeling that provides proactive awareness of expected KPI impacts and dashboards that provide performance insights and service quality across the organization. · Develop a strong understanding of client CX strategies and fully integrate with Percepta operations and processes to provide relevant, accurate guidance to leadership and project teams. · Review documentation such as service design, use cases, knowledge base, performance metrics, and other indicators to build a thorough comprehension of the business as it exists. · Develop professional and impactful presentations that are summarized to the appropriate level (across Percepta and Client Leadership levels, including Executive Level) Education · BA/BS or equivalent experience required · Business Process Improvement or Management Certifications (Six Sigma, BPM, etc.) a plus Experience · 5+ years of experience with analyzing large complex data sets, with a proven track record of using findings to drive positive change. · Practical use of the application of mathematical models and statistical techniques in the workplace scenario · Contact center including back-office, as well as automotive industry experience a plus; specifically, case management environment experience is highly preferrable. Skills · Take a given problem, identify relevant data sets, complete relevant multivariate, inferential, statistical analysis to develop key recommendations · Familiarity with industry leading data science and analytics tools · Strong organizational, analytical, and problem-solving skills · Excellent time management skills and the ability to effectively multitask · Excellent oral and written communication skills, with the ability to interact effectively with all levels of management · Capable of effectively facilitating meetings and developing presentations · Advanced user of MS Office Suite · Demonstrates initiative and a high degree of professionalism · Strong critical and strategic thinking skills Percepta requires all employees hired in the United States to successfully pass a background check and depending on location and client program a drug test, as a condition of employment. Percepta is an Equal Opportunity Employer. Job Type: Full-time Pay: $70,000.00 - $76,000.00 per month Benefits: 401(k) 401(k) matching Dental insurance Disability insurance Employee assistance program Employee discount Flexible schedule Flexible spending account Health insurance Health savings account Life insurance Paid time off Tuition reimbursement Vision insurance Schedule: Day shift Monday to Friday Supplemental Pay: Bonus pay Ability to commute/relocate: Melbourne, FL: Reliably commute or planning to relocate before starting work (Required) Education: Bachelor's (Preferred) Experience: data analysis: 5 years (Required) Work Location: Fully Remote",,392 reviews
