URL,page_count,job_title,company,location,job_Description,post_date,reviews
https://www.indeed.com/viewjob?jk=620e60adab1d3146&from=web&vjs=3,200,"Senior .Net Engineer - Azure Bot Services Developer, Conversational AI",Andor Health,"Orlando, FL 32811","Position Description:  The Senior .Net Engineer is a hands-on full stack engineer with superior coding skills and an ability to learn new technologies quickly. The successful candidate has a passion for creatively solving tough problems and is a voice of leadership wherever you go. This position leads major design efforts on large sections of a product and takes pride in crafting solid production code which will stand the test of time. Position Responsibilities: Deliver well thought-out, highly maintainable solutions to complex problems Collaborate with others on technical design & architecture for products & services Be a member of a close-knit group of like-minded professionals working in a dynamic, fast-paced environment Facilitate and lead design discussion - The whiteboard is your domain Work closely with business, UX and UI, product management, data sciences, and other teams to conceive, create, and design unique customer experiences on mobile and desktop Collaborate with architecture, scalability, availability and reliability of Andor Health's platform Exercise ability to translate complexity into simple and intuitive solutions for the customer Basic Qualifications: 5-7 years of experience building large-scale, high throughput web applications or services Expert in at least one statically typed programming language (C#, Java, etc.) Experience with as many of these as possible: C# .Net Core Azure Service Bus, Event Hubs, Event Grid Azure AI’s services, infrastructure, and tools for developing AI apps Microsoft’s Bot Framework ecosystem and the lifecycle of conversational AI app development Azure Bot Framework RDBMS (i.e., MSSQL, etc.) Message Queuing Ability to learn and apply new technologies rapidly Embedding of artificial intelligence solutions in cloud applications Analytics tools for conversational AI applications Preferred Qualifications: Experience in healthcare industry EMR integration experience is a plus Cloud implementation using Microsoft Azure a plus Demonstrated capabilities include but are not limited to the following: Shows appetite and aptitude for owning responsibility of technical decisions and direction for one or many projects/teams. Aptly manages team demands on his/her time and shows willingness/ability to delegate technical execution or responsibilities when appropriate. Acts as a liaison or primary point of contact for communicating with client side technical expertise. Directs technical aspect of operations related to escalated client accounts or high severity issues as they affect or confront a project or team. Attends to both business and technical considerations when designing solutions to project/team or company related issues. Demonstrates interest in improving the company's technical awareness, depth and use of technology across the business. Participates in the evolution of company level best practices, standards, and policies as it relates to software development. Provides thought-leadership as it relates to emerging technologies and readying our company and engineers for productively integrating the same into our business. Travel requirements Depends upon the project/program needs Working arrangements Hours required to complete projects/assignments The preceding functions may not be comprehensive in scope regarding work performed by an employee assigned to this position classification. Management reserves the right to add, modify, change, or rescind the work assignments of this position. Management also reserves the right to make reasonable accommodations so that a qualified employee(s) can perform the essential functions of the position. At Andor Health, our greatest strength comes from bringing together talented people with diverse perspectives to support the technological needs of physicians, hospitals, and post-acute organizations across the globe. Andor Health offers a comprehensive compensation and benefits package, including holidays, vacation, medical, dental, and vision insurance, company paid life insurance and retirement savings. Andor Health's policy is to provide equal employment opportunity and affirmative action in all of its employment practices without regard to race, color, religion, sex, national origin, ancestry, marital status, protected veteran status, age, individuals with disabilities, sexual orientation, or gender identity or expression or any other legally protected category. Applicants for North American based positions with Andor Health must be legally authorized to work in the United States or Canada. Verification of employment eligibility will be required as a condition of hire. EOE Minorities/Females/Individuals with Disabilities/Protected Veterans Drug Free Workplace EEO Law Poster and Supplement",30 days ago,
https://www.indeed.com/viewjob?jk=bddf5ea77a4aab78&from=web&vjs=3,200,Senior NLP Analyst,"Kore.ai, Inc.","Orlando, FL 32819","Who is Kore.ai? Kore.ai is an enterprise software provider of a Virtual Assistant Platform and smart conversational and digital solutions for enterprises to build and deploy out-of-the-box or completely customized virtual assistants for their customers and workforce. Kore.ai turns advancements in natural language processing, machine learning, and artificial intelligence into enterprise opportunity. At  Kore.ai  you will enjoy success, develop your professional skills and allow your career to thrive within a fast-growing business who is expanding their global team. Learn more at https://kore.ai POSITION / TITLE: Senior NLP Analyst RESPONSIBILITIES: Work with product management teams to determine business requirements for the design, configuration, and deployment of conversational UI initiatives Tune and refine the chatbot natural language processing (NLP) engine, workflows and intents, as well as publish new workflows Design, configure, and test reusable components such as intent models and machine learning models to promote configuration-based solutions, under the guidance of the product team Provide input to help the product team understand how conversational experiences will enhance customer engagement Perform regular analysis of trends in chatbot conversations to proactively suggest topics and unanswered questions with the biggest opportunity to automate Use rapid prototyping and testing of various conversational flows to help the product team assess the outcome of different approaches Compelling real world experience related to machine learning OR Artificial intelligence related to Natural language processing and or Computational linguistics Expertise in either Java or C/C++ and any one of scripting languages like Perl/Python/ JavaScript EXPERIENCE REQUIRED 5+ years of hands on experience Experience with Natural Language Processing LOCATION –  USA MUST HAVE SKILLS Application of machine learning algorithms and techniques for natural language processing Experience with supervised and unsupervised machine learning techniques Owning module development as individual contributor Sound knowledge in Syntax and Semantic processing using statistical methodologies and/or Chatscript Experience in Word prediction algorithms 3-5 years’ experience purely in applied linguistics & NLP, related product development Experience in Information extraction and retrieval techniques Familiarity with chatbots, voice enabled devices, or other conversational channels Good to have skills with big data management tools, Node.js and scripting Good knowledge on content categorization algorithms Research, design and development of natural language processing algorithms EDUCATION QUALIFICATION Bachelors or Master’s Degree in Engineering OR Computer Applications",30+ days ago,
https://www.indeed.com/viewjob?jk=9546cb03da676317&from=web&vjs=3,200,"Senior Software Engineer, Natural Language Processing / NLP",Recruiting From Scratch,"Clearwater, FL 33759","Our client helps organizations globally to build trust and speed into their business by matching the Speed of PrivacyOps to the Speed of Dev/BusinessOps. Clients include Patreon, Twilio, Coinbase, Robinhood, and Samara. Design and implement end-to-end Machine Learning and Natural Language Processing models and systems to help construct the foundation on which our global data infrastructure will be built.  Role Overview This role requires you to design and implement end-to-end Machine Learning (ML) and Natural Language Processing (NLP) models and systems to drive business impact. You partner with cross-functional stakeholders and customers to frame business problems as ML problems, prototype solutions effectively, and implement production-grade ML systems and the backend software systems they support to provide end to end five-star user experiences. Given you are constructing the foundation on which our global data infrastructure will be built, you need to pay close attention to detail and maintain a forward-thinking outlook as well as scrappiness for the present needs. You thrive in a fast-paced, iterative, but heavily test-driven development environment, with full ownership to design features from scratch to impact the business and the accountability that comes along. Responsibilities Scoping: Actively participate in customer engagements and partner with cross-functional stakeholders (legal product managers, customer success) to scope technical requirements for high impact business problems; determine whether ML is the right tool for the job and, if it is, how to frame the problem as an ML task Prototyping: Investigate different options quickly and thoroughly to identify the simplest, most pragmatic tool that drives business impact End-to-end System Design and Implementation: Gather training data; train, deploy, evaluate, and iteratively improve production-grade machine learning systems; implement and test the backend software systems they support to provide end-to-end five-star user experiences Follow and promote software engineering and machine learning best practices across the organization; keep up to date with the state of the art developments in NLP research, open-source frameworks, and MLOps Shape the direction of machine learning and build a cohesive team culture of ownership, growth, transparency, and customer focus You are a good fit if you: Have a track record of delivering production-grade ML/NLP models and systems, specifically in text classification, entity and relation extraction, summarization, question-answering, and knowledge base construction (2+ years) Have strong software engineering skills, and set examples by writing modular and maintainable code considering design principles and applying sound testing practices Are comfortable with Python, and have experience with ML/NLP tools and libraries such as scikit-learn, PyTorch, TensorFlow, spaCy, Hugging Face, Gensim, etc. Have a systematic and goal-directed approach to project management Are comfortable dealing with ambiguity and ruthlessly prioritizing and managing your time with a sense of urgency Thrive in a self-directed environment with full ownership to design features from scratch to impact the business and the accountability that comes along Are proactive about continuous improvement and excited about learning at breakneck speed in a fast-growth environment; are eager to candidly and directly give and receive feedback to improve together as a team Are customer and mission-driven, motivated by bringing the most value as possible to users and shaping an industry from the ground up Are the ultimate team player: collaborate effectively with others, consistently make time to help your teammates, and are ego-less in the search for the best ideas",30+ days ago,
https://www.indeed.com/viewjob?jk=1a2ec63af5517dc8&from=web&vjs=3,200,Natural Language Processing Engineer,Instasks App platform,"Miami, FL","Instasks App is a Professional Concierge Service. The app provides top-tiered professionals and clients with an online platform. Our unique approach to building an App is to give the client and the provider instant bookings and an easy process of all services: For example, client requests for quick tasks and large projects. Providers receive custom requests for their specialized skills. The app takes care of all invoicing between client and provider with a detailed invoice. And book all the confirmed jobs. We track providers' locations for the client's en route to any job. We created a portal platform to guide you in listing your professions. The platform provides you with schedules, invoicing and credit card processing are all part of the enhanced technology. Clients will have a choice to give the providers reviews and star ratings to ensure our elite services when booking on our app. Our mission is to help all providers strive to achieve their financial and independent goals. To have more time with their families and create a brighter future for all. The App offers opportunities to providers over the age of 18 and, by law, over the age of 21 for any tasks serving liquor. Build your future with a secure & safe platform. Be your own boss by choosing the TASKS that best suit your schedules and be available to work when you want to work. Build your income to help increase your revenue. Book tasks that are within a 15-mile radius. Our language preferred gives you better communication skills during your tasks. Our client's and providers' health & well-being are our highest priorities.  BACKGROUND CHECK POLICY:  All providers accountants go through an extensive (background check) through a third party company. The certificates they receive are in place to ensure the provider and client feel safe. The document you receive from the third-party background company can be given to any job you are applying for. Our policy states all providers must go through a third party background check only after you are confirmed for a job. We request you do not go through the background check link until you are confirmed for any jobs.  ETIQUETTE TRAINING POLICY:  Each provider will go through etiquette training to ensure that every provider is a friendly and well-mannered individual. We are poised to give our clients the very best in professional service. Our platform should leave no room for laxity as we work hard to bring the very best to our customers.  SKILLS AND ABILITIES:  Requires working from detailed instructions and occasional independent decision-making. Ability to read, analyze and interpret documents such as safety rules, operating and maintenance instructions, or procedural manuals. We are looking for a Natural Language Processing Engineer to help us improve our NLP products and create new NLP applications. NLP Engineer's responsibilities include transforming natural language data into useful features using NLP techniques to feed classification algorithms. To succeed in this role, you should possess outstanding skills in statistical analysis, machine learning methods and text representation techniques. Your ultimate goal is to develop efficient self-learning NLP applications. Responsibilities   Study and transform data science prototypes.  Design NLP applications.  Select appropriately annotated datasets for Supervised Learning methods.  Use effective text representations to transform natural language into useful features.  Find and implement the right algorithms and tools for NLP tasks.  Develop NLP systems according to requirements.  Train the developed model and run evaluation experiments.  Perform statistical analysis of results and refine models.  Extend ML libraries and frameworks to apply in NLP tasks.  Remain updated in the rapidly changing field of machine learning.  Requirements   Proven experience as an NLP Engineer or similar role.  Understanding of NLP techniques for text representation, semantic extraction techniques, data structures and modelling.  Ability to effectively design software architecture.  Deep understanding of text representation techniques (such as n-grams, a bag of words, sentiment analysis etc), statistics and classification algorithms.  Knowledge of Python, Java and R.  Ability to write robust and testable code.  Experience with machine learning frameworks (like Keras or PyTorch) and libraries (like scikit-learn).  Strong communication skills.  An analytical mind with problem-solving abilities.  Degree in Computer Science, Mathematics, Computational Linguistics or a similar field.  ",30+ days ago,
