URL,page_count,job_title,company,location,job_Description,post_date,reviews
https://www.indeed.com/viewjob?jk=38ea00ad7c7071a7&from=web&vjs=3,190,Senior Machine Learning Engineer - Remote,New Relic,"Miami, FL 33101","Please note that visa sponsorship is not available for this position. Your Opportunity New Relic is looking for a Senior Machine Learning Engineer to join our Applied Intelligence Services team. We are a blend of pure engineering (high efficiency, distributed services in JVM languages) and applied research (Python, Statistical Methods, and Machine Learning). Our team focuses on detecting and analyzing anomalous behavior. As a part of our AIOps solution, we provide tools to help customers analyze these issues and reduce the mean time to resolution. This aligns with our mission to proactively improve the customer’s ability to detect issues as early and comprehensively as possible, assist the customer in analyzing data to deliver understanding and facilitate collaboration, and continuously improve by capturing team knowledge to learn from past experiences and demonstrate in the future. Work our team has shipped includes time series dynamic baselines alerting, NRQL query facet suggestion, Error Profiles, and Proactive Detection. What You’ll Do Our ideal candidate is someone who can strengthen our team with their knowledge and passion for data science and machine learning to build outstanding products that delight our customers. Research, develop, and prototype statistical and data science solutions to model our customers’ production systems, to detect and help explain unusual behavior Own our product, from concept to operations. We ship high-quality software and ensure our services are reliable and are on-call for the services we own Work collaboratively on a small team of engineers to ship reliable data science and ML solutions at scale Create and maintain distributed high-throughput applications in JVM languages, using frameworks such as Kafka (familiarity with stream processing technologies, like Kafka Stream or Flink a plus) Be an enthusiast and mentor for engineering standards among engineers inside and outside the team Collaborating with product managers, product designers, and technical support engineers to frame problems within business and product context Take on team responsibilities, so things don’t “fall through the cracks” Flexibility and a desire to learn Maintain a  work-life balance  that enables you to thrive by using unlimited flex time-off,  twelve weeks of paid parental leave , and our DataNerds4Good volunteer time off program! Your Qualifications Must-have: 4+ years of professional work experience with software engineering teams Hands-on experience and knowledge of machine learning techniques and algorithms using Python or R Familiarity with building, operating, and owning modern systems in Java. Experience having developed and shipped high-throughput, fault-tolerant, multi-threaded applications Have a keen eye for quality- ability to write unit tests for all their code and considers what type of automated testing is appropriate Collaborative working style that includes colleagues in important decisions and leads to shared code ownership Nice-to-have: Experience with Kotlin Applied statistics skills, ability to reason about time series analysis data Experience developing software for the public Cloud, preferably AWS Please note that visa sponsorship is not available for this position. Our Office or Your Office You will be working with engineers and leaders distributed throughout the world, concentrated around our major offices in Portland, San Francisco, Phoenix, Barcelona, and Tel Aviv. Our global headquarters for research and development is in the center of downtown Portland, situated in the thriving tech community of the Pacific Northwest. We enjoy easy multi-modal commute access and a plethora of good eats and exceptional coffee. We provide competitive compensation including equity and big-company benefits (medical, dental, etc.)—all while maintaining the energy, agility, and fun of a start-up. We're looking for bold and passionate people to be a part of our mission to create a more perfect software. We'd love to have you apply, even if you don't feel you meet every single requirement. What's most important to us is finding authentic and accountable people who feel connected to our mission and values, not just candidates who check off all the boxes.  We believe in empowering all Relics to achieve professional, and business success through a workforce model called Flex First. The Flex First model allows us to work in a variety of workplaces that best support our success, including fully office-based, fully remote, or a combination of both.  Read more about Flex First and New Relic’s vaccine policy as part of our commitment to maintaining a safe and healthy workplace in light of the COVID-19 pandemic. About Us New Relic (NYSE: NEWR) is a cloud-based observability platform that gives developers, engineers, operations, and management a clear view of what’s happening in today’s complex software environments. So they can find and fix problems faster, and deliver delightful experiences for their customers. That's why the world’s best engineering teams rely on New Relic to visualize, analyze, and troubleshoot their software. It’s the simplest, most powerful cloud-based observability platform, built to create more perfect software. All from one place. Founded in 2008, we’re a global company passionate about building a culture where all employees feel a deep sense of belonging, where every ‘Relic’ can bring their whole self to work and feel supported and empowered to thrive. We’re consistently recognized as a distinguished employer and are committed to building world-class products and an award-winning culture. For more information, visit newrelic.com. Our Hiring Process New Relic takes seriously our stewardship of the data of our thousands of customers worldwide. In compliance with applicable law, all persons hired will be required to verify identity and eligibility to work and to complete employment eligibility verification. We will consider qualified applicants with arrest and conviction records based on individual circumstances and in accordance with applicable law including, but not limited to, the San Francisco Fair Chance Ordinance. https://sfgov.org/olse/sites/default/files/FCO%20poster2020.pdf Headhunters and recruitment agencies may not submit resumes/CVs through this website or directly to managers. New Relic does not accept unsolicited headhunter and agency resumes, and will not pay fees to any third-party agency or company that does not have a signed agreement with New Relic. New Relic is an equal opportunity employer. We eagerly seek a diverse applicant pool and hire without regard to race, color, gender identity, religion, national origin, ancestry, citizenship, physical abilities (or disability), age, sexual orientation, veteran status, or any other characteristic protected by law. Interested in the details of our privacy policy? Read more here: https://newrelic.com/termsandconditions/applicant-privacy-policy  #LI-LM1",30+ days ago,28 reviews
https://www.indeed.com/viewjob?jk=1d36fefd81f22b77&from=web&vjs=3,190,Senior AI Engineer,Trimble,"Sunrise, FL 33323","We welcome applicants who are open to working remote. About Trimble PPM: Founded in 1995 and based in Sunrise, Florida, e-Builder, now Trimble PPM, a Trimble Company, is the pioneer of a fully integrated, cloud-based construction management software. Our client list reads as the “who’s, who” in all our vertical markets: Facebook, Caltech, INOVA Healthcare, and Chicago Transit Authority – to name just a few - . As one of the fastest growing companies in South Florida, we are proud to be named a ‘Florida Company to Watch,’ to be nominated as one of South Florida’s best places to work and have our CEO named South Florida Business Journal’s Ultimate CEO. We’re excited to find innovative ways to combine technology with construction with a fun work environment. To learn more about our award-winning organization and corporate culture visit www.e-builder.net Responsibilities: Create and Maintain AI/ML Models to solve Business Problems Research and stay informed of the latest best practices in Machine Learning Collaborate with Trimble’s Construction Sector AI Center of Excellence to create AI/ML systems to revolutionize the Construction Industry Assist in new and innovative ideas to grow the business using AI/ML Passion for AI/ML with innovative and cutting-edge ideas Regularly and proactively communicate status, risks, and other issues related to projects that are under development Update Jira issues and participate in reviews All other duties as assigned Attributes/Skills Required: Advanced understanding of Statistical Modelling and Neural Networks Proficient in Python or R Able to create, test, deploy models as a microservice Ability to work effectively in a team environment Experience with multiple database technologies (minimum SQL and MongoDB) Experience using agile development practices like TDD, BDD, pair programming and automated builds Experience with model creation from ideation (data analysis) to production maintenance Experience running high concurrency networks in a production environment Design effective, scalable and performant networks to complex technology problems Ability to communicate effectively with management, other engineers, and internal and external customers Must be self-motivated and able to work independently or as part of a team Knowledge of CI/CD pipelines, setup and gating Ability to write business and technical specification documents that convey AI/ML solutions clearly and concisely Customer focused with excellent follow through on commitments Intermediate knowledge of Agile methodologies, preferably KanBan Experience/Education: Masters degree in Computer Science, Software Engineering with a focus in Machine Learning Working experience as an AI Engineer will be considered in place of a degree A minimum of 5 years of experience working on enterprise software development environments Business knowledge of the construction industry is highly desirable If you can accomplish the above, then you have what it takes to be a successful Senior AI Engineer here at Trimble PPM! We are an Equal Opportunity Employer and a Drug-Free Workplace Trimble Inc. is proud to be an Equal Opportunity and Affirmative Action Employer and considers qualified applicants for employment without regard to race, gender, age, color, religion, national origin, marital status, disability, sexual orientation, status as a covered veteran in accordance with applicable federal, state and local laws, or any other protected factor. EOE/M/F/V/D",15 days ago,279 reviews
https://www.indeed.com/viewjob?jk=0d4aedb696e1cae3&from=web&vjs=3,190,"Director, Statistical Programming",Everest Clinical Research,United States,"Everest Clinical Research (“Everest”) is a full-service contract research organization (CRO) providing a broad range of expertise-based clinical research services to worldwide pharmaceutical, biotechnology, and medical device industries. We serve some of the best-known companies and work with many of the most advanced drugs, biologics, and medical devices in development today. Everest has been an independent CRO since 2004 with a strong foundation as a statistical and data management center of excellence. Building on this foundation, Everest has successfully developed and established itself as a full-service CRO. Everest’s headquarters are located in Markham (Greater Toronto Area), Ontario, Canada with additional sites in Little Falls (Greater New York City Area), New Jersey, USA, and Shanghai (Pudong Zhangjiang New District), China. Everest is known in the industry for its high quality deliverables, superior customer service, and flexibility in meeting clients’ needs. A dynamic organization with an entrepreneurial origin, Everest continues to experience exceptional growth and great success. Quality is our backbone, customer-focus is our tradition, flexibility is our strength…that’s us…that’s Everest. To drive continued success in this exciting clinical research field, we are seeking committed, skilled, and customer-focused individuals to join our winning team as  Director, Statistical Programming  for our Little Falls, New Jersey, USA on-site location, or remotely from a home-based office anywhere in the USA in accordance with our Work from Home policy. Key Accountabilities: Provide leadership/expertise in resolving complex problems in support of division/company objectives, or assigned projects, or as a consultant to others. Represent the company and the statistical programming department in customer development and liaison. Provide leadership/expertise in day to day statistical programming. Participate in new business development and bidding processes. Serve on the management team at the corporate level ensuring divisional needs and concerns are represented. Provide high expertise in statistical programming methods and techniques in support of ongoing projects and with clients. Interact with regulatory agencies and support sponsor company in new drug application. Oversee and participate in the development of a Project Plan, develop and monitor timelines for statistical programming activities for assigned projects. Oversee programming support activities of others. When necessary, validate the accuracy, consistency and integrity of the statistical output displays generated by the Study Programmer. Direct staff teams on performing statistical programming or resolving difficult problems. Monitor and assess the progress status of ongoing projects. Serve as primary contact between divisional areas and the client for responsible areas. Manage sponsors and vendor relationship. Participate in regular and ad hoc management meetings with clients. Develop statistical programming performance requirements and measurements according to the corporate standards. Perform ongoing assessment/measurement of project team performance against set standards. Perform semi-annual and annual performance review and development plans for direct subordinates and, where appropriate, indirect subordinates. Participate in the recruiting and staffing for the responsible functions, and coaching, mentoring, and developing staff members. Provided technical training to new programmers and biostatisticians. Qualifications and Experience: M.Sc., M.A. or higher degree in Computer Science, Biostatistics, Mathematics or related fields. Ten years' related experience. An in-depth knowledge of clinical trial data management, statistical programming and analysis, requirements for assembling and presenting trial results to regulatory agencies. In-depth knowledge of industry standards on how clinical trial data are structured, stored, analyzed, and presented. Knowledge of clinical trial regulatory and ICH requirements. Must demonstrate ability to effectively plan, control, and carry on tasks in SAS programming, statistical analysis, and submission of trial data and results to FDA. Must possess in-depth level understanding of the concept of standardization in data, programming, and statistical reporting of trial results, and its implication to the relevant functions and operations. Must have sound technical judgment and experience in process design and implementation in relevant areas. Strong leadership and drive to achieve goals will be required in order to build the standardization portfolio. To find out more about Everest Clinical Research and to review other opportunities, please visit our website at www.ecrscorp.com We thank all interested applicants, however, only those selected for an interview will be contacted. Everest is committed to upholding the principles of dignity, independence, integration, and equal opportunity. We welcome and encourage applications from people with disabilities, and upon request we will provide accommodations for candidates participating in any part of our recruitment and selection process. #LI-Remote #LI-GL1 Equal Opportunity Employer/Protected Veterans/Individuals with Disabilities The contractor will not discharge or in any other manner discriminate against employees or applicants because they have inquired about, discussed, or disclosed their own pay or the pay of another employee or applicant. However, employees who have access to the compensation information of other employees or applicants as a part of their essential job functions cannot disclose the pay of other employees or applicants to individuals who do not otherwise have access to compensation information, unless the disclosure is (a) in response to a formal complaint or charge, (b) in furtherance of an investigation, proceeding, hearing, or action, including an investigation conducted by the employer, or (c) consistent with the contractor’s legal duty to furnish information. 41 CFR 60-1.35(c)",3 days ago,10 reviews
https://www.indeed.com/viewjob?jk=7e66eec0ef653fca&from=web&vjs=3,190,Senior Statistician - Innovative Biopharma - USA,Warman O'Brien,United States,"Senior Statistician - Innovative Biopharma – Rayleigh, US I am seeking a Senior Biostatistician for a forward-thinking Global Biopharma company with a promising pipeline including several novel molecules. They have an extremely innovative culture where you matter, and that encourages people to bring forward new ideas. Concentrate on late phase submissions and covering all aspects of clinical analysis. They are looking for a Lead Statistician to provide insights into Epilepsy with expertise in RWE and non-interventional studies About the Role Acts as the lead biostatistician for one or more clinical studies within a clinical program or across multiple clinical programs. Gives input into the study design, efficacy and safety parameters and the planned statistical analyses. Performs simulations to support choice of study design, decision rules and the sample size. Participates in protocol development if this is not delegated to an external partner biostatistician. Reviews and approves the protocol prepared by the external partner biostatistician. Supports or overseas external partner biostatistical support for all statistical operational aspects of the clinical trial, covering trial set up, trial delivery and the readout of results. This includes input into randomization specifications, statistical analysis plans, interim analyses, safety reviews and final analyses. Communicates and coordinates all statistical activities with external partner biostatisticians. Ensuring the implementation of global, program and SSI standards by all biostatisticians contributing to the project. Provides input on interpretation of results by attending and presenting at the Results Interpretation Meeting (RIM). Reviews and inputs into the clinical study report. Required expertise in RWE and non-interventional studies. There may also be Phase 2/3 work along with these RWE and NIS. Assists the biostatistician lead for a program of studies with the statistical deliverables for regulatory submissions and the lifecycle of a development compound. Person specification:  Excellent understanding of SAS computing package. Able to manage multiple tasks and projects. Advanced statistical analysis skills. Good clinical studies design and analysis experience. Culture : There is a strong emphasis on innovation, collaboration and impact whilst still offering a motivating, friendly and flexible work environment that values their employees. What do you get in return? Opportunity to gain novel insights to drive decision making in clinical development Industry leading salary, annual bonus, car allowance and Long Term Incentive Plan Your ideas to be heard and implemented Not what you are looking for? Please contact Aimee Weston for a confidential conversation on 07806 790645 Reference ID: AW00024 Job Type: Full-time Salary: $75,688.00 - $149,805.00 per year Schedule: Monday to Friday Supplemental Pay: Bonus Pay Experience: Statistician: 2 years (Preferred) Work Remotely: Temporarily due to COVID-19",,
https://www.indeed.com/viewjob?jk=898ad76def040004&from=web&vjs=3,190,"Senior .Net Engineer - Azure Bot Services Developer, Conversational AI",Andor Health,"Orlando, FL 32811","Position Description:  The Senior .Net Engineer is a hands-on full stack engineer with superior coding skills and an ability to learn new technologies quickly. The successful candidate has a passion for creatively solving tough problems and is a voice of leadership wherever you go. This position leads major design efforts on large sections of a product and takes pride in crafting solid production code which will stand the test of time. Position Responsibilities: Deliver well thought-out, highly maintainable solutions to complex problems Collaborate with others on technical design & architecture for products & services Be a member of a close-knit group of like-minded professionals working in a dynamic, fast-paced environment Facilitate and lead design discussion - The whiteboard is your domain Work closely with business, UX and UI, product management, data sciences, and other teams to conceive, create, and design unique customer experiences on mobile and desktop Collaborate with architecture, scalability, availability and reliability of Andor Health's platform Exercise ability to translate complexity into simple and intuitive solutions for the customer Basic Qualifications: 5-7 years of experience building large-scale, high throughput web applications or services Expert in at least one statically typed programming language (C#, Java, etc.) Experience with as many of these as possible: C# .Net Core Azure Service Bus, Event Hubs, Event Grid Azure AI’s services, infrastructure, and tools for developing AI apps Microsoft’s Bot Framework ecosystem and the lifecycle of conversational AI app development Azure Bot Framework RDBMS (i.e., MSSQL, etc.) Message Queuing Ability to learn and apply new technologies rapidly Embedding of artificial intelligence solutions in cloud applications Analytics tools for conversational AI applications Preferred Qualifications: Experience in healthcare industry EMR integration experience is a plus Cloud implementation using Microsoft Azure a plus Demonstrated capabilities include but are not limited to the following: Shows appetite and aptitude for owning responsibility of technical decisions and direction for one or many projects/teams. Aptly manages team demands on his/her time and shows willingness/ability to delegate technical execution or responsibilities when appropriate. Acts as a liaison or primary point of contact for communicating with client side technical expertise. Directs technical aspect of operations related to escalated client accounts or high severity issues as they affect or confront a project or team. Attends to both business and technical considerations when designing solutions to project/team or company related issues. Demonstrates interest in improving the company's technical awareness, depth and use of technology across the business. Participates in the evolution of company level best practices, standards, and policies as it relates to software development. Provides thought-leadership as it relates to emerging technologies and readying our company and engineers for productively integrating the same into our business. Travel requirements Depends upon the project/program needs Working arrangements Hours required to complete projects/assignments The preceding functions may not be comprehensive in scope regarding work performed by an employee assigned to this position classification. Management reserves the right to add, modify, change, or rescind the work assignments of this position. Management also reserves the right to make reasonable accommodations so that a qualified employee(s) can perform the essential functions of the position. At Andor Health, our greatest strength comes from bringing together talented people with diverse perspectives to support the technological needs of physicians, hospitals, and post-acute organizations across the globe. Andor Health offers a comprehensive compensation and benefits package, including holidays, vacation, medical, dental, and vision insurance, company paid life insurance and retirement savings. Andor Health's policy is to provide equal employment opportunity and affirmative action in all of its employment practices without regard to race, color, religion, sex, national origin, ancestry, marital status, protected veteran status, age, individuals with disabilities, sexual orientation, or gender identity or expression or any other legally protected category. Applicants for North American based positions with Andor Health must be legally authorized to work in the United States or Canada. Verification of employment eligibility will be required as a condition of hire. EOE Minorities/Females/Individuals with Disabilities/Protected Veterans Drug Free Workplace EEO Law Poster and Supplement",30 days ago,
