URL,page_count,job_title,company,location,job_Description,post_date,reviews
https://www.indeed.com/viewjob?jk=1589cdba8dd70979&from=web&vjs=3,190,Data Scientist,Envision,United States,"Basic Qualifications:   PhD with 1 year of experience or MS with 2 years of experience in Operations Research, Applied Mathematics, Statistics, Data Science, or another highly quantitative discipline.  Demonstrated experience in formulating MILP or MIQCP optimization models and/or deep reinforcement learning models for real world problems.  Strong Python coding skills for data analysis and modeling, including experience with standard data science packages (numpy, pandas, matplotlib, seaborn).  Ability to learn new quantitative domains and modeling techniques.  Self-motivated and able to work independently as well as part of a team.  Strong communication skills for interactions with team members.   Preferred Qualifications:   Demonstrated experience building optimization, reinforcement learning, predictive machine learning, simulation, and/or statistical models.  Experience with at least one or more of the following optimization software and modeling language: PuLP, GPLK, CBC, CPLEX, AMPL, GAMS, or GUROBI.  Passion for writing well-structured, well-tested, maintainable, performant, and well-documented code, with an emphasis on scientific code.  Experience translating scientific models into code.  Applied experience with agricultural science and/or agricultural datasets.  Experience using tools for big datasets, such as SQL and PySpark.  Experience using version control systems, e.g. git.  ",23 days ago,12 reviews
https://www.indeed.com/viewjob?jk=3cfb98791370a26f&from=web&vjs=3,180,Senior Architect (Voice Skills/AI/Machine Learning),Andor Health,"Orlando, FL 32839","Position Summary Andor Health is seeking an experienced  Senior Architect (Voice Skills/AI/Machine Learning) . The successful candidate will be joining our passionate team of professionals who are working to develop, market, sell, and support new healthcare technology solutions that transform the way clinical teams collaborate and coordinate care. At Andor Health, our mission is to deliver technology solutions that help healthcare organizations streamline clinical team collaboration, meet regulatory requirements and achieve better health outcomes for patients. Responsibilities   Architect, Design, Develop and Deploy enterprise solutions which include components such as Chatbots, Voice / Virtual Assistants, Machine Learning and Cognitive Services. Familiarity to voice skills SDK's, process flows, intents as well as an SDK (Alexa Skills, Google Actions, SiriKit). Experience delivering highly scalable solutions utilizing a cloud provider such as AWS, Azure or GCP. Provide end-to-end technical lead for complex application development projects which include requirements gathering analysis design planning development testing and implementation of technology solutions. The ideal candidate should be experienced with leading from a technical perspective for teams consisting of multiple technical practitioner areas, including applications, cloud providers, security, customer service, technical support, quality management, etc. The ideal candidate should understand product management and will work with customer engagement leads, sales staff, and executive management to ensure that solutions and delivery continue to meet customer requirements while adapting to ongoing market and competitive conditions. The successful candidate will work with new and existing customers to provide solution engineering expertise necessary to successfully design, build, and deliver solutions that meet customer requirements. Perform code reviews to ensure best practices are being followed. Provide guidance for new feature integration and key architectural decisions. Provide advanced technical consulting and advice to others on solution design. Create design documents, including existing modules. Quickly prototype new ideas/technologies to create proof of concept and demos. Qualifications Experience in the healthcare industry 5-7+ years of varied experience in Information Technology 2-4 years of experience in Machine Learning & Artificial Intelligence/Machine Learning/Deep Learning Experience with machine learning software, such as Azure ML, TensorFlow, Theano and Torch In-depth experience with the SDLC development lifecycle and software development methodologies Strong process development skills with the ability to learn and understand technical concepts in order to interpret document and formalize procedures Strong programming skills in SQL, C#, .NET, Java, JavaScript Background in speech algorithms, statistical probability, advanced machine learning techniques Experience in Natural Language Processing (NLP), Statistical Language Modeling (SLM), Text-to-Speech (TTS), Automatic Speech Recognition (ASR), Natural Language Understanding (NLU) and Signal Processing Named Entity, Keyword and Topic Extraction Deep-learning Chatbots and dialog modeling Intent detection, Query Parsing and Semantic mapping Preferred B.S. or B.A. in Computer Science or related discipline 2-4 years' experience in the Microsoft Azure technology stack Experience with SDK's like Slack or Microsoft Teams The preceding functions may not be comprehensive in scope regarding work performed by an employee assigned to this position classification. Management reserves the right to add, modify, change, or rescind the work assignments of this position. Management also reserves the right to make reasonable accommodations so that a qualified employee(s) can perform the essential functions of the position. At Andor Health, our greatest strength comes from bringing together talented people with diverse perspectives to support the technological needs of physicians, hospitals, and post-acute organizations across the globe. Andor Health offers a comprehensive compensation and benefits package, including holidays, vacation, medical, dental, and vision insurance, company paid life insurance and retirement savings. Andor Health's policy is to provide equal employment opportunity and affirmative action in all of its employment practices without regard to race, color, religion, sex, national origin, ancestry, marital status, protected veteran status, age, individuals with disabilities, sexual orientation, or gender identity or expression or any other legally protected category. Applicants for North American based positions with Andor Health must be legally authorized to work in the United States or Canada. Verification of employment eligibility will be required as a condition of hire. EOE Minorities/Females/Individuals with Disabilities/Protected Veterans Drug Free Workplace EEO Law Poster and Supplement",1 day ago,
https://www.indeed.com/viewjob?jk=944b17812f0874f9&from=web&vjs=3,180,Senior AI Developer,Endura Technologies,"Miami, FL 33133","About Endura Technologies Endura Technologies is a fabless semiconductor company providing state of the art, disruptive chipset solutions in Power Management and Smart Audio across a wide spectrum of applications from Mobile devices, IoT, Personal Computers, and Cloud Servers. Endura’s patented technology offers ultra-fast switching regulators with the smallest form factor in the world, providing high performance and ultra-low power through best-in-class efficiency. Endura’s proprietary low power and small size Artificial Intelligence (AI) implementation combined with its innovative Analog Front-End (AFE) offers solutions for intelligent IoT, smart Audio, and other applications with best-in-class SNR and AOP. Reporting to Head of Software Department Responsibilities Design, develop and implement the different components of AI SW stack. Analyze software requirements and come up with software solutions best suited for Endura AI HW IPs. Develop test plans for Endura AI system, implement and execute benchmark and test scenarios for different AI models. Familiarity with Continuous Integration system a big bonus. Analyze and identify system-level integration issues, interface with the HW, software & integration and test teams Skills and Specifications Excellent programming skills in C++, C, and Python Experience in machine learning frameworks such as Tensorflow, PyTorch, MxNet, Torch etc. Excellent understanding of TCP/IP network programming concepts Excellent embedded systems and device driver programming skills is a plus Excellent skill set in adhering to software product life-cycle practices end-to-end Excellent analytic and problem-solving skills Excellent teamwork and communication skills Have a learn-it-all and not a know-it-all mindset Familiarity/Experience in developing and maintaining automated Continuous Integration (CI) and System Test framework based on popular frameworks like GitLab, Jenkins, Azure, etc. is a big plus Education and Qualifications BSEE/CS required MSEE/CS preferred 3+ years work experience in relevant fields AAP/EEO Statement The Bridgewest Group is an equal opportunity employer.",30+ days ago,2 reviews
https://www.indeed.com/viewjob?jk=898ad76def040004&from=web&vjs=3,190,"Senior .Net Engineer - Azure Bot Services Developer, Conversational AI",Andor Health,"Orlando, FL 32811","Position Description:  The Senior .Net Engineer is a hands-on full stack engineer with superior coding skills and an ability to learn new technologies quickly. The successful candidate has a passion for creatively solving tough problems and is a voice of leadership wherever you go. This position leads major design efforts on large sections of a product and takes pride in crafting solid production code which will stand the test of time. Position Responsibilities: Deliver well thought-out, highly maintainable solutions to complex problems Collaborate with others on technical design & architecture for products & services Be a member of a close-knit group of like-minded professionals working in a dynamic, fast-paced environment Facilitate and lead design discussion - The whiteboard is your domain Work closely with business, UX and UI, product management, data sciences, and other teams to conceive, create, and design unique customer experiences on mobile and desktop Collaborate with architecture, scalability, availability and reliability of Andor Health's platform Exercise ability to translate complexity into simple and intuitive solutions for the customer Basic Qualifications: 5-7 years of experience building large-scale, high throughput web applications or services Expert in at least one statically typed programming language (C#, Java, etc.) Experience with as many of these as possible: C# .Net Core Azure Service Bus, Event Hubs, Event Grid Azure AI’s services, infrastructure, and tools for developing AI apps Microsoft’s Bot Framework ecosystem and the lifecycle of conversational AI app development Azure Bot Framework RDBMS (i.e., MSSQL, etc.) Message Queuing Ability to learn and apply new technologies rapidly Embedding of artificial intelligence solutions in cloud applications Analytics tools for conversational AI applications Preferred Qualifications: Experience in healthcare industry EMR integration experience is a plus Cloud implementation using Microsoft Azure a plus Demonstrated capabilities include but are not limited to the following: Shows appetite and aptitude for owning responsibility of technical decisions and direction for one or many projects/teams. Aptly manages team demands on his/her time and shows willingness/ability to delegate technical execution or responsibilities when appropriate. Acts as a liaison or primary point of contact for communicating with client side technical expertise. Directs technical aspect of operations related to escalated client accounts or high severity issues as they affect or confront a project or team. Attends to both business and technical considerations when designing solutions to project/team or company related issues. Demonstrates interest in improving the company's technical awareness, depth and use of technology across the business. Participates in the evolution of company level best practices, standards, and policies as it relates to software development. Provides thought-leadership as it relates to emerging technologies and readying our company and engineers for productively integrating the same into our business. Travel requirements Depends upon the project/program needs Working arrangements Hours required to complete projects/assignments The preceding functions may not be comprehensive in scope regarding work performed by an employee assigned to this position classification. Management reserves the right to add, modify, change, or rescind the work assignments of this position. Management also reserves the right to make reasonable accommodations so that a qualified employee(s) can perform the essential functions of the position. At Andor Health, our greatest strength comes from bringing together talented people with diverse perspectives to support the technological needs of physicians, hospitals, and post-acute organizations across the globe. Andor Health offers a comprehensive compensation and benefits package, including holidays, vacation, medical, dental, and vision insurance, company paid life insurance and retirement savings. Andor Health's policy is to provide equal employment opportunity and affirmative action in all of its employment practices without regard to race, color, religion, sex, national origin, ancestry, marital status, protected veteran status, age, individuals with disabilities, sexual orientation, or gender identity or expression or any other legally protected category. Applicants for North American based positions with Andor Health must be legally authorized to work in the United States or Canada. Verification of employment eligibility will be required as a condition of hire. EOE Minorities/Females/Individuals with Disabilities/Protected Veterans Drug Free Workplace EEO Law Poster and Supplement",30 days ago,
https://www.indeed.com/viewjob?jk=c00f7343aa87822b&from=web&vjs=3,180,Senior Machine Learning Engineer (Crypto Exchange),Recruiting From Scratch,"Clearwater, FL 33759","Who is Recruiting from Scratch:  Recruiting from Scratch is a premier talent firm that focuses on placing the best product managers, software, and hardware talent at innovative companies. Our team is 100% remote and we work with teams across the United States to help them hire. We work with companies funded by the best investors including Sequoia Capital, Lightspeed Ventures, Tiger Global Management, A16Z, Accel, DFJ, and more.   If you are a fit, the team will reach out to you about this role or any others that may be a fit for our clients.    Our Client Our client is growing the Data Science team and AI stack. They are looking for senior data scientists and machine learning engineers who are interested in solving diverse and complex business problems. You will leverage your experience and communication skills to work across business teams to build and develop innovative machine learning models and algorithms.   Responsibilities  Be able to distill complex models and analysis into compelling insights for our stakeholders and executives   Ensure data quality throughout all stages of acquisition and processing, including such areas as data sourcing/collection, ground truth generation, normalization, transformation, cross-lingual alignment/mapping, etc.   Develop new tools and solutions to enable stakeholders to consume and understand data more intuitively   Stay up-to-date with data science tools and methodologies in technology and financial domain   Knowledge of probability and statistics, including experimental design, predictive modeling, optimization, and causal inference. Experience in design and deployment of real-world, large-scale, user-facing systems   Manage your own process: identify and execute on high impact projects, triage external requests, and make sure you bring projects to conclusion in time for the results to be useful  Qualifications  Masters or PhD(preferred) in Statistics, Applied Math, Computer Science or related fields   4+ years of work experience in analytics and data science domain focusing on business problems   3+ years of experience deploying statistical and machine learning models in production   2+ years of experience in integrating data science models into applications   Skilled in programming languages like Python, Java/C++/C# and SQL   Sound knowledge in dealing with large data sets for analytical approach and quantitative methods   Solid understanding of machine learning fundamentals, and familiar with standard algorithms and techniques   Good understanding of deep learning algorithms and workflows   Ability to analyze a wide variety of data: structured and unstructured, observational and experimental, to drive system designs and product implementations   Good understanding of cloud computing and infrastructure concepts   Experience with one or more big data tools and technologies like Snowflake, Databricks, S3, Hadoop, Spark   Experience working with NLP applications is a plus   Experience in financial domain is a plus   Strong technical and business communication  It Pays to Work Here  Competitive Compensation and Profit-Sharing Equity   Flexible vacation policy   Retirement Plan Matching   Generous Parental leave   Comprehensive health plans   Training and professional development",30 days ago,
https://www.indeed.com/viewjob?jk=0d4aedb696e1cae3&from=web&vjs=3,190,"Director, Statistical Programming",Everest Clinical Research,United States,"Everest Clinical Research (“Everest”) is a full-service contract research organization (CRO) providing a broad range of expertise-based clinical research services to worldwide pharmaceutical, biotechnology, and medical device industries. We serve some of the best-known companies and work with many of the most advanced drugs, biologics, and medical devices in development today. Everest has been an independent CRO since 2004 with a strong foundation as a statistical and data management center of excellence. Building on this foundation, Everest has successfully developed and established itself as a full-service CRO. Everest’s headquarters are located in Markham (Greater Toronto Area), Ontario, Canada with additional sites in Little Falls (Greater New York City Area), New Jersey, USA, and Shanghai (Pudong Zhangjiang New District), China. Everest is known in the industry for its high quality deliverables, superior customer service, and flexibility in meeting clients’ needs. A dynamic organization with an entrepreneurial origin, Everest continues to experience exceptional growth and great success. Quality is our backbone, customer-focus is our tradition, flexibility is our strength…that’s us…that’s Everest. To drive continued success in this exciting clinical research field, we are seeking committed, skilled, and customer-focused individuals to join our winning team as  Director, Statistical Programming  for our Little Falls, New Jersey, USA on-site location, or remotely from a home-based office anywhere in the USA in accordance with our Work from Home policy. Key Accountabilities: Provide leadership/expertise in resolving complex problems in support of division/company objectives, or assigned projects, or as a consultant to others. Represent the company and the statistical programming department in customer development and liaison. Provide leadership/expertise in day to day statistical programming. Participate in new business development and bidding processes. Serve on the management team at the corporate level ensuring divisional needs and concerns are represented. Provide high expertise in statistical programming methods and techniques in support of ongoing projects and with clients. Interact with regulatory agencies and support sponsor company in new drug application. Oversee and participate in the development of a Project Plan, develop and monitor timelines for statistical programming activities for assigned projects. Oversee programming support activities of others. When necessary, validate the accuracy, consistency and integrity of the statistical output displays generated by the Study Programmer. Direct staff teams on performing statistical programming or resolving difficult problems. Monitor and assess the progress status of ongoing projects. Serve as primary contact between divisional areas and the client for responsible areas. Manage sponsors and vendor relationship. Participate in regular and ad hoc management meetings with clients. Develop statistical programming performance requirements and measurements according to the corporate standards. Perform ongoing assessment/measurement of project team performance against set standards. Perform semi-annual and annual performance review and development plans for direct subordinates and, where appropriate, indirect subordinates. Participate in the recruiting and staffing for the responsible functions, and coaching, mentoring, and developing staff members. Provided technical training to new programmers and biostatisticians. Qualifications and Experience: M.Sc., M.A. or higher degree in Computer Science, Biostatistics, Mathematics or related fields. Ten years' related experience. An in-depth knowledge of clinical trial data management, statistical programming and analysis, requirements for assembling and presenting trial results to regulatory agencies. In-depth knowledge of industry standards on how clinical trial data are structured, stored, analyzed, and presented. Knowledge of clinical trial regulatory and ICH requirements. Must demonstrate ability to effectively plan, control, and carry on tasks in SAS programming, statistical analysis, and submission of trial data and results to FDA. Must possess in-depth level understanding of the concept of standardization in data, programming, and statistical reporting of trial results, and its implication to the relevant functions and operations. Must have sound technical judgment and experience in process design and implementation in relevant areas. Strong leadership and drive to achieve goals will be required in order to build the standardization portfolio. To find out more about Everest Clinical Research and to review other opportunities, please visit our website at www.ecrscorp.com We thank all interested applicants, however, only those selected for an interview will be contacted. Everest is committed to upholding the principles of dignity, independence, integration, and equal opportunity. We welcome and encourage applications from people with disabilities, and upon request we will provide accommodations for candidates participating in any part of our recruitment and selection process. #LI-Remote #LI-GL1 Equal Opportunity Employer/Protected Veterans/Individuals with Disabilities The contractor will not discharge or in any other manner discriminate against employees or applicants because they have inquired about, discussed, or disclosed their own pay or the pay of another employee or applicant. However, employees who have access to the compensation information of other employees or applicants as a part of their essential job functions cannot disclose the pay of other employees or applicants to individuals who do not otherwise have access to compensation information, unless the disclosure is (a) in response to a formal complaint or charge, (b) in furtherance of an investigation, proceeding, hearing, or action, including an investigation conducted by the employer, or (c) consistent with the contractor’s legal duty to furnish information. 41 CFR 60-1.35(c)",3 days ago,10 reviews
