URL,page_count,job_title,company,location,job_Description,post_date,reviews
https://www.indeed.com/viewjob?jk=ef27922e5c742fd6&from=web&vjs=3,30,Applied Scientist - Government (Secret),Descartes Labs,"Honolulu, HI","The Company Descartes Labs is a cutting edge company currently ranked #40 in the world for high performance compute (HPC) and top three (3) in the United States. This distinction validates that Descartes Labs is the leading provider of peta-scale geospatial analytics. The Descartes Labs Government business is applying the same state-of-the-art applications that rank us in the top categories nationally and internationally to help Government, Public Sector and Military organizations with big geospatial data challenges achieve mission success.   Our cloud platform enables rapid ingestion and normalization of petascale, geospatially enabled data and facilitates the ability to rapidly train, test, and deploy AI/ML solutions that optimize manual analytical workflows. More specifically, the Descartes Labs platform assists our customers to corral their multi-sensor, multi-intelligence ecosystems by applying scientific analysis to cross-functional challenges at a regional and global level thereby creating new sources of insights and operational advantage for government and warfighter end users to rapidly make informed decisions. The Role Descartes Labs is building the geospatial data platform of the future to enable world class analysis at global scale. In this position, you will work with our internal Product and Applied Science Teams to build cutting edge solutions for our government partners across a range of applications. You will be an advocate for our technology and help transform the way our customers utilize geospatial and location based data to support their critical missions. Minimum Salary: $134,500 USD  Your Impact Use our archive of satellite imagery, weather data, and other geospatial datasets to develop and build change detection, computer vision, and defense and intelligence monitoring tools and models. Work closely with our customers and partners to develop data visualization frameworks, interfaces, and tools. Collaborate with product managers to develop new products, feature datasets, and capabilities relevant to our government customers. Work with project managers to communicate progress to clients and translate the results of scientific analyses into actionable insights. Actively participate as a member of a cross-disciplinary team, openly communicating your ideas, insights, and feedback and helping to continuously improve processes. Collaborate with product managers to develop new products, feature datasets, and capabilities.  What You Bring Demonstrated background developing deep learning, computer vision, and/or machine learning models in a customer-focused environment. Experience building and iterating on proof-of-concept level demonstrations to drive customer conversations. Real-world software experience in Python is required; familiarity with TensorFlow, PyTorch, or another deep learning framework preferred. Experience working with remote sensing and geospatial data. Strong problem solving skills, with the ability to research, develop, and implement solutions to novel problems. Self-motivated and able to work independently as well as within a team. Degree (BS/MS/PhD) in a relevant field preferred . Familiarity with cloud-based and/or distributed computing. Security Clearance eligible; existing Secret or TS clearance preferred.  Who You Are Curious. You are always exploring and experimenting, interested in why and how, seeking not only to understand but to make work and the world better. You enthusiastically share your learning with others and actively seek information and knowledge. Conscientious. You are determined, always keep your promises, and are forward thinking. Principled and integrous, you take your commitments seriously. Humble. Unpretentious and self-aware, you cultivate compassion for others and take responsibility for your mistakes. Egoes are barriers to doing the best work and always learning. Open and Inclusive. You are receptive and interested in new ideas and perspectives, even when those perspectives don’t agree with your views. You value and respect difference and create ways for all people to contribute to the organization. Collaborative. You know it takes a team to get anything accomplished and you actively and inclusively work across the organization. You listen intently and openly and are always focused first on creating the best results. Adaptable. You are able to navigate changing circumstances and environments with ease and approach uncertainty with enthusiasm, while inspiring others towards effective goal setting and accomplishment. Top Reasons to Work at Descartes Labs Free Fridays! - Spend Fridays the way you want, there is no expectation to work! Some of us are in customer-facing roles, or on-call, and may need to be flexible to create great customer experiences, but that should be the exception and not the rule. We pride collaboration over ownership, iteration over perfection, principles over rules, and discussion over directives. We’re using the world’s top technology to solve the world’s largest problems with a strong focus on sustainability, environment, and impact science. We look at Descartes Labs as a work environment where people are included, treat their colleagues with professional regard and respect, and thrive as a result. We strongly encourage and enjoy a flexible work environment; Free Fridays, unlimited PTO, remote-firstDescartes Labs offers a generous compensation package including a competitive salary; choice of medical plan; dental, life, and disability insurance; paid holidays, unlimited PTO; monthly WFH stipend.  In response to Executive Order 14042 and accompanying Task Force Guidance, all Descartes Labs Government Inc. employees must be fully vaccinated for COVID-19 by January 18, 2022, unless a medical or religious accommodation is formally approved by Descartes Labs Government Inc. prior to employment or as otherwise required by law. Proof of vaccination is a condition of employment. You belong here! If your experience and interests match with some of the above, we want you to apply. We are dedicated to building a diverse community, where employees belong, even if they are different. Scientific discovery is in our DNA, and diversity fuels innovation! Accommodations will be provided as requested by candidates taking part in all aspects of the selection process.",30+ days ago,
https://www.indeed.com/viewjob?jk=00a11f0deea88bf9&from=web&vjs=3,30,Sr. Healthcare Data Analyst,Comagine Health,United States,"Together with our partners, Comagine Health works to improve health and create a better health care system so that people and communities will flourish. The Senior Healthcare Data Analyst designs and executes the analytics for a variety of project types. Coordinating with internal and external parties, this role promotes using data in meaningful ways to achieve improvements in health care, set goals, and measure the success of the project. This role ensures that projects are completed on time and in a clinically, scientifically, and statistically sound manner. What you’ll be doing for us:  Design and lead the analytics for large and complex projects, including the engagement of external clients and interested parties Collaborate with leadership and others to develop goals, standards, and activities supporting the delivery of reliable and actionable data reports, dashboards, and products for internal and external customers Analyze information obtained from a variety of sources, conduct and document the thoughtful and sound analyses and evaluation of data, and provide meaningful interpretation of data to a variety of audiences Serve as a subject matter expert for both internal and external audiences in area of analytic expertise Analyze and define problems and research possible solutions using existing statistical software and established statistical methods Adhere to all internal quality control (IQC) processes for programming, visualization and reporting to maintain data integrity, and contribute to the improvement of IQC processes Generate technical manuals, reports and other documentation reflecting advanced knowledge in assigned functional areas including the development of user manuals, user guidance/guides, training materials, publications, and presentations Work with ITS partners on appropriate data governance strategies to maintain DUA requirements Provide consultation to other analysts on advanced methods in statistical methodology, study design and data analyses Provide technical support to interested parties as needed Maintain current knowledge of relevant technologies as assigned Provide training and day-to-day guidance and work leadership to other analysts and other team members in a mentorship role Stay current with environmental factors that may affect our organizational goals and mission and share this information appropriately Leadership Competencies Participate in a variety of personnel management activities, including but not limited to recruitment, selection, on-boarding, training, evaluation, and separation, according to Comagine Health policy and practice and in collaboration with leadership and Human Resources. Ensures delivery of initial orientation and training (including review of direct reports’ job descriptions), plus on-going training. Ensures availability of procedures, technology, and other resources necessary to conduct work activities; provides subject matter expertise as applicable. Provides timely, continuous recognition and feedback using objective, job-related data, and observations (including documented performance appraisals); timely initiates performance improvement opportunities in alignment with Comagine Health policy and practice. Develops and monitors professional development goals and objectives; assigns work and delegates authority appropriate for established, job-related duties, responsibilities, and qualifications. Develops, maintains, and enforces individual- and team-level performance expectations for deliverables; applies Comagine Health’s general standards of conduct. Required Skills*_ What would make you a strong fit for our role: _* Expertise in the design of analytic strategies for projects (quality improvement, analytics, care management and research), particularly in healthcare settings Proficiency in presenting complex information in a clear and compelling format Knowledge of statistics or biostatistics and the appropriate application of analytic methods Expertise in manipulating and analyzing large datasets, focused on relational databases Minimum of 8 years of experience in programming (SAS, SQL, R, Python, or other languages) Strong preference for candidates with advanced Data Visualization skills. We are heavily utilizing Tableau at this time, but looking for candidates with a focus on the future. Study design (preferred) Ability to organize, delegate and coordinate multiple simultaneous tasks in a team environment Willingness and ability to provide mentoring, coaching, advice, and assistance to employees in a collaborative learning environment Excellent oral and written communications skills Excellent interpersonal and problem-solving skills Required Experience*_ Required Experience: _* BA/BS in in epidemiology, social sciences, statistics, mathematics, computer science, or a related field; equivalent combination of education and/or work experience in related field may be substituted 8 years of healthcare-related data analysis, research, and/or other relevant work experience Preferred MA/MS in a related field Prior work experience in healthcare 1 year of project management experience 1 year of supervisory experience Comagine Health’s mission is to work together with our partners to improve health and create a better health care system so that people and communities will flourish. As part of our mission and values, we recognize the importance of having our employees vaccinated against COVID-19- both as a protection for our larger community and to keep our employees and their families safe. As a federal contractor, and in compliance with Executive Order 14042, Comagine Health requires its employees and contractors to be fully vaccinated against COVID-19 (including any booster shots if required), unless they are approved for a reasonable accommodation based on medical condition or religious belief that prevents them from being vaccinated. Being fully vaccinated against COVID-19 is a condition of employment at Comagine Health. If you are fully vaccinated, you will be required to provide proof of your completed COVID-19 vaccination prior to the first day of your employment. Failure to provide timely proof of your COVID-19 vaccination status may result in your offer of employment being rescinded or your start being delayed. If you are unable to be fully vaccinated due to medical condition or religious belief, you will be required to request an exemption upon acceptance of the offer of employment. As a part of this process, you will be required to provide information or documentation about the reason you cannot be vaccinated. If your request for an exemption is not approved, then your offer of employment may be rescinded. Job Type: Full-time",,52 reviews
https://www.indeed.com/viewjob?jk=f4d0b64f7e4c2038&from=web&vjs=3,30,Data Engineer,Ukpeagvik Iñupiat Corporation/Bowhead Family of Companies,"Honolulu, HI","Tracking Code   IND-21-1529-W   Job Code   21-1529   Posting Title   Data Engineer   Post Date   10/21/2021   Full Time / Part-Time   Full Time    Travel   Negligible   City   Honolulu   State   HI    Description   DATA ENGINEER (IND-21-1529-W):  Bowhead seeks a Data Engineer to support the INDOPACOM JIOC, conducting strategic topic research and analysis for new intelligence requirements located in Honolulu, HI.  Specific needs are identified for support in collaborative intelligence planning, collection strategy development. Intelligence, Surveillance, and Reconnaissance (ISR ) mission management, foreign disclosure support. Counterintelligence (Cl ). Human Intelligence (HUMINT). collection operations management, exploitation, and innovative R&D, and Cyber Forensics.  Responsibilities may include:   Conduct data analytics, data engineering, data mining, exploratory analysis, predictive analysis, and statistical analysis, and uses scientific techniques to correlate data into graphical, written, visual and verbal narrative products, enabling more informed analytic decisions.  Proactively retrieve information from various sources, analyzes it for better understanding about the data set and builds Artificial Intelligence (AI) tools that automate certain processes. Duties typically include: creating various Machine Learning (ML)-based tools or processes, such as recommendation engines or automated lead scoring systems.  Perform statistical analysis, applies data mining techniques, and builds high quality prediction systems.  Design how data will be stored, accessed, used, integrated, and managed by different data regimes and digital systems.  Work with data users to determine, create, and populate optimal data architectures, structures, and systems.  Plan, design, and optimize data throughput and query performance.  Participate in the selection of backend database technologies (e.g. SQL. NoSQL. UPC. etc.), their configuration and utilization, and the optimization of the full data pipeline infrastructure to support the actual content, volume. ETL. and periodicity of data to support the intended kinds of queries and analysis to match expected responsiveness.   Requirements   Master’s degree in a related field is highly preferred; Bachelor’s degree in a related field is required.  Five to seven (7+) years of experience with Computer/Data Science Languages including but not limited to: Java, Flash, C++, C#, Macromedia, HTML, XML, Analysis, Python, Corona SDK, JavaScript, WordPress, CSS, PHP, jQuery, Python, R, Watson IBM, Tableau, SAS  Experience with databases/applications/operating systems including: MySQL, Access, Oracle, SQL Server. MS Word, PowerPoint, Excel, Eclipse, SharePoint, Windows, Azure (cloud)  Familiar with formats/medium/tools including but not limited to: Blitz, Cognos, Kibana, JEMA, SENTIENT, MIST, MOVINT, SOCET GXP, DotMatrix, Google Earth, SNAPGLASS or related tool.  Intermediate to advanced level skills in Microsoft Office software suite - Word, Excel, Outlook, PowerPoint.  Ability to communicate effectively with all levels of employees and outside contacts.  Strong interpersonal skills and good judgment with the ability to work alone or as part of a team.  SECURITY CLEARANCE REQUIREMENTS: Must currently have and be able to maintain a clearance at the Top Secret level with SCI eligibility. US Citizenship is a requirement for a Top Secret clearance at this location.  Applicants may be subject to a pre-employment drug & alcohol screening and/or random drug screen, and must follow UIC’s Non-DOT Drug & Alcohol Testing Program requirements. If the position requires, an applicant must pass a pre-employment criminal background history check. All post-secondary education listed on the applicant’s resume/application may be subject to verification.  Where driving may be required or where a rental car must be obtained for business travel purposes, applicants must have a valid driver license for this position and will be subject to verification. In addition, the applicant must pass an in-house, online, driving course to be authorized to drive for company purposes.  UIC is an equal opportunity employer. We evaluate qualified applicants without regard to race, age, color, religion, sex, sexual orientation, gender identity, national origin, disability, veteran status, and other protected characteristics EOE/AA/M/F/D/V. In furtherance, pursuant to The Alaska Native Claims Settlement Act 43 U.S.C. Sec. 1601 et seq., and federal contractual requirements, UIC and its subsidiaries may legally grant certain preference in employment opportunities to UIC Shareholders and their Descendants, based on the provisions contained within The Alaska Native Claims Settlement Act.  All candidates must apply online at www.uicalaska.com, and submit a completed application for all positions they wish to be considered. Once the employment application has been completed and submitted, any changes to the application after submission may not be reviewed. Please contact a UIC HR Recruiter if you have made a significant change to your application. In accordance with the Americans with Disabilities Act of 1990 (ADA), persons unable to complete an online application should contact UIC Human Resources for assistance (https://uicalaska.com/careers/recruitment/).  UIC Government Services (UICGS / Bowhead) provides innovative business solutions to federal and commercial customers in the areas of engineering, maintenance services, information technology, program support, logistics/base support, and procurement. Collectively, the fast-growing Bowhead Family of Companies offers a breadth of services which are performed with a focus on quality results. Headquartered in Springfield, VA, we are a fast-growing, multi-million-dollar corporation recognized as one of the top 25 8(a) companies for government contracting. Bowhead offers competitive benefits including medical, dental, vision, life insurance, accidental death and dismemberment, short/long-term disability, and 401(k) retirement plans as well as a paid time off programs for eligible full-time employees. Eligible part-time employees are able to participate in the 401(k) retirement plans and state or contract required paid time off programs.  Link to apply:  https://rn21.ultipro.com/UKP1001/JobBoard/JobDetails.aspx?__ID=*56303204BB112211  #LI-KC1    UIC and its Family of Companies is an equal opportunity employer. We evaluate qualified applicants without regard to race, age, color, religion, sex, sexual orientation, gender identity, national origin, disability, veteran status, and other protected characteristics EOE/AA/M/F/D/V. Equal Opportunity Employer/Protected Veterans/Individuals with Disabilities. Please view Equal Employment Opportunity Posters provided by OFCCP here. The contractor will not discharge or in any other manner discriminate against employees or applicants because they have inquired about, discussed, or disclosed their own pay or the pay of another employee or applicant. However, employees who have access to the compensation information of other employees or applicants as a part of their essential job functions cannot disclose the pay of other employees or applicants to individuals who do not otherwise have access to compensation information, unless the disclosure is (a) in response to a formal complaint or charge, (b) in furtherance of an investigation, proceeding, hearing, or action, including an investigation conducted by the employer, or (c) consistent with the contractor's legal duty to furnish information. 41 CFR 60-1.35(c)",30+ days ago,19 reviews
