URL,page_count,job_title,company,location,job_Description,post_date,reviews
https://www.indeed.com/viewjob?jk=7cfc4767c1335307&from=web&vjs=3,10,Data Scientist,"IntelliGenesis, LLC","Honolulu, HI","Maximize your potential with IntelliGenesis!  IntelliGenesis LLC has supported Department of Defense and Intelligence Community customers since 2007 by providing next generation capabilities for: Offensive & Defensive Cyber Services, National Security Cyber Training, Data Science & Decision-Making Analytics, Intelligence Analysis, and Intelligence Solutions Engineering.  IntelliGenesis offers an extremely competitive and generous benefits package that provides employees with both professional and personal satisfaction and growth while keeping focus on supporting the mission. Additionally, our employees enjoy a company culture that emphasizes the importance of family and work/life balance. Our benefits include: Medical, Dental and Vision Insurance, 25 days of PTO with the option to purchase up to an additional 5 days, 12 paid holidays, up to 10% 401k match, Annual Individual Technology Budget, Unlimited Education/Training Reimbursements, and much more!  We are currently seeking Data Scientists! Job Duties   Employ some combination (2 or more) of the following skill areas: Foundations: (Mathematical, Computational, Statistical)  Data Processing: (Data management and curation, data description and visualization, workflow and reproducibility)  Modeling, Inference, and Prediction: (Data modeling and assessment, domain-specific considerations)  Devise strategies for extracting meaning and value from large datasets  Make and communicate principled conclusions from data using elements of mathematics, statistics, computer science, and application-specific knowledge  Through analytic modeling, statistical analysis, programming, and/or other appropriate scientific method, develop and implement qualitative and quantitative methods for characterizing, exploring and assessing large datasets in various states of organization, cleanliness, and structure that account for the unique features and limitations inherent in customer data holdings  Translate practical mission needs and analytic questions related to large datasets into technical requirements and, conversely, assist other with drawing appropriate conclusions from the analysis of such data  Effectively communicate complex technical information to non-technical audiences  Make informed recommendations regarding competing technical solutions by maintaining awareness of constantly shifting collection, processing, storage and analytic capabilities and limitations   Required Skills:   US Citizens Only  Active TS/SCI Clearance and Polygraph required  Information Assurance Certification may be required Minimum of three (3) years of relevant experience and a Bachelor’s degree or five (5) years of relevant experience and an Associate’s degree required. Degree must be in Mathematics, Applied Mathematics, Statistics, Applied Statistics, Machine Learning, Data Science, Operations Research, or Computer Science  A broader range of degrees will be considered if accompanied by a Certificate in Data Science from an accredited college/university  Relevant experience must be two of more of the following: Designing/implementing machine learning  Data science  Advanced analytical algorithms  Programming (skill in at least one high-level language (e.g., Python))  Statistical analysis (e.g., variability, sampling error, inference, hypothesis testing, EDA, application of linear models)  Data management (e.g., data cleaning and transformation)  Data mining  Data modeling and assessment  Artificial intelligence  Software engineering  IntelliGenesis, LLC is an EOE M/F/D/V",30+ days ago,4 reviews
https://www.indeed.com/viewjob?jk=48431c84d2c4995d&from=web&vjs=3,20,Software Engineer II (AI Team),Decision Research Corporation,"1600 Kapiolani Blvd, Honolulu, HI 96814","DRC provides global enterprise level software solutions to the financial services industry. DRC is currently looking for energetic, fast learning, and qualified individuals to join our team as a mid level application developer. This is a full time position in our Honolulu, HI office.  DRC uses a number of various programming languages and technologies, including Microsoft .NET. Qualified applicants should be able to quickly learn new concepts and software as necessary and should be able to demonstrate during the interviewing process their proficiency with the above technologies. Experience working in teams developing enterprise commercial grade transactional software systems is required.  Primary duties include:  Develop, test, and debug enterprise software solutions. Adhere to all development standards. Research, document and report project related items such as technology, infrastructure and applications.  Minimum qualifications:  A bachelor’s degree in ICS; MIS; Information Technology Management; Engineering or Mathematics (with strong computer skills).Vast understanding of cloud services and solutions in platforms such as Azure. Two years’ experience with technologies such as ASP. Net, C#, SQL, JavaScript, SQL Server, HTML, XML, web services, MVC, and object-oriented technologies. Familiarity with Python and should be able to use REST-based APIs and SDKs to build computer vision, natural language processing, knowledge mining, and conversational AI solutions on Azure. Understand the components that make up the Azure AI portfolio and the available data storage options. In addition, candidates need to understand and be able to apply responsible AI principle. Experience such as internships or personal projects a plus. -Self- motivated, excellent problem-solving skills, attention to detail and ability to learn new technologies quickly and work well in teams developing enterprise commercial grade transactional software systems is a plus.  Familiar with Agile software development life cycle Excellent problem-solving skills, attention to detail and ability to learn new technologies quickly and work well in teams, especially when developing when developing enterprise commercial grade transactional software systems is a plus.  This position is located in our Honolulu, Hawaii office.",30+ days ago,4 reviews
https://www.indeed.com/viewjob?jk=cfa6be14b58b3dac&from=web&vjs=3,20,"Big Data Architect, Senior",Booz Allen Hamilton,"737 Bishop St, Honolulu, HI 96813","The Challenge: Are you looking for an opportunity to not just develop software, but to build a system that will help protect the integrity of the mission related to a national intelligence agency? As a Big Data Architect SME, you can solve a problem with a complete end-to-end solution in a fast-paced, agile environment. We’re looking for a developer with the advanced skills needed to build data pipelines using a big data architecture to glean key insights from vision to production-ready system. This role is more than just coding. We need a full-stack developer who will use their passion to learn new tools and techniques, identify and implement system improvements, and mentor teammates. Using Hadoop, NiFi, and Kafka along with languages, such as Python, you’ll build data flows which transform data into useable insights. You’ll analyze the needs and the environment to make sure the solution you’re developing considers the current architecture and operating environment, as well as future functionality and enhancements. Join us as we build systems to change within an agency that supports our national interests for the better. Empower change with us You Have: Experience with data architecture, engineering, and Extract Transform Load (ETL) Experience with developing solutions to automate data integration and data management processes, including Extract Transform Load (ETL), and data cleansing and enrichment Experience with conducting organizational and technology assessments to implement new large data initiatives Experience with open-source data ingestion tools, including Nifi, Spark Ability to obtain a security clearance Bachelor's degree  Nice If You Have: Experience in data governance and data management practices with an emphasis on Federal and industry standard models, including DAMA DMBOK, TOGAF, DODAF, or FEA DRM Experience with utilizing statistical process control (SPC) to monitor and control the data analytics pipeline Experience with presenting to senior executives and communicating complex issues to a broad audience for gaining approvals Experience with analytical technologies used in enterprise reporting, including Tableau, Qlik, Looker, OBIEE, or equivalent Experience with leading teams of 5-10+ staff members, including providing both technical task and administrative leadership Experience in supporting and working with cross-functional teams in a dynamic environment Knowledge of basic concepts in CS and data science, including machine learning and artificial intelligence Ability to work independently and address ad-hoc challenges Ability to explain advanced concepts to team members, users, and clients Secret clearance Clearance: Applicants selected will be subject to a security investigation and may need to meet eligibility requirements for access to classified information. Build Your Career: A challenging and dynamic work environment isn’t all we have to offer. When you join Booz Allen, you’ll have access to: experts in virtually every field a culture that focuses on supporting our employees opportunities that provide stability while offering variety You’ll also be exposed to a wealth of training resources through our Digital University, an online learning portal featuring more than 5000 functional and technical courses, certifications, and books. Build your technical skills through hands-on training on the latest tools and tech from our in-house experts. Pursuing certifications that directly impact your role? You may be able to take advantage of our tuition assistance, on-site bootcamps, certification training, academic programs, vendor relationships, and a network of professionals who can give you helpful tips. We’ll help you develop the career you want as you chart your own course for success. We’re an EOE that empowers our people—no matter their race, color, religion, sex, gender identity, sexual orientation, national origin, disability, veteran status, or other protected characteristic—to fearlessly drive change.",30+ days ago,"2,314 reviews"
https://www.indeed.com/viewjob?jk=352b7d91ee7a1930&from=web&vjs=3,30,"Senior Software Engineer, Natural Language Processing / NLP",Recruiting From Scratch,"Honolulu, HI 96804","Our client helps organizations globally to build trust and speed into their business by matching the Speed of PrivacyOps to the Speed of Dev/BusinessOps. Clients include Patreon, Twilio, Coinbase, Robinhood, and Samara. Design and implement end-to-end Machine Learning and Natural Language Processing models and systems to help construct the foundation on which our global data infrastructure will be built.  Role Overview This role requires you to design and implement end-to-end Machine Learning (ML) and Natural Language Processing (NLP) models and systems to drive business impact. You partner with cross-functional stakeholders and customers to frame business problems as ML problems, prototype solutions effectively, and implement production-grade ML systems and the backend software systems they support to provide end to end five-star user experiences. Given you are constructing the foundation on which our global data infrastructure will be built, you need to pay close attention to detail and maintain a forward-thinking outlook as well as scrappiness for the present needs. You thrive in a fast-paced, iterative, but heavily test-driven development environment, with full ownership to design features from scratch to impact the business and the accountability that comes along. Responsibilities Scoping: Actively participate in customer engagements and partner with cross-functional stakeholders (legal product managers, customer success) to scope technical requirements for high impact business problems; determine whether ML is the right tool for the job and, if it is, how to frame the problem as an ML task Prototyping: Investigate different options quickly and thoroughly to identify the simplest, most pragmatic tool that drives business impact End-to-end System Design and Implementation: Gather training data; train, deploy, evaluate, and iteratively improve production-grade machine learning systems; implement and test the backend software systems they support to provide end-to-end five-star user experiences Follow and promote software engineering and machine learning best practices across the organization; keep up to date with the state of the art developments in NLP research, open-source frameworks, and MLOps Shape the direction of machine learning and build a cohesive team culture of ownership, growth, transparency, and customer focus You are a good fit if you: Have a track record of delivering production-grade ML/NLP models and systems, specifically in text classification, entity and relation extraction, summarization, question-answering, and knowledge base construction (2+ years) Have strong software engineering skills, and set examples by writing modular and maintainable code considering design principles and applying sound testing practices Are comfortable with Python, and have experience with ML/NLP tools and libraries such as scikit-learn, PyTorch, TensorFlow, spaCy, Hugging Face, Gensim, etc. Have a systematic and goal-directed approach to project management Are comfortable dealing with ambiguity and ruthlessly prioritizing and managing your time with a sense of urgency Thrive in a self-directed environment with full ownership to design features from scratch to impact the business and the accountability that comes along Are proactive about continuous improvement and excited about learning at breakneck speed in a fast-growth environment; are eager to candidly and directly give and receive feedback to improve together as a team Are customer and mission-driven, motivated by bringing the most value as possible to users and shaping an industry from the ground up Are the ultimate team player: collaborate effectively with others, consistently make time to help your teammates, and are ego-less in the search for the best ideas",30+ days ago,
https://www.indeed.com/viewjob?jk=09daf0799bad3bd5&from=web&vjs=3,30,NLP Engineer at Speech to Text Start Up,Recruiting From Scratch,"Honolulu, HI 96804","Who is Recruiting from Scratch: Recruiting from Scratch is a premier talent firm that focuses on placing the best product managers, software, and hardware talent at innovative companies. Our team is 100% remote and we work with teams across the United States to help them hire. About our Client Join our client in transforming the way remote teams work and communicate. Their AI-powered collaborative note-taking app works across Zoom, Google Meet, and Microsoft Teams to help teams record, transcribe, search and share meeting notes. In addition, we are making virtual meetings accessible to all employees - allowing team members with disabilities to participate in a world that is now dominated by virtual meetings.  With over 10M users experiencing their product, they are making an impact at scale and we are growing fast. The team is made up of top talent from companies like Google, Facebook, Yahoo!, Microsoft, Pinterest, Spotify, and Plaid. They are backed by leading investors that include David Cheriton (Google’s first investor), Tim Draper ( Draper Associates ), Spectrum Equity, Horizons Ventures, GGV Capital, and Duke University.  About this role They are seeking an experienced NLP Engineer (Junior | Senior | Staff) to join our technology team and solve challenging technical problems in processing collaborative voice conversations. Members of the technology team work as a group and with colleagues in engineering and product to devise and deploy new algorithms for speech recognition, speaker diarization, and language understanding.  Need to Have M.S. in Computer Science or equivalent Strong programming skills with working knowledge of Python You have 1-3 years of experience working on neural network based NLP Familiarity with the state of the art in deep learning Working knowledge of TensorFlow, PyTorch, or similar frameworks Experience working in a Linux environment Team player with good communication skills (oral and written) Preferred Qualifications Ph.D. in Computer Science, Speech/Language Processing or Machine Learning Experience with MapReduce, Spark, or similar frameworks Experience building crawlers Experience administering Linux clusters Experience developing web applications Employee Benefits Stock. Be a [literal] stakeholder in our company’s future.   Food. Enjoy catered meals and boundless snacks. Fun. We host team lunches weekly and team events bi-quarterly. People. Work with talented, collaborative, and friendly people who love what they do. Health and Saving. Receive the benefits of comprehensive health, dental, vision and disability insurance.",30+ days ago,
https://www.indeed.com/viewjob?jk=389d1d3e917e85f3&from=web&vjs=3,30,Otter.AI | Speaker Identification Engineer,Recruiting From Scratch,"Honolulu, HI 96804","Who is Recruiting from Scratch: Recruiting from Scratch is a premier talent firm that focuses on placing the best product managers, software, and hardware talent at innovative companies. Our team is 100% remote and we work with teams across the United States to help them hire. About our Client Join our client in transforming the way remote teams work and communicate. Their AI-powered collaborative note-taking app works across Zoom, Google Meet, and Microsoft Teams to help teams record, transcribe, search and share meeting notes. In addition, we are making virtual meetings accessible to all employees - allowing team members with disabilities to participate in a world that is now dominated by virtual meetings.  With over 10M users experiencing their product, they are making an impact at scale and we are growing fast. The team is made up of top talent from companies like Google, Facebook, Yahoo!, Microsoft, Pinterest, Spotify, and Plaid. They are backed by leading investors that include David Cheriton (Google’s first investor), Tim Draper ( Draper Associates ), Spectrum Equity, Horizons Ventures, GGV Capital, and Duke University.  About this role Our client is seeking an experienced Speaker Identification Engineer (Junior | Senior | Staff) to join our technology team and solve challenging technical problems in processing collaborative voice conversations. Members of the technology team work as a group and with colleagues in engineering and product to devise and deploy new algorithms for speech recognition, speaker diarization, and recognition.  Qualifications M.S. in Computer Science or equivalent Strong programming skills with working knowledge of C++ and Python 1-3 years of experience working on DNN based speaker id and diarization system Experience with TensorFlow, PyTorch, or similar frameworks Experience working in a Linux environment Team player with good communication skills (oral and written)Qualifications Preferred Qualifications Ph.D. in Computer Science, Speech/Language Processing or Machine Learning Familiarity with the state of the art in deep learning Experience with end-to-end neural network based speaker recognition Experience with MapReduce, Spark, or similar frameworks Experience building crawlers Experience administering Linux clusters Experience developing web applications Employee Benefits Stock. Be a [literal] stakeholder in our company’s future.   Food. Enjoy catered meals and boundless snacks. Fun. We host team lunches weekly and team events bi-quarterly. People. Work with talented, collaborative, and friendly people who love what they do. Health and Saving. Receive the benefits of comprehensive health, dental, vision and disability insurance.",30+ days ago,
https://www.indeed.com/viewjob?jk=3fc820d9393b30c7&from=web&vjs=3,30,Machine Learning Engineer (Speech to Text Startup),Recruiting From Scratch,"Honolulu, HI 96804","Who is Recruiting from Scratch: Recruiting from Scratch is a premier talent firm that focuses on placing the best product managers, software, and hardware talent at innovative companies. Our team is 100% remote and we work with teams across the United States to help them hire. About our Client Join our client in transforming the way remote teams work and communicate. Their AI-powered collaborative note-taking app works across Zoom, Google Meet, and Microsoft Teams to help teams record, transcribe, search and share meeting notes. In addition, we are making virtual meetings accessible to all employees - allowing team members with disabilities to participate in a world that is now dominated by virtual meetings.  With over 10M users experiencing their product, they are making an impact at scale and we are growing fast. The team is made up of top talent from companies like Google, Facebook, Yahoo!, Microsoft, Pinterest, Spotify, and Plaid. They are backed by leading investors that include David Cheriton (Google’s first investor), Tim Draper ( Draper Associates ), Spectrum Equity, Horizons Ventures, GGV Capital, and Duke University.   About this role They are seeking research and engineering professionals to join our technology team in conducting research and development of new deep learning algorithms for speaker ID, speech recognition and language understanding.  Members of the technology team work collaboratively as a group and with colleagues in engineering and product to devise and deploy new algorithms for natural language processing, speech recognition, speaker separation, diarization, and speaker identification.  Engineers on this team will work on algorithm development, model training and evaluation of the above-mentioned systems.  Need to Have B.S. in Computer Science or EECS Strong programming skills with working knowledge of Python Comfort with working in Linux terminals Experience with TensorFlow or PyTorch, or similar deep learning frameworks Familiarity with the state of the art in deep learning Comfort with working in a highly collaborative startup environment Team player with good communication skills (oral and written)  Nice to Have PhD or equivalent industry experience in speech/speaker recognition or NLP Employee Benefits Stock. Be a [literal] stakeholder in our company’s future.   Food. Enjoy catered meals and boundless snacks. Fun. We host team lunches weekly and team events bi-quarterly. People. Work with talented, collaborative, and friendly people who love what they do. Health and Saving. Receive the benefits of comprehensive health, dental, vision and disability insurance.",30+ days ago,
