URL,page_count,job_title,company,location,job_Description,post_date,reviews
https://www.indeed.com/viewjob?jk=d34e6636a5e84c3e&from=web&vjs=3,10,"Machine Learning Engineer, Mid",Booz Allen Hamilton,Hawaii,"The Challenge: Are you excited at the prospect of unlocking the secrets held by a data set? Are you fascinated by the possibilities presented by the IoT, machine learning, and artificial intelligence advances? In an increasingly connected world, massive amounts of structured and unstructured data open up new opportunities. As a data scientist, you can turn these complex data sets into useful information to solve global challenges. Across private and public sectors — from fraud detection to cancer research, to national intelligence — you know the answers are in the data. We have an opportunity for you to use your leadership and analytical skills to improve national security missions. You’ll work closely with your customer to understand their questions and needs, then dig into their data-rich environment to find the pieces of their information puzzle. You’ll explore data from various sources, discover patterns and previously hidden insights to address business problems, and use the right combination of tools and frameworks to turn that set of disparate data points into objective answers to help senior leadership make informed decisions. You’ll provide your customer with a deep understanding of their data, what it all means, and how they can use it. Join us as we use data science for good in national security. Empower change with us. You Have: 1+ years of experience with using data science and machine learning tools in a professional work environment Experience with using Python to perform data analysis, mining, and data visualization Ability to author complex documents describing and visualizing analytical results TS/SCI clearance Bachelor's degree Nice If You Have: Experience with the transition of a research capability to an operational product Experience with performing behavioral analysis and anomaly detection on data sets, including identifying true vs. false and positives vs. negatives Experience with developing and deploying machine learning models and analytic solutions in production environments Experience with SIGINT or cybersecurity operations TS/SCI clearance with a polygraph Master's degree Clearance: Applicants selected will be subject to a security investigation and may need to meet eligibility requirements for access to classified information; TS/SCI clearance is required. Build Your Career: At Booz Allen, we know the power of analytics, and we’re dedicated to helping you grow as a data analysis professional. When you join Booz Allen, you can expect: access to online and onsite training in data analysis and presentation methodologies, and tools like Hortonworks, Docker, Tableau, and Splunk a chance to change the world with the Data Science Bowl—the world’s premier data science for social good competition participation in partnerships with data science leaders, like our partnership with NVIDIA to deliver Deep Learning Institute (DLI) training to the federal government You’ll have access to a wealth of training resources through our Analytics University, an online learning portal specifically geared towards data science and analytics skills, where you can access more than 5000 functional and technical courses, certifications, and books. Build your technical skills through hands-on training on the latest tools and state-of-the-art tech from our in-house experts. Pursuing certifications? Take advantage of our tuition assistance, onsite boot camps, certification training, academic programs, vendor relationships, and a network of professionals who can give you helpful tips. We’ll help you develop the career you want, as you chart your own course for success. We’re an EOE that empowers our people—no matter their race, color, religion, sex, gender identity, sexual orientation, national origin, disability, veteran status, or other protected characteristic—to fearlessly drive change.",30+ days ago,"2,314 reviews"
https://www.indeed.com/viewjob?jk=a54325b8827689dd&from=web&vjs=3,10,"Data Strategy and Management Analyst, Senior",Booz Allen Hamilton,"737 Bishop St, Honolulu, HI 96813","The Challenge: Are you excited at the prospect of the possibilities presented by machine learning, and artificial intelligence advances? In an increasingly connected world, massive amounts of structured and unstructured data open up new opportunities. As a data strategist, you can turn these complex data sets into useful information to solve global challenges. Across private and public sectors — from healthcare, to national— you know the answers are in the data. We have an opportunity for you to use your leadership, strategic, and analytical skills to improve DoD mission impact. You’ll work closely with your clients to understand their questions and needs, and then dig into their data-rich environment to find the pieces of their information puzzle and make recommendations. You’ll analyze business problems, define technical requirements, build operating models, use data-driven decision-making, apply machine learning, and recommend the right combination of tools and frameworks to turn that set of disparate data points into objective answers to help military leaders make informed decisions. You’ll provide your clients with a deep understanding of their data, what it all means, and how they can use it. You Have: Experience with data management using Business Process Design, Business Process Improvement and Change Management processes Knowledge of architecture or governance principles and best practices Ability to collect and analyze data requirements Ability to explain practices to gain business and IT stakeholder buy-in Ability to research data management policies, strategies, and industry solutions Secret clearance Bachelor's degree Nice If You Have: Knowledge of common data analytics and business intelligence tools Knowledge of logical and physical data modeling concepts Change Management Professional Certification Clearance: Applicants selected will be subject to a security investigation and may need to meet eligibility requirements for access to classified information; Secret clearance required. Build Your Career: Consulting at Booz Allen means empowering you to provide your customers with the best support. With a consulting career at Booz Allen, you’ll have access to: a large business consulting community experts in virtually every field a culture that focuses on supporting our employees We have opportunities that provide stability while offering variety, so you can find the right fit for your career — and your life. You’ll also have access to a wealth of training resources through our Consulting University, an online learning portal where you can access more than 5000 functional and technical, certifications, and books. Build your skills through hands-on training on the latest tools and tech from our in-house experts. Pursuing certifications that directly impact your role? You may be able to take advantage of our tuition assistance, on-site courses, vendor relationships, and a network of professionals who can give you helpful tips. We’ll help you develop the career you want as you chart your own course for success. With contracts across the globe in multiple industries, no matter where you want to go with your consulting career, we have the path the takes you there. We’re an EOE that empowers our people—no matter their race, color, religion, sex, gender identity, sexual orientation, national origin, disability, veteran status, or other protected characteristic—to fearlessly drive change.",30+ days ago,"2,314 reviews"
https://www.indeed.com/viewjob?jk=0bbca5fba37180e5&from=web&vjs=3,10,Market Research Analyst / Statistician,SMS Research & Marketing Services,"1042 Fort Street Mall, Honolulu, HI 96813","Minimum qualifications.  2 years experience in analyzing data  Working knowledge of statistical packages, SPSS preferred  Excellent writing and communication skills and managing projects  Works well with a team and clients   For more information about this position, or to submit your resume, please fill out the form above.",30+ days ago,3 reviews
https://www.indeed.com/viewjob?jk=0cd8cbb4702793a0&from=web&vjs=3,10,Data Scientist (Banking/Financials),Pitney Bowes,Hawaii,"At Pitney Bowes, we do the right thing, the right way. As a member of our team, you can too. We have amazing people who are the driving force, the inspiration and foundation of our company. Our thriving culture can be broken down into four components:  Client. Team. Win. Innovate. We actively look for prospects who:  Are passionate about client success. Enjoy collaborating with others. Strive to exceed expectations. Move boldly in the quest for superior and best in market solutions. Job Description: You are: A Self-motivated Contributor who can design and build datasets that solve business problems. You are a Determined team player who can use data to predict and influence customer behaviors to meet organizational objectives. You will:  Contribute to the creation of a new analytics team serving all facets of the Financial Services business, with a focus on data governance  Develop and operationalize data management and benchmarking, including data normalization, cleaning, and mapping of data into a normalized structure  Develop models in support of sales enablement, revenue forecasting and portfolio management  Develop, support, and deliver business review documents on a regular cadence  Create and publish reporting and dashboards, anticipating relevant questions and analysis  Comfortable explaining analysis to a non-technical audience, understanding and translating operational challenges to achieve data led solutions. Can build and present data in a consumable manner (presentations, dashboards) that answer business questions Your background: As a Data Scientist,  you have:  Degree in Statistics, Computer Science, Data Analytics, a related quantitative discipline  Experience with statistical modelling and analytical techniques & working with Python, SQL, and R  2+ years' experience working in a Data Science/Data Analysis/Statistics role in a commercial or consumer financial environment  Statistical techniques such as linear/logistic regression, clustering, decision trees, time series analysis, machine learning, A/B tests, GLM, Bayesian Methods)  Experience with data, including querying, aggregation, analysis, and visualization is a benefit Desirable:  Experience in a Financial Services or Commercial Bank  Masters or PhD in related field  Experience with rate making and financial forecasting  Experience with Snowflake, SAP HANA We will: Provide the opportunity to grow and develop your career Offer an inclusive environment that encourages diverse perspectives and ideas Deliver challenging and unique opportunities to contribute to the success of a transforming organization Offer comprehensive benefits globally  ( pbprojectliving.com) Pitney Bowes is an Equal Employment Opportunity/Affirmative Action Employer that values diversity and inclusiveness in the workplace. Women/Men/Veterans/Individuals with Disabilities/LGBTQ+   are encouraged to apply. All interested individuals must apply online. Individuals with disabilities who cannot apply via our online application should refer to the alternate application options via our Individuals with Disabilities link.",20 days ago,"3,073 reviews"
https://www.indeed.com/viewjob?jk=45a53e565bc6b75f&from=web&vjs=3,10,RESEARCH STATISTICIAN IV,Hawaii Health Systems Corporation,"Kailua-Kona, HI","DATE POSTED:  12/21/2021  JOB TITLE:  RESEARCH STATISTICIAN IV (Quality Management)  RECRUITMENT NO:  KCH 21-232 (Full Time with Benefits)  SALARY RANGE:  $4.600.00 PER MONTH (SR-22; BU: 13)  JOB DUTIES :  The primary responsibility of the position is to perform timely and accurate data retrieval from the Electronic Medical Record, entering data into various databases, utilizing established specifications to submit data to external reporting agencies. This position will be working with physicians, program administrators, subject matter specialists and staff. This position may be required to work shifts, weekends, and holidays.  MINIMUM QUALIFICATION REQUIREMENTS :  EDUCATION:  One of the following must have successfully been completed:   A full four (4) year course leading to a bachelor’s degree in an accredited college or university.  Four (4) years of progressively responsible experience in administrative, professional, investigative, technical or other responsible work which demonstrated that the applicant is able to assimilate and analyze data to arrive at sound solutions to problems and which includes evidence of professional statistical work.  Appropriate experience as described in (2), with education that will total four years of education and experience and give the applicant a technical knowledge comparable to that which would have been acquired through successful completion of a full four (4) year course.   EXPERIENCE :  Specialized Experience :   Specialized Experience:  Two and one half (2 ½) years of research statistical survey work which included applying statistical theory and method in planning establishment and operation of comprehensive data collection systems, including all phases of collection, editing, processing and publishing complex and extensive statistical data. The capacity to plan and coordinate statistical survey activities of considerable difficulty, breadth and complexity is required.  Two (2)  years of experience in data collection and reporting and/or clinical chart reviews and abstraction preferred.  CERTIFICATION :  ( Preferred)  RHIT (Registered Health Information Technician), or CCS (Certified Coding Specialist), or CTR (Certified Tumor Registrar) or any other healthcare related certification that provides knowledge and expertise in clinical review of the patient medical record.  LICENSE :  None required.  Required Forms & Documentation:  Evidence of the appropriate training (e.g., official transcript or degree) to be given credit for education and/or experience. A legible photocopy will be accepted; however, Kona Community Hospital reserves the right to request an official copy.   All West Hawaii Health Care Facilities are Nicotine Free  An Equal Opportunity Employer  ALL JOB VACANCIES WILL BE POSTED FOR A MINIMUM OF TEN (10) CALENDAR DAYS  For an application packet, click on the links below. For additional information, call  (808) 322-4458  or e-mail  Recruiting/Employment .   Application Form (PDF)  Drug Screen Authorization Form (PDF)  Licensure information  Request for Administrative Review (PDF)   Applications are also available at:   Kona Community Hospital  Human Resources Office  79-1019 Haukapila Street  Kealakekua, HI 96750  Phn:  (808) 322-4458  Fax: (808) 322-5870   Kohala Hospital  Human Resources Office  P. O. Box 10  Kapaau, HI 96755  Phn:  (808) 322-4458  Fax: (808) 322-5870   Kona Community Hospital is a 94-bed full-service acute care hospital with 24-hour emergency services, proudly serving the West Hawaii community. For nearly 100 years we have been caring for the people of West Hawaii. Adding more and more services, we have constantly improved our abilities to serve our residents and visitors whenever they are in need. We are your friends and neighbors, here to help through trying times and happy moments, through crisis and celebrations. As your community hospital, you can count on us. We take pride that every patient that comes through our door is treated like “ohana.”  PERSONS WITH DISABILITIES MAY CONTACT THE RECRUITMENT OFFICER AT (808) 733-4162, (TTD/TTY), or E-mail: konajobs@hhsc.org TO DISCUSS SPECIAL NEEDS IN APPLYING.  Application hours are: Monday to Friday (except holidays) 8:00 –4:00 pm at which time applicants are able to complete an application and have their application reviewed by the facility Human Resources Office. Only applicants that have been through a Human Resources (HR) applicant screening process will be considered for an interview with a hiring manager. Applications for announcements with a deadline date must be on file no later than the last day to file applications. Applications for announcements with “Continuous Recruitment until Needs are Met” will be accepted as long as there are vacancies. Inactive/filled announcements will be taken off the HHSC website.  QUALITY OF EXPERIENCE:  Possession of the required amount of experience will not in itself be accepted as proof of qualification for the position. Overall paid or unpaid experience must have been of such scope and responsibility as to conclusively demonstrate that you have the ability to perform the duties of this position. Provide a detailed description of your duties and responsibilities. If you worked on a part-time basis, indicate the average number of hours worked per week. Please note that experience will be based on a 40-hour workweek.  Note:  We will not postpone the recruitment process because of your failure to provide accurate and complete information concerning your qualifications.  MERIT OR CIVIL SERVICE SYSTEM : Applicants must meet the minimum qualification requirements, including education, experience, other public employment requirements for State Civil Service employment, and HHSC Standards of Fitness. Only those applicants that are scheduled for an interview with the hiring manager will be contacted. Applications will be kept active for six (6) months.  CITIZENSHIP AND RESIDENCE REQUIREMENT:  Applicants must be eligible to work in the U.S. and at the time of appointment intend to reside in the State of Hawaii during the course of employment with the Hawaii Health Systems Corporation.  VETERAN’S PREFERENCE:  If you are claiming Veteran’s Preference, you must submit a copy of your DD214 and/or other substantiating documents specifying the periods of your service.  PHYSICAL/MENTAL REQUIREMENTS:  Applicants must be able to physically and mentally perform efficiently the duties of the position. Qualified applicants with disabilities who can perform the essential functions of the advertised position are encouraged to apply. The Hawaii Health Systems Corporation is committed to making reasonable accommodations on a case-by-case basis. Applicants seeking reasonable accommodation should be ready to discuss the accommodation sought so that a determination can be made that such accommodation is reasonable and would not cause the employer undue hardship.  MEDICAL/PHYSICAL EXAMINATION REQUIREMENT:  Offers of employment will be contingent on successfully passing a pre-employment physical examination, which includes drug screen and other regulatory medical requirements such as, but not limited to, two-step tuberculosis (TB) screen. The cost for physical examinations, except the cost for drug screening, shall be borne by the applicant and not the Hawaii Health Systems Corporation.  COVID-19 VACCINATION REQUIREMENT:  COVID-19 vaccination is a condition of employment for Hawaii Health Systems Corporation. After receiving a conditional offer of employment, all prospective new HHSC employees are required to be fully vaccinated against COVID-19. New employees are required to provide confirmation of their full vaccination status by presenting their CDC vaccination card or VAMS Certificate prior to their start date.  PHYSICAL EXAMINATION REQUIREMENT:  Offers of employment will be conditioned on the results of a complete physical examination, which includes a drug screening. For certain job categories, applicants may be referred to an HHSC-designated physician, rather than the applicant’s personal physician of choice. The cost for all physical examinations, except the cost for the drug screening, shall be borne by the applicant and not the Hawaii Health Systems Corporation. The Hawaii Health Systems Corporation shall bear the cost of the drug screening.  JOB LOCATION: KONA COMMUNITY HOSPITAL – MEDICAL STAFF SERVICES  applicants may be referred to an HHSC-designated physician, rather than the applicant’s personal physician of choice. The cost for all physical examinations, except the cost for the drug screening, shall be borne by the applicant and not the Hawaii Health Systems Corporation. The Hawaii Health Systems Corporation shall bear the cost of the drug screening.  CRIMINAL/BACKGROUND, CREDENTIALING CHECKS:  Applicable checks will be conducted periodically and any associated costs may be borne by the applicant. If a job offer is made or employment is begun prior to completion of all applicable checks, any offer of employment or continued employment is contingent upon satisfactory return of all required checks.  HOW TO APPLY:  Applications are available at the  Kona Community Hospital,  Human Resources Office, 79-1019 Haukapila Street, Kealakekua, HI 96750 or  Kohala Hospital,  P. O. Box 10, Kapaau, HI 96755. You can call (808) 733-4162, (Voice/TT), e-mail: konajobs@hhsc.org or visit our website at  www.hhsc.org . Application hours are: Monday to Friday (except holidays) 8:00 AM – 4:00 pm at which time applicants are able to complete an application and have their application reviewed by the facility Human Resources Office. Only applicants that have been through a Human Resources (HR) applicant screening process will be considered for an interview with a hiring manager. Applications for announcements with a deadline date must be on file no later than the last day to file applications. Applications for announcements with “Continuous Recruitment Until Needs are Met” will be accepted as long as there are vacancies. Inactive/filled announcements will be taken off the HHSC website.   STEPS TO AN ADMINISTRATIVE REVIEW, SUBSEQUENT APPEALS : If you do not agree with a decision made by the Employment Office as to your non-qualification or non-selection for a position, you may complete a Request for Administrative Review form (available on the HHSC website) or you may submit a written request within twenty (20) days from the date of your sent notice to the Regional Chief Executive Officer/Designee. Your letter requesting the Administrative Review must include 1. The job title(s) and recruitment number(s), 2. the specific reason(s) you are requesting the review noting if there is a statute or rule violation, and 3. any additional information you want to submit to substantiate your request. If you do not submit your request within the  twenty (20) days deadline, no Administrative Review will be conducted.  Since the Administrative Review is a prerequisite to subsequent steps, failure to utilize this process will make you ineligible for subsequent appeals. The administrative review, formal complaint and/or appeals hearing will not necessarily postpone the recruitment process and/or rescind a selection.  If you do not agree with the Administrative Review, you may file a Formal Complaint and then, if you are still not satisfied, you can appeal to the HHSC Merit Appeals",30+ days ago,13 reviews
https://www.indeed.com/viewjob?jk=b7e7c7bbe9907612&from=web&vjs=3,10,Sr Data Analyst,"Torch Technologies, Inc.","Honolulu, HI 96801","Job Description: In general, the data analyst will collect and store data on personnel, equipment, finance, logistics, etc. and bring technical expertise to ensure the quality and accuracy of that data, then process, design, and present it in ways to help people, businesses, and organizations make better decisions.  Responsibilities  Manage master data, including creation, updates, and deletion.  Provide quality assurance of imported data, working with quality assurance analysts if necessary.  Commission and decommission of data sets.  Perform analysis to assess quality and meaning of data.  Process classified data and information according to guidelines.  Manage and designing the reporting environment, including data sources, security, and metadata.  Support the data warehouse in identifying and revising reporting requirements.  Support initiatives for data integrity and normalization.  Create and maintain reports in various formats including interactive visualizations from single or multiple systems.  Troubleshoot the reporting database environment and reports.  Train end-users on new reports and dashboards.  Provide technical expertise in data storage structures, data mining, and data cleansing.    Job Requirements:   Bachelor’s degree from an accredited university or college in Mathematics, Computer Science, Economics, Engineering or Statistics and 7 years experience  3+ years’ experience mining data as a data analyst.  Proven analytic skills, including mining, evaluation, analysis, and visualization.  Technical writing experience in relevant areas, including queries, reports, and presentations.  Strong SQL, MS Excel, and MS Access skills including creating tables and queries, formulas, power queries, pivots, macros, and data connections; Or the ability to quickly learn these as well as other analytical tools.  Ability to work with stakeholders to assess potential risks and areas of improvement.  Ability to translate business requirements into non-technical, lay terms.  High-level experience in methodologies and processes for managing large-scale databases.  Demonstrated experience in handling large data sets and relational databases.  Understanding of addressing and metadata standards.  High-level written and verbal communication skills.  Strong programming experience with frameworks including XML, Javascript, and C#.  Proven success in working in a collaborative, team-oriented environment.  Knowledge management preferred",14 days ago,3 reviews
