URL,page_count,job_title,company,location,job_Description,post_date,reviews
https://www.indeed.com/viewjob?jk=4ce4d4256f447387&from=web&vjs=3,30,Machine Learning Engineer,OPTX,United States,"This role will work with the Data Science team and other stakeholders to plan and execute data-driven projects and processes. You will be designing end-to-end machine learning mechanisms and pipelines using scalable technology. You will be working in a fast-pace fail-fast environment. Responsibilities: The Machine Learning Engineer position will develop web-based products and new APIs to utilize and implement machine learning models Primary effort will be to incorporate data science models with OPTX product teams and build internal web-based consumption tool Develop infrastructure and “pipelines” for handling data, applying generalization and abstraction layers to enhance efficiency and sustainability of data architecture Design automated monitoring, redundancies, and robust architecture to minimize data and modeling interruptions Working with distributed clusters / parallelized processing Collaborate with product teams to align with product road maps and ensure API feeds are always working Collaborates with stakeholders to design tests and validate/measure results. Performs other job-related duties as requested. Requirements: MS or PhD in quantitative field, preferred computer science Demonstrated experience in developing data science solutions Previous experience working in a cloud environment Real time data (ie Spark, Kafka) experience preferred Client and server-side scripting (ie HTML, Javascript, PHP, Python Flask) experience required Relational Database (SQL) experience required Must possess very strong interpersonal, communication and consensus building skills; willing to work on developing and managing key relationships across the organization Must be able to work in a deadline-oriented environment, ensuring decisions and management communication is occurring in a timely fashion Ability to uphold and demonstrate the highest level of integrity in all situations and recognize standards required by a regulated business Bonus Points For · 4+ years of experience with R / Python / bash · Previous experience creating machine learning applications, data-processing pipelines, monitoring results / iterating after launch. · Previous experience with supporting cloud-based ML pipeline/operationalization. · Previous experience in the gaming/casino industry · Relevant experience can range from working on a wide-variety of optimization, and classification problems, e.g. segmentation, propensity modeling, text/sentiment classification, LTV prediction, collaborative filtering/recommendation, or anomaly detection Job Type: Full-time Pay: $100,000.00 - $175,000.00 per year Benefits: 401(k) 401(k) matching Dental insurance Flexible schedule Health insurance Paid time off Vision insurance Schedule: 8 hour shift Supplemental Pay: Bonus pay Education: Master's (Preferred) Experience: Spark: 3 years (Preferred) SQL: 3 years (Preferred) Work Location: Multiple Locations",,
https://www.indeed.com/viewjob?jk=65c70ef0e21bd500&from=web&vjs=3,20,Corporate Advanced Analyst I (Data Scientist),Hawaii Medical Service Association,"818 Keeaumoku St, Honolulu, HI 96814","Job Summary  Works independently with internal and external customers to clearly articulate and define business problem(s) to be solved; reviews data sources and preps needed data; performs required analysis; applies accepted statistical methodologies where applicable; documents the process that was followed and data sources/tools used; ensures results have been validated (statistically, if necessary); and prepares/presents findings that are informative and audience appropriate to drive decision making across various levels of the organization.  Duties and Responsibilities  Advanced Analytics and Technical Expertise: Performs data analysis to address complex business questions, applies data programming and statistical methodologies where applicable. Documents and communicates data strategies, analytic methods and results, and findings and impacts.  Determines what kind of analytics will be performed (descriptive, predictive, prescriptive) and defines/documents overall framework.  Where appropriate, applies linear regression (correlation, contingency table, ANOVA, inference, chi-square, t-test) and/or time series methods (data set-up, conversions, trends, decomposition, models, forecasts, confidence).  Utilizes appropriate tools to load, integrate, and analyze data.  Conducts analysis and documents findings, identifies unexpected anomalies and root cause (if possible) and determines if analysis can continue, identifies alternatives if anomalies cannot be resolved  Ensures reproducibility of outcomes.  Documents entire analysis process, including business problem, data sources, methods and tools used, project reference, and outcomes.  Implements pre-emptive actions, where possible.  Data Management: Reviews data sources and preps needed data. Identifies existing and new data sources.  Performs data prototyping, if necessary, to agree what data can/not be used.  Preps data for use in analysis, goes back to source if problems are found, and identifies other options/alternatives if problems cannot be resolved.  Performs review of data to ensure completeness/accuracy/timeliness for the purpose of the analysis.  Ensures existing, approved, corporate tools used can accept/integrate the data.  Where necessary (and if practical to be done within the delivery timeframe of a project), facilitates the identification and use of new tools and works with the Technical Review Committee to authorize its use.  Project Definition and Coordination: Lead meetings with internal and external customers to clearly articulate and define business problem(s) of medium/high complexity and impact (department/function specific, external customer centric, or part of a corporate project). Types of projects include descriptive and predictive analytics.  Applies a whole company perspective, draws upon previous knowledge and experience, and - where necessary - researches new/other approaches to identify and agree upon objectives, approach, and success measures.  Works with customer to submit appropriate paperwork (ISS, TPDR, etc.) and ensures necessary agreements are in place for external customers.  Defines delivery milestones and negotiates timeframes, monitors progress, and periodically notifies customer of status.  Effective Communication: Works primarily with department heads or function leads to prepare/present findings that are informative and audience appropriate Reviews findings and outcomes with customer, ensures business problem/objectives have been met, and prepares documentation of the analysis  Where necessary, manage divergent views in the audience and advises the internal/external customer on any recommendations or options that will facilitate data and analysis driven decision making.  Prepares a presentation of the analysis, process followed, and reviews it with the customer to ensure the results are audience appropriate.  Other Duties/Functions: Performs all other miscellaneous responsibilities and duties as assigned or directed. Trains others on MicroStrategy and Excel.  Functions as a team player within the department and embodies collaboration.  Exempt or Non-Exempt  Exempt  Minimum Qualifications  Bachelor's degree and four years of related experience or two years of Healthcare Analytics experience; or an equivalent combination of education and related work experience.  Strong oral and written communicate skills.  Strong understanding of data (types, content reliability, etc.).  Strong problem solving and data collection, analysis, and interpretation.  Strong understanding/use of dashboards, data visualization tools, and advanced and custom graphics.  Basic knowledge of Microsoft Office applications. Including but not limited to Word, PowerPoint, Excel, and Outlook.  Proficiency with OLAP tools and databases.  Knowledge of one or more of the following: SQL, R or SAS/SPSS.",28 days ago,118 reviews
https://www.indeed.com/viewjob?jk=352e442acb7c82df&from=web&vjs=3,30,Data Scientist,Recruiting From Scratch,"Honolulu, HI 96804","Who is Recruiting from Scratch: Recruiting from Scratch is a premier talent firm that focuses on placing the best product managers, software, and hardware talent at innovative companies. Our team is 100% remote and we work with teams across the United States to help them hire. We work with companies funded by the best investors including Sequoia Capital, Lightspeed Ventures, Tiger Global Management, A16Z, Accel, DFJ, and more. If you are a fit, the team will reach out to you about this role or any others that may be a fit for our clients. Our Client Our client is a research and development organization focused on the web3 ecosystem. They love the open nature of blockchain and intend to leverage it to increase opportunity and fairness. They are a cross-functional team of continuous learners that like to focus on difficult, challenging problems that take focus and diligence to crack. Our client is looking for highly motivated and adaptable individuals to work with us in delivering on their vision. You will: Design and build models across a variety of use cases to deliver insights for internal and external stakeholders Participate in research and development process, staying up to date on recent work Work heavily with different data sets to create sources and signals necessary for modeling purposes Create visualizations and summaries of research efforts to present to research, engineering, and executive teams You have: Curiosity, empathy, and an interest in working with a team in a highly collaborative environment An ability to adapt and work under large amounts of uncertainty 5+ years developing production-quality software in a high-performance language like Python, C++, Go, etc Experience with tools and frameworks like Pytorch, TensorFlow, Pandas, etc Experience developing and deploying production quality code Strong communication skills when it comes to explaining your decision and your work product Bonus if you have: BA/MA, BS/MS, or PhD in a technical field Experience in gaming, economics, blockchain, mathematical or statistical modeling, AI/ML Experience designing or working with DeFi protocols Experience with smart contract development",30+ days ago,
https://www.indeed.com/viewjob?jk=6c7e3ce42da0f0a5&from=web&vjs=3,30,Senior AI/ML Software Developer,"Lexmark International, Inc.",United States,"Senior AI/ML Software Developer Lexmark creates innovative imaging solutions and technologies that help customers worldwide print, secure, and manage information with ease, efficiency and unmatched value. Combining innovative technologies with deep industry expertise, Lexmark simplifies the complex intersection of digital and printed information in retail, financial services, healthcare, manufacturing, education, government and more. Lexmark operates in over 170 countries. The Lexmark Ventures division is chartered with leveraging Lexmark technologies, competencies, and relationships to establish non-traditional Lexmark growth, revenues, and contribution. The Senior AI/ML Software Developer will develop advanced AI, neural network, machine learning, data analytics, and optimization algorithms and apply them to create new intelligent devices, solutions and services, with prominent emphasis on vision-based problems. Fluent in convolutional neural network architectures and toolkits. Capable of building novel neural networks or using existing networks and optimizing to meet customer demands. Proficient in python and C++ development, and experienced building Vision Based AI applications (object detection, classification, tracking, segmentation, etc). Creates and maintains complex datasets and tools for annotating and training new AI models. Conversant in training of neural networks for temporal based problems (detecting human behaviors, etc). Builds AI applications for deployment on embedded systems or in the cloud, depending on customer need. Key Qualifications:  BS,MS in Computer Science or demonstrated substantial expertise in machine learning a plus  Practical background building vision-based machine learning and artificial intelligence (AI/ML) solutions  Ability to build and train custom neural networks Preferred Skills:  Python and C++ coding  AI/ML model creation (CNN)  Data set training and management  Deepstream development experience  Data Analytics  Algorithm development skills  Image sensors and optics a plus",15 days ago,489 reviews
https://www.indeed.com/viewjob?jk=8bf44c62c39b34e4&from=web&vjs=3,30,Data Scientist Visualization Engineer,"nference, inc.",United States,"Company Description A science-first software company, nference has been called “The Google of Biomedicine” by the Washington Post. Our proprietary AI-enabled software is the only platform that addresses the end-to-end challenges associated with unlocking the potential of electronic medical records (EMRs) in a privacy-preserving manner. The exponential growth of biomedical data, driven by the adoption of EMRs, provides an unprecedented opportunity to create transformative technologies and products in healthcare. nference partners with medical centers to turn decades of rich, but predominantly unstructured, data captured in EMRs into powerful solutions that enable scientists to discover and develop the next generation of personalized diagnostics and treatments for patients worldwide. We believe that the greatest opportunity for our generation to elevate human health is by developing technology to curate and synthesize the world's biomedical data in order to enable that scientific discovery. nference is headquartered in Kendall Square (Cambridge, MA), the world’s biotech capital, with offices in Rochester (Minnesota), Bangalore (India) and Toronto (Canada). You will work alongside a multidisciplinary team of serial entrepreneurs from the tech and biotech worlds along with highly trained, innovative and dedicated scientists/physicians (PhD in Biology/Genomics and/or MD). Job Description nference is seeking a highly skilled and experienced Data Scientist/Visualization Engineers. This position would be focused on execution of the various scientific collaborations with our partners and developing innovative components that can be incorporated into our analytics platform that is used to gain insights from the entire gamut of medical data(clinical notes in natural language text, longitudinal structured patient history, images and videography, lab and clinical measurements and observations, genomics etc.). In this position, you would work closely with physicians, scientists, data scientists, and engineers, both internally and externally, to drive forward cutting-edge research and develop new models of patient care. You must be a self-starter who thrives in a fast-paced, agile environment – which requires wearing many hats, the ability to change direction quickly, and an eagerness to learn new technologies as needed. This position will be based in our Durham, NC office. Individuals do not have to be physically located in Durham and can be remote. Responsibilities :  - Exploring, examining and presenting data from multiple structured and unstructured sources with the goal of discovering advancing hypotheses relevant to life sciences and biomedicine - Applying mathematical and statistical concepts to perform analyses across a diverse range of scientific, clinical and translational datasets. - Leveraging expertise in computer science, software development and algorithms to analyze and implement analytic workflow processes and data visualizations. - Deploy, debug and ensure high performance of developed solutions. - Working with a team of other data scientists to build and develop the core software platform and underlying inference tools. Working with research scientists and clinical scientists in leveraging those tools towards collaborations with physicians and biopharma researchers. - Leveraging speaking skills and presentation expertise to convey complex information to audiences from diverse backgrounds Required Qualifications :  - BS/MS in computer science, data science, computer engineering, statistics - Ability to build visualizations of analytic information using web technologies - Understanding of data structures, software engineering principles, software architecture and machine learning principles - Coding experience: Web technologies like Javascript/HTML/CSS, Web frameworks like React/Angular, NoSQL and SQL databases. Familiarity with languages like python, golang, C/C++ and machine learning tools like pandas, NumPy, scipy, PyTorch, Keras, TensorFlow, scikit-learn, Jupyter notebooks etc. will be additionally preferred. - Experience with software development · Working with big data · Data quality analysis · Feature engineering · Model training, testing, and validation using packages - Familiarity with statistical analysis and database queries - Must be able to work collaboratively, must be able to work across teams - Experience working with healthcare (electronic health records, claims data, etc.) or biological datasets (RNAseq, genomics, proteomics, etc.) strongly preferred Position includes competitive sick/vacation/holiday package, equity, health, dental, life insurance, STD, LTD and 401k plan. nference will only respond via email to candidates selected for further consideration. nference is an Equal Opportunity Employer and considers applicants for all positions without regard to race, color, creed, religion, ancestry, national origin, age, gender identity, gender expression, sex/gender, marital status, sexual orientation, physical or mental disability, medical condition, military/veteran status, citizenship status, basis of genetic information, or any other group protected by law. Job Type: Full-time Benefits: 401(k) Dental insurance Health insurance Life insurance Paid time off Parental leave Retirement plan Vision insurance Schedule: Monday to Friday Education: Bachelor's (Preferred) Work Location: Multiple Locations",,
https://www.indeed.com/viewjob?jk=f39f4fb8379fd34e&from=web&vjs=3,30,Data Scientist,Novetta,"Honolulu, HI","Join our team dedicated to developing and executing innovative solutions in support of customer mission success. Novetta is committed to cultivating a diverse, inclusive workplace culture, embracing our differences and perspectives to build a stronger, more successful company. Job Description:  Novetta is currently seeking a Data Scientist to fill an immediate opening located in Honolulu, HI. The selected candidate should have extensive experience in a relative field such as quantitative methods, statistics, or analytic methodologies. This candidate may be required to deploy forward up to 10% of the time into operational areas or other remote sites.  Responsibilities:   Responsible to support quantitative and qualitative integrated assessments of research questions across entire projects to assess the uncertainties (uncertainty includes work scope gaps, normal estimating, variability/error, and risk events) associated with integrated baseline activities and assists in the implementation of the risk mitigation actions  Qualitative simulations may be performed to forecast an accurate and realistic project schedule to anticipate potential areas of high risk and uncertainty  Perform advanced risk analysis across all government requirements, organizational missions, and activities  Explores data sets and verifies data quality to gain an understanding of relevant data, then identifies differences in data distribution that could affect performance when deploying the machine learning model in an operational environment  Identify data sets of machine learning tests and use cases  Develops and tunes machine learning model's hyper parameters   Basic Qualifications:   2+ years experience with deep learning frameworks, and extensive experience with programming languages such as Python, R, MS SQL, MySQL, NoSQL, MongoDB, Tableau, Hadoop, Spark, and basic libraries (such as scikit-learn and pandas)  2+ years experience in visualizing and manipulating big data sets, including leaflet, plotly, D3, and ggplot  2+ years experience with Linux / Red Hat platforms, and proficient with OpenCV  2+ years experience with data mining and statistical analysis     Desired Skills:   Excellent pattern recognition and predictive modeling skills  Streaming device metadata understanding: Understand how to log and capture streaming device metadata  Function independently and can present/defend/communicate the results and ideas to key decision makers  Modeling familiarity: Ability to understand how to optimize datasets for use in computational models  Network & Transport understanding: Should have an awareness of network architecture and ensuring low-latency database hookups and calls  Graph Indexing: Ability to develop logical connections between disparate data via indexing in an efficient manner, and building/understanding graph algorithms to maximize value of retained data  AWS familiarity: Ability to use and manage AWS instances as well as coding lambda functions (etc) to minimize expenditure while maximizing throughput   Security Clearance Requirements:   Active TS/SCI security clearance required  Willing to undergo polygraph examination   Novetta, from complexity to clarity.  Novetta delivers highly scalable advanced analytics and secure technology solutions to address challenges of national and global significance. Focused on mission success, Novetta pioneers disruptive technologies  in machine learning, data analytics, full-spectrum cyber, cloud engineering, open source analytics, and multi-INT fusion  for  Defense, Intelligence Community, and Federal Law Enforcement customers. Novetta is headquartered in McLean, VA with over 1,300 employees across the U.S.  Our culture is shaped by a commitment to our core values:  Integrity •  We hold ourselves accountable to the highest standards of integrity and ethics.  Customer Success •  We strive daily to exceed expectations and achieve customer mission success.  Employee Focus •  We invest in our employees' professional development and training, respecting individuality, and fostering a culture of diversity and inclusion.  Innovation •  We know that discovering new and innovative ways to solve problems is critical to our success and makes us a great company.  Excellence in Execution •  We take pride in flawless execution as we build a company that is best in class.   Earn a REFERRAL BONUS for the qualified people you know.  For more details or to submit a referral, visit bit.ly/NovettaReferrals.   Novetta is an equal opportunity/affirmative action employer.  All qualified applicants will receive consideration for employment without regard to sex, gender identity, sexual orientation, race, color, religion, national origin, disability, protected veteran status, age, or any other characteristic protected by law.   The health and safety of our employees is a priority for Novetta. Please be aware that Novetta requires all employees to be fully vaccinated as a condition of employment. Novetta will consider requests for medical or religious accommodation to this vaccination requirement during the recruiting process.",5 days ago,51 reviews
