URL,page_count,job_title,company,location,job_Description,post_date,reviews
https://www.indeed.com/viewjob?jk=69272564e7bf1212&from=web&vjs=3,10,Sr. Data & ML Engineer,"Amazon Web Services, Inc.",Montana," Bachelor’s degree in Computer Science, Engineering, Mathematics or a related field or equivalent professional or military experience  8+ years of experience of Data platform implementation  3+ years of hands-on experience in implementation and performance tuning of Kinesis, Kafka, Spark or similar implementations  Hands on experience with building data or machine learning pipeline  Experience with one or more relevant tools (Flink, Spark, Sqoop, Flume, Kafka, Amazon Kinesis)  Experience developing software code in one or more programming languages (Java, JavaScript, Python, etc)  Current experience with hands-on implementation  At Amazon Web Services (AWS), we’re hiring highly technical Data and Machine Learning engineers to collaborate with our customers and partners on key engagements. Our consultants will develop and deliver proof-of-concept projects, technical workshops, and support implementation projects. These professional services engagements will focus on customer solutions such as Machine Learning, Data and Analytics, HPC and more. In this role, you will work with our partners, customers and focus on our AWS offerings such Amazon Kinesis, AWS Glue, Amazon Redshift, Amazon EMR, Amazon Athena, Amazon SageMaker and more. You will help our customers and partners to remove the constraints that prevent them from leveraging their data to develop business insights. AWS Professional Services engage in a wide variety of projects for customers and partners, providing collective experience from across the AWS customer base and are obsessed about customer success. Our team collaborates across the entire AWS organization to bring access to product and service teams, to get the right solution delivered and drive feature innovation based upon customer needs. You will also have the opportunity to create white papers, writing blogs, build demos and other reusable collateral that can be used by our customers. Most importantly, you will work closely with our Solution Architects, Data Scientists and Service Engineering teams. The ideal candidate will have extensive experience with design, development and operations that leverages deep knowledge in the use of services like Amazon Kinesis, Apache Kafka, Apache Spark, Amazon Sagemaker, Amazon EMR, NoSQL technologies and other 3rd parties. Inclusive Team Culture Here at AWS, we embrace our differences. We are committed to furthering our culture of inclusion. We have thirteen employee-led affinity groups, reaching 85,000 employees in over 190 chapters globally. We have innovative benefit offerings, and host annual and ongoing learning experiences, including our Conversations on Race and Ethnicity (CORE) and AmazeCon (gender diversity) conferences. Amazon’s culture of inclusion is reinforced within our 16 Leadership Principles, which remind team members to seek diverse perspectives, learn and be curious, and earn trust. Work/Life Balance Our team puts a high value on work-life harmony. Striking a healthy balance between your personal and professional life is crucial to your happiness and success here. We are a customer-obsessed organization—leaders start with the customer and work backwards. They work vigorously to earn and keep customer trust. As such, this is a customer facing role in a hybrid delivery model. Project engagements include remote delivery methods and onsite engagement that will include travel to customer locations as needed. Mentorship & Career Growth Our team is dedicated to supporting new members. We have a broad mix of experience levels and tenures, and we’re building an environment that celebrates knowledge sharing and mentorship. We care about your career growth and strive to assign projects based on what will help each team member develop into a better-rounded professional and enable them to take on more complex tasks in the future. This is a customer facing role. You will be required to travel to client locations and deliver professional services when needed.   Masters or PhD in Computer Science, Physics, Engineering or Math.  Familiar with Machine learning concepts  Hands on experience working on large-scale data science/data analytics projects  Hands-on experience with technologies such as AWS, Hadoop, Spark, Spark SQL, MLib or Storm/Samza.  Experience Implementing AWS services in a variety of distributed computing, enterprise environments.  Experience with at least one of the modern distributed Machine Learning and Deep Learning frameworks such as TensorFlow, PyTorch, MxNet Caffe, and Keras.  Experience building large-scale machine-learning infrastructure that have been successfully delivered to customers.  Experience defining system architectures and exploring technical feasibility trade-offs.  3+ years experiences developing cloud software services and an understanding of design for scalability, performance and reliability.  Ability to prototype and evaluate applications and interaction methodologies.  Experience with AWS technology stack.  Written and verbal technical communication skills with an ability to present complex technical information in a clear and concise manner to a variety of audiences.  Amazon is committed to a diverse and inclusive workplace. Amazon is an equal opportunity employer and does not discriminate on the basis of race, national origin, gender, gender identity, sexual orientation, protected veteran status, disability, age, or other legally protected status. For individuals with disabilities who would like to request an accommodation, please visit https://www.amazon.jobs/en/disability/us. For employees based in Colorado, this position starts at $122,300 per year. A sign-on bonus and restricted stock units may be provided as part of the compensation package, in addition to a range of medical, financial, and/or other benefits, dependent on the position offered.",30+ days ago,"76,982 reviews"
https://www.indeed.com/viewjob?jk=e91f328eed890a23&from=web&vjs=3,10,Data Scientist - Online Maps,Aurora,"Bozeman, MT","Who We Are At Aurora, we’re on a mission to deliver the benefits of self-driving technology safely, quickly, and broadly. It all starts with the Aurora Driver, a platform created from industry-leading hardware and software and designed to adapt across a variety of vehicle types and industries. We’re led by a team of self-driving luminaries, and we’ve forged strategic partnerships with leading transportation companies—including ride-hailing network Uber, truck-manufacturers PACCAR and Volvo Trucks, and the world’s largest automaker Toyota—setting us up to deliver the Aurora Driver in both trucks and passenger vehicles. We are funded by Amazon, Uber, T Rowe Price, and some of Silicon Valley’s best venture capital firms, including Sequoia, Greylock, and Index Ventures. Aurora is in the best position to lead the self-driving space with a team of unparalleled depth and expertise, the technology to deliver, and the partnerships to build a transformative business for the long-term. Aurora hires talented people with diverse backgrounds who are ready to help build a transportation ecosystem that will make our roads safer, get crucial goods where they need to go, and make mobility more efficient and accessible for all. We’re searching for a Data Scientist to join Aurora’s Online Map team. Online Map data scientists work with product managers, autonomy and systems engineers, and fellow data scientists to define the direction of Aurora’s autonomy development and identify the issues of tomorrow, today. In this role, you will Work with cross-functional teams of product managers, engineers, and data scientists to define the direction of Aurora’s autonomy development, focused on navigating areas where reality differs from the map, such as in construction zones. Get to know the inner workings of Aurora’s autonomous vehicles. Using this knowledge you will: Analyze data to garner insights into current vehicle functioning and the nature of current and future operational domains Define metrics that will give leadership and developers insight into vehicle performance and progress towards company goals. Build models to predict vehicle performance in current and future operational domains. Present insights to management, engineers, and fellow data scientists Automate critical data collection and analysis tasks to support continued business decisions Research new algorithms and workflows and implement them as needed to reach company goals Required Qualifications BS, MS, or PhD in Statistics, Operations Research, Economics, Computer Science, or a related field Proficiency in Python coding and programming concepts Strong knowledge and experience using relational databases (SQL, PostgreSQL, etc.) Knowledge of common data analysis, inference, and statistical modeling tools Superb analytical and problem solving skills, and an ability to deeply understand the ""why"" and ""how"" of what we are working on Ability to develop insightful visualizations to communicate data with stakeholders Strong interpersonal and communication skills Planning and organizational abilities Desirable Qualifications 1+ years in a Data Science role Experience in a relevant industry showing a track record of research, and analysis Experience setting up ETL pipelines and leveraging big data engines (e.g. Spark) Ability to be a leader and mentor and commitment to learning; someone who seeks to deliver impact, but also invests in themselves and others. Experience with geospatial data analysis, tools, and visualization. #LI-MD1 #LI-Entry-Level Working at Aurora At Aurora, we bring together people with extraordinary talent and experience united by the strength of our values. We operate with integrity, set outrageous goals, and continue to build a culture where we win together—all without any jerks. We have offices in 8+ locations across the United States. We offer a competitive benefits package to qualifying employees. Our Career Page includes everything you need to know about working at Aurora. We believe that self-driving technology has broad benefits – including an increase in safety and access to transportation – and to achieve those benefits, we want and need a workforce with diverse experiences, insights, and perspectives; said another way, a workforce that reflects the communities and people our technology will benefit. You can find all the latest news on our Blog Individuals seeking employment at Aurora are considered without regard to race, color, religion, national origin, age, sex, gender, gender identity, gender expression, sexual orientation, marital status, pregnancy status, parent or caregiver status, ancestry, political affiliation, veteran and/or military status, physical or mental disability, or any other status protected by federal or state law. About Aurora Founded in 2017, Aurora was started by industry luminaries, and now we’re a team with a multitude of perspectives and experiences. Chris Urmson helped lead Carnegie Mellon’s efforts in Darpa’s Grand Challenges, then was a founding member of Google’s self-driving team. Sterling Anderson worked on the tech at MIT before leading Tesla’s Model X and Autopilot programs. Drew Bagnell, also a Carnegie Mellon alum, is a machine learning expert who helped build Uber’s autonomy effort. Regarded as the most experienced leadership team in the industry, these three bring decades of expertise, passion and focus to realizing our mission. Job Type: Full-time",,
https://www.indeed.com/viewjob?jk=3619e0b4769966ef&from=web&vjs=3,10,Machine Learning Data Engineer-Providence Research Network,Providence,Montana,"Description:  Providence St. Joseph Health is calling a   Machine Learning Data Engineer to our location in Renton, WA.  We are seeking a Health Insights Machine Learning Data Engineer to design and build data pipelines and models to support clinical and research applications. The ideal candidate will need to be a self-starter with outstanding analytical abilities, excellent communication skills, and comfortable in an ever-changing environment.  In this position you will have the following responsibilities:  Design, implement, and support large scale data cleaning, dataset preparation, ELT (ETL) pipeline, data structure optimization, and scripting.  Support big-data technologies and solutions (i.e. GCP Data Proc and BigQuery, Spark, Azure Databricks, Snowflake) to optimize processing of large datasets in an accurate and timely fashion.  Basic knowledge of machine learning algorithms (i.e. classification, regression, clustering, neural network etc.), feature engineering, and experience with AI platform on cloud (i.e. hyperparameter tuning on GCP AI platform or AWS SageMaker).  Actively participate in code reviews, support the overall code base, and support the establishment of standard processes and frameworks.  Qualifications:  Required qualifications for this position include:  Bachelor's Degree in Computer Science, Engineering, Data Science or similar field  3 years in data engineering or machine learning role(s)  Experience with data pipeline and/or container tools, and CI/CD methodologies like Apache Beam, Airflow, Docker or Kubernetes, on cloud platforms like GCP or Azure  Experience with continuous integration/continuous deployment best practices  Preferred qualifications for this position include:  Master's Degree in Computer Science, Engineering, Data Science or similar field  Data science and/or cloud analytics certificates on AWS, Google Cloud Platform and/or Microsoft Azure  2 years Hands-on experience as a data engineer or machine learning engineer, working in a cloud-based environment  Python experience  Experience with NLP (e.g. Word2Vec, TF-IDF), especially in a clinical or healthcare setting  Experience with data pipeline and/or container tools like Apache Beam, Airflow, Docker or Kubernetes on cloud platforms like GCP or Azure  Familiarity with clinical data or electronic medical records and clinical research activities  Hands-on expereince as a data engineer or machine learning engineer, working in a cloud-based environment. database architecture, functional requirements assessment,  About the department you will serve.  Providence Strategic and Management Services provides a variety of functional and system support services for all eight regions of Providence Health & Services from Alaska to California. We are focused on supporting our Mission by delivering a robust foundation of services and sharing of specialized expertise  We offer comprehensive, best-in-class benefits to our caregivers. For more information, visit  https://www.providenceiscalling.jobs/rewards-benefits/  Our Mission  As expressions of God’s healing love, witnessed through the ministry of Jesus, we are steadfast in serving all, especially those who are poor and vulnerable.  About Us  Providence is a comprehensive not-for-profit network of hospitals, care centers, health plans, physicians, clinics, home health care and services continuing a more than 100-year tradition of serving the poor and vulnerable. Providence is proud to be an Equal Opportunity Employer. Providence does not discriminate on the basis of race, color, gender, disability, veteran, military status, religion, age, creed, national origin, sexual identity or expression, sexual orientation, marital status, genetic information, or any other basis prohibited by local, state, or federal law.  Schedule:  Full-time  Shift:  Day  Job Category:  Analytics/Business Intelligence  Location:  Washington-Renton  Other Location(s):  Montana, California, Washington, Oregon, Texas, Alaska  Req ID:  326840",Today,"3,223 reviews"
https://www.indeed.com/viewjob?jk=e048d584d6b2b439&from=web&vjs=3,10,Data Scientist -ProServe,"Amazon Web Services, Inc.",Montana," Bachelor’s degree in a highly quantitative field (Computer Science, Machine Learning, Operational Research, Statistics, Mathematics, etc.) or equivalent professional or military experience  Experience with ML fields, e.g., natural language processing, computer vision, statistical learning theory  4+ years of industry experience in predictive modeling, data science, and analysis  Experience in an ML engineer or data scientist role building and deploying ML models or hands on experience developing deep learning models  Experience writing code in Python, R, Scala, Java, C++ with documentation for reproducibility  Experience handling terabyte size datasets, diving into data to discover hidden patterns, using data visualization tools, writing SQL, and working with GPUs to develop models  Experience writing and speaking about technical concepts to business, technical, and lay audiences and giving data-driven presentations  Want to help the largest global enterprises derive business value through the adoption of Artificial Intelligence (AI) and Machine Learning (ML)? Excited by using massive amounts of disparate data to develop ML models? Eager to learn to apply ML to a diverse array of enterprise use cases? Thrilled to be a part of Amazon who has been pioneering and shaping the world’s AI/ML technology for decades? At Amazon Web Services (AWS), we are helping large enterprises build ML models on the AWS Cloud. We are applying predictive technology to large volumes of data and against a wide spectrum of problems. AWS Professional Services works together with AWS customers to address their business needs using AI solutions. AWS Professional Services is a unique consulting team. We pride ourselves on being customer obsessed and highly focused on the AI enablement of our customers. If you have experience with AI, including building ML models, we’d like to have you join our team. You will get to work with an innovative company, with great teammates, and have a lot of fun helping our customers. A successful candidate will be a person who enjoys diving deep into data, doing analysis, discovering root causes, and designing long-term solutions. Inclusive Team Culture Here at AWS, we embrace our differences. We are committed to furthering our culture of inclusion. We have thirteen employee-led affinity groups, reaching 85,000 employees in over 190 chapters globally. We have innovative benefit offerings, and host annual and ongoing learning experiences, including our Conversations on Race and Ethnicity (CORE) and AmazeCon (gender diversity) conferences. Amazon’s culture of inclusion is reinforced within our 16 Leadership Principles, which remind team members to seek diverse perspectives, learn and be curious, and earn trust. Work/Life Balance Our team puts a high value on work-life harmony. Striking a healthy balance between your personal and professional life is crucial to your happiness and success here. We are a customer-obsessed organization—leaders start with the customer and work backwards. They work vigorously to earn and keep customer trust. As such, this is a customer facing role in a hybrid delivery model. Project engagements include remote delivery methods and onsite engagement that will include travel to customer locations as needed. Mentorship & Career Growth Our team is dedicated to supporting new members. We have a broad mix of experience levels and tenures, and we’re building an environment that celebrates knowledge sharing and mentorship. We care about your career growth and strive to assign projects based on what will help each team member develop into a better-rounded professional and enable them to take on more complex tasks in the future. This is a customer-facing role and you will be required to travel to client locations and deliver professional services as needed.  Major responsibilities include:   Assist customers by being able to deliver a ML project from beginning to end, including understanding the business need, aggregating data, exploring data, building & validating predictive models, and deploying completed models with concept-drift monitoring and retraining to deliver business impact to the organization  Use AWS AI services (e.g., Personalize), ML platforms (SageMaker), and frameworks (e.g., MXNet, TensorFlow, PyTorch, SparkML, scikit-learn) to help our customers build ML models  Research and implement novel ML approaches, including hardware optimizations on platforms such as AWS Inferentia  Work with our other Professional Services consultants (Big Data, IoT, HPC) to analyze, extract, normalize, and label relevant data, and with our Professional Services engineers to operationalize customers’ models after they are prototyped  Master’s degree of PhD in a highly quantitative field (Computer Science, Machine Learning, Operational Research, Statistics, Mathematics, etc.)  Ability to develop strategic, baselined, data modeling processes; ability to accurately determine cause-and-effect relationships.  Publications or presentations in recognized ML journals or conferences  Deep technical skills, consulting experience, and business savvy to interface with all levels and disciplines within our customers’ organization  Demonstrable track record of dealing well with ambiguity, prioritizing needs, and delivering results in a dynamic environment  Amazon is committed to a diverse and inclusive workplace. Amazon is an equal opportunity employer and does not discriminate on the basis of race, national origin, gender, gender identity, sexual orientation, protected veteran status, disability, age, or other legally protected status. For individuals with disabilities who would like to request an accommodation, please visit https://www.amazon.jobs/en/disability/us. For employees based in Colorado, this position starts at $114,700 per year. A sign-on bonus and restricted stock units may be provided as part of the compensation package, in addition to a range of medical, financial, and/or other benefits, dependent on the position offered.",30+ days ago,"76,982 reviews"
