URL,page_count,job_title,company,location,job_Description,post_date,reviews
https://www.indeed.com/viewjob?jk=9cfa6b98b868ad2f&from=web&vjs=3,10,Senior Data Analyst - Remote (Anywhere US),Change Healthcare,Montana,"Senior Data Analyst Overview of Position Plans, conducts, and directs the analysis of both internal and external business problems to be solved with automated systems. Works with clients to develop analyses for the purpose of pre-sale software evaluation, claims editing optimization, or ad hoc reporting. Leads analytic engagements for a portfolio of clients, in conjunction with internal business intelligence to design analyses to meet customer needs. Works independently with internal and external clients on complex problems where analysis of situations or data requires an evaluation of identifiable factors. Exercises judgment within defined procedures and practices to determine appropriate actions. May work with analytics manager in conjunction with sales, services, and solution design staff to analyze client or prospect’s claim editing opportunities or software reporting problems and assists team in executing optimal analytic design. Helps with the analytical approaches, potential solutions, and the operational constraints of the client, and can aid in the implementation of analytic solutions to achieve maximum value from the Change Healthcare suite of products and services as well as answer additional questions a client may have. Responsible for working with large files of healthcare claims data and able to translate analytic outputs into actionable results. Able to clearly and confidently present results to all levels of the client organization. Has the ability to manage and prioritize multiple projects simultaneously and adapt to rapidly changing schedules, priorities, and workflows. Has excellent group facilitation and presentation skills, including the ability to communicate effectively with a wide variety of individuals and groups. What will be my duties and responsibilities in this job? Works with clients, other analytics team members, product management, sales, and services staff to design and execute claims editing solutions for analytic deliverables including, but not limited to, recurring reports, product optimization and savings opportunity analyses, and other ad-hoc analyses required by constituents. Facilitates all pieces of external and internal analytic engagements, such as data diagnostic review, data mapping, edit analysis using Excel and SQL, and presentations using PowerPoint. Executes complex analyses to aid in reporting and interpretation of analytical findings to build a customer solution roadmap and achieve maximum value from the Change Healthcare suite of products and services. Compiles findings into a clear, concise, and actionable deliverable. Presents findings to customers and completes necessary follow-up analysis. Manages customer portfolio of analytic engagements and deliverables, responding to any ad hoc requests on an ongoing basis. What are the requirements needed for this position? 6+ years experience in healthcare claims operations, with a focus on claims auditing and adjudication process improvement What critical skills are needed for you to consider someone for this position? Experience in presenting to senior management level personnel both inside and outside the organization. Managing a portfolio of customers, providing high quality customer deliverables in a timely manner Knowledge of healthcare claims coding, including CPT/HCPCS and ICD10. Strong project management and organizational skills; ability to think and react quickly, efficiently, and adequately according to business requirements and various constraints Knowledge of healthcare claims processing, managed care operations, and healthcare data attributes Skilled at creating professional presentations and confidently delivering them to internal and external audiences Expert skills with MS Office applications - Excel, PowerPoint, Visio Understanding of HIPAA & Data Security Compliance What other skills/experience would be helpful to have? Bachelor’s Degree preferred Knowledge of data manipulation languages such as SQL, PL/SQL Experience designing and developing healthcare analyses Understanding of Claims Editing Software Familiarity with ClaimsXten a plus Understanding of claims processing systems such as Facets, Amisys, etc. a plus What are the working conditions and physical requirements of this job? General office demands/Home office How much should I expect to travel? Up to 10% travel requirement Employees in roles that require travel will need to be able to qualify for a company credit card or be able to use their own personal credit card for travel expenses and submit for reimbursement. Join our team today where we are creating a better coordinated, increasingly collaborative, and more efficient healthcare system! COVID Mandate As a federal contractor, Change Healthcare is adhering to the Executive Order which mandates vaccination. As such, we are requiring all U.S. new hires and employees to show proof of being fully vaccinated for COVID-19 or receive an approved accommodation by their date of hire, as a condition of employment. As we continue to navigate the ever-changing COVID-19 pandemic, we remain committed to doing our part to ensure the health, safety, and well-being of our team members and our communities. Proof of vaccination or accommodations requests will be collected once an offer is accepted with Change Healthcare. All accommodation requests will be carefully considered but are not guaranteed to be approved. Equal Opportunity/Affirmative Action Statement  Change Healthcare is an equal opportunity employer. All qualified applicants will receive consideration for employment without regard to race, color, religion, age, sex, sexual orientation, gender identity, genetic information, national origin, disability, or veteran status. To read more about employment discrimination protections under federal law, read  EEO is the Law  at https://www.eeoc.gov/employers/eeo-law-poster and the supplemental information at https://www.dol.gov/ofccp/regs/compliance/posters/pdf/OFCCP_EEO_Supplement_Final_JRF_QA_508c.pdf. If you need a reasonable accommodation to assist with your application for employment, please contact us by sending an email to applyaccommodations@changehealthcare.com with ""Applicant requesting reasonable accommodation"" as the subject. Resumes or CVs submitted to this email box will not be accepted. Click here https://www.dol.gov/ofccp/pdf/pay-transp_%20English_formattedESQA508c.pdf to view our pay transparency nondiscrimination policy. California (US) Residents: By submitting an application to Change Healthcare for consideration of any employment opportunity, you acknowledge that you have read and understood Change Healthcare’s Privacy Notice to California Job Applicants Regarding the Collection of Personal Information. Change Healthcare maintains a drug free workplace and conducts pre-employment drug-testing, where applicable, in accordance with federal, state and local laws.",30+ days ago,"1,243 reviews"
https://www.indeed.com/viewjob?jk=4c302c89cf31da8e&from=web&vjs=3,20,Otter.AI | Speaker Identification Engineer,Recruiting From Scratch,"Bozeman, MT 59717","Who is Recruiting from Scratch:   Recruiting from Scratch is a premier talent firm that focuses on placing the best product managers, software, and hardware talent at innovative companies. Our team is 100% remote and we work with teams across the United States to help them hire.   About our Client   Join our client in transforming the way remote teams work and communicate. Their AI-powered collaborative note-taking app works across Zoom, Google Meet, and Microsoft Teams to help teams record, transcribe, search and share meeting notes. In addition, we are making virtual meetings accessible to all employees - allowing team members with disabilities to participate in a world that is now dominated by virtual meetings.  With over 10M users experiencing their product, they are making an impact at scale and we are growing fast. The team is made up of top talent from companies like Google, Facebook, Yahoo!, Microsoft, Pinterest, Spotify, and Plaid. They are backed by leading investors that include David Cheriton  (Google’s first investor), Tim Draper ( Draper Associates ), Spectrum Equity, Horizons Ventures, GGV Capital, and Duke University.  About this role   Our client is seeking an experienced Speaker Identification Engineer (Junior | Senior | Staff) to join our technology team and solve challenging technical problems in processing collaborative voice conversations. Members of the technology team work as a group and with colleagues in engineering and product to devise and deploy new algorithms for speech recognition, speaker diarization, and recognition.  Qualifications   M.S. in Computer Science or equivalent   Strong programming skills with working knowledge of C++ and Python   1-3 years of experience working on DNN based speaker id and diarization system   Experience with TensorFlow, PyTorch, or similar frameworks   Experience working in a Linux environment   Team player with good communication skills (oral and written)Qualifications   Preferred Qualifications   Ph.D. in Computer Science, Speech/Language Processing or Machine Learning   Familiarity with the state of the art in deep learning   Experience with end-to-end neural network based speaker recognition   Experience with MapReduce, Spark, or similar frameworks   Experience building crawlers   Experience administering Linux clusters   Experience developing web applications   Employee Benefits Stock. Be a [literal] stakeholder in our company’s future.    Food. Enjoy catered meals and boundless snacks.   Fun. We host team lunches weekly and team events bi-quarterly.   People. Work with talented, collaborative, and friendly people who love what they do.   Health and Saving. Receive the benefits of comprehensive health, dental, vision and disability insurance.",30+ days ago,
https://www.indeed.com/viewjob?jk=8d8761e5430cdffe&from=web&vjs=3,10,Senior Data Analyst,Change Healthcare,Montana,"Title: Senior Data Analyst Overview of the Position: The Data Analyst will join the data science team embedded within the Technology Enabled Services organization. The team member will assist in the creation of data driven solutions to business problems including data consolidation and normalization, generation of actionable business insight, building advanced analytical models, and partnering with operations and overhead partners for feedback and user acceptance. The position will receive a business-driven problem, gather and cleanse data, build complex and automated models, draw key insights from the data, and ultimately deliver interventional tools to drive savings to the bottom line. The ideal candidate for this role has a propensity for data mining, project management, and can draw insights from analytics to improve and develop measurable interventions. What will be my duties and responsibilities in his job? Collects, cleanses, and automates data flows into a central repository Analyzes existing data sets to identify patterns, outliers, and areas of inconsistencies through relationships that exist in the data Collaborates with business leaders to validate data insights, and design strategies or recommend changes Builds models for automated data analysis and predictive insights Creates data visualizations for end users including the use of dashboards (Power BI) or user interfaces (PowerApps or other web-based interface) Facilitates cross-functional teams and uses an inclusive approach to understanding current operations Demonstrate good judgment and analytical skills to conduct option analysis and present recommendations What are the requirements needed for this position? BA or BS degree in a quantitative discipline such as Management Information Systems, Statistics, Applied Mathematics, or Computer Science 2-4 years of applicable work experience preferably in analytics, data science, business intelligence, or similar field. Strong personal computer literacy required including working knowledge of relevant software packages such as Microsoft Excel, statistics packages (Python or R), and data visualization suites (Power BI, Spotfire, Tableau, etc.) Ability to work with large amounts of data, including checks for integrity, summation, and effective communication (written and verbal) to internal and external constituents Experience with SQL is required. What other skills/experience would be helpful to have? Healthcare background is preferred Excellent organizational, communication and interpersonal skills Demonstrated ability to manage indirect teams, including members who may be senior in rank Demonstrated capacity to become “expert” in new topics and disciplines quickly “Self-starter” attitude with the ability to excel in dynamic work environments Comfort with problem solving frameworks, root cause analysis, hypothesis testing, and translation of insights into business impact Ability to manage multiple priorities How much will I be expected to travel in this position? Very limited travel required (possibly 1-2 times per year). Join our team today where we are creating a better coordinated, increasingly collaborative, and more efficient healthcare system! COVID Mandate As a federal contractor, Change Healthcare is adhering to the Executive Order which mandates vaccination. As such, we are requiring all U.S. new hires and employees to show proof of being fully vaccinated for COVID-19 or receive an approved accommodation by their date of hire, as a condition of employment. As we continue to navigate the ever-changing COVID-19 pandemic, we remain committed to doing our part to ensure the health, safety, and well-being of our team members and our communities. Proof of vaccination or accommodations requests will be collected once an offer is accepted with Change Healthcare. All accommodation requests will be carefully considered but are not guaranteed to be approved. Equal Opportunity/Affirmative Action Statement  Change Healthcare is an equal opportunity employer. All qualified applicants will receive consideration for employment without regard to race, color, religion, age, sex, sexual orientation, gender identity, genetic information, national origin, disability, or veteran status. To read more about employment discrimination protections under federal law, read  EEO is the Law  at https://www.eeoc.gov/employers/eeo-law-poster and the supplemental information at https://www.dol.gov/ofccp/regs/compliance/posters/pdf/OFCCP_EEO_Supplement_Final_JRF_QA_508c.pdf. If you need a reasonable accommodation to assist with your application for employment, please contact us by sending an email to applyaccommodations@changehealthcare.com with ""Applicant requesting reasonable accommodation"" as the subject. Resumes or CVs submitted to this email box will not be accepted. Click here https://www.dol.gov/ofccp/pdf/pay-transp_%20English_formattedESQA508c.pdf to view our pay transparency nondiscrimination policy. California (US) Residents: By submitting an application to Change Healthcare for consideration of any employment opportunity, you acknowledge that you have read and understood Change Healthcare’s Privacy Notice to California Job Applicants Regarding the Collection of Personal Information. Change Healthcare maintains a drug free workplace and conducts pre-employment drug-testing, where applicable, in accordance with federal, state and local laws.",30+ days ago,"1,243 reviews"
https://www.indeed.com/viewjob?jk=64329919e4b39417&from=web&vjs=3,20,Senior Simulation Data Scientist,Recruiting From Scratch,"Bozeman, MT 59717","Who is Recruiting from Scratch: Recruiting from Scratch is a premier talent firm that focuses on placing the best product managers, software, and hardware talent at innovative companies. Our team is 100% remote and we work with teams across the United States to help them hire. We work with companies funded by the best investors including Sequoia Capital, Lightspeed Ventures, Tiger Global Management, A16Z, Accel, DFJ, and more.   If you are a fit, the team will reach out to you about this role or any others that may be a fit for our clients.  Our Client  Our Client's mission is to drive adoption and understanding of the financial systems of the future. They are the platform for off-chain intelligence that drives on-chain efficiency in Decentralized Finance (DeFi). They work with protocols to manage risk, improve capital efficiency, and manage incentive spend. They also publish cutting-edge research and aim to take a leading role in defining market risk standards across the industry.   Our client is building infrastructure that allows us to simulate and stress-test blockchain protocols, contracts, and network interactions at scale over a wide range of market conditions. Their models ingest a wide range of on-chain and off-chain data, and are continuously calibrated to the current crypto market structure so that our recommendations are always up-to-date. These models and infrastructure power the platform that currently manages risk and optimizes incentives for over $40B in assets.   You will be working as part of an experienced team that has developed simulation software for many other industries, including high-frequency trading, autonomous vehicles and ride-sharing, and the natural sciences  Responsibilities:  Architecting, implementing, and stewarding end-to-end data infrastructure   Building agent-based simulations of smart contracts and blockchain networks using our Python SDK   Designing and optimizing incentive models for blockchain protocols and help discover potential attack vectors   Build data models and visualizations of public blockchain data and simulation results that provide intuitive analytics to customers   Understand product, risk, and business requirements and how to apply ML to solve our most challenging problems in impactful ways   Automating and scaling simulation model deployment on cloud infrastructure   Make business recommendations to the executive and cross-functional teams (e.g. cost-benefit, forecasting, experiment analysis) effectively through findings from quantitative information   Driving best practices around security in data engineering   Driving data literacy and data-driven decision making across functions  Qualifications:  8-10 years of relevant experience   Experience developing production quality software in Python, Go, or other high-performance languages   Experience with scientific computing packages such as Numpy/Scipy, Pandas, etc..   Track record of designing, building, scaling and maintaining production services, and composing service-oriented architecture   Experience with distributed computation frameworks such as Spark, Flink, TensorFlow   M.S. or Ph.D. in STEM field, with experience building production Blockchain pipelines (development, deployment, inference and monitoring) at scale  Bonus Points:  Smart contract development experience (e.g. Solidity)   Experience with building Machine Learning infrastructure at scale",30+ days ago,
https://www.indeed.com/viewjob?jk=ea728f0ef3c0b9e5&from=web&vjs=3,20,,,,,,
https://www.indeed.com/viewjob?jk=33755bb089b0d7e0&from=web&vjs=3,20,Data Scientist,Recruiting From Scratch,"Bozeman, MT 59717","Who is Recruiting from Scratch: Recruiting from Scratch is a premier talent firm that focuses on placing the best product managers, software, and hardware talent at innovative companies. Our team is 100% remote and we work with teams across the United States to help them hire. We work with companies funded by the best investors including Sequoia Capital, Lightspeed Ventures, Tiger Global Management, A16Z, Accel, DFJ, and more.   If you are a fit, the team will reach out to you about this role or any others that may be a fit for our clients.   Our Client   Our client is a research and development organization focused on the web3 ecosystem. They love the open nature of blockchain and intend to leverage it to increase opportunity and fairness. They are a cross-functional team of continuous learners that like to focus on difficult, challenging problems that take focus and diligence to crack. Our client is looking for highly motivated and adaptable individuals to work with us in delivering on their vision.   You will:  Design and build models across a variety of use cases to deliver insights for internal and external stakeholders   Participate in research and development process, staying up to date on recent work   Work heavily with different data sets to create sources and signals necessary for modeling purposes   Create visualizations and summaries of research efforts to present to research, engineering, and executive teams  You have:  Curiosity, empathy, and an interest in working with a team in a highly collaborative environment   An ability to adapt and work under large amounts of uncertainty   5+ years developing production-quality software in a high-performance language like Python, C++, Go, etc   Experience with tools and frameworks like Pytorch, TensorFlow, Pandas, etc   Experience developing and deploying production quality code   Strong communication skills when it comes to explaining your decision and your work product  Bonus if you have:  BA/MA, BS/MS, or PhD in a technical field   Experience in gaming, economics, blockchain, mathematical or statistical modeling, AI/ML   Experience designing or working with DeFi protocols   Experience with smart contract development",30+ days ago,
