URL,page_count,job_title,company,location,job_Description,post_date,reviews
https://www.indeed.com/viewjob?jk=75149dd89ef025ab&from=web&vjs=3,10,Sr. Data Analyst,Bozeman Deaconess Hospital,"Bozeman, MT","Now Hiring! Position Summary: The Senior Data Analyst serves to advance and develop our quantitative capabilities to deliver analytic solutions across large and very diverse data sets leveraging our EDW and advanced analytic solutions and capabilities. Serves as a business intelligence consultant/developer in identifying, structuring, analyzing, and visualizing data, particularly focused on applying advanced methodologies to support organizational performance. Supports cross-functional stakeholders with various financial and clinical analyses and research, and participates in committees and special projects as appropriate. Possesses and further develops analytical practices and skill sets to assemble actionable information and makes recommendations on complex clinical question and develop and implement data driven strategies to support key initiatives. Manages and maintains the integrity of our source data, data movement and quality assurance, and the EDW functions, both independently and in conjunction with internal and external partners. Minimum Qualifications: Bachelor’s Degree in computer science, engineering, statistics, mathematics or other technical concentration requiring strong analytical skills; or 4 years of equivalent education and experience 3 years of technical, analytical, and/or statistical role experience or 5 years of equivalent education and experience Advanced SQL skills with working knowledge of relational databases and familiarity with data architecture concepts Epic certification within 4 months of hire Preferred:  Master’s Degree in computer science, engineering, statistics, mathematics or other technical concentration requiring strong analytical skills Preferred:  5 years of experience in a healthcare related technical, analytical, and/or statistical role Preferred:  Experience with EHR data, preferably Epic/Clarity & Caboodle Essential Job Functions: Models complex clinical business problems, discovers operational insights and identifies opportunities through the use of statistical, algorithmic, mining and visualization techniques supporting the organization's strategic goals and deployment. Resolves complex data challenges using a range of advanced SQL queries and programming; tunes and helps others with non-performing SQL statements and educates others on SQL best practices. Produces customized complex statistical analysis performing propensity score matching, coarsened exact matching, multivariate regression, confidence intervals, power analysis, regression modeling, etc. Designs and engineers subject area marts (SAM) within enterprise data warehouse in partnership with teammates to support a wide range of analytical needs. Supports and facilitates data operating system (DOS) and (SAM) subject area mart validation processes leveraging programming skills to optimize and creates efficiency when appropriate. Conducts rigorous data mining and statistically sound analytical analyses to develop and report high quality actionable and quantitative information developing standard tools, interactive dashboards, and custom analyses. Exercises judgment in selecting methods, techniques and evaluation criteria for obtaining results and demonstrates effectiveness of selected approach. Uses SQL and statistical/scientific computer languages to draw actionable insights from large data sets languages and technologies for the purpose of extracting and processing data. Creates impactful and dynamic data visualizations and infographics to communicate results of highly complex analysis to varying audiences both verbally and in presentation. Defines data and collaboratively establishes core metrics and KPIs in accordance with the objectives of the Data Analytics organization. Teaches and inspires other Insights & Analytics peers through knowledge sharing, pair programming, and/or giving feedback during code reviews. Provides leadership and expertise to best construct data and execute analysis where partnered with less skilled peers. Designs and facilitates training sessions to develop analytical and data warehousing skills among cross-functional peers. Assists in fulfilling or owning various ad hoc strategic and business reporting requests and projects. Knowledge, Skills and Abilities Demonstrates sound judgement, patience, and maintains a professional demeanor at all times Ability to work in a busy and stressful environment Creativity, problem analysis and decision making Exercises tact, discretion, sensitivity and maintains confidentiality Ability to analyze, organize and prioritize work while meeting multiple deadlines Self-directed, completes assignments accurately, thoroughly and with minimal oversight Advanced math skills; ability to collect, analyze, interpret and/or present complex data. Strong emotional intelligence, interpersonal and teamwork skills The above statements are intended to describe the general nature and level of work being performed by people assigned to the job classification. They are not to be construed as a contract of any type nor an exhaustive list of all job duties performed by individuals so classified. 77211300 Information Technology",30+ days ago,92 reviews
https://www.indeed.com/viewjob?jk=885ac22c50827b76&from=web&vjs=3,10,Senior Data Analyst,Gainwell Technologies,Montana,"Job Description:  Essential Job Functions Designs, implements and maintains complex databases, access methods, access time, validation checks, organization, protection and security, documentation, and statistical methods to ensure that client requirements are satisfied. Reviews and edits data requirements and documents according to required standards by utilizing prescribed tools and methods to ensure that design and implementation are according to company guidelines and client specifications. Provides overall monitoring of standards and procedures and suggests revisions when necessary to ensure updated guidelines to meet changing market demands and consistency across databases. Applies data analysis or data modeling techniques to establish, modify or maintain complex data structures and their associated components to increase efficiency of structures and components. Investigates and resolves technical matters of significance within databases by analyzing and determining possible causes to ensure client satisfaction. Provides work direction and guidance to less experienced personnel using the data structures and associated components to ensure that business specifications are met. Provides training in data modeling techniques and in incorporating data modeling into information systems to ensure consistency in development and maintenance of database structures across the company. Researches business objectives and data requirements of client to ensure that developed databases meet client needs. Communicates with clients about data-related discrepancies and other matters of significance to ascertain information and correct errors. Basic Qualifications Bachelor's degree in information systems, computer science or related field preferred, or equivalent combination of education and experience 6+ years of experience in data analysis Experience working with data administration, repository management, database creation techniques, and data warehousing standards, strategies, and tools Experience working with business processes and the technology industry 5+ years of experience working with dashboard and reporting tools 5+ years of experience in Medicaid, Healthcare Other Qualifications Good research, data analysis and problem-solving skills Good communication skills to communicate with designers, management and customers Training skills to provide data-modeling and implementation training to less experienced personnel Ability to work independently and as part of a team Ability to create and maintain formal and informal networks Ability to handle multiple tasks simultaneously and switch between tasks quickly",28 days ago,40 reviews
https://www.indeed.com/viewjob?jk=808f41bb4c5c5a5b&from=web&vjs=3,10,Data Scientist,Change Healthcare,Montana,"Title: AI Data Scientist Overview of Position The Data Scientist will be responsible for supporting Artificial Intelligence, Machine Learning, and Data Science solutions for Change Healthcare, reporting to an AI Data Science leader under the Chief AI Officer. We’re looking for data scientists with a passion for artificial intelligence to help drive a new generation of data and machine learning enabled services and products to impact healthcare. You will enjoy working with a highly talented and diverse team of data scientists specializing in deep learning, active learning, and classical machine learning, one of the richest data sets in US healthcare, nearly limitless cloud compute resources including Spark clusters and GPUs, and the ability to see your insights turned into real products. The ideal candidate will have a background in machine learning, have experience working with large data sets, and have some experience in building and deploying data-driven innovative AI solutions. You are focused on results, a self-starter, able to put the customer first, team first, and have demonstrated success in using data science to develop and deploy AI solutions with a focus on customer impact. You also are able to rapidly prototype new ideas and methods to deliver quality code that is testable and concise. What will be my duties and responsibilities in this job? Use AI/ML technologies to innovate current Chang Healthcare operations. The tasks of innovation include, but not limited to: Smart revenue management, Intelligent payment platform, medical chart reading, code reading with noisy and incomplete OCR documents, Conversational AI to facilitate customer services and other healthcare related use cases Work closely with business and operations to understand the business requirements. To be able convert ambiguous requirements to mathematical AI models that can be trained and deployed to solve business problems Have strong implementation skills to the proposed solutions and work closely with engineering team to create product pipelines that are scalable and flexible Willing to work in an agile and fast-moving working environment Passion for learning and innovating at new AI technologies that can facilitate future projects What are the requirements needed for this position? Ph.D. in Computer Science, Math, Physics, Electrical Engineering, Industrial Engineering, Statistics, bioinformatics or other hardcore technical fields with profound mathematical training. Proficient in translating unstructured business problems into an abstract mathematical framework Fluency in one of the scripting languages, such as: Python, Scalar, PySpark and others Experience with Spark, MapReduce and other big data processing tools is preferred Familiar with both SQL and noSQL databases, ability to write efficient queries in SQL Expertise in NLU/NLP, Conversational AI Expertise with one of the Deep Learning platforms, such as, TensorFlow, Pytorch, and Keras Expertise in Knowledge Graph and personalization Ability to initiate and drive projects to completion with minimal guidance The ability to communicate the results of analyses in a clear and effective manner Familiar with AWS and its components, such as EMR, S3, EC2, SageMaker. or customer build AI Platform What other skills/experience would be helpful to have? Ph.D. with experiences on medical coding, medical chart reading, entity detection, and other reading comprehension using AI/NLP technologies Ph.D. with experience on big data processing in the areas of Revenue cycle management includes, but not limited to, risk management, payment accuracy, smart reconciliation, etc... Ph.D. with experiences on conversational AI technologies, such as AI model for intent detection, NER, dialog management and other related components Experience with medical ontologies, medical Knowledge Graph that links multiple entities, such as patients, providers, and payers. Possess the ability to run large scale inference on top of KG and generate business values Experience with medical image processing, diagnosis based on images and narratives using AI technologies Exceptional interpersonal and communication skills, including the ability to describe the logic and implications of a complex model to all types of partners (product managers, engineers, designers, senior executives) What are the working conditions and physical requirements of this job? General office demands #li-remote Join our team today where we are creating a better coordinated, increasingly collaborative, and more efficient healthcare system! Colorado Residents Only: The base pay range for Colorado residents is $102,723.50 - $189,304.50 plus any relevant incentive pay programs that may be aligned to the role. Pay is based on several factors including but not limited to education, work experience, certifications, etc. In addition to your base pay, Change Healthcare offers the following benefits for this position, subject to applicable eligibility requirements: Health, dental and vision plans; wellness program; health savings account; flexible spending accounts; 401(k) retirement plan; life insurance; short-term and long-term disability insurance; Employee Assistance Program; PTO; tuition reimbursement; and employee-paid critical illness and accident insurance. COVID Mandate As a federal contractor, Change Healthcare is adhering to the Executive Order which mandates vaccination. As such, we are requiring all U.S. new hires and employees to show proof of being fully vaccinated for COVID-19 or receive an approved accommodation by their date of hire, as a condition of employment. As we continue to navigate the ever-changing COVID-19 pandemic, we remain committed to doing our part to ensure the health, safety, and well-being of our team members and our communities. Proof of vaccination or accommodations requests will be collected once an offer is accepted with Change Healthcare. All accommodation requests will be carefully considered but are not guaranteed to be approved. Equal Opportunity/Affirmative Action Statement  Change Healthcare is an equal opportunity employer. All qualified applicants will receive consideration for employment without regard to race, color, religion, age, sex, sexual orientation, gender identity, genetic information, national origin, disability, or veteran status. To read more about employment discrimination protections under federal law, read  EEO is the Law  at https://www.eeoc.gov/employers/eeo-law-poster and the supplemental information at https://www.dol.gov/ofccp/regs/compliance/posters/pdf/OFCCP_EEO_Supplement_Final_JRF_QA_508c.pdf. If you need a reasonable accommodation to assist with your application for employment, please contact us by sending an email to applyaccommodations@changehealthcare.com with ""Applicant requesting reasonable accommodation"" as the subject. Resumes or CVs submitted to this email box will not be accepted. Click here https://www.dol.gov/ofccp/pdf/pay-transp_%20English_formattedESQA508c.pdf to view our pay transparency nondiscrimination policy. California (US) Residents: By submitting an application to Change Healthcare for consideration of any employment opportunity, you acknowledge that you have read and understood Change Healthcare’s Privacy Notice to California Job Applicants Regarding the Collection of Personal Information. Change Healthcare maintains a drug free workplace and conducts pre-employment drug-testing, where applicable, in accordance with federal, state and local laws.",6 days ago,"1,243 reviews"
https://www.indeed.com/viewjob?jk=3c289be5e98de16d&from=web&vjs=3,20,"Senior Software Engineer, Natural Language Processing / NLP",Recruiting From Scratch,"Bozeman, MT 59717","Our client helps organizations globally to build trust and speed into their business by matching the Speed of PrivacyOps to the Speed of Dev/BusinessOps. Clients include Patreon, Twilio, Coinbase, Robinhood, and Samara.  Design and implement end-to-end Machine Learning and Natural Language Processing models and systems to help construct the foundation on which our global data infrastructure will be built.   Role Overview   This role requires you to design and implement end-to-end Machine Learning (ML) and Natural Language Processing (NLP) models and systems to drive business impact. You partner with cross-functional stakeholders and customers to frame business problems as ML problems, prototype solutions effectively, and implement production-grade ML systems and the backend software systems they support to provide end to end five-star user experiences. Given you are constructing the foundation on which our global data infrastructure will be built, you need to pay close attention to detail and maintain a forward-thinking outlook as well as scrappiness for the present needs. You thrive in a fast-paced, iterative, but heavily test-driven development environment, with full ownership to design features from scratch to impact the business and the accountability that comes along.   Responsibilities   Scoping: Actively participate in customer engagements and partner with cross-functional stakeholders (legal product managers, customer success) to scope technical requirements for high impact business problems; determine whether ML is the right tool for the job and, if it is, how to frame the problem as an ML task   Prototyping: Investigate different options quickly and thoroughly to identify the simplest, most pragmatic tool that drives business impact   End-to-end System Design and Implementation: Gather training data; train, deploy, evaluate, and iteratively improve production-grade machine learning systems; implement and test the backend software systems they support to provide end-to-end five-star user experiences   Follow and promote software engineering and machine learning best practices across the organization; keep up to date with the state of the art developments in NLP research, open-source frameworks, and MLOps   Shape the direction of machine learning and build a cohesive team culture of ownership, growth, transparency, and customer focus   You are a good fit if you:   Have a track record of delivering production-grade ML/NLP models and systems, specifically in text classification, entity and relation extraction, summarization, question-answering, and knowledge base construction (2+ years)   Have strong software engineering skills, and set examples by writing modular and maintainable code considering design principles and applying sound testing practices   Are comfortable with Python, and have experience with ML/NLP tools and libraries such as scikit-learn, PyTorch, TensorFlow, spaCy, Hugging Face, Gensim, etc.   Have a systematic and goal-directed approach to project management   Are comfortable dealing with ambiguity and ruthlessly prioritizing and managing your time with a sense of urgency   Thrive in a self-directed environment with full ownership to design features from scratch to impact the business and the accountability that comes along   Are proactive about continuous improvement and excited about learning at breakneck speed in a fast-growth environment; are eager to candidly and directly give and receive feedback to improve together as a team   Are customer and mission-driven, motivated by bringing the most value as possible to users and shaping an industry from the ground up   Are the ultimate team player: collaborate effectively with others, consistently make time to help your teammates, and are ego-less in the search for the best ideas",30+ days ago,
https://www.indeed.com/viewjob?jk=17c8484f72d4b433&from=web&vjs=3,20,Senior Software Engineer - Streaming,Neuro-ID,Montana,"About Neuro-ID:  Here at Neuro-ID, you will be joining a best-in-class team on a trajectory of tremendous growth. We are a Series-B start-up (https://techcrunch.com/2021/11/04/neuro-id-takes-in-fresh-capital-to-combat-fraud-from-all-of-our-taps-types-and-swipes/), backed by top tier investors Canapi Ventures, FinVC Capital, and TTV Capital and we serve some of the largest names across various industries such as Intuit, Square, Affirm, Mission Lane, Petal, and others.  We are pioneering the behavioral analytics space, providing a new standard for collecting, translating and actioning on the real-time behaviors of digital interactions. Through a body of patented technology, Neuro-ID developed the Friction Index™, leveraging over a decade of scientific research and discovery in Human-Computer Interaction (HCI) to measure both customer Intent and Experience. For companies, this real-time behavioral data is used during the digital onboarding process to segment genuine from fraudulent customers, enabling them to maximize conversion, reduce false positives and stop sophisticated fraud.  Founded by 2 world-renowned PhDs, and led by a team of seasoned executives, we continue to make strategic key additions to our team to expand our product offerings and enter new verticals.  Come join our team!   Your Focus:  Help develop the overarching strategy for streaming analytics at Neuro-ID, with short and long-term initiatives. Collaborate with the product team and data scientists to determine technical requirements for new applications, services, and integrations. Contribute to software architecture and best practices. Participate in an agile development cycle, write documentation, perform code reviews, and mentor others. Deliver innovative, engaging prototypes using your knowledge of analytics technologies. Work with a team of uniquely talented data scientists and engineers who love learning, experimenting, and pushing the limits. Participate in building an outstanding company culture that focuses on the human engine inside Neuro-ID and enables you to do the best work of your career.   About You:  You can develop software in Java, Python, or JavaScript and understand both the theoretical concepts of the language and how to write well-documented well-tested code. You have first-hand experience writing Apache Flink applications.  You understand how to write well-formed SQL queries and know to structure datasets and queries to enhance performance. You are familiar with AWS and its breadth of services, including compute, database, and storage, with a special focus on analytics technologies. You can own medium-to-large-sized features from technical design through deployment in production.  You can manage your own time, and can both work well independently and also as part of a collaborative team. You enjoy collaborating with your fellow engineers, data scientists, and product managers to solve complex problems.  You look to find new and innovative ways to tackle complex problems through thorough experimentation.  Bonus:  You have development experience as a data scientist or data engineer. You maintain an active  AWS Certified Data Analytics - Specialty  certification. You have experience creating LookML models, views, and dashboards. You have experience working with geographically distributed engineering teams.  Life at Neuro-ID:  Neuro-ID is in hyper-growth mode, and the team here has a lot of ambition. However, what sets us apart from the rest is that the culture at Neuro-ID is truly special. It just might be that once in a lifetime opportunity. And it's not just the tech, or the market opp, it's also the people. Our headquarters are nestled in a quiet section of Montana's Rocky Mountains, but our distributed enterprise has the ambition to change the digital world. And we're doing just that each and every day by up-leveling world class organizations' digital strategies for fraud and CX with behavior. We work very hard, we are very focused, and the environment is incredibly dynamic. However, we make time to celebrate and build culture. We believe wholeheartedly that the journey should be memorable, enjoyable, and meaningful, even if it's not easy.  Compensation:   Competitive salary and equity package (Own a slice of a rocket ship!) Team:   Remote “Connected” Workforce, quarterly culture events with regional team, functional team quarterly planning offsites, monthly all team celebration meetings, All Access We Work Cards, annual all team summits in Whitefish, MT, and MORE all in service to create a connected, but flexible workforce. Wellness:  Healthy people are happy people! We offer comprehensive and top tier health, dental, vision, FSA, DCA, 401K, monthly wellness stipend for gym memberships, strava licenses, or really anything related to wellness. Education:  Annual education reimbursement for an approved education purpose, course, books, podcast subscription, etc. Tech:  Technology Station Kit: Computer (Mac or PC Choice), Monitor(s), Keyboard, Mouse, Dongles, HeadSet; Remote Work Comfort Stipend: Annual stipend to continually improve your remote work set-up Location:  Our flagship “HQ” nestled in beautiful Whitefish, Montana with over 5000 square of office space and thousands of acres of outdoor adventure space for our remote employees to enjoy when in town for off-sites. Competitive PTO Policy:   Recharging when you are running hard is crucial! We stress work/life balance. Our PTO policies include the entire office closure for the whole week between Christmas Eve and New Years Day for recharging prior to the New Year!  Dare to do something bold!",30+ days ago,
