URL,page_count,job_title,company,location,job_Description,post_date,reviews
https://www.indeed.com/viewjob?jk=77262b380df92f09&from=web&vjs=3,10,Senior Data Analyst,Ryder System,"Jackson, MS 39203","Current Employees:  If you are a current employee at Ryder (not a Contractor or temporary employee through a staffing agency), please click here (http://wd5.myworkday.com/ryder/d/task/1422$3.htmld) to log in to Workday to apply using the internal application process. To learn how to apply for a position using the Career worklet, please review this quick reference guide (https://rydersystems.service-now.com/sys\ attachment.do?sys\ id=a39f83621bd99050632a4223cd4bcb91) .   (https://ryder.com/job-applicant-privacy-policy)  You are the driving force behind our company.  Start your career with Ryder today!  Summary  The Senior Data Analyst role is to support delivery of final business solutions to the operation through Product Development. The Senior Data Analyst’s technical skills will be put to the test as they explore data and present crispy insights and a smooth user experience. The Senior Data Analyst is expected to be a supply chain data expert and their use cases. This position will work on cutting edge data technology as a key user on Ryder's Azure Data Lake driving the analytics initiatives as an expert in this field. Will be involved in data sourcing and designing data warehouses, data marts, critical analytical dashboards, reports and queries to drive strategic business decisions for internal Ryder teams and external customers. Dig deep into the core issues of business problems in order to drive a solution that gets at the heart of the causative problem. On this team, the Senior Data Analyst will get the chance to be the expert on data management, collaborating with Data Analysts, Engineers and Scientists and operations leadership, using all the skills in order to exploit data to drive the business forward. This will push the envelope of what is possible within the big data space; streaming live data into a data lake and experimenting with data in the data sandbox and be part of the future Ryder’s cutting-edge technologies.  Essential Functions  Gather and explore data by understanding operational processes and business needs, interpret and integrate data and translate this into usable outputs or visualizations to drive business decisions.  Work with Product Development team, evaluating their needs and ad-hoc requests to prioritize product efforts creating innovative solutions.  Enhance data maturity and integration to standardize the core value add functionality enabling a multiplier effect.  Experience working within a collaborative team. Mentor junior members and peers to achieve success.  Challenge the status quo and help guide entrepreneurial innovation in both analytical products and the curation of new data sources elevating analytics beyond data pulling and reporting to the delivery actionable insights and setting best practices.  Knowledge of the Ryder Business, understanding the complexity of the supply chain world and the role that data has within this ecosystem.  Additional Responsibilities  Performs other duties as assigned.  Skills and Abilities  Experience developing data and BI solutions with tools like:  Scrum methodology  Power BI  Tableau  Azure Data Factory  Exposure using tools like:  ETL tools (SSIS, Alteryx)  Data manipulation tools (SQL, Python). Expertise on transact-SQL commands including complex queries, views, functions, stored procedures, cursors and triggers on SQL server.  Object oriented development stacks (.net)  Strong verbal and written communication skills, with an ability to express complex technical concepts in business terms  Support product innovation, working closely with technology throughout the build, test, and release of the product using agile methodologies  Qualifications  Bachelor's degree required in Computer Science, Data Analytics or equivalent.  Master's degree preferred in Supply Chain, Data Analytics, Computer Science or equivalent.  Five (5) years or more Applied Project(s) experience in demonstrating, digital transformation, data management projects. Required  Two (2) years or more experience in creating dashboards for diagnostic analysis across the business. Experience working in a cloud environment. Required  Five (5) years or more working in an individual contributor role as a key member of the team that others rely on. Preferred  Travel 0-20%  Job Category:  Data Science & Analytics  Ryder is proud to be an Equal Opportunity Employer and Drug Free workplace. All qualified applicants will receive consideration for employment without regard to race, religion, color, national origin, sex, sexual orientation, gender identity, age, status as a protected veteran, among other things, or status as a qualified individual with disability.   (https://ryder.com/job-applicant-privacy-policy)  \#wd",1 day ago,"4,909 reviews"
https://www.indeed.com/viewjob?jk=af90dfe882cebb71&from=web&vjs=3,10,Data Center Engineer,NCI Information Systems Inc.,"Stennis Space Center, MS 39529","Overview: For more than 30 years, NCI Information Systems has been a leading provider of digital transformation solutions and services to U.S. government agencies. With its Empower Platform™, NCI is at the forefront of implementing artificial intelligence (AI) solutions to solve the government’s most complex mission challenges. Headquartered in Reston, Va., NCI is accelerating public sector AI adoption to create a government workforce that is exponentially more creative and productive. For more information, visit www.nciinc.com. NCI is proud to be recognized as a 2022 Military Friendly Employer by Viqtory, the publisher of G.I. Jobs. This designation reflects the company’s commitment to hiring and supporting active-duty and veteran employees.  Responsibilities: NCI  is looking for a  Data Center Technician  to support the physical infrastructure for the GSA organization and its facilities. The Data Center Technician will use data center best practices and related industry standards to create and modify processes and procedures as/where applicable. The Data Center Technician will provide engineering and IT technical support for GSA Data Centers. You will analyze, troubleshoot and resolve complex problems with Data Center services (business applications, networking and hardware) and prioritize tasks based on service level criteria. . Job duties include, but not limited to: Perform design, operations and optimization of GSA Data Centers to ensure quality service delivery Develop, execute, and maintain the Data Center technical drawings ( rack elevations, floor layouts) Develop, execute, and maintain the Architecture and Engineering (A&E) design of proposed enhancements to hosted platforms and equipment at Federally sponsored data centers, and colocation data centers Develop, execute, and maintain the Government’s Business Process Document (BPD) to include processes and procedures infrastructure and architecture and facility controls Performs and evaluates cost analyses and vendor comparisons for large scale projects to ensure cost-effective and efficient operations. Monitor, Analyze and execute emerging technologies and best practices in data center technologies through application of advanced methods, theories and research techniques  Qualifications: Contract required qualifications include : Technical Bachelor’s degree or equivalent with 2 - 7 years of experience or 6 – 11 years of relevant experience Applies fundamental concepts, processes, practices, and procedures on technical assignments. Performs work that requires practical experience and training. Work is performed under supervision. Contract desired qualifications include : Direct experience with Data Center design and operations Direct experience with Data Center performance analysis tools such as the Sunbird Data Center Infrastructure Management (DCIM) system Direct experience using ServiceNow for ticket management and inventory management Self-motivated, detail oriented, positive in approach, professional persona Ability to assist with creating, developing and implementing project process improvement(s) General knowledge of server/network equipment and software support configurations Strong aptitude for independent working environment and high productivity rate Excellent communication and customer relationship skills Server, OS, Network, BICSI or data center certification is a plus Proficient with Microsoft Office (Word, Excel) and Visio Data Center Environmental Analysis experience inclusive of identifying and evaluating energy efficiency opportunities and addressing opportunities in electrical systems, air management, HVAC, and IT equipment. Requirements: Travel, less than 10% This position requires a Public Trust Clearance 24x7x365 on-call rotation schedule Place of duty is located at the Stennis Data Center, Kiln, Mississippi area (30 – 40 min driving radius) of 9325 Cypress Loop Road, Stennis Space Center, MS 39529 Physical Requirements: This position requires the ability to perform the below essential functions: Sitting for long periods Standing for long periods Ambulate throughout an office and/or between several buildings Must be able to work at heights, off of a ladder, lift up to 50 pounds, use pallet jack and server lift  About NCI: It is the policy of NCI to provide equal opportunity in recruiting, hiring, training, and promoting individuals in all job categories without regard to race, color, religion, national origin, gender, age, disability, genetic information, veteran status, sexual orientation, gender identity, or any other protected class or category as may be defined by federal, state, or local laws or regulations. In addition, we affirm that all compensation, benefits, company-sponsored training, educational assistance, social, and recreational programs are administered without regard to race, color, religion, national origin, gender, age, disability, genetic information, veteran status, sexual orientation, or gender identity. It is our firm intent to support equal employment opportunity and affirmative action in keeping with applicable federal, state, and local laws and regulations. NCI is a VEVRAA Federal Contractor.",30+ days ago,410 reviews
https://www.indeed.com/viewjob?jk=dde767973b09736d&from=web&vjs=3,10,Senior-Technology Project/Program Management (Data Analyst for Wireless)),AT&T,Mississippi,"Overall Purpose: Responsible for all aspects of the development and implementation of assigned technical projects and provides a single point of contact for those projects. Projects are typically high value long term projects.  Key Roles and Responsibilities: Project Manager leads cross functional teams to complete projects within allotted timeline and budget. Takes technical projects from original concept through final implementation. Defines project scope and objectives. Develops detailed work plans, schedules, project estimates, resource plans, and status reports. Conducts project meetings and is responsible for project tracking and analysis. Ensures adherence to quality standards and reviews project deliverables. Manages the integration of vendor tasks and tracks and reviews vendor deliverables. Provides technical and analytical guidance to project team. Recommends and takes action to direct the analysis and solutions of problems. Job Contribution: Seasoned technical professional. Contributes through proven technical expertise. Has significant dept/functional impact.  KNOWLEDGE SME within own discipline/specialty area; basic knowledge of other disciplines/specialty areas. Deep technical knowledge. Applies in depth knowledge of discipline/specialty area standards/processes. Integrates industry experience and deep professional/technical knowledge. Technical leader and recognized expert on select ATT technologies/systems/procedures.  ANALYSIS/PROBLEM SOLVING Solves unique problems through evaluative judgment/precedent. Independently applies sophisticated analysis in evaluating issues. Develops new concepts/methods/techniques for cross functional initiatives. Recognizes/pursues alternative methods.  INDEPENDENCE Guided by department goals/objectives. Exercises latitude in determining objectives/approaches to projects. Leads multiple small to medium sized projects and technical breadth.  CONTRIBUTION TO ATT TECHNOLOGY Key contributor on complex projects/initiatives. Impacts current and future business opportunities through application of specialized technical/ industry knowledge. Develops methods/techniques based on strategic project objectives.  COMMUNICATION Mentors and provides technical guidance and explains advanced concepts to others in work area. Coordinates across multiple departments. Promotes active listening and open communication. Provides leadership/guidance to others.  Education: Preferred Bachelor of Science or Bachelor of Administration degree or equivalent experience. PMP Certification desired. Experience: Typically requires 5-8 years experience. VBA or SQL programming required. PACE experience preferred. Technical Career Pathway (TCP) role. Supervisory: No.  Environmental Requirements: This position may be responsible for contributing to ATT compliance with environmental laws and regulations as applicable to its job function. This may include, but is not limited to, work related to fuel tanks, emergency and stand-by generators, boilers, hazardous waste, hazardous materials, batteries, manholes and vaults, water wells, linear and other construction projects, water discharge, or air emissions.  Required Qualifications  -  Expert in Contract Administration  Expert in Vendor Analysis  Expert in Wireless Engineering Principles  Understanding of Network Equipment/Architecture systems and Operations  Expertise in Product Development and Introduction  Expertise in Program and Project Management Experience  Desired Qualifications  -  5-8 years of experience  Bachelor of Science in Math or Engineering or Science  Six Sigma training, PMP and PE  VBA or SQL programming required  PACE experience preferred   AT&T will consider for employment qualified applicants in a manner consistent with the requirements of federal, state and local laws",14 days ago,"40,050 reviews"
https://www.indeed.com/viewjob?jk=a4a26c458194f446&from=web&vjs=3,10,Senior Data Scientist - ProServe,"Amazon Web Services, Inc.",Mississippi," Bachelor’s degree in a highly quantitative field (Computer Science, Machine Learning, Operational Research, Statistics, Mathematics, etc.) or equivalent professional or military experience  Experience with ML fields, e.g., natural language processing, computer vision, statistical learning theory  6+ years of industry experience in predictive modeling, data science, and analysis  Experience in an ML engineer or data scientist role building and deploying ML models or hands on experience developing deep learning models  Experience writing code in Python, R, Scala, Java, C++ with documentation for reproducibility  Experience handling terabyte size datasets, diving into data to discover hidden patterns, using data visualization tools, writing SQL, and working with GPUs to develop models  Experience writing and speaking about technical concepts to business, technical, and lay audiences and giving data-driven presentations  Want to help the largest global enterprises derive business value through the adoption of Artificial Intelligence (AI) and Machine Learning (ML)? Excited by using massive amounts of disparate data to develop ML models? Eager to learn to apply ML to a diverse array of enterprise use cases? Thrilled to be a part of Amazon who has been pioneering and shaping the world’s AI/ML technology for decades? At Amazon Web Services (AWS), we are helping large enterprises build ML models on the AWS Cloud. We are applying predictive technology to large volumes of data and against a wide spectrum of problems. AWS Professional Services works together with AWS customers to address their business needs using AI solutions. AWS Professional Services is a unique consulting team. We pride ourselves on being customer obsessed and highly focused on the AI enablement of our customers. If you have experience with AI, including building ML models, we’d like to have you join our team. You will get to work with an innovative company, with great teammates, and have a lot of fun helping our customers. A successful candidate will be a person who enjoys diving deep into data, doing analysis, discovering root causes, and designing long-term solutions. Inclusive Team Culture Here at AWS, we embrace our differences. We are committed to furthering our culture of inclusion. We have thirteen employee-led affinity groups, reaching 85,000 employees in over 190 chapters globally. We have innovative benefit offerings, and host annual and ongoing learning experiences, including our Conversations on Race and Ethnicity (CORE) and AmazeCon (gender diversity) conferences. Amazon’s culture of inclusion is reinforced within our 16 Leadership Principles, which remind team members to seek diverse perspectives, learn and be curious, and earn trust. Work/Life Balance Our team puts a high value on work-life harmony. Striking a healthy balance between your personal and professional life is crucial to your happiness and success here. We are a customer-obsessed organization—leaders start with the customer and work backwards. They work vigorously to earn and keep customer trust. As such, this is a customer facing role in a hybrid delivery model. Project engagements include remote delivery methods and onsite engagement that will include travel to customer locations as needed. Mentorship & Career Growth Our team is dedicated to supporting new members. We have a broad mix of experience levels and tenures, and we’re building an environment that celebrates knowledge sharing and mentorship. We care about your career growth and strive to assign projects based on what will help each team member develop into a better-rounded professional and enable them to take on more complex tasks in the future. This is a customer-facing role and you will be required to travel to client locations and deliver professional services as needed.  Major responsibilities include:   Assist customers by being able to deliver a ML project from beginning to end, including understanding the business need, aggregating data, exploring data, building & validating predictive models, and deploying completed models with concept-drift monitoring and retraining to deliver business impact to the organization  Use AWS AI services (e.g., Personalize), ML platforms (SageMaker), and frameworks (e.g., MXNet, TensorFlow, PyTorch, SparkML, scikit-learn) to help our customers build ML models  Research and implement novel ML approaches, including hardware optimizations on platforms such as AWS Inferentia  Work with our other Professional Services consultants (Big Data, IoT, HPC) to analyze, extract, normalize, and label relevant data, and with our Professional Services engineers to operationalize customers’ models after they are prototyped  Master’s degree of PhD in a highly quantitative field (Computer Science, Machine Learning, Operational Research, Statistics, Mathematics, etc.)  Ability to develop strategic, baselined, data modeling processes; ability to accurately determine cause-and-effect relationships.  Publications or presentations in recognized ML journals or conferences  Deep technical skills, consulting experience, and business savvy to interface with all levels and disciplines within our customers’ organization  Demonstrable track record of dealing well with ambiguity, prioritizing needs, and delivering results in a dynamic environment  Amazon is committed to a diverse and inclusive workplace. Amazon is an equal opportunity employer and does not discriminate on the basis of race, national origin, gender, gender identity, sexual orientation, protected veteran status, disability, age, or other legally protected status. For individuals with disabilities who would like to request an accommodation, please visit https://www.amazon.jobs/en/disability/us. For employees based in Colorado, this position starts at $116,200 per year. A sign-on bonus and restricted stock units may be provided as part of the compensation package, in addition to a range of medical, financial, and/or other benefits, dependent on the position offered.",30+ days ago,"78,410 reviews"
