URL,page_count,job_title,company,location,job_Description,post_date,reviews
https://www.indeed.com/viewjob?jk=00a77024901dcab0&from=web&vjs=3,20,"Senior DevOps Engineer, Machine Learning",Change Healthcare,Mississippi,"Senior DevOps Engineer, Machine Learning (remote - US) Overview of Position We are seeking a world-class Machine Learning DevOps Engineer to manage and deploy Artificial Intelligence/Machine Learning platforms and solutions for Change Healthcare, reporting to an AI Engineering Leader under the Office of the Chief AI Officer. We’re looking for engineers with a passion for artificial intelligence to help drive a new generation of data and machine learning-enabled services and products to impact the healthcare system. What will be my duties and responsibilities in this job? In this role, you will enjoy working with a highly talented and diverse team of data scientists and engineers specializing in deep learning, active learning, and classical machine learning with one of the richest data sets in US healthcare, nearly limitless cloud compute resources including Spark clusters and GPUs, and the ability to support a large pipeline of AI models directly into business impact. The ideal candidate will have strong expertise in Dev ops, Standardize Build , Deploy , Sizing and Capacity planning, have experience working with large data sets, and have experience in building Machine Learning Platforms, applying Machine Learning and deploying data-driven solutions. You are focused on results, a self-starter, able to put the team first, and have demonstrated success in using data science to develop and deploy solutions with a focus on impact. What are the requirements needed for this position? Master's degree in Computer Sciences, or Mathematics OR Bachelor’s degree in Computer Sciences, or Mathematics +6 years of equivalent work experience. Expertise in rapidly deploying AI solutions to production on a DevOps-focused team Create backend and infrastructure solutions to deploy and manage production systems. Define standard practices and build tooling around incidents, postmortems, changes, and capacity and work with other Engineering teams to help them adopt these practices to improve their services Capacity planning and demand forecasting to meet systems demand, identifying performance bottlenecks and devising tuning improvements Architect to optimize speed and cost for compute and storage. Secure and automate solutions through collaboration with InfoSec and Architecture resource Strong fluency in Terraform, Gitlabs, Cloud-formation experience preferred Managing Spark or Pyspark experience preferred Proficiency using Kubeflow, Airflow and other workflows Ability to initiate and drive projects to completion with minimal guidance The ability to communicate the results of analyses in a clear and effective manner Experience with large data sets and distributed computing (Spark) Experience in AWS or GCP using tools such as EMR, S3, EC2, Deep Learning AMI’s, SageMaker Above-average capabilities with cloud computing techniques or tools such as S3, EC2, EMR, SageMaker, ECS, Docker, Gitlab CI, Python packaging, command-line executions and shell scripting Knowledge of common data structures and ability to write efficient code in Python Exceptional interpersonal and communication skills, including the ability to describe the logic and implications of a complex model to all types of partners (product managers, engineers, designers, senior executives) Knowledge and experience in the healthcare industry is a plus AWS Certification is a plus #li-remote Join our team today where we are creating a better coordinated, increasingly collaborative, and more efficient healthcare system! Colorado Residents Only: The base pay range for Colorado residents is $0.00 - $0.00 plus any relevant incentive pay programs that may be aligned to the role. Pay is based on several factors including but not limited to education, work experience, certifications, etc. In addition to your base pay, Change Healthcare offers the following benefits for this position, subject to applicable eligibility requirements: Health, dental and vision plans; wellness program; health savings account; flexible spending accounts; 401(k) retirement plan; life insurance; short-term and long-term disability insurance; Employee Assistance Program; PTO; tuition reimbursement; and employee-paid critical illness and accident insurance. COVID Mandate As a federal contractor, Change Healthcare is adhering to the Executive Order which mandates vaccination. As such, we are requiring all U.S. new hires and employees to show proof of being fully vaccinated for COVID-19 or receive an approved accommodation by their date of hire, as a condition of employment. As we continue to navigate the ever-changing COVID-19 pandemic, we remain committed to doing our part to ensure the health, safety, and well-being of our team members and our communities. Proof of vaccination or accommodations requests will be collected once an offer is accepted with Change Healthcare. All accommodation requests will be carefully considered but are not guaranteed to be approved. Equal Opportunity/Affirmative Action Statement  Change Healthcare is an equal opportunity employer. All qualified applicants will receive consideration for employment without regard to race, color, religion, age, sex, sexual orientation, gender identity, genetic information, national origin, disability, or veteran status. To read more about employment discrimination protections under federal law, read  EEO is the Law  at https://www.eeoc.gov/employers/eeo-law-poster and the supplemental information at https://www.dol.gov/ofccp/regs/compliance/posters/pdf/OFCCP_EEO_Supplement_Final_JRF_QA_508c.pdf. If you need a reasonable accommodation to assist with your application for employment, please contact us by sending an email to applyaccommodations@changehealthcare.com with ""Applicant requesting reasonable accommodation"" as the subject. Resumes or CVs submitted to this email box will not be accepted. Click here https://www.dol.gov/ofccp/pdf/pay-transp_%20English_formattedESQA508c.pdf to view our pay transparency nondiscrimination policy. California (US) Residents: By submitting an application to Change Healthcare for consideration of any employment opportunity, you acknowledge that you have read and understood Change Healthcare’s Privacy Notice to California Job Applicants Regarding the Collection of Personal Information. Change Healthcare maintains a drug free workplace and conducts pre-employment drug-testing, where applicable, in accordance with federal, state and local laws.",30+ days ago,"1,264 reviews"
https://www.indeed.com/viewjob?jk=dd93c2ecd167348d&from=web&vjs=3,10,Machine Learning: Hydraulic & Environmental Data,U.S. Department of Defense (DOD),"Vicksburg, MS","Organization  U.S. Department of Defense (DOD) Reference Code  ERDC-EL-2021-0005 How to Apply  How to Apply  Components of the online application are as follows:  Profile Information  Educational and Employment History  Essay Questions (goals, experiences, and skills relevant to the opportunity)  Resume (PDF)  Transcripts/Academic Records -  Recommendation   Submitted documents must have all social security numbers, student identification numbers, and/or dates of birth removed (blanked out, blackened out, made illegible, etc.) prior to uploading into the application system.  If you have questions, send an email to USACE@orise.orau.gov. Please list the reference code of this opportunity in the subject line of the email.  All documents must be in English or include an official English translation.  Description  The Environmental Laboratory (EL) provides relevant, value-added technology supporting the environmental mission of the US Army Corps of Engineers, the Department of Defense (DoD), and the Nation. Headquartered in Vicksburg, Mississippi, EL’s interdisciplinary staff of over 220 engineers, scientists, technicians, and support personnel plans and executes all phases of the technology development process, from basic research to field implementation to commercialization. The EL staff consists of problem solvers who use research, development, experimentation, special studies, and technical support to address the needs of national and international business development partners. Partnering with Federal and State agencies, academia, and the private sector, the EL uses its distinctive technical capabilities to resolve complex, multi-disciplinary environmental sustainability problems. The EL website can be accessed at: http://el.erdc.usace.army.mil/  Under the guidance of a mentor, the participant will collaborate with federal employees on developing analysis of hydraulic and environmental data specifically with using machine learning approaches. Measurements of animal movement and hydraulic/water quality parameters (temperature, gas content, sound, etc) under in a laboratory are routine. Development and analysis of numerical data sets via machine learning approaches are being conducted within the team. The participant will participate in the maintenance and operation of laboratory gear and facilities. Specialized training for maintaining animals (fish) will be required. This project requires a knowledge of computer software development, machine learning approaches and general programing (C, C++, Python, Matlab etc). The participant will learn specialized data collection techniques using ADVs, ADCP etc. The participant's contribution to ongoing research activities may include the following:  Monitoring and maintaining real-time data collection QA/QC of historical data Development and implementation of machine learning based analysis techniques Testing of new instrumentation and participation in experiment design Preparing, maintaining, and operating laboratory equipment Participating in the preparation of reports, presentations, or journal articles communicating research activities and findings  Appointment Length  This appointment is a twelve month research appointment, with the possibility to be renewed for additional research periods. Appointments may be extended depending on funding availability, project assignment, program rules, and availability of the participant.  Participant Benefits  Participants will receive a stipend to be determined by ERDC-EL. Stipends are typically based on the participant’s academic standing, discipline, experience, and research facility location. Other benefits may include the following:  Health Insurance Supplement.  Participants are eligible to purchase health insurance through ORISE.  Relocation Allowance  Training and Travel Allowance  Nature of Appointment  The participant will not enter into an employee/employer relationship with ORISE, ORAU, DOD, or any other office or agency. Instead, the participant will be affiliated with ORISE for the administration of the appointment through the ORISE appointment letter and Terms of Appointment.   Qualifications  Support and develop machine learning applications for diverse environmental challenges such as computing hydrodynamic flow fields and fish behavior using existing 2D and 3D hydrodyanmic models and fish telemetry data. Supporting the planning and execution of complex logistical challenges associated with vaccine delivery within the United States and potentially OCONUS. Apply diverse computational tools such as Python and R, Java, C#, C++, and VBA Programming. Develop machine learning applications using tools such as Tensorflow.js. Participate in algorithm development, software design, GUI development, web development, and formal test suites. Develop user tools to access results and support wider adoption of technical conclusions.  Eligibility Requirements  Citizenship:  U.S. Citizen Only  Degree:  Bachelor's Degree, Master's Degree, or Doctoral Degree received within the last 60 months or anticipated to be received by 5/31/2021 11:59:00 PM. Overall GPA:  3.00 Discipline(s): Computer, Information, and Data Sciences  Earth and Geosciences  Engineering  Environmental and Marine Sciences  Life Health and Medical Sciences  Mathematics and Statistics  Other Physical Sciences  Physics",30+ days ago,77 reviews
https://www.indeed.com/viewjob?jk=28f5772eec79424f&from=web&vjs=3,20,Machine Learning Engineer,Pearson,"Jackson, MS","Pearson, the world's leading learning company, has global-reach and market leading businesses in education, business, and consumer publishing and is listed on the London and New York stock exchanges (UK: PSON; NYSE: PSO). For more information, visit www.pearson.com.  The Personalized Learning and Analytics team (PLA) in Pearson is responsible for software development of analytics and machine learning platforms. PLA is growing and we are looking for a new team member. Together with a highly multi-disciplinary team of engineers, scientists, strategic partners, product managers and subject domain experts you will work on building solutions powered by big data. You will work on a best-in-class cloud computing platform, with cutting edge big data tools at your disposal while having access to experts in education, engineering and data science.  Pearson is an Equal Opportunity and Affirmative Action Employer, and a member of E-Verify. All qualified applicants, including minorities, women, veterans, and people with disabilities are encouraged to apply.  RESPONSIBILITIES  :  Develop scalable data processing pipelines  Collaborate with other scientists and engineers to find effective solutions to technical challenges  Provide input for product road maps  Work closely with engineers to build, test, deploy and troubleshoot machine learning algorithms designed to enhance the learner’s experience  Work with product partners and stakeholders to communicate expectations and deliver on them  Research, design, and develop statistics or statistical models where applicable to monitor usage/performance and help make data driven decisions  Create machine learning microservices and have a willingness to maintain our Kubernetes cluster  Be involved in the development, maintenance and evolution of our services and products   QUALIFICATIONS  :  Bachelors degree in computer science, statistics, mathematics, physical science, engineering, or a comparable related technical field: or equivalent years of experience.  Desire to explore and develop solutions to questions that may or may not have a right answer  Demonstrated mastery in communication of technical ideas to non-technical audiences  Ability to translate customer goals into practical engineering solutions  Good understanding of foundational statistics concepts and algorithms: linear/logistic regression, random forest, boosting, NNs, etc.  Passion for learning (new problem domains, algorithms, tools etc.) and for analyzing data  Strong programming skills with fluency in at least one of Python, Java, Scala, C/C++ Familiar with industry standard software engineering practices and systems knowledge  Working knowledge of Unix/Linux systems  Ability to access, manage, transfer, integrate and analyze complex datasets, especially using SQL  Familiarity with libraries such as pandas, TensorFlow, scikit-learn   PREFERRED QUALIFICATIONS:  MS or higher in computer science, mathematics or a comparable related technical field  2+ years of industry experience in software engineering and data science  Experience with working on large data sets, especially with Spark  Experience with Python and Java  Experience with cloud computing platforms such as AWS or GCP  Experience with Kubernetes   The anticipated starting salary range for Colorado-based individuals expressing interest in this position is $75-144K. This position is eligible to participate in an annual incentive program.  Benefits available to eligible employees can be seen at: https://pearsonbenefitsus.com/  Learning is the most powerful force for change in the world. More than 20,000 Pearson employees deliver our products and services in nearly 200 countries, all working towards a common purpose – to help everyone achieve their potential through learning. We do that by providing high quality, digital content and learning experiences, as well as assessments and qualifications that help people build their skills and grow with the world around them. We are the world’s leading learning company. Learn more at pearsonplc.com.  Pearson believes that wherever learning flourishes, so do people. We are committed to being an anti-racist company in everything we do. We value the power of an inclusive culture and a strong sense of belonging. We promote a culture where differences are embraced, opportunities are accessible, consideration and respect are the norm, and all individuals are supported in reaching their full potential. Through our talent, we believe that diversity, equity, and inclusion make us a more innovative and vibrant place to work. People are at the center, and we are committed to a sustainable environment and workplace where talent can learn, grow, and thrive.  To learn more about Pearson’s commitment to a diverse and inclusive workforce, please click here: http://www.pearson.com/careers/diversity-and-inclusion.html  Pearson is an Affirmative Action and Equal Opportunity Employer and a member of E-Verify. We are committed to building a team that represents a variety of backgrounds, perspectives, and skills. The more inclusive we are, the better our work will be. All employment is decided based on qualifications, merit, and business need. All qualified applicants will receive consideration for employment without regard to race, ethnicity, color, religion, sex, sexual orientation, gender identity, gender expression, age, national origin, protected veteran status, disability status, or any other group protected by law.  Job:  TECHNOLOGY  Organization:  Corporate Strategy & Technology  Schedule:  FULL_TIME  Req ID:  707",30+ days ago,"2,709 reviews"
https://www.indeed.com/viewjob?jk=78eb0f11852ee3f8&from=web&vjs=3,20,Sr. Data Engineer - Patient Data / AI / ML,Change Healthcare,Mississippi,"Sr. Data Engineer - Patient Data / AI / ML Remote, US The opportunity is at Change Healthcare. Transforming the future of healthcare isn’t something we take lightly. It takes teams of the best and the brightest, working together to make an impact. As one of the largest healthcare technology companies in the U.S., we are a catalyst to accelerate the journey toward improved lives and healthier communities. Here at Change Healthcare, we’re using our influence to drive positive changes across the industry, and we want motivated and passionate people like you to help us continue to bring new and innovative ideas to life. We will be asking you to Lead elegant systems design and develop technologies to effectively ingest and store patient-related data and for data scientists and engineers to access this data with ease. Design, build and launch new data extraction, transformation and loading processes in production. Collaborate with product managers, data scientists and other engineers. To be effective at this role you will need to be Curious - willing to learn new things and try new things, able to implement prototypes, rolling up your sleeves Data-Driven - able to drive decisions and influence based on data. Communicative - possess an ability to simplify complex concepts, explain AI technologies in ways that can be consumed by non-technical stakeholders Inspiring and empowering - possess influencing skills and natural ability to build trust with machine learning engineers and data scientists Sense of Urgency - bring an agile, let’s get things done attitude We are assuming that you have MS degree in computer science or related field. 10+ years' experience in distributed systems, at least five in applied AI Infrastructure. Hands on experience in Java 11, Scala or Python in designing ETL pipelines. Experience with AWS technologies (Lambda, EMR, EC2, SQS and RDS etc) Hands on experience in tackling massive data sets with Yarn, Spark, Presto, Hive, Impala etc. Familiarity with key value stores and NoSQL databases like HBase, Cassandra, Hive etc. Experience with CI/CD using Jenkins. Familiarity with shell scripting using Bash or Zsh. Prior experience in leading and mentoring others. #li-remote Join our team today where we are creating a better coordinated, increasingly collaborative, and more efficient healthcare system! COVID Mandate As a federal contractor, Change Healthcare is adhering to the Executive Order which mandates vaccination. As such, we are requiring all U.S. new hires and employees to show proof of being fully vaccinated for COVID-19 or receive an approved accommodation by their date of hire, as a condition of employment. As we continue to navigate the ever-changing COVID-19 pandemic, we remain committed to doing our part to ensure the health, safety, and well-being of our team members and our communities. Proof of vaccination or accommodations requests will be collected once an offer is accepted with Change Healthcare. All accommodation requests will be carefully considered but are not guaranteed to be approved. Equal Opportunity/Affirmative Action Statement  Change Healthcare is an equal opportunity employer. All qualified applicants will receive consideration for employment without regard to race, color, religion, age, sex, sexual orientation, gender identity, genetic information, national origin, disability, or veteran status. To read more about employment discrimination protections under federal law, read  EEO is the Law  at https://www.eeoc.gov/employers/eeo-law-poster and the supplemental information at https://www.dol.gov/ofccp/regs/compliance/posters/pdf/OFCCP_EEO_Supplement_Final_JRF_QA_508c.pdf. If you need a reasonable accommodation to assist with your application for employment, please contact us by sending an email to applyaccommodations@changehealthcare.com with ""Applicant requesting reasonable accommodation"" as the subject. Resumes or CVs submitted to this email box will not be accepted. Click here https://www.dol.gov/ofccp/pdf/pay-transp_%20English_formattedESQA508c.pdf to view our pay transparency nondiscrimination policy. California (US) Residents: By submitting an application to Change Healthcare for consideration of any employment opportunity, you acknowledge that you have read and understood Change Healthcare’s Privacy Notice to California Job Applicants Regarding the Collection of Personal Information. Change Healthcare maintains a drug free workplace and conducts pre-employment drug-testing, where applicable, in accordance with federal, state and local laws.",30+ days ago,"1,264 reviews"
