URL,page_count,job_title,company,location,job_Description,post_date,reviews
https://www.indeed.com/viewjob?jk=444477ebe6b24c6f&from=web&vjs=3,10,Senior Data Scientist - Nationwide Opportunities,"Amazon Web Services, Inc.",Montana," Bachelor’s degree in a highly quantitative field (Computer Science, Machine Learning, Operational Research, Statistics, Mathematics, etc.) or equivalent professional or military experience  Experience with ML fields, e.g., natural language processing, computer vision, statistical learning theory  6+ years of industry experience in predictive modeling, data science, and analysis  Experience in an ML engineer or data scientist role building and deploying ML models or hands on experience developing deep learning models  Experience writing code in Python, R, Scala, Java, C++ with documentation for reproducibility  Experience handling terabyte size datasets, diving into data to discover hidden patterns, using data visualization tools, writing SQL, and working with GPUs to develop models  Experience writing and speaking about technical concepts to business, technical, and lay audiences and giving data-driven presentations  Want to help the largest global enterprises derive business value through the adoption of Artificial Intelligence (AI) and Machine Learning (ML)? Excited by using massive amounts of disparate data to develop ML models? Eager to learn to apply ML to a diverse array of enterprise use cases? Thrilled to be a part of Amazon who has been pioneering and shaping the world’s AI/ML technology for decades? At Amazon Web Services (AWS), we are helping large enterprises build ML models on the AWS Cloud. We are applying predictive technology to large volumes of data and against a wide spectrum of problems. AWS Professional Services works together with AWS customers to address their business needs using AI solutions. AWS Professional Services is a unique consulting team. We pride ourselves on being customer obsessed and highly focused on the AI enablement of our customers. If you have experience with AI, including building ML models, we’d like to have you join our team. You will get to work with an innovative company, with great teammates, and have a lot of fun helping our customers. A successful candidate will be a person who enjoys diving deep into data, doing analysis, discovering root causes, and designing long-term solutions. Inclusive Team Culture Here at AWS, we embrace our differences. We are committed to furthering our culture of inclusion. We have thirteen employee-led affinity groups, reaching 85,000 employees in over 190 chapters globally. We have innovative benefit offerings, and host annual and ongoing learning experiences, including our Conversations on Race and Ethnicity (CORE) and AmazeCon (gender diversity) conferences. Amazon’s culture of inclusion is reinforced within our 16 Leadership Principles, which remind team members to seek diverse perspectives, learn and be curious, and earn trust. Work/Life Balance Our team puts a high value on work-life harmony. Striking a healthy balance between your personal and professional life is crucial to your happiness and success here. We are a customer-obsessed organization—leaders start with the customer and work backwards. They work vigorously to earn and keep customer trust. As such, this is a customer facing role in a hybrid delivery model. Project engagements include remote delivery methods and onsite engagement that will include travel to customer locations as needed. Mentorship & Career Growth Our team is dedicated to supporting new members. We have a broad mix of experience levels and tenures, and we’re building an environment that celebrates knowledge sharing and mentorship. We care about your career growth and strive to assign projects based on what will help each team member develop into a better-rounded professional and enable them to take on more complex tasks in the future. This is a customer-facing role and you will be required to travel to client locations and deliver professional services as needed.  Major responsibilities include:   Assist customers by being able to deliver a ML project from beginning to end, including understanding the business need, aggregating data, exploring data, building & validating predictive models, and deploying completed models with concept-drift monitoring and retraining to deliver business impact to the organization  Use AWS AI services (e.g., Personalize), ML platforms (SageMaker), and frameworks (e.g., MXNet, TensorFlow, PyTorch, SparkML, scikit-learn) to help our customers build ML models  Research and implement novel ML approaches, including hardware optimizations on platforms such as AWS Inferentia  Work with our other Professional Services consultants (Big Data, IoT, HPC) to analyze, extract, normalize, and label relevant data, and with our Professional Services engineers to operationalize customers’ models after they are prototyped  Master’s degree of PhD in a highly quantitative field (Computer Science, Machine Learning, Operational Research, Statistics, Mathematics, etc.)  Ability to develop strategic, baselined, data modeling processes; ability to accurately determine cause-and-effect relationships.  Publications or presentations in recognized ML journals or conferences  Deep technical skills, consulting experience, and business savvy to interface with all levels and disciplines within our customers’ organization  Demonstrable track record of dealing well with ambiguity, prioritizing needs, and delivering results in a dynamic environment  Amazon is committed to a diverse and inclusive workplace. Amazon is an equal opportunity employer and does not discriminate on the basis of race, national origin, gender, gender identity, sexual orientation, protected veteran status, disability, age, or other legally protected status. For individuals with disabilities who would like to request an accommodation, please visit https://www.amazon.jobs/en/disability/us. For employees based in Colorado, this position starts at $116,200 per year. A sign-on bonus and restricted stock units may be provided as part of the compensation package, in addition to a range of medical, financial, and/or other benefits, dependent on the position offered.",30+ days ago,"76,982 reviews"
https://www.indeed.com/viewjob?jk=9be454bde7e35343&from=web&vjs=3,10,Machine Learning Engineer,Pearson,"111 N Last Chance Gulch, Helena, MT 59601","Pearson, the world's leading learning company, has global-reach and market leading businesses in education, business, and consumer publishing and is listed on the London and New York stock exchanges (UK: PSON; NYSE: PSO). For more information, visit www.pearson.com.  The Personalized Learning and Analytics team (PLA) in Pearson is responsible for software development of analytics and machine learning platforms. PLA is growing and we are looking for a new team member. Together with a highly multi-disciplinary team of engineers, scientists, strategic partners, product managers and subject domain experts you will work on building solutions powered by big data. You will work on a best-in-class cloud computing platform, with cutting edge big data tools at your disposal while having access to experts in education, engineering and data science.  Pearson is an Equal Opportunity and Affirmative Action Employer, and a member of E-Verify. All qualified applicants, including minorities, women, veterans, and people with disabilities are encouraged to apply.  RESPONSIBILITIES  :  Develop scalable data processing pipelines  Collaborate with other scientists and engineers to find effective solutions to technical challenges  Provide input for product road maps  Work closely with engineers to build, test, deploy and troubleshoot machine learning algorithms designed to enhance the learner’s experience  Work with product partners and stakeholders to communicate expectations and deliver on them  Research, design, and develop statistics or statistical models where applicable to monitor usage/performance and help make data driven decisions  Create machine learning microservices and have a willingness to maintain our Kubernetes cluster  Be involved in the development, maintenance and evolution of our services and products   QUALIFICATIONS  :  Bachelors degree in computer science, statistics, mathematics, physical science, engineering, or a comparable related technical field: or equivalent years of experience.  Desire to explore and develop solutions to questions that may or may not have a right answer  Demonstrated mastery in communication of technical ideas to non-technical audiences  Ability to translate customer goals into practical engineering solutions  Good understanding of foundational statistics concepts and algorithms: linear/logistic regression, random forest, boosting, NNs, etc.  Passion for learning (new problem domains, algorithms, tools etc.) and for analyzing data  Strong programming skills with fluency in at least one of Python, Java, Scala, C/C++ Familiar with industry standard software engineering practices and systems knowledge  Working knowledge of Unix/Linux systems  Ability to access, manage, transfer, integrate and analyze complex datasets, especially using SQL  Familiarity with libraries such as pandas, TensorFlow, scikit-learn   PREFERRED QUALIFICATIONS:  MS or higher in computer science, mathematics or a comparable related technical field  2+ years of industry experience in software engineering and data science  Experience with working on large data sets, especially with Spark  Experience with Python and Java  Experience with cloud computing platforms such as AWS or GCP  Experience with Kubernetes   The anticipated starting salary range for Colorado-based individuals expressing interest in this position is $75-144K. This position is eligible to participate in an annual incentive program.  Benefits available to eligible employees can be seen at: https://pearsonbenefitsus.com/  Learning is the most powerful force for change in the world. More than 20,000 Pearson employees deliver our products and services in nearly 200 countries, all working towards a common purpose – to help everyone achieve their potential through learning. We do that by providing high quality, digital content and learning experiences, as well as assessments and qualifications that help people build their skills and grow with the world around them. We are the world’s leading learning company. Learn more at pearsonplc.com.  Pearson believes that wherever learning flourishes, so do people. We are committed to being an anti-racist company in everything we do. We value the power of an inclusive culture and a strong sense of belonging. We promote a culture where differences are embraced, opportunities are accessible, consideration and respect are the norm, and all individuals are supported in reaching their full potential. Through our talent, we believe that diversity, equity, and inclusion make us a more innovative and vibrant place to work. People are at the center, and we are committed to a sustainable environment and workplace where talent can learn, grow, and thrive.  To learn more about Pearson’s commitment to a diverse and inclusive workforce, please click here:  http://www.pearson.com/careers/diversity-and-inclusion.html  Pearson is an Affirmative Action and Equal Opportunity Employer and a member of E-Verify. We are committed to building a team that represents a variety of backgrounds, perspectives, and skills. The more inclusive we are, the better our work will be. All employment is decided based on qualifications, merit, and business need. All qualified applicants will receive consideration for employment without regard to race, ethnicity, color, religion, sex, sexual orientation, gender identity, gender expression, age, national origin, protected veteran status, disability status, or any other group protected by law.  Job:  TECHNOLOGY  Organization:  Technology & Operations  Schedule:  FULL_TIME  Req ID:  707",30+ days ago,"2,696 reviews"
https://www.indeed.com/viewjob?jk=a5c5c8085b0b3b44&from=web&vjs=3,10,"Director, Data Analytics and Business Intelligence - Remote (Anywhere US)",Change Healthcare,Montana,"Director Data Analytics and Business Intelligence Overview of Position The Director of Analytics and Business Intelligence role is a leadership position with the skills and experience to build and lead cross functional strategic analytic engagements that significantly contribute to the overall success of Change Healthcare’s Payment Accuracy suite of solutions. They will lead a team of FTE’s and the development, delivery, and management of reporting, analytic innovation, Artificial Intelligence modeling, and solution design. They will work closely with operations, information technology, sales, and account management colleagues to implement, develop, and deliver the analytical and reporting tools necessary to support the Payment Accuracy suite of solutions. What are the requirements needed for this position? 7+ years working in a healthcare analytics or comparable role. 3+ years’ experience client/external facing role 5+ years’ experience in a people management role What critical skills are needed for you to consider someone for this position? Excellent data analysis and interpretation skills Knowledge and experience with analytics solutions using cloud-based solutions Rapid critical thinking skills Exceptional internal/external presentation and verbal communication skills Expertise in Excel, Word, PowerPoint, and some combination of SQL, Tibco Spotfire, Jira, R, Powershell, and/or Python Demonstrated experience advancing programs by informing and shaping data driven strategy Ability to lead through ambiguity and complexity to take calculated risks to solve problems, forge new paths for growth, and achieve challenging goals Outstanding ability to collaborate and partner with customers, other business teams, and senior leadership Confirmed strategic business leadership with experience identifying, quantifying, and pursuing new opportunities Ability to work in a dynamic environment with multiple concurrent projects using creativity, flexibility, and organizational skills Has multi-year experience in working with analytics teams to examine and specify unique solutions and provides proof of ability to work across complex business and technical teams to understand and specify technology solutions linking analytics business needs to operations What other skills/experience would be helpful to have? MBA or Masters Degree a plus Solid foundation of operational, clinical, and financial healthcare knowledge In-depth knowledge of services management related to the healthcare industry Understanding CPT codes, DRG codes, HCPCS, Diagnosis codes, and modifier rules and guidelines. Advanced industry certifications preferred What are the working conditions and physical requirements of this job? General office demands/Home office How much should I expect to travel? Up to 20% travel requirement Employees in roles that require travel will need to be able to qualify for a company credit card or be able to use their own personal credit card for travel expenses and submit for reimbursement. #li-remote Join our team today where we are creating a better coordinated, increasingly collaborative, and more efficient healthcare system! COVID Mandate As a federal contractor, Change Healthcare is adhering to the Executive Order which mandates vaccination. As such, we are requiring all U.S. new hires and employees to show proof of being fully vaccinated for COVID-19 or receive an approved accommodation by their date of hire, as a condition of employment. As we continue to navigate the ever-changing COVID-19 pandemic, we remain committed to doing our part to ensure the health, safety, and well-being of our team members and our communities. Proof of vaccination or accommodations requests will be collected once an offer is accepted with Change Healthcare. All accommodation requests will be carefully considered but are not guaranteed to be approved. Equal Opportunity/Affirmative Action Statement  Change Healthcare is an equal opportunity employer. All qualified applicants will receive consideration for employment without regard to race, color, religion, age, sex, sexual orientation, gender identity, genetic information, national origin, disability, or veteran status. To read more about employment discrimination protections under federal law, read  EEO is the Law  at https://www.eeoc.gov/employers/eeo-law-poster and the supplemental information at https://www.dol.gov/ofccp/regs/compliance/posters/pdf/OFCCP_EEO_Supplement_Final_JRF_QA_508c.pdf. If you need a reasonable accommodation to assist with your application for employment, please contact us by sending an email to applyaccommodations@changehealthcare.com with ""Applicant requesting reasonable accommodation"" as the subject. Resumes or CVs submitted to this email box will not be accepted. Click here https://www.dol.gov/ofccp/pdf/pay-transp_%20English_formattedESQA508c.pdf to view our pay transparency nondiscrimination policy. California (US) Residents: By submitting an application to Change Healthcare for consideration of any employment opportunity, you acknowledge that you have read and understood Change Healthcare’s Privacy Notice to California Job Applicants Regarding the Collection of Personal Information. Change Healthcare maintains a drug free workplace and conducts pre-employment drug-testing, where applicable, in accordance with federal, state and local laws.",30+ days ago,"1,243 reviews"
https://www.indeed.com/viewjob?jk=925de697f4847007&from=web&vjs=3,10,Senior Data Analyst Talent Acquisition (TA) PSJH,Providence,Montana,"Description:  Providence is calling a Senior Data Analyst Talent Acquisition (TA).   This position is virtual and open to Candidates residing in Alaska, Washington, Montana, Oregon, California or Texas.  Applicants that meet qualifications will receive a text with a additional questions from our Modern Hire system.  We are seeking a Senior Data Analyst Talent Acquisition (TA) PSJH who will provide strategic consultation, insights, analysis and reports by leveraging solutions and systems data, market and competitive intelligence and benchmarking research to support Talent Acquisition with strategic planning and decisions, TA success measurements/metrics/results/ROI and business outcomes. Regularly identifies, designs and conducts quantitative and qualitative analysis of talent acquisition data to reveal critical insights, enable actionable decisions, develop strategies, adjust tactics and tell the story of the value of the TA function. The TA Senior Data Analyst focuses on enterprise efforts and maintains ""expert"" status in recruitment and marketing data and reporting capabilities of the systems, solutions and vendors. This role also creates and applies technical expertise in building reporting infrastructure and advancing capabilities and maturity of the insights and intelligence function.  This position identifies, designs and conducts quantitative and qualitative analysis of enterprise wide talent acquisition strategies and partners with HRIS to make connections to the people strategy. Performs all duties in a manner that promotes a team concept and reflects the PSJH mission and core values.  In this position you will have the following responsibilities:  Provide analysis and reporting for of Talent Acquisition data for the purpose of strategic planning and decision-making by TA, HR PSJH leaders and executives. Enables TA and HR leaders to tell the story of the value of TA and the hiring of talent through data and competitive intelligence.  Work with HR staff and other customers to analyze and satisfy data requests through production of established intelligence or utilization of various tools and applications to develop new intelligence. Works with HR, Finance, Marketing, and TA vendors to analyze data using various systems, data sources and benchmarking research to develop new intelligence and insights to support TA.  Ensure validity of data including identifying and reconciling discrepancies in intelligence from multiple reporting sources and/or systems and/or conducting period audits to improve data quality.  Identify, design, and document process workflows, data models, system decisions, designs and procedures related to TA information systems and related functions.  Create new value and maintains credibility and strong relationships with TA stakeholders, including hiring managers, recruiting teams, and HR leaders.  Proactively seek out benchmarking and best practice sharing opportunities and implements industry best practices for accessing, analyzing and disseminating data.  Lead critical initiatives and projects to improve data and insights and serves as project lead or work stream lead on major informational projects that involve TA data.  Educate users of TA intelligence on how to access, utilize and discuss TA information, including group and one-on-one training.  Provide reviews, assessments and recommendations for tools and technologies used to generate reports or streamline processes.  Investigate, resolve and perform follow-up tasks on complex system and data related problems as needed.  Qualifications:  Required qualifications for this position include:  Bachelor's Degree in any related field or equivalent education/experience.  5 years related experience.  Experience in an HR, TA, Finance, Sales, Retail, Supply Chain, Technology or Marketing or other business environment working with data reporting, analytics and insights consultation.  Experience in an HR TA, marketing or healthcare environment and data.  Technical expertise regarding data models, database design development, data mining and segmentation techniques.  Experience extracting and analyzing data using a variety of enterprise reporting tools and data sources (Examples SQL, Tableau, Oracle Business Intelligence (OBIEE), Crystal Reports, ATS, CRMS and Microsoft BI).  Experience presenting and communicating outcome-based analyses to senior leaders for strategic planning and decision making.  Demonstrated proficiency in influencing and negotiating.  Experience educating others on basic data analytical techniques and concepts.  Experience leading complex projects through an established project management methodology  About the department you will serve.  Providence Shared Services provides a variety of functional and system support services for our Providence family of organizations across Alaska, California, Montana, New Mexico, Oregon, Texas and Washington. We are focused on supporting our Mission by delivering a robust foundation of services and sharing of specialized expertise.  We offer comprehensive, best-in-class benefits to our caregivers. For more information, visit  https://www.providenceiscalling.jobs/rewards-benefits/  Our Mission  As expressions of God’s healing love, witnessed through the ministry of Jesus, we are steadfast in serving all, especially those who are poor and vulnerable.  About Us  Providence is a comprehensive not-for-profit network of hospitals, care centers, health plans, physicians, clinics, home health care and services continuing a more than 100-year tradition of serving the poor and vulnerable. Providence is proud to be an Equal Opportunity Employer. Providence does not discriminate on the basis of race, color, gender, disability, veteran, military status, religion, age, creed, national origin, sexual identity or expression, sexual orientation, marital status, genetic information, or any other basis prohibited by local, state, or federal law.  Schedule:  Full-time  Shift:  Day  Job Category:  HR Other  Location:  Washington-Renton  Other Location(s):  Montana, California, Washington, Oregon, Texas, Alaska  Req ID:  314726",30+ days ago,"3,223 reviews"
