URL,page_count,job_title,company,location,job_Description,post_date,reviews
https://www.indeed.com/viewjob?jk=226ef16a699e8e66&from=web&vjs=3,10,Data Engineer II - Patient Data / AI / ML,Change Healthcare,Mississippi,"Data Engineer, Patient Data (Remote-US) Transforming the future of healthcare isn’t something we take lightly. It takes teams of the best and the brightest, working together to make an impact. As one of the largest healthcare technology companies in the U.S., we are a catalyst to accelerate the journey toward improved lives and healthier communities. Here at Change Healthcare, we’re using our influence to drive positive changes across the industry, and we want motivated and passionate people like you to help us continue to bring new and innovative ideas to life. Data engineers at Change Healthcare are software developers who design, build and launch efficient & reliable data pipelines to move and transform data (both large and small amounts). They design elegant interfaces between internal services and internal customers. Design, build and launch new data extraction, transformation and loading processes in production. We will be asking you to Design, build and launch efficient & reliable data pipelines to move and transform data (both large and small amounts). Assemble large, complex data sets that meet business requirements. Optimize data delivery and re-design infrastructure for greater scalability. Develop the infrastructure required for optimal extraction, transformation, and loading of data from a wide variety of data sources Develop analytics tools that utilize the data pipeline to provide actionable insights into customer acquisition, operational efficiency, and other key business performance metrics. To be effective at this role you will need to be Curious - willing to learn new things and try new things, able to implement prototypes, rolling up your sleeves Data-Driven - able to drive decisions and influence based on data. Sense of Urgency - bring an agile, let’s get things done attitude We are assuming that you have MS degree in computer science or related field. Comfortable with modern programming languages (Python, Java, …) Familiarity with key value stores and NoSQL databases like HBase, Cassandra, Hive etc. Familiarity with shell scripting using Bash or Zsh. #li-remote Join our team today where we are creating a better coordinated, increasingly collaborative, and more efficient healthcare system! COVID Mandate As a federal contractor, Change Healthcare is adhering to the Executive Order which mandates vaccination. As such, we are requiring all U.S. new hires and employees to show proof of being fully vaccinated for COVID-19 or receive an approved accommodation by their date of hire, as a condition of employment. As we continue to navigate the ever-changing COVID-19 pandemic, we remain committed to doing our part to ensure the health, safety, and well-being of our team members and our communities. Proof of vaccination or accommodations requests will be collected once an offer is accepted with Change Healthcare. All accommodation requests will be carefully considered but are not guaranteed to be approved. Equal Opportunity/Affirmative Action Statement  Change Healthcare is an equal opportunity employer. All qualified applicants will receive consideration for employment without regard to race, color, religion, age, sex, sexual orientation, gender identity, genetic information, national origin, disability, or veteran status. To read more about employment discrimination protections under federal law, read  EEO is the Law  at https://www.eeoc.gov/employers/eeo-law-poster and the supplemental information at https://www.dol.gov/ofccp/regs/compliance/posters/pdf/OFCCP_EEO_Supplement_Final_JRF_QA_508c.pdf. If you need a reasonable accommodation to assist with your application for employment, please contact us by sending an email to applyaccommodations@changehealthcare.com with ""Applicant requesting reasonable accommodation"" as the subject. Resumes or CVs submitted to this email box will not be accepted. Click here https://www.dol.gov/ofccp/pdf/pay-transp_%20English_formattedESQA508c.pdf to view our pay transparency nondiscrimination policy. California (US) Residents: By submitting an application to Change Healthcare for consideration of any employment opportunity, you acknowledge that you have read and understood Change Healthcare’s Privacy Notice to California Job Applicants Regarding the Collection of Personal Information. Change Healthcare maintains a drug free workplace and conducts pre-employment drug-testing, where applicable, in accordance with federal, state and local laws.",26 days ago,"1,264 reviews"
https://www.indeed.com/viewjob?jk=c25c986e24d01e8d&from=web&vjs=3,10,Senior Data Engineer – Systems Data Analyst (REMOTE),GE Appliances,"Jackson, MS","Description  Job Location USA, Louisville, KY Other ID US, USA, Atlanta, GA, USA, Austin, TX, USA, Chicago, IL, USA, Columbia, SC, USA, Columbus, OH, USA, Des Moines, IA, USA, Durham, NC, USA, Indianapolis, IN, USA, Jackson, MS, USA, Jacksonville, FL, USA, Minneapolis, MN, USA, Nashville, TN, USA, Newark, NJ, USA, Oklahoma City, OK, USA, Philadelphia, PA, USA, St Louis, MO Job Posting Title Senior Data Engineer – Systems Data Analyst (REMOTE) The Challenge The Dishwasher Systems Data Analyst will primarily be responsible for supporting the development, implementation, and maintenance of data visualization and insights built upon all manners of data used within the Dishwasher business. In addition to these primary responsibilities, this position will support the development, technical documentation, and implementation of digital features and capabilities including Standing Instructions, user stories, and algorithm flow charts. What you will Do In addition to these primary responsibilities, this position will support the development, technical documentation, and implementation of digital features and capabilities including Standing Instructions, user stories, and algorithm flow charts. Lead the development, implementation, and maintenance of data visualization and dashboards for uses such as: Connected dishwasher data, Consumer insights based on connected product usage, Quality metrics in support of the Cost of Quality team. Support ongoing improvements in data integrity and governance through creation of documentation and processes that ensure data validity and value to the Dishwasher business. Become Proficient in the Technology Connected / Software Competency by understanding the Connected Home ecosystem and infrastructure. Develop knowledge of Dishwasher System Competency for product level design and interactions as they related to product / component operation, system response, and resulting product data including performance telemetry, fault codes, and other metrics. Qualifications/Requirements BS degree in Engineering or equivalent technical discipline. 7+ years engineering experience or equivalent with excellent verbal, written communication, and interpersonal skills. Proficient with data visualization tools like Tableau, SAS, Data Studio, and / or Looker. Proficient with data lake tools and languages like SQL. Working knowledge of collaboration tools for software development and management such as Confluence and GitHub. Demonstrated ability to organize and maintain documentation and analyses. Strong analytical/problem solving skills with demonstrated ability to scope and analyze cross-functional problems to generate/implement insights and potential solutions. What you need to Succeed Additional Qualifications: 5+ years of data analytics and visualization experience. Previous Dishwasher product and design experience. Proven ability to collaborate with cross-functional and cross-region teams. Experience in communicating business/project performance with senior leadership. #L1-KB1 GE Appliances is an Equal Opportunity Employer. Employment decisions are made without regard to race, color, religion, national or ethnic origin, sex, sexual orientation, gender identity or expression, age, disability, protected veteran status or other characteristics protected by law.",13 days ago,356 reviews
https://www.indeed.com/viewjob?jk=a7766cbeaddabd38&from=web&vjs=3,10,"Data Science Director - Facebook Reality Labs, Assistant",Portal,Mississippi,"We are looking for a seasoned Data Science Director who can navigate the technical complexity of the space and the solutions while also managing and supporting a broad and diverse range of stakeholders. This leader will have a strong product sense, technical and communication skills. Direct experience shipping an intelligent agent or NLP product is highly preferred. You will partner with cross-functional stakeholders (Product, Engineering, Content, Programming, Design) to tackle challenging analytical, statistical, and experimentation problems. The insights that you derive will guide crucial strategic decisions about the future of AI voice products at Facebook. The Data Science team’s mission is to leverage data to understand, identify, and execute, accelerating the journey toward building a novel, powerful, and useful AI voice product for Facebook. Projects our DS work on range from broad user and ecosystem understanding, strategic planning and product goal setting, as well as diving deep on specific applications or the engagement of our users. There are product areas, like Portal and VR, where the Assistant feature is already shipped and we’re continuing to build on that, while there are many other areas like new HW products that are still early in the product development phase. This team is focused on helping the product team scope out new opportunities, define success across the overall product ecosystem and each product area individually, as well as understand how AI voice products can contribute to our mission to increase meaningful connections. This leader will drive the DS team into more experimentation with broad hypothesis areas and determine how we are going to test and then push DS into product development. Given the phase of the products, there’s a lot of testing and pivoting and product re-scoping as we find the right path and product features.    Collaborate with product, engineering and research and other functional experts to shape a shared, data-driven strategic vision for Assistant across the company. Define and shape the north star for driving growth, quality and relevance of our Assistant products and ecosystems. Drive product development with a team of world-class engineers, data scientists, researchers, and other functional experts. Deeply understand the Assistant ecosystem and define and analyze metrics that evaluate our trajectory and inform the success of our products. Translate insights into product direction and empower cross-functional partners to execute in a data-informed manner throughout the entire product life-cycle. Cultivate culture of executional excellence and analytical rigor.    7+ years of experience in managing other team members in a formal capacity and experience managing managers 7+ years of experience doing quantitative analysis 7+ years of experience in an analytical role in technology, hardware, consulting, investment banking, or product management Experience with SQL or other analytic functions and data manipulation in Python or R Experience initiating and driving projects to completion with minimal guidance Experience communicating the results of analysis to influence company and product direction    Masters Degree in Computer Science, Business, Math, Physics, Engineering, or related quantitative field Understanding of statistical analysis, experience with packages, such as Python, R, MATLAB, SPSS, SAS, Stata, etc. Experience with large data sets and distributed computing (Hive/Hadoop/Spark)   Facebook's mission is to give people the power to build community and bring the world closer together. Through our family of apps and services, we're building a different kind of company that connects billions of people around the world, gives them ways to share what matters most to them, and helps bring people closer together. Whether we're creating new products or helping a small business expand its reach, people at Facebook are builders at heart. Our global teams are constantly iterating, solving problems, and working together to empower people around the world to build community and connect in meaningful ways. Together, we can help people build stronger communities - we're just getting started.  Facebook is proud to be an Equal Opportunity and Affirmative Action employer. We do not discriminate based upon race, religion, color, national origin, sex (including pregnancy, childbirth, or related medical conditions), sexual orientation, gender, gender identity, gender expression, transgender status, sexual stereotypes, age, status as a protected veteran, status as an individual with a disability, or other applicable legally protected characteristics. We also consider qualified applicants with criminal histories, consistent with applicable federal, state and local law.Facebook is committed to providing reasonable accommodations for candidates with disabilities in our recruiting process. If you need any assistance or accommodations due to a disability, please let us know at accommodations-ext@fb.com.",5 days ago,643 reviews
https://www.indeed.com/viewjob?jk=a1d8e7f6d76159e5&from=web&vjs=3,10,Data Scientist,Change Healthcare,Mississippi,"Title: AI Data Scientist Overview of Position The Data Scientist will be responsible for supporting Artificial Intelligence, Machine Learning, and Data Science solutions for Change Healthcare, reporting to an AI Data Science leader under the Chief AI Officer. We’re looking for data scientists with a passion for artificial intelligence to help drive a new generation of data and machine learning enabled services and products to impact healthcare. You will enjoy working with a highly talented and diverse team of data scientists specializing in deep learning, active learning, and classical machine learning, one of the richest data sets in US healthcare, nearly limitless cloud compute resources including Spark clusters and GPUs, and the ability to see your insights turned into real products. The ideal candidate will have a background in machine learning, have experience working with large data sets, and have some experience in building and deploying data-driven innovative AI solutions. You are focused on results, a self-starter, able to put the customer first, team first, and have demonstrated success in using data science to develop and deploy AI solutions with a focus on customer impact. You also are able to rapidly prototype new ideas and methods to deliver quality code that is testable and concise. What will be my duties and responsibilities in this job? Use AI/ML technologies to innovate current Chang Healthcare operations. The tasks of innovation include, but not limited to: Smart revenue management, Intelligent payment platform, medical chart reading, code reading with noisy and incomplete OCR documents, Conversational AI to facilitate customer services and other healthcare related use cases Work closely with business and operations to understand the business requirements. To be able convert ambiguous requirements to mathematical AI models that can be trained and deployed to solve business problems Have strong implementation skills to the proposed solutions and work closely with engineering team to create product pipelines that are scalable and flexible Willing to work in an agile and fast-moving working environment Passion for learning and innovating at new AI technologies that can facilitate future projects What are the requirements needed for this position? Ph.D. in Computer Science, Math, Physics, Electrical Engineering, Industrial Engineering, Statistics, bioinformatics or other hardcore technical fields with profound mathematical training. Proficient in translating unstructured business problems into an abstract mathematical framework Fluency in one of the scripting languages, such as: Python, Scalar, PySpark and others Experience with Spark, MapReduce and other big data processing tools is preferred Familiar with both SQL and noSQL databases, ability to write efficient queries in SQL Expertise in NLU/NLP, Conversational AI Expertise with one of the Deep Learning platforms, such as, TensorFlow, Pytorch, and Keras Expertise in Knowledge Graph and personalization Ability to initiate and drive projects to completion with minimal guidance The ability to communicate the results of analyses in a clear and effective manner Familiar with AWS and its components, such as EMR, S3, EC2, SageMaker. or customer build AI Platform What other skills/experience would be helpful to have? Ph.D. with experiences on medical coding, medical chart reading, entity detection, and other reading comprehension using AI/NLP technologies Ph.D. with experience on big data processing in the areas of Revenue cycle management includes, but not limited to, risk management, payment accuracy, smart reconciliation, etc... Ph.D. with experiences on conversational AI technologies, such as AI model for intent detection, NER, dialog management and other related components Experience with medical ontologies, medical Knowledge Graph that links multiple entities, such as patients, providers, and payers. Possess the ability to run large scale inference on top of KG and generate business values Experience with medical image processing, diagnosis based on images and narratives using AI technologies Exceptional interpersonal and communication skills, including the ability to describe the logic and implications of a complex model to all types of partners (product managers, engineers, designers, senior executives) What are the working conditions and physical requirements of this job? General office demands #li-remote Join our team today where we are creating a better coordinated, increasingly collaborative, and more efficient healthcare system! Colorado Residents Only: The base pay range for Colorado residents is $102,723.50 - $189,304.50 plus any relevant incentive pay programs that may be aligned to the role. Pay is based on several factors including but not limited to education, work experience, certifications, etc. In addition to your base pay, Change Healthcare offers the following benefits for this position, subject to applicable eligibility requirements: Health, dental and vision plans; wellness program; health savings account; flexible spending accounts; 401(k) retirement plan; life insurance; short-term and long-term disability insurance; Employee Assistance Program; PTO; tuition reimbursement; and employee-paid critical illness and accident insurance. COVID Mandate As a federal contractor, Change Healthcare is adhering to the Executive Order which mandates vaccination. As such, we are requiring all U.S. new hires and employees to show proof of being fully vaccinated for COVID-19 or receive an approved accommodation by their date of hire, as a condition of employment. As we continue to navigate the ever-changing COVID-19 pandemic, we remain committed to doing our part to ensure the health, safety, and well-being of our team members and our communities. Proof of vaccination or accommodations requests will be collected once an offer is accepted with Change Healthcare. All accommodation requests will be carefully considered but are not guaranteed to be approved. Equal Opportunity/Affirmative Action Statement  Change Healthcare is an equal opportunity employer. All qualified applicants will receive consideration for employment without regard to race, color, religion, age, sex, sexual orientation, gender identity, genetic information, national origin, disability, or veteran status. To read more about employment discrimination protections under federal law, read  EEO is the Law  at https://www.eeoc.gov/employers/eeo-law-poster and the supplemental information at https://www.dol.gov/ofccp/regs/compliance/posters/pdf/OFCCP_EEO_Supplement_Final_JRF_QA_508c.pdf. If you need a reasonable accommodation to assist with your application for employment, please contact us by sending an email to applyaccommodations@changehealthcare.com with ""Applicant requesting reasonable accommodation"" as the subject. Resumes or CVs submitted to this email box will not be accepted. Click here https://www.dol.gov/ofccp/pdf/pay-transp_%20English_formattedESQA508c.pdf to view our pay transparency nondiscrimination policy. California (US) Residents: By submitting an application to Change Healthcare for consideration of any employment opportunity, you acknowledge that you have read and understood Change Healthcare’s Privacy Notice to California Job Applicants Regarding the Collection of Personal Information. Change Healthcare maintains a drug free workplace and conducts pre-employment drug-testing, where applicable, in accordance with federal, state and local laws.",30+ days ago,"1,264 reviews"
