URL,page_count,job_title,company,location,job_Description,post_date,reviews
https://www.indeed.com/viewjob?jk=0cb5a6af073a0358&from=web&vjs=3,10,Senior Data Analyst,Change Healthcare,Mississippi,"Title: Senior Data Analyst Overview of the Position: The Data Analyst will join the data science team embedded within the Technology Enabled Services organization. The team member will assist in the creation of data driven solutions to business problems including data consolidation and normalization, generation of actionable business insight, building advanced analytical models, and partnering with operations and overhead partners for feedback and user acceptance. The position will receive a business-driven problem, gather and cleanse data, build complex and automated models, draw key insights from the data, and ultimately deliver interventional tools to drive savings to the bottom line. The ideal candidate for this role has a propensity for data mining, project management, and can draw insights from analytics to improve and develop measurable interventions. What will be my duties and responsibilities in his job? Collects, cleanses, and automates data flows into a central repository Analyzes existing data sets to identify patterns, outliers, and areas of inconsistencies through relationships that exist in the data Collaborates with business leaders to validate data insights, and design strategies or recommend changes Builds models for automated data analysis and predictive insights Creates data visualizations for end users including the use of dashboards (Power BI) or user interfaces (PowerApps or other web-based interface) Facilitates cross-functional teams and uses an inclusive approach to understanding current operations Demonstrate good judgment and analytical skills to conduct option analysis and present recommendations What are the requirements needed for this position? BA or BS degree in a quantitative discipline such as Management Information Systems, Statistics, Applied Mathematics, or Computer Science 2-4 years of applicable work experience preferably in analytics, data science, business intelligence, or similar field. Strong personal computer literacy required including working knowledge of relevant software packages such as Microsoft Excel, statistics packages (Python or R), and data visualization suites (Power BI, Spotfire, Tableau, etc.) Ability to work with large amounts of data, including checks for integrity, summation, and effective communication (written and verbal) to internal and external constituents Experience with SQL is required. What other skills/experience would be helpful to have? Healthcare background is preferred Excellent organizational, communication and interpersonal skills Demonstrated ability to manage indirect teams, including members who may be senior in rank Demonstrated capacity to become “expert” in new topics and disciplines quickly “Self-starter” attitude with the ability to excel in dynamic work environments Comfort with problem solving frameworks, root cause analysis, hypothesis testing, and translation of insights into business impact Ability to manage multiple priorities How much will I be expected to travel in this position? Very limited travel required (possibly 1-2 times per year). Join our team today where we are creating a better coordinated, increasingly collaborative, and more efficient healthcare system! COVID Vaccination Requirements We remain committed to doing our part to ensure the health, safety, and well-being of our team members and our communities. As such, we require all employees to disclose COVID-19 vaccination status prior to beginning employment and we may require periodic testing for certain roles. In addition, some roles require full COVID-19 vaccination as an essential job function. Change Healthcare adheres to COVID-19 vaccination regulations as well as all client COVID-19 vaccination requirements and will obtain the necessary information from candidates prior to employment to ensure compliance. Equal Opportunity/Affirmative Action Statement  Change Healthcare is an equal opportunity employer. All qualified applicants will receive consideration for employment without regard to race, color, religion, age, sex, sexual orientation, gender identity, genetic information, national origin, disability, or veteran status. To read more about employment discrimination protections under federal law, read  EEO is the Law  at https://www.eeoc.gov/employers/eeo-law-poster and the supplemental information at https://www.dol.gov/ofccp/regs/compliance/posters/pdf/OFCCP_EEO_Supplement_Final_JRF_QA_508c.pdf. If you need a reasonable accommodation to assist with your application for employment, please contact us by sending an email to applyaccommodations@changehealthcare.com with ""Applicant requesting reasonable accommodation"" as the subject. Resumes or CVs submitted to this email box will not be accepted. Click here https://www.dol.gov/ofccp/pdf/pay-transp_%20English_formattedESQA508c.pdf to view our pay transparency nondiscrimination policy. California (US) Residents: By submitting an application to Change Healthcare for consideration of any employment opportunity, you acknowledge that you have read and understood Change Healthcare’s Privacy Notice to California Job Applicants Regarding the Collection of Personal Information. Change Healthcare maintains a drug free workplace and conducts pre-employment drug-testing, where applicable, in accordance with federal, state and local laws.",30+ days ago,"1,264 reviews"
https://www.indeed.com/viewjob?jk=2f34f9d05a70a349&from=web&vjs=3,10,Senior Data Scientist,BAE Systems,"Vicksburg, MS 39180","BAE Systems is seeking a Senior Data Scientist to join our team supporting the Department of Defense (DoD) High Performance Computing (HPC) Modernization Program (DoD HPCMP) and Army Corps of Engineers, Engineer Research and Development Center (ERDC) DoD Supercomputing Resource Center (DSRC) located at Vicksburg, MS. The successful candidate will serve as a lead Data Scientist supporting HPC engineering and operations.  This position develops, transforms, and models data to improve decision making. Provide analytical support to the HPCMP Data Analysis and Assessment Center (DAAC), including but not limited to: Assist users with scientific visualization, data analysis tools, and techniques; create artistic, conceptual, and physics based visualizations.  Responsible for data extraction and manipulation of data sets. Creates workflows and predictive models for end-users using system tools. Conducts statistical analysis on data to ensure correct predictive forecasting. Manages the analytics request process by capturing requirements. Responsible for the creation and maintenance of surveys and deciphering survey analytics; participation in technical forums; and representing our company in joint meetings with the customer on HPC technical topics.  The candidate is expected to have strong analytical, problem solving, multi-tasking and teamwork skills, and needs excellent written and oral communication skills in order to collaborate and support government agencies and national laboratories. Knowledge, good understanding and experience with HPC systems and their performance is required. Particularly, demonstrated proficiency with python/MATLAB/Julia or similar abstract language. Demonstrated proficiency with technical writing. Must be willing to travel to conferences and workshops, to meet / present technical findings to large audiences and sponsors, and to assist with technical writing. Applicant must have a dynamic skill set, be willing to work with new technologies, be highly organized and capable of planning and coordinating multiple tasks. The position will require attention to detail, effective problem solving skills and excellent judgment. Ability to work independently with sensitive and confidential information, maintain a professional demeanor, work as a team member without daily supervision and effectively communicate with diverse groups of clients. #hits-u02   Required Education, Experience, & Skills  M.S. degree (Ph.D. preferred) and 8+ years’ working experience, or equivalent experience. 8570.01M/ IAT-II  Preferred Education, Experience, & Skills  6+ years’ experience with HPC systems ITIL Foundation  About BAE Systems Intelligence & Security BAE Systems, Inc. is the U.S. subsidiary of BAE Systems plc, an international defense, aerospace and security company which delivers a full range of products and services for air, land and naval forces, as well as advanced electronics, security, information technology solutions and customer support services. Improving the future and protecting lives is an ambitious mission, but it’s what we do at BAE Systems. Working here means using your passion and ingenuity where it counts – defending national security with breakthrough technology, superior products, and intelligence solutions. As you develop the latest technology and defend national security, you will continually hone your skills on a team—making a big impact on a global scale. At BAE Systems, you’ll find a rewarding career that truly makes a difference.  Intelligence & Security (I&S), based in McLean, Virginia, designs and delivers advanced defense, intelligence, and security solutions that support the important missions of our customers. Our pride and dedication shows in everything we do—from intelligence analysis, cyber operations and IT expertise to systems development, systems integration, and operations and maintenance services. Knowing that our work enables the U.S. military and government to recognize, manage and defeat threats inspires us to push ourselves and our technologies to new levels.  At BAE Systems, we celebrate the array of skills, experiences, and perspectives our employees bring to the table. For us, differences are a source of strength. We’re laser-focused on high performance, and we work hard every day to nurture an inclusive culture where all employees can innovate and thrive. Here, you will not only build your career, but you will also enjoy work-life balance, uncover new experiences, and collaborate with passionate colleagues.",13 days ago,"3,312 reviews"
https://www.indeed.com/viewjob?jk=b5464658a783964f&from=web&vjs=3,20,"Principal Product Manager, AI and Interoperability Platform",Change Healthcare,Mississippi,"Principal PM, AI & Interoperability Position Overview Change healthcare has built the industry-leading Enterprise Imaging Cloud Native solution to help physicians provide better patient care from anywhere with ease, speed, and security. We are looking for a dynamic and passionate Principal Product Manager to drive our cloud platform vision, roadmap and execution. You will be working with internal stakeholders, customers, and external partners to create a scalable, secure, and extensible platform with outstanding customer experience. An important part of our value proposition to customers is leveraging their data and enabling multiple applications from the healthcare ecosystem to seamlessly integrate into the solutions and workflow. You will define how 3rd parties capabilities, such as partners Artificial Intelligence (AI) applications, are integrated into our products through standard APIs and SDK easily and securely. You will serve as a bridge, a coach, and a liaison to the different product teams to identify shared needs and fulfill them through standard platform services.   What will I be responsible for in this job? Drive the strategy, roadmap, and execution of the Stratus Imaging Cloud platform in aspects of data management & interoperability (APIs), to create extensible and scalable services for internal and external customers. Define system requirements and facilitate framework and end-to-end experience for 3rd party applications to easily integrate with the cloud solutions. Work closely with the different product teams to identify shared business and customers' needs and fulfill them via platform services to improve development efficiency, supportability, and scalability. Use extensive influencing and communication skills to share and align your strategy across the greater PM team and overall product strategy. Define the system SLIs/SLOs in collaboration with the application/product teams and] the process to track and improve them. Identify and research industry standards (e.g., FHIR) and implement them in the platform based on the business priorities. Drive market communication to increase solution awareness and differentiation and educate customers on the value proposition. Use extensive influencing and communication skills to share and align your strategy across the greater PM team and overall product strategy. What Are The Requirements Needed For This Position? 5+ years of relevant Product Management experience, with 3+ years experience with Cloud and SaaS solution. Experience building platforms and API's to meet a wide variety of use cases Bachelor's Degree in Computer Science, Engineering, Information Systems, or a closely related field preferred, or equivalent experience a plus What critical skills are needed for you to consider someone for this position? Experience in healthcare IT and Interoperability standards – a big plus. Experience as a SW developer – a plus. Experience with defining product strategy and roadmap. Experience in building and launching new products (preferably in a regulated market) Familiarity with agile development process. Experience with market analysis (analyzing the market competitive landscape, quantifying/comparing/identifying strategic alternatives) Experience in building business relationships and partnerships; working with internal and external stakeholders Strong influencer and collaboration skills; able to build consensus among a diverse group of stakeholders. Excellent Business Acumen & Communication (Verbal & Written) Skills. What other skills/experience would be helpful to have? A strong understanding and practical experience with AI/Machine Learning and is a plus. Strong decision making and judgment. Demonstrated ability to use problem solving and analytical skills to build fact-based business cases. Ability to multi task and manage multiple priorities How much should I expect to travel? 25% (travel % during covid may change) Employees in roles that require travel will need to be able to qualify for a company credit card or be able to use their own personal credit card for travel expenses and submit for reimbursement. #li-remote Join our team today where we are creating a better coordinated, increasingly collaborative, and more efficient healthcare system! COVID Vaccination Requirements We remain committed to doing our part to ensure the health, safety, and well-being of our team members and our communities. As such, we require all employees to disclose COVID-19 vaccination status prior to beginning employment and we may require periodic testing for certain roles. In addition, some roles require full COVID-19 vaccination as an essential job function. Change Healthcare adheres to COVID-19 vaccination regulations as well as all client COVID-19 vaccination requirements and will obtain the necessary information from candidates prior to employment to ensure compliance. Equal Opportunity/Affirmative Action Statement  Change Healthcare is an equal opportunity employer. All qualified applicants will receive consideration for employment without regard to race, color, religion, age, sex, sexual orientation, gender identity, genetic information, national origin, disability, or veteran status. To read more about employment discrimination protections under federal law, read  EEO is the Law  at https://www.eeoc.gov/employers/eeo-law-poster and the supplemental information at https://www.dol.gov/ofccp/regs/compliance/posters/pdf/OFCCP_EEO_Supplement_Final_JRF_QA_508c.pdf. If you need a reasonable accommodation to assist with your application for employment, please contact us by sending an email to applyaccommodations@changehealthcare.com with ""Applicant requesting reasonable accommodation"" as the subject. Resumes or CVs submitted to this email box will not be accepted. Click here https://www.dol.gov/ofccp/pdf/pay-transp_%20English_formattedESQA508c.pdf to view our pay transparency nondiscrimination policy. California (US) Residents: By submitting an application to Change Healthcare for consideration of any employment opportunity, you acknowledge that you have read and understood Change Healthcare’s Privacy Notice to California Job Applicants Regarding the Collection of Personal Information. Change Healthcare maintains a drug free workplace and conducts pre-employment drug-testing, where applicable, in accordance with federal, state and local laws.",5 days ago,"1,264 reviews"
https://www.indeed.com/viewjob?jk=5e6181ade161160b&from=web&vjs=3,10,Machine Learning Engineer,Salesforce,Mississippi,"To get the best candidate experience, please consider applying for a maximum of 3 roles within 12 months to ensure you are not duplicating efforts. Job Category Products and Technology Job Details Job Description The Team: The Data Science team in Salesforce’s Digital Success and Scale (DSS) organization creates data science products that drive customer success. The team works with executives, success managers, sales, renewal managers, and product managers across DSS and Salesforce to discover and analyze opportunities for growth and to provide actionable insights supporting business decision making.     Role:  We are looking for machine learning engineers who are passionate about building scalable production machine learning applications. As a key member of the data science team you will have immense opportunities to work on a broad range of business/technical problems and technologies, build machine learning models, design/automate/deploy production machine learning pipelines. You will be working with a group of world-class data scientists, program managers and business analysts to build intelligent services for both internal teams and customer-facing products. We share a passion for problem solving, new technologies, and learning, so you will be highly encouraged to explore new technologies and come up with innovative solutions that could take the team’s data science machine learning engineering capability to the next level.     Requirements:  In detail, you will: Work with large amounts of structured and unstructured data. Work with internal stakeholders to explore and understand business data. Apply complex analytical techniques to derive actionable insights. Design and implement data science applications. Design, build, automate, deploy and maintain machine learning production pipelines. Implement machine learning model lifecycle management framework. Build model performance tracking tools, to monitor month over month model performance, identify drivers and provide recommendations for model performance improvement Collaborate with other salesforce data science and engineering teams to establish, formulate and build insight-based feature store. Author technical documentation and reports to communicate process and results   Qualifications: Preferred Experience and Skills: Bachelor or Masters degree in Physics, Mathematics, Statistics, Computer Science or related field with project experience in machine learning and statistical modeling 3-5 years hands on experience in building data science applications and machine learning pipelines. Working knowledge of one or more SQL languages: Oracle, MySQL, PostgreSQL, Redshift, etc. Working knowledge of one or more scientific programming languages/packages: Python or R Development experience in at least one programming language: Python, Java, C++, etc. Knowledge of common machine learning and statistics frameworks and concepts Experience with large data sets, distributed computing and cloud computing platforms. MLOps experience is highly regarded. Experience with Automation tools like Airflow is plus Salesforce experience/certification is a plus but not required. Founded in 1999, Salesforce is the global leader in Customer Relationship Management (CRM). Companies of every size and industry are using Salesforce to transform their businesses, across sales, service, marketing, commerce, and more by connecting with customers in a whole new way. We harness technologies that can revolutionize companies, careers, and, hopefully, our world. Salesforce is built on a set of four core values: Trust, Customer Success, Innovation, and Equality. By making technology more accessible, we're helping create a future with greater opportunity and equality for all. This has taken our company to great heights, including being named one of the FORTUNE ""100 Best Companies to Work For®"" for 12 years in a row. There are those who choose to work with the best and brightest. And then, there are those who want to do more than just a job. They are the ones improving lives, not only their careers. Having an impact now instead of later. Doing something that’s so much bigger than themselves, an industry, and their company. We believe everyone can be a Trailblazer. Join Salesforce and discover a future of new opportunities. Salesforce.com and Salesforce.org are Equal Employment Opportunity and Affirmative Action Employers. Qualified applicants will receive consideration for employment without regard to race, color, religion, sex, sexual orientation, gender perception or identity, national origin, age, marital status, protected veteran status, or disability status. Headhunters and recruitment agencies may not submit resumes/CVs through this Web site or directly to managers. Salesforce.com and Salesforce.org do not accept unsolicited headhunter and agency resumes. Salesforce.com and Salesforce.org will not pay fees to any third-party agency or company that does not have a signed agreement with Salesforce.com or Salesforce.org. Pursuant to the San Francisco Fair Chance Ordinance and the Los Angeles Fair Chance Initiative for Hiring, Salesforce will consider for employment qualified applicants with arrest and conviction records. LI-Y For Colorado-based roles: Minimum annual salary of $  [128,600]  . You may also be entitled to receive  [incentive compensation]  bonus, restricted stock units, and benefits. Accommodations If you require assistance due to a disability applying for open positions please submit a request via this Accommodations Request Form . Posting Statement At Salesforce we believe that the business of business is to improve the state of our world. Each of us has a responsibility to drive Equality in our communities and workplaces. We are committed to creating a workforce that reflects society through inclusive programs and initiatives such as equal pay, employee resource groups, inclusive benefits, and more. Learn more about Equality at Salesforce and explore our benefits. Salesforce.com and Salesforce.org are Equal Employment Opportunity and Affirmative Action Employers. Qualified applicants will receive consideration for employment without regard to race, color, religion, sex, sexual orientation, gender perception or identity, national origin, age, marital status, protected veteran status, or disability status. Salesforce.com and Salesforce.org do not accept unsolicited headhunter and agency resumes. Salesforce.com and Salesforce.org will not pay any third-party agency or company that does not have a signed agreement with Salesforce.com or Salesforce.org . Salesforce welcomes all. Pursuant to the San Francisco Fair Chance Ordinance and the Los Angeles Fair Chance Initiative for Hiring, Salesforce will consider for employment qualified applicants with arrest and conviction records. As a federal contractor, Salesforce is required to verify that all US-based employees are fully vaccinated against COVID-19. If you receive an offer and are unable to get vaccinated for religious or medical reasons, you may request a reasonable accommodation.",27 days ago,811 reviews
