URL,page_count,job_title,company,location,job_Description,post_date,reviews
https://www.indeed.com/viewjob?jk=2d9caa049234a17a&from=web&vjs=3,10,Data Engineer,Valmont Industries,"28800 Ida Street, Valley, NE 68064","28800 Ida St Valley Nebraska 68064-8016 Why Valmont   Welcome to Valmont, where a world of opportunity awaits. When you join our team, you become part of a passionate group dedicated to changing lives and conserving resources around the globe. We want problem solvers who roll up their sleeves to foster progress and innovation for all people. At Valmont, we provide infrastructure, irrigation, tubing and coatings to the world. We strengthen cities. We nourish croplands. We design, manufacture and coat. Our products and services make a difference. Join us, and  BUILD YOUR WORLD. A Brief Summary of This Position: The Data Engineer’s role is to expand and optimize our data, data architecture, data flow and collection of data for cross functional teams. As a member of our Data and Analytics team, the Data Engineer will support our BI Analysts, Data Analysts, Data Scientists, and other members of IT to ensure the data architecture is consistent for all ongoing projects. The candidate is expected to be an experienced data wrangler and pipeline builder who enjoys optimizing data systems and building them up from scratch. The ideal candidate will be excited about helping us redesign and build up our data architecture to support Valmont’s move to becoming a Data Driven organization and to utilize advanced Analytics and Artificial Intelligence. Essential Functions: This position reports to the Manager Enterprise Data Warehouse and has no direct or indirect reports No travel requirements Flexible schedule however must be able to work in the office one day per week Work with cross departmental teams to define metrics, guidelines, and strategies for effective use of data and information Plan with team, document and enforce data architecture standards Work closely with Data Analytics and business teams to identify, design, and build appropriate data and analytical tools Assist in the development of data management policies and procedures Develop best practices for data lifecycle management Conduct research and make recommendations on big data infrastructure, database technologies, analytics tools, services, protocols, and standards Drive the collection of new data and the refinement of existing data sources Develop tools and libraries that will help Data Analytics team members more efficiently interface with large amounts of data Develop, implement, and maintain change control and testing processes for modifications to data analytics Collaborate with database and disaster recovery administrators to ensure effective protection and integrity of data assets Manage and/or provide guidance to junior members of the Data Analytics team Required Qualifications of Every Candidate (Education, Experience, Knowledge, Skills and Abilities): Preferred Bachelor’s degree with 3+ years of relevant experience or Associate’s degree with 5+ years of relevant experience or 7+ years of relevant experience Strong working SQL knowledge and experience working with relational databases, query authoring (SQL) as well as working familiarity with a variety of databases Strong analytic skills related to working with structured and unstructured datasets Build processes supporting data transformation, data structures, metadata, dependency, and workload management Ability to manipulate, process, and extract value from large, disconnected datasets Working knowledge of message queuing, stream processing, and highly scalable ‘big data’ data stores Experience supporting and working with cross-functional teams in a dynamic environment Strong project management experience Ability to learn and understand organization’s goals and objectives Knowledge of applicable data privacy practices and laws Highly Qualified Candidates Will Also Possess These Qualifications: Bachelor’s or Graduate degree in the field of computer science, informatics, or another quantitative field and/or 5 years equivalent work experience Experience with big data, data pipeline, stream processing and workflow management tools Experience with Microsoft Azure Cloud and the associated tools Experience with Data Vault Methodology and WhereScape RED and 3D Benefits: Valmont offers employees and their families a comprehensive Total Well-being benefit package to ensure their individual and family’s overall wellness needs are met. Benefits include*: Medical, dental and vision insurance Paid time off Employer paid life insurance Employer paid short-term and long-term disability Retirement plans Dependent care Employee assistance programs Voluntary programs like tobacco cessation, Type 2 diabetes reversal, mortgage services, home & auto insurance, health coaching and more. Due to the nature of Valmont’s Global Business and Union contracts, not all benefits are the same. Working Environment and Physical Efforts: Work is typically performed in an office setting. The incumbent is regularly required to sit for extended periods of time, as well as talk and listen on the phone and in personal conversations or meetings. Environment is fast paced and demanding most of the time. No travel requirements for this position. The employee frequently is required to use hands to finger, handle, or feel and reach with hands and arms while working in the office with various files and forms and while working on the computer. The employee is occasionally required to move about the office. Incumbent must utilize proper ergonomic safeguards such as monitor height and positions, keyboard location and height and proper wrists rests. The employee must occasionally lift and/or move up to 15 pounds in working with large files, binders, and computer equipment. Specific vision abilities required by this job include close vision, distance vision, peripheral vision, and depth perception. Valmont does not discriminate against any employee or applicant in employment opportunities or practices on the basis of race, color, religion, sex, sexual orientation, gender identity, national origin, age, genetic information, veteran status, disability or any other characteristic protected by law. Reasonable accommodation may be made to enable individuals with disabilities to perform the essential functions. If you have a disability and require any assistance in filling out the application for employment email EEOCompliance@Valmont.com.",30+ days ago,575 reviews
https://www.indeed.com/viewjob?jk=3c4041f8a5bec902&from=web&vjs=3,20,"Senior Associate, Data Scientist, NLP",KPMG,"Suite 300 1212 N. 96th Street, Omaha, NE 68114","Innovate. Collaborate. Build. Create. Solve. The KPMG Digital Lighthouse is KPMG's award-winning Analytics & AI Center of Excellence recognized by clients and leading analyst firms in the US and globally. The KPMG Lighthouse is a curation of specialized technical capabilities and domain experts working across the digital landscape: applied data science, AI, data engineering and insights, software engineering, automation, and big data. Here, you'll work with a diverse team of professionals to explore and build solutions for clients in a multiplatform environment. You'll be an important part of our high-energy, unique, fast-paced, and innovative culture that delivers with the agility of a tech startup and the backing of a leading global consulting firm. In this particular role, you'll work specifically in the AI Analytics & Engineering Community within the Digital Lighthouse, on a wide range of projects. From applied AI to optimization to big data platform engineering, your analytical and technical skills will drive real impact in the business world. At KPMG, our commitment to your career development helps to set us apart as an employer. We want to enhance your potential, both for yourself and as a contributor to our firm. That's why we provide every opportunity to expand your skills, knowledge and experiences through formal education and training programs, leadership development opportunities, and, as well as informal one-on-one coaching and mentoring from your KPMG colleagues. KPMG is currently seeking a Senior Associate with NLP experience to join our KPMG Lighthouse - Center of Excellence for Advanced Analytics. Responsibilities: Identify business problem, select appropriate performance metric, develop data science modeling/algorithmic approach, and evaluate success of that approach within constraints of data and timeline Work in multi-disciplinary and cross-functional teams to translate business requirements into artificial intelligence goals and modeling approaches Rapidly iterate models and results to refine and validate approach working across different areas (risk management, financial services, mergers and acquisitions, and public policy) Work in a fast-paced and dynamic environment with both virtual and face-to-face interactions utilizing structured approaches to solving problems, managing risks, documenting assumptions, communicating results, and educating others through insightful visualizations, reports and presentations Build ingestion processes to, prepare, extract, and annotate a rich data variety of unstructured data sources (social media, news, internal/external documents, images, video, voice, emails, financial data, and operational data)Leverage a variety of tools and approaches to solve complex business objectives, from Statistical Natural Language Processing, Information Retrieval/Extraction, Machine Learning/Deep Learning, Image Processing, Rules Engines, Regular Expressions, Knowledge Graphs, and Semantic Search. Deploy and validate models; work with clients iteratively to validate performance metrics, and sample output to drive towards a business-first solution; utilize APIs, platforms, containers, and distributed processing to achieve throughput goals Qualifications: Minimum of two years of experience leading work streams with at least two data scientists, engineers, and other data & analytics professionals, including innovation, quality management, utilizing analytics and software development processes for natural language processing, machine learning on unstructured data, and/or information retrieval; Multidisciplinary backgrounds Master's degree from an accredited college/university in Computer Science, Engineering, or related STEM fields. PhD from an accredited college/university is preferred Ability to apply artificial intelligence techniques to achieve concrete business goals while managing limited resources and constraints around data; Ability to discuss mathematical formulations, alternatives, and impact on modeling approach and understanding of development practices (testing, code design, complexity, and code optimization) Solid experience performing data science from data discovery, cleaning, model selection, validation, and deployment; experience coding artificial intelligence methods using object-oriented programming in a software development process, and ability to reuse, restructure, refactor and optimize code for efficiency Fluency in Python; Proficiency in AI related frameworks (NLTK, Spacy, Scikit-Learn, Tensorflow, PyTorch); Experience with leveraging pre-trained models and transfer learning; Experience with platforms (Google Cloud, Azure, and AWS); Ability to pick up new languages and technologies quickly and to work efficiently under Unix/Linux environment with experience with source code management systems like Git/GitLab; Ability to work with a variety of databases (SQL, ElasticSearch, Solr, Neo4j) Ability to travel when necessary; must be legally authorized to work in the United States without sponsorship of a visa now or in the future KPMG LLP (the U.S. member firm of KPMG International) offers a comprehensive compensation and benefits package. KPMG is an affirmative action-equal opportunity employer. KPMG complies with all applicable federal, state and local laws regarding recruitment and hiring. All qualified applicants are considered for employment without regard to race, color, religion, age, sex, sexual orientation, gender identity, national origin, disability, protected veteran status, or any other category protected by applicable federal, state or local laws. The attached link contains further information regarding the firm's compliance with federal, state and local recruitment and hiring laws. No phone calls or agencies please. At KPMG any employee, partner or contractor must be fully vaccinated or have a reasonable accommodation for COVID-19 in order to go to any KPMG office, or to work on or in association with a federal contract (unless prohibited by applicable law).",30+ days ago,"7,008 reviews"
https://www.indeed.com/viewjob?jk=9ef0097ded6f7fa3&from=web&vjs=3,20,Data Scientist,Change Healthcare,Nebraska,"Title: AI Data Scientist Overview of Position The Data Scientist will be responsible for supporting Artificial Intelligence, Machine Learning, and Data Science solutions for Change Healthcare, reporting to an AI Data Science leader under the Chief AI Officer. We’re looking for data scientists with a passion for artificial intelligence to help drive a new generation of data and machine learning enabled services and products to impact healthcare. You will enjoy working with a highly talented and diverse team of data scientists specializing in deep learning, active learning, and classical machine learning, one of the richest data sets in US healthcare, nearly limitless cloud compute resources including Spark clusters and GPUs, and the ability to see your insights turned into real products. The ideal candidate will have a background in machine learning, have experience working with large data sets, and have some experience in building and deploying data-driven innovative AI solutions. You are focused on results, a self-starter, able to put the customer first, team first, and have demonstrated success in using data science to develop and deploy AI solutions with a focus on customer impact. You also are able to rapidly prototype new ideas and methods to deliver quality code that is testable and concise. What will be my duties and responsibilities in this job? Use AI/ML technologies to innovate current Chang Healthcare operations. The tasks of innovation include, but not limited to: Smart revenue management, Intelligent payment platform, medical chart reading, code reading with noisy and incomplete OCR documents, Conversational AI to facilitate customer services and other healthcare related use cases Work closely with business and operations to understand the business requirements. To be able convert ambiguous requirements to mathematical AI models that can be trained and deployed to solve business problems Have strong implementation skills to the proposed solutions and work closely with engineering team to create product pipelines that are scalable and flexible Willing to work in an agile and fast-moving working environment Passion for learning and innovating at new AI technologies that can facilitate future projects What are the requirements needed for this position? Ph.D. in Computer Science, Math, Physics, Electrical Engineering, Industrial Engineering, Statistics, bioinformatics or other hardcore technical fields with profound mathematical training. Proficient in translating unstructured business problems into an abstract mathematical framework Fluency in one of the scripting languages, such as: Python, Scalar, PySpark and others Experience with Spark, MapReduce and other big data processing tools is preferred Familiar with both SQL and noSQL databases, ability to write efficient queries in SQL Expertise in NLU/NLP, Conversational AI Expertise with one of the Deep Learning platforms, such as, TensorFlow, Pytorch, and Keras Expertise in Knowledge Graph and personalization Ability to initiate and drive projects to completion with minimal guidance The ability to communicate the results of analyses in a clear and effective manner Familiar with AWS and its components, such as EMR, S3, EC2, SageMaker. or customer build AI Platform What other skills/experience would be helpful to have? Ph.D. with experiences on medical coding, medical chart reading, entity detection, and other reading comprehension using AI/NLP technologies Ph.D. with experience on big data processing in the areas of Revenue cycle management includes, but not limited to, risk management, payment accuracy, smart reconciliation, etc... Ph.D. with experiences on conversational AI technologies, such as AI model for intent detection, NER, dialog management and other related components Experience with medical ontologies, medical Knowledge Graph that links multiple entities, such as patients, providers, and payers. Possess the ability to run large scale inference on top of KG and generate business values Experience with medical image processing, diagnosis based on images and narratives using AI technologies Exceptional interpersonal and communication skills, including the ability to describe the logic and implications of a complex model to all types of partners (product managers, engineers, designers, senior executives) What are the working conditions and physical requirements of this job? General office demands #li-remote Join our team today where we are creating a better coordinated, increasingly collaborative, and more efficient healthcare system! Colorado Residents Only: The base pay range for Colorado residents is $102,723.50 - $189,304.50 plus any relevant incentive pay programs that may be aligned to the role. Pay is based on several factors including but not limited to education, work experience, certifications, etc. In addition to your base pay, Change Healthcare offers the following benefits for this position, subject to applicable eligibility requirements: Health, dental and vision plans; wellness program; health savings account; flexible spending accounts; 401(k) retirement plan; life insurance; short-term and long-term disability insurance; Employee Assistance Program; PTO; tuition reimbursement; and employee-paid critical illness and accident insurance. COVID Mandate As a federal contractor, Change Healthcare is adhering to the Executive Order which mandates vaccination. As such, we are requiring all U.S. new hires and employees to show proof of being fully vaccinated for COVID-19 or receive an approved accommodation by their date of hire, as a condition of employment. As we continue to navigate the ever-changing COVID-19 pandemic, we remain committed to doing our part to ensure the health, safety, and well-being of our team members and our communities. Proof of vaccination or accommodations requests will be collected once an offer is accepted with Change Healthcare. All accommodation requests will be carefully considered but are not guaranteed to be approved. Equal Opportunity/Affirmative Action Statement  Change Healthcare is an equal opportunity employer. All qualified applicants will receive consideration for employment without regard to race, color, religion, age, sex, sexual orientation, gender identity, genetic information, national origin, disability, or veteran status. To read more about employment discrimination protections under federal law, read  EEO is the Law  at https://www.eeoc.gov/employers/eeo-law-poster and the supplemental information at https://www.dol.gov/ofccp/regs/compliance/posters/pdf/OFCCP_EEO_Supplement_Final_JRF_QA_508c.pdf. If you need a reasonable accommodation to assist with your application for employment, please contact us by sending an email to applyaccommodations@changehealthcare.com with ""Applicant requesting reasonable accommodation"" as the subject. Resumes or CVs submitted to this email box will not be accepted. Click here https://www.dol.gov/ofccp/pdf/pay-transp_%20English_formattedESQA508c.pdf to view our pay transparency nondiscrimination policy. California (US) Residents: By submitting an application to Change Healthcare for consideration of any employment opportunity, you acknowledge that you have read and understood Change Healthcare’s Privacy Notice to California Job Applicants Regarding the Collection of Personal Information. Change Healthcare maintains a drug free workplace and conducts pre-employment drug-testing, where applicable, in accordance with federal, state and local laws.",6 days ago,"1,243 reviews"
