URL,page_count,job_title,company,location,job_Description,post_date,reviews
https://www.indeed.com/viewjob?jk=50438bec48f325a7&from=web&vjs=3,10,Customer Transformation Data Scientist - Senior Associate,PRICE WATERHOUSE COOPERS,"Omaha, NE","A career in our Analytics Technology practice, within Data and Analytics Technology services, will provide you with the opportunity to help organisations uncover enterprise insights and drive business results using smarter data analytics. We focus on a collection of organisational technology capabilities, including business intelligence, data management, and data assurance that help our clients drive innovation, growth, and change within their organisations in order to keep up with the changing nature of customers and technology. You’ll make impactful decisions by mixing mind and machine to leverage data, understand and navigate risk, and help our clients gain a competitive edge. Our team helps clients navigate various analytics applications to get the most value out of their technology investment and foster confidence in their business intelligence. As part of our team, you’ll help our clients implement enterprise content and data management applications that improve operational effectiveness and provide impactful data analytics and insights. To really stand out and make us fit for the future in a constantly changing world, each and every one of us at PwC needs to be a purpose-led and values-driven leader at every level. To help us achieve this we have the PwC Professional; our global leadership development framework. It gives us a single set of expectations across our lines, geographies and career paths, and provides transparency on the skills we need as individuals to be successful and progress in our careers, now and in the future. As a Senior Associate, you'll work as part of a team of problem solvers, helping to solve complex business issues from strategy to execution. PwC Professional skills and responsibilities for this management level include but are not limited to: Use feedback and reflection to develop self awareness, personal strengths and address development areas. Delegate to others to provide stretch opportunities, coaching them to deliver results. Demonstrate critical thinking and the ability to bring order to unstructured problems. Use a broad range of tools and techniques to extract insights from current industry or sector trends. Review your work and that of others for quality, accuracy and relevance. Know how and when to use tools available for a given situation and can explain the reasons for this choice. Seek and embrace opportunities which give exposure to different situations, environments and perspectives. Use straightforward communication, in a structured way, when influencing and connecting with others. Able to read situations and modify behavior to build quality relationships. Uphold the firm's code of ethics and business conduct. Job Requirements and Preferences : Basic Qualifications : Minimum Degree Required : Bachelor Degree Required Fields of Study : Computer and Information Science, Computer and Information Science & Accounting, Economics, Economics and Finance, Economics and Finance & Technology, Engineering, Operations Management/Research, Statistics Additional Educational Requirements : Other quantitative fields of study may be considered Minimum Years of Experience : 3 year(s) Preferred Qualifications : Preferred Knowledge/Skills : Demonstrates thorough abilities and/or a proven record of success in the application of statistical methods, data mining or data-driven problem solving, emphasizing a combination of some of the following areas: Performing in development language environments: e.g. Python, Java, C++, R, SQL, etc. and applying analytical methods to large and complex datasets leveraging one of those languages; Applying statistical modelling, algorithms, data mining and machine learning algorithms problem solving; Manipulating and analyzing complex, high-volume, high-dimensionality data from varying sources; Demonstrating familiarity with machine learning architectures used for text analysis and anomaly detection; Building modularised, configurable and re-usable statistical and predictive models including (but not limited to) natural language processing, decision trees, multi-label classification, regression analysis and neural networks; Applying techniques such as multivariate regressions, Bayesian probabilities, clustering algorithms, machine learning, dynamic programming, stochastic-processes, queuing theory, algorithmic knowledge to efficiently research and solve complex development problems and application of engineering methods to define, predict and evaluate the results obtained; and, Visualizing and communicating analytical results, using technologies such as Tableau, Spotfire, PowerBI and Qlikview. Demonstrates thorough knowledge and/or a proven record of success emphasizing a combination of some of the following areas: Assisting with the delivery and tracking of large-scale projects; Demonstrating aptitude for building and implementing predictive models in a highly documented, well presented fashion; Demonstrating aptitude for conducting quantitative and qualitative analyses of large and complex data as it relates to the project requirements in customer transformation; Supporting engagement leads in the interpretation and presentation of model results and model choice rationale; Collaborating with business development teams responsible for writing and presenting proposals to prospective clients, leveraging PC applications including Microsoft Word, Excel, PowerPoint, and Project; and, Managing and/or contributing to project planning, engagement administration, budget management, and successful completion of engagement work stream(s). For positions in Colorado, visit the following link for information related to Colorado's Equal Pay for Equal Work Act: https://pwc.to/coloradoadvisoryseniorassociate. All qualified applicants will receive consideration for employment at PwC without regard to race; creed; color; religion; national origin; sex; age; disability; sexual orientation; gender identity or expression; genetic predisposition or carrier status; veteran, marital, or citizenship status; or any other status protected by law. PwC is proud to be an affirmative action and equal opportunity employer. PwC does not intend to hire experienced or entry level job seekers who will need, now or in the future, PwC sponsorship through the H-1B lottery, except as set forth within the following policy: https://pwc.to/H-1B-Lottery-Policy For positions based in San Francisco, consideration of qualified candidates with arrest and conviction records will be in a manner consistent with the San Francisco Fair Chance Ordinance. 256954 Please note that, at this time, to be in-person at a PwC office, client location or PwC-sponsored events, you must be fully vaccinated against COVID-19.   #LI-Remote",27 days ago,"7,788 reviews"
https://www.indeed.com/viewjob?jk=7df542c5bc750fea&from=web&vjs=3,10,Data Scientist,PayPal,"Omaha, NE 68128","Who we are: At PayPal (NASDAQ: PYPL), we believe that every person has the right to participate fully in the global economy. Our mission is to democratize financial services to ensure that everyone, regardless of background or economic standing, has access to affordable, convenient, and secure products and services to take control of their financial lives. We’re a purpose-driven company, and our beliefs are the foundation of how we conduct business every day. We’re guided by our core values of Inclusion, Innovation, Collaboration, and Wellness. Collectively, these values inspire us to work together as One Team with our customers at the center of everything we do, and to take care of ourselves, each other, and the communities in which we live and work. We challenge the status quo, ask questions, and find solutions. Join us as we enable the hopes, dreams, and ambitions of millions of people around the world. Job Description Summary: We are seeking a highly motivated team player with strong analytical skills who specializes in creating, driving, and executing projects. As a Data Scientist, this person will be providing data-driven solutions for managing and optimizing the routing process for the identity program at PayPal. This role will primarily involve creating an intelligent routing solution leveraging the data models to improve queue routing and prioritization. This includes automating our manual processes by integrating multiple systems using the algorithms and auto-switch routing models for dynamic scheduling. This role will be supporting data extraction, configuration, modeling, and lead routing solutions to improve customer experiences by delivering leads to be serviced almost in real-time. This person will also be working closely with our technology partners in defining requirements for the routing solution, global operations partners, identifying and driving sustainable operational improvements, as well as with the product development partners to ensure proper implementation of the solution. If you are a driven, analytical thinker that values collaboration, continuous learning, and problem-solving, we would love to hear from you.  Job Description: Responsibilities: Design, develop and implement real-time, advance machine learning algorithms to optimize routing solution Work with large volumes of data; extract and manipulate large datasets using standard tools such as SQL, SAS, Hadoop, Python, R Analyze data to identify trends and forecast incoming volume using predictive analytics Design and maintain dynamic scheduling model using machine learning techniques Partner with stakeholders (Product, Technology, Operations) to continually improve/optimize routing and scheduling Share findings by organizing the data results into easy-to-understand frameworks using Tableau or other visualization tools Qualifications: Master’s degree in any quantitative discipline such as Engineering, Computer Science, Economics, Statistics or Mathematics 3-5 years of experience analyzing large, multi-dimensional data sets and synthesizing insights into actionable solutions Advanced SQL, Excel, and visualization tools such as Tableau or Qlikview; experience with a statistical programming language like R or Python Good understanding of statistics (A/B testing) Ability to independently manage, organize and prioritize multiple tasks, projects, and responsibilities Well-developed research and analytical skills with good problem solving and lateral thinking ability Analysis of existing applications to identify weakness and develop opportunities for improvements Ability to rapidly learn new concepts (technical, risk, business) a critical success factor in this role Team-oriented, must be self-motivated, plan and manage time effectively, and be customer-focused Detailed, thorough, diligent individual with robust data analysis, and time management skills Proven ability to function well independently as well as in a team Excellent verbal and written communication skills with the ability to articulate concepts and ideas to diverse audiences Experience within the financial industry, with payments/ (e-Commerce knowledge preferred) Preferred Qualifications: Experience in risk management (Sanctions, AML, Fraud, Credit, Compliance, CIP/KYC etc.) Experience in payments industry Knowledge of the economic sanctions programs administered by the U.S. Department of the Treasury's Office of Foreign Assets Control, and general knowledge of sanctions evasion practices is also desirable  For more than 20 years, PayPal has remained at the forefront of the digital payment revolution. By leveraging technology to make financial services and commerce more convenient, affordable, and secure, our open digital payments platform gives PayPal’s 400 million active account holders the confidence to connect and transact in new and powerful ways. Through a combination of technological innovation and strategic partnerships, PayPal creates better ways to manage and move money, and offers choice and flexibility when sending payments, paying, or getting paid. Available in more than 200 markets around the world, the PayPal platform, including Braintree, Venmo and Xoom, enables consumers and merchants to receive money in more than 100 currencies, withdraw funds in 56 currencies and hold balances in their PayPal accounts in 25 currencies.  PayPal provides equal employment opportunity (EEO) to all persons regardless of age, color, national origin, citizenship status, physical or mental disability, race, religion, creed, gender, sex, pregnancy, sexual orientation, gender identity and/or expression, genetic information, marital status, status with regard to public assistance, veteran status, or any other characteristic protected by federal, state or local law. In addition, PayPal will provide reasonable accommodations for qualified individuals with disabilities.",7 days ago,"1,504 reviews"
https://www.indeed.com/viewjob?jk=decfd18fabeaa024&from=web&vjs=3,10,"Manager, Internal Audit Data Science",PayPal,"Omaha, NE 68128","Who we are: At PayPal (NASDAQ: PYPL), we believe that every person has the right to participate fully in the global economy. Our mission is to democratize financial services to ensure that everyone, regardless of background or economic standing, has access to affordable, convenient, and secure products and services to take control of their financial lives. We’re a purpose-driven company, and our beliefs are the foundation of how we conduct business every day. We’re guided by our core values of Inclusion, Innovation, Collaboration, and Wellness. Collectively, these values inspire us to work together as One Team with our customers at the center of everything we do, and to take care of ourselves, each other, and the communities in which we live and work. We challenge the status quo, ask questions, and find solutions. Join us as we enable the hopes, dreams, and ambitions of millions of people around the world. Job Description Summary: The position will report directly to the Global Head of Internal Audit Data Science Solutions. The position will be responsible for supporting the Global Internal Audit Team through data driven test design, execution, and delivery of data/results to assist in audit assignments.  Job Description: The position will be responsible for: Support of internal audit plan and global audit team with data science support across multiple time zones Pro-actively developing and maintaining strategic partnerships within the Internal Audit team, the business and respective support areas across PayPal Maintaining a holistic view of the IADSS function on value-add and risk-based methodology Project management and implementation of data science initiatives for the Internal Audit team Successfully handling large and challenging workloads on successive assignments Demonstrating exemplary time managements skills and effectively multi-task to deliver multiple projects within time-frame constraints EXPERIENCE REQUIRED: The ideal candidate should have a minimum of 7+ years of External Audit or Internal Audit experience within a large and high growth company that provides financial products and services, and proven experience in data science and project management. SKILLS REQUIRED: The successful candidate must possess: SQL and Hadoop / Other Big Data skills Be curious and inquisitive: passion for digging into data and uncovering meaningful insights Have excellent problem-solving skills and attention to detail Ability to identify problems and recommend solutions to complex projects Be highly motivated, results-oriented self-starter, enjoy working in a fast-paced environment, and can deliver successful results with minimal guidance Experience with Tableau or similar visualization tools Excellent relationship and communication skills to build internal networks within the team and wider company A team player with excellent time and project management skills and the ability to successfully manage multiple projects at once A passion for understanding the unique PayPal community, along with a passion for understanding the online payments business Ability to travel when required Key Responsibilities: Design, execute and deliver data analytics testing in a meaningful manner to assist audit assignment testing Develop and maintain constructive working relationships across the Global Internal Audit Team and audit stakeholders Identify and deliver on value added services to the wider Internal Audit Team. HIGHLY DESIRED: Financial Services Experience Project management experience Experience in automation data analytics Experience using data analytics software such as Arbutus, ACL, or IDEA Experience in RPA, AI and/or ML  For more than 20 years, PayPal has remained at the forefront of the digital payment revolution. By leveraging technology to make financial services and commerce more convenient, affordable, and secure, our open digital payments platform gives PayPal’s 400 million active account holders the confidence to connect and transact in new and powerful ways. Through a combination of technological innovation and strategic partnerships, PayPal creates better ways to manage and move money, and offers choice and flexibility when sending payments, paying, or getting paid. Available in more than 200 markets around the world, the PayPal platform, including Braintree, Venmo and Xoom, enables consumers and merchants to receive money in more than 100 currencies, withdraw funds in 56 currencies and hold balances in their PayPal accounts in 25 currencies.  PayPal provides equal employment opportunity (EEO) to all persons regardless of age, color, national origin, citizenship status, physical or mental disability, race, religion, creed, gender, sex, pregnancy, sexual orientation, gender identity and/or expression, genetic information, marital status, status with regard to public assistance, veteran status, or any other characteristic protected by federal, state or local law. In addition, PayPal will provide reasonable accommodations for qualified individuals with disabilities.",30+ days ago,"1,504 reviews"
https://www.indeed.com/viewjob?jk=aa7ea1c5a618238d&from=web&vjs=3,20,Sr. Data Analyst Credit Services,First National Bank of Omaha,"Omaha, NE","At FNBO, our employees are the heart of our story—and we’re committed to their success! Please see below the details of this career opportunity and how it fits into our organization’s success. Gen6, LLC is building the future of embedded credit card products and cobrand partnerships. Think of us as a product-focused tech company, rather than a traditional card issuer or bank. Our start-up mentality is going to be key to our success and we want people like YOU, who share a passion to build, on this journey with us! As a Data Analyst at Gen6, your role is to be an expert at understanding data. You will be working with multiple business segments within the Credit Card as a Service (CaaS) team, including, Risk, Marketing, Finance and Technology. We expect you to aid various teams in drawing insight from the data and use that information to make informed business decisions. Tasks will include designing the data warehouse table structure, creating dashboards, reporting packages, and business tools for use across the organization and with our partner brands. If you're passionate about data, love to learn, enjoy collaborating cross-functionally, and are excited to work like a startup, this is a great opportunity to grow your skills and contribute to an exciting new team. General Responsibilities  : Develop coding for reports, dashboards, and visualizations. Use the appropriate tools to help your stakeholders improve their performance, and sometimes design algorithms to decipher deeper why and how questions. Understand your business stakeholders’ objectives, the metrics that are the most important to them, and how they measure their performance. Plan and execute short-term projects from start to finish. Finding and understanding the correct data sources for a given analysis. Learning from and sharing knowledge and skills with your teammates to grow BI’s total impact to the organization. Basic Requirements  : B.S. degree in math, statistics, computer science, or equivalent technical field 3+ Years of SAS/SQL or equivalent. Must have the ability to write complex, highly optimized queries across large volumes of data 3+ years of Industry experience in a report development, data science, business analytics, business intelligence or comparable data engineering role, including data warehousing and business intelligence tools, techniques and technology Ability to work in an unstructured environment with an emphasis on taking initiative to solve problems in a fast-paced environment Excellent oral and written communication skills, and comfort presenting to everyone from entry-level employees to senior vice presidents Focuses primarily on how to achieve overall analytic objectives of a project with speed and quality. Ability to explain complicated or technical information in a simple way to non-technical audiences Sensitivity to clients' needs and able to develop warm client relationships Creativity to determine the best solution for a real-world problem with quantitative data Enjoyment from collaborating with others in team environment Equity, Diversity, & Inclusion: FNBO is committed to belonging, inclusion, diversity and equity. We are committed to intentionally and proactively creating pathways to success for historically underrepresented populations. To accomplish this, we foster a culture of belonging and inclusion so that every employee is valued, and has opportunity and the ability to make an impact. FNBO strives to reflect the diversity of the communities we serve in the makeup of our workforce. See the full  FNBO Equity, Diversity, & Inclusion Statement  here All qualified applicants will receive consideration for employment without regard to age, race, color, religion, sex, sexual orientation, gender identity, national origin, protected veteran status, or disability status.",14 days ago,222 reviews
https://www.indeed.com/viewjob?jk=9095f2e290e2e798&from=web&vjs=3,10,"Sr. Analyst, Data Scientist",First National Bank of Omaha,"Omaha, NE","At FNBO, our employees are the heart of our story—and we’re committed to their success! Please see below the details of this career opportunity and how it fits into our organization’s success. The Sr. Analyst, Data Analysis is accountable for acting as a subject matter expert and applying knowledge to work related to reporting or modeling. This may include working to extract, manipulate, and summarize large amounts of data to provide business insight and intelligence to assigned business units. This role may require utilization of SAS, SQL, Business Objects, and other reporting tools. Develop and implement machine learning models and analyze business problems with recommendations to current strategies within Decision Sciences of Consumer Banking Group at First National Bank of Omaha. Perform advanced analytics on FNBO portfolio for quick and adaptive results to uncover hidden insights that can be applied to business strategies, including product targeting, customer experience, new account acquisition, and account management. Develop machine learning algorithms that can be applied in marketing optimization, customer feedback mining, segmentations, and loss prediction. Perform data wrangling and visualization of very large datasets. Data validation and Integration from multiple sources, including SQL databases. Support model implementation, including automation of production code, optimization of model efficiency, and deployment of models into production on big data platform. Research and leverage alternative data in predictive modeling. Work with the cross-functional team to identify new opportunities with machine learning and deliver/implement the developed models or analyses. Exhibit professional behavior and promote positive working relationships. Basic Qualification Minimum of three (3) years of working experience in advanced analytics or data science. Must have a Master’s or Ph.D. Degree in Data Science, Statistics, Economics, Computer Science, or other related STEM field. Strong working knowledge in computer programming languages, including Python, R, and SQL. Knowledge of Cloud Computing and Intelligent Automation tools (e.g. Amazon Snowflake, Amazon SageMaker). Experience with data visualization tools (e.g. Power BI, R Shiny, Markdown, and Microsoft Visual Studio) Depth of knowledge in leveraging latest big data tools/platforms (i.e. machine learning techniques, deep learning), Demonstrate excellent oral and written communication skills. Demonstrate the ability to handle stress, meet deadlines, and work independently. Demonstrated experience working in teams. Preferred experience big-data computation. Equity, Diversity, & Inclusion: FNBO is committed to belonging, inclusion, diversity and equity. We are committed to intentionally and proactively creating pathways to success for historically underrepresented populations. To accomplish this, we foster a culture of belonging and inclusion so that every employee is valued, and has opportunity and the ability to make an impact. FNBO strives to reflect the diversity of the communities we serve in the makeup of our workforce. See the full  FNBO Equity, Diversity, & Inclusion Statement  here All qualified applicants will receive consideration for employment without regard to age, race, color, religion, sex, sexual orientation, gender identity, national origin, protected veteran status, or disability status.",28 days ago,222 reviews
