URL,page_count,job_title,company,location,job_Description,post_date,reviews
https://www.indeed.com/viewjob?jk=3754e68fdb0852a5&from=web&vjs=3,10,NC3 Data Scientist,SAIC,"Offutt AFB, NE 68113","Job ID: 2110273 Location:  OFFUTT AFB , NE , US Date Posted:  2021-07-14 Category:  Information Technology Subcategory:  Data Scientist Schedule:  Full-time Shift:  Day Job Travel:  Yes, 10 % of the Time Minimum Clearance Required:  Top Secret Clearance Level Must Be Able to Obtain:  TS/SCI Potential for Remote Work:  No  Description  SAIC is seeking an NC3 Scientist in Omaha, NE.  Job Duties Include:  Develop and implement processes to collect, validate, and store Nuclear Command, Control, and Communications (NC3) infrastructure, process, procedure, status, and threat data.  Work with Subject Matter Experts (SMEs) to collect, validate, store, and manage NC3 data.  Document requirements and support system implementation of automated data ingestion, analysis, and visualization systems.  Work in cross-functional teams with application developers, cloud computing engineers, and stakeholders.  Qualifications  Bachelors with 5+ years of experience or 9 years of experience in lieu of degree  Must have active TS/SCI Clearance  Experience managing data in Oracle SQL back-end data stores and graphical databases (Oracle Graph or Neo4J)  Experience with data analytics tools: Power BI, and Tableau  Must be US Citizen   COVID Policy: Prospective and/or new employees are required to adhere with SAIC's vaccination policy. All SAIC employees must be fully vaccinated and they must submit proof of vaccination on their first day of employment. Prospective or new employees may seek an exemption to the vaccination requirement at Contact Us and must have an approved exemption prior to the start of their employment. Where work is performed strictly at a customer site, customer site vaccination requirements preempt SAIC's vaccination policy. SAIC® is a premier Fortune 500® technology integrator driving our nation's technology transformation. Our robust portfolio of offerings across the defense, space, civilian, and intelligence markets includes secure high-end solutions in engineering, digital, artificial intelligence, and mission solutions. Using our expertise and understanding of existing and emerging technologies, we integrate the best components from our own portfolio and our partner ecosystem to deliver innovative, effective, and efficient solutions that are critical to achieving our customers' missions.  We are more than 26,500 strong; driven by mission, united by purpose, and inspired by opportunities. SAIC is an Equal Opportunity Employer, fostering a respectful work culture based on diversity, equity, and inclusion that values all contributors. Headquartered in Reston, Virginia, SAIC has annual revenues of approximately $7.1 billion. For more information, visit saic.com.",30+ days ago,"2,868 reviews"
https://www.indeed.com/viewjob?jk=1d74a8ed15657ad0&from=web&vjs=3,10,Data Scientist,Huntington Ingalls Industries Inc.,"Offutt A F B, NE 68113","Date:  Nov 26, 2021 Location:  OFFUT AFB, NE, US, 68113 Company:  HII's TSD .  Job Description  HII-TECHNICAL SOLUTIONS DIVISION (HII-TSD) is seeking a qualified expert-level Data Scientist to support our customer, U.S. Air Force Air Combat Command (ACC). The Data Scientist provides installation support to more than 50 associate units and ensures security for ISR, EN, treaty verification facilities and systems located worldwide, including the National Airborne Operations Center. The incumbent conducts data analytics, data engineering, data mining, exploratory analysis, predictive and statistical analysis using scientific techniques to correlate data into graphical, written, visual and verbal narrative products that enable more informed analytic decisions. Duties include: creating various ML-based tools or processes, such as recommendation engines or automated lead scoring systems; performing statistical analysis, applies data mining techniques, and builds high quality prediction systems. He/she needs to be skilled in data visualization and use of graphical applications, including Microsoft Office (Power BI) and Tableau; major data science languages, such as R and Python; managing and merging of disparate data sources, preferably through R, Python, or SQL; statistical analysis; and data mining algorithms. The Data Scientist should have prior experience with large data multi-INT analytics, ML, and automated predictive analytics. This position is located at Offut AFB, NE.  Essential Job Responsibilities  Ability to define problems, supervise studies and lead surveys to collect and analyze data to provide advice and recommend solutions.  Analytic leadership and expertise in identifying, planning, developing, and executing analytic production methodologies, tradecraft and techniques aligned with labor category mission.  Extensive ability to provide strategic advice, technical guidance and expertise to Defense planners and policymaker (e.g., Undersecretary level or higher).  Minimum Qualifications  15 years relevant experience with Bachelors in related field; 13 years relevant experience with Masters in related field; 10 years relevant experience with PhD or Juris Doctorate in related field; or High School Diploma or equivalent and 19 years relevant experience.  Minimum 15 years of experience conducting analysis relevant to the specific labor category with at least a portion of the experience within the last 2 years.  Clearance: Must possess and maintain a TS/SCI clearance   A division of Huntington Ingalls Industries  This opportunity resides with  Defense & Federal Solutions , a business group within Huntington Ingalls Industries’ Technical Solutions division, helps solve tough national security challenges for the Department of Defense, the intelligence community and federal civilian agencies. Our expert capabilities include intelligence, surveillance and reconnaissance (ISR), and cyber; secure enterprise IT engineering and operations; military training and simulation; logistics management and integrated product support; and fleet maintenance, modernization, repair and sustainment.  Huntington Ingalls Industries is America’s largest military shipbuilding company and a provider of professional services to partners in government and industry. For more than a century, HII’s Newport News and Ingalls shipbuilding divisions in Virginia and Mississippi have built more ships in more ship classes than any other U.S. naval shipbuilder. HII’s Technical Solutions division supports national security missions around the globe with unmanned systems, nuclear and environmental services, and defense and federal solutions. Headquartered in Newport News, Virginia, HII employs more than 42,000 people operating both domestically and internationally. For more information, visit: www.huntingtoningalls.com.  Huntington Ingalls Industries is an Equal Opportunity/Vets and Disabled Employer. U.S. Citizenship may be required for certain positions.   Nearest Major Market:  Omaha  Nearest Secondary Market:  Council Bluffs",30+ days ago,"2,033 reviews"
https://www.indeed.com/viewjob?jk=260b91c2b4825639&from=web&vjs=3,10,Data Scientist,"Sandhills Global, Inc.","Lincoln, NE 68521","The Data Scientist may be responsible for any of the following tasks: Analyzing data that is collected in our current and future products and services. The Data Scientist would need to be able to take this data and apply to the markets our products are in for us to better serve our customers. The Data Scientist must have good communication and organization skills, along with a working knowledge of day to day operations and priorities within their department and the company. Assume other duties as ssigned.  Qualifications: Bachelors or Masters Degree in Statistics or Mathematics preferred or any other quantitative discipline Strong proficiencies in Python and its frameworks Knowledge of the products and customers of the Auction and Heavy Equipment industries Technical expertise regarding data models, database design and development, data mining and segmentation techniques Strong skills working with technical aspects of SQL, R and Tableau Knowledge of statistics and experience using statistical packages for analyzing large datasets Strong analytical skills with the ability to collect, organize, analyze, and disseminate significant amounts of information with attention to detail and accuracy Adept at queries, report writing, and present findings Excellent oral and written communication skills Able to work independently and communicate within a team environment Results oriented Flexible and open to change Stable and progressive work history Professional appearance and demeanor, Ability to travel by air and ground - valid driver’s license required Able to work with minimal supervision.",30+ days ago,58 reviews
https://www.indeed.com/viewjob?jk=93ff5c8a34a02287&from=web&vjs=3,10,Senior Data Scientist,"Medical Solutions, LLC","Omaha, NE 68114","At Medical Solutions, we’re people who care, helping people who care. No matter how you look at it, there’s a whole lot of care going on in our world and that’s just the way we like it. What do we do? Medical Solutions is one of the nation’s largest providers of total workforce solutions in the healthcare industry, connecting nurses and allied health clinicians with hospitals and healthcare systems across the country and around the corner. Through our family of brands, we also serve a segment of clients outside of the healthcare space. And we’re the very best at what we do. You’ll love our culture that’s filled with heart and soul. As a company and employer, we’re sincerely and unabashedly us. We lead as humans first and believe the unique qualities of each team member make us better together. We share a purpose for helping others and the drive to make a difference. And we offer endless opportunities for personal and professional growth, throughout your career. At Medical Solutions, you’ll find a great place to work and a career home. We’ve received Best Places to Work awards, landed top industry awards, and received accolades for the impact we’ve made in business and within our community. But the only way to really get to know us, is to join us. We think you’ll fit right in. Senior Data Scientist – Job Description Our team is currently looking for a Senior Data Scientist who is passionate about creating awesome advanced analytics solutions for our customers and our teammates. You’ll be hands on with solution delivery, working with data engineering and business stakeholders. The ideal candidate will identify, design, and implement solutions that optimize business processes in a strategic and impactful way. We value open and honest communication, and we strive to create a positive and fun team-based environment. We want teammates that challenge themselves, as well as those around them to create high quality analytical products and services. You’ll be flexible, proactive, and solution focused. Job Responsibilities: Learn business processes and gain deep understanding of their data requirements to design and apply advanced analytics solutions to optimize them Design, develop, evaluate, and deploy predictive modeling, machine learning (ML), advanced analytics solutions Expert level data visualization to summarize and present key insights to both technical and non-technical audiences including presenting predictions and other analytical outcomes Contributes to identifying new statistical methods, technologies, and design patterns Establishes and maintains coding and ML standards, source control, scalability, testing processes, etc. Contributes to architectural design discussions Assists in implementation of ML-Ops practices Mentor less experienced data scientists Work cross-functionally with resources such as business SMEs, analysts, data engineers, architects, DBAs, infrastructure to design and deliver advanced analytic solutions Work with analysts to document requirements, assumptions, and methodologies including validation, testing, and implementation strategies Tuning production models Assists with building data science and advanced analytics roadmaps Adhere to established coding and ML standards Work with the defined source control and change management processes Stay current with the approved enterprise technology and ML stack Job Qualifications: Master’s degree in Statistics, Data Science, or a closely related discipline in a Computer Science field (or equivalent) Minimum 5 years of demonstrated experience with utilizing machine learning to optimize business outcomes including detailed experience with machine learning methods, design, build, testing, and implementation Minimum 5 years of experience working with Database Management Systems, Data Lake, and cloud-based ML Ecosystems such as Spark or Azure Data Bricks Deep understanding and experience with advanced statistics and modern machine learning predictive techniques, including GLMs, decision trees, forests, boosted ensembles, neural networks, deep learning, and graph analytics Experience using Integrated Development Environments like Notebooks (e.g. Jupyter), and Visual Studio with SSDT, Azure Data Tools, SQL Server Management Studio Skilled in data modeling for advanced analytics Deep understanding of common design patterns and their uses Skilled using DataOps and ML-Ops processes and tools and creating operational, production machine learning models Proficiency with ETL and ELT design patterns and optimization as well as complex orchestration via tools like Azure Data Factory, Azure Data Bricks, or similar Using work management tools such as Jira or Azure DevOps Experienced with web services and other Application Programming Interfaces Expert knowledge of SQL Expert knowledge and application of modern data science languages such as Python, R, Scala, etc. Strong interpersonal communication and presentation skills Collaborative and team-centric servant leadership Provides feedback in a constructive way to team members Ability to anticipate changes and impacts Iterative mindset focused on constant improvement Some of the benefits we offer… Insurance: Day 1 benefits (health, dental, vision, 401(k) + employer match) and company-paid life insurance; short and long-term disability; supplemental life insurance for yourself, spouse & child(ren); and multiple voluntary benefits Remote work option – we’re where  you  are! Flexible PTO (PT-Oh!) Flexible schedules Award-winning training program Connectivity stipend Competitive compensation as part of our total rewards package (8) paid Holidays Paid parental leave Employee Assistance Program (EAP) Why us? We live our Values in all we do Commitment to diversity, equity, and inclusion Focus on total wellbeing Employee Experience Team that provides perks in-office and virtually Relaxed culture and casual dress (t-shirts and flip-flops welcome!) Learn more about Medical Solutions and what it’s like to be part of our team. Check out our Careers website, https://www.thebestjobieverhad.com. Equal Opportunity Employer/Protected Veterans/Individuals with Disabilities The contractor will not discharge or in any other manner discriminate against employees or applicants because they have inquired about, discussed, or disclosed their own pay or the pay of another employee or applicant. However, employees who have access to the compensation information of other employees or applicants as a part of their essential job functions cannot disclose the pay of other employees or applicants to individuals who do not otherwise have access to compensation information, unless the disclosure is (a) in response to a formal complaint or charge, (b) in furtherance of an investigation, proceeding, hearing, or action, including an investigation conducted by the employer, or (c) consistent with the contractor’s legal duty to furnish information. 41 CFR 60-1.35(c)",20 days ago,108 reviews
https://www.indeed.com/viewjob?jk=a25c92b940f46e4b&from=web&vjs=3,10,Data Scientist - Senior (BR),Celestar Corporation,"Offutt AFB, NE","Celestar Corporation is seeking a  Data Scientist - Senior  who will perform duties at  Offutt AFB, NE . If interested and qualified, we welcome you to apply for this challenging opportunity. CLEARANCE REQUIREMENT: Active Top-Secret Level Clearance with SCI Access. ANTICIPATED AWARD DATE : January/February 2022 ANTICIPATED START DATE : February 2022 About Us : Celestar, a Veteran Owned Company is Very Competitive with Salaries and Benefits. As an example, we offer Company Paid Benefits that include Employee and Family Dental Insurance, Employ Health Insurance, Life Insurance and Disability Insurance as well. We also offer a 401K retirement company match, paid Holidays and Personal Time off. RESPONSIBILITIES Assist and advise the Government with identifying, capturing, integrating, properly formatting, processing, modeling, and displaying data and quantitative results (e.g., statistical and machine learning results) for consumption/interpretation by the USSTRATCOM J2 staff, Commander USSTRATCOM and other external customers. Assist and advise the Government with completing staff tasks assigned for action or coordination. Provide support to prepare staff action packages in accordance with USSTRATCOM procedures and support USSTRATCOM planning efforts against a potential adversary's strategic weapons. The contractor shall consider staff action packages as time- sensitive unless otherwise designated by the Government. Engage with the IC, defense agencies, other combatant commands, and other mission partners and stakeholders in support of USSTRATCOM's mission, as requested by the Government. Attend working groups, conferences, and other meetings, as requested by the Government, to advance the J2's understanding of a potential adversary's strategic weapons. Provide studies, assessments, briefings, reports, staff packages, and other documents pursuant to tasks in this PWS written in clear, concise language, free of spelling or grammar errors, and shall meet Government formatting and content guidelines. Store working files, documents, finished projects, and staff actions in electronic form, and hard copy when appropriate, in accordance with Command, DoD, and IC records management policies. Participate in discussions, meetings, conferences, publication evaluations and special projects, providing accurate and relevant feedback within specified timeframes, as requested by the Government. Accomplish, lead, or participate in detailed studies and analysis, as requested by the Government, to optimize internal or external support to the Command; providing timely, accurate, and relevant studies. Analyze and evaluate process and capability shortfalls and make program management recommendations for improvement. Interact with appropriate entities, as specified by the Government, and utilize existing software to develop digital databases, create maps, charts, and graphics, and shall utilize products and data feeds from Combat Support Agencies and DoD entities. Contractor shall collaborate with the appropriate GEOINT Requirements Manager or Geospatial Information & Services (GI&S) Officer to provide input for spatial foundation and analysis requirements. Provide methodology development, tool evaluation/ development, and process design/management support to USSTRATCOM J2 in coordination with other directorates, as well as subordinate service component commands. Apply basic knowledge of Mathematics, Applied Mathematics, Statistics, Applied Statistics, Machine Learning, Data Science, Data mining, Operations Research, or Computer Science Apply relevant experience must in designing, implementing machine learning, advanced analytical algorithms, programming, data science, advanced statistical analysis, artificial intelligence, and/or software engineering. Integrate and synchronize efforts, as requested by the Government, with other Government agencies or national research centers to aid in deepening collaboration with Allies, Partner Nations, and academia to assist developing their capacities in order to meet theater priorities and counter security threats to the Homeland. Identify, recommend, and use exploratory data analysis, statistical analysis, root- cause analysis, structured/unstructured predictive analytics, predictive modeling, optimization, and forecasting to produce actionable data-driven insights and outcomes for both time-sensitive and long-term business questions. Recommend and consult on probability and statistical processes and how to apply them, including logistic regression, forecasting analysis, cluster analysis, spatial analysis, risk simulation, hypothesis testing, Bayesian analysis, and predictive modeling. REQUIREMENTS Develop products in accordance with established processes and governing directives, research the availability and adequacy of existing products, identify shortfalls which may impact the Command's readiness and responsiveness for mission execution, and provide assessments used in the development of production plans. Provide support to manage GIS and cloud-based databases and product-specific files and data services, provide support to develop and execute production plans based on availability or adequacy shortfalls, gauge production progress against outstanding requirements, and provide status updates. Coordinate with data stewards and requirements owners to address known business requirement needs or previously intractable problems by designing, extracting, cleaning, normalizing, analyzing, reviewing, documenting, and automating analysis by merging disparate data or utilizing available data warehouse, and programming language such as R, Python, or SQL. For all analytical activities, follow prescribed guidance to document the design, sources, methods, data transformation, and visualization techniques to promote reliability, reproducibility, and tracking. Assist and advise on applicable software solutions and emerging technologies supporting stated requirements in order to meet USSTRATCOM J2 requirements. Provide assistance in developing, measuring, collecting, analyzing, and reporting the business value and alignment of CIO solution delivery, services, and operations as well as the performance of business activities to fully understand business and operational problems and opportunities for improvement. Research, study, and present technical information, in the form of briefings or written papers, on relevant threat warning issues for senior leaders as requested by the Government. Communication skills, both written and oral, to include preparation of written products for senior leader (general officer/flag officer/senior executive service level) use and the ability to communicate at all levels in a highly professional manner. Valid US Passport EDUCATION & EXPERIENCE : Master’s Degree and twelve (12) years of experience or Bachelor’s Degree and an additional five (5) years of related experience for a total of seventeen (17) years in lieu of a Master’s Degree Experience in one or more (combined experience) of the following disciplines: Mathematics, Applied Mathematics, Statistics, Applied Statistics, Machine Learning, Data Science, Operations Research, or Computer Science. A degree in a related field (e.g., Computer Information Systems), a degree in the physical/hard sciences (e.g. physics, chemistry, biology, astronomy), or other science disciplines (i.e., behavioral, social, and life) may be considered if it includes a concentration of coursework (typically 5 or more courses) in advanced mathematics (typically 200 level or higher; such as calculus, differential equations, discrete mathematics) and/or computer science (e.g., algorithms, programming, data structures, data mining, artificial intelligence). College-level Algebra or other math courses intended to meet a basic college level requirement, or upper-level math courses designated as elementary or basic do not count. Note : A broader range of degrees will be considered if accompanied by a Certificate in Data Science from an accredited college/university. Relevant experience must be in designing/implementing machine learning, data mining, advanced analytical algorithms, programming, predictive modeling, testing and experimentation, and advanced operations research, data science, data cleaning, data discovery, advanced statistical analysis, artificial intelligence, visualizations, and/or software engineering. Experience in more than one area is  highly desired . IMPORTANT NOTE: This is a Best Athlete Selection Process! Please ensure that the required and/or desired experience is reflected on your resume to receive fair and competitive consideration. Come onboard with a company that Values its Employees! Celestar is an Equal Opportunity/Affirmative Action Employer. All qualified applicants will receive consideration for employment without regard to race, color, religion, sex, sexual orientation, age, protected veteran status, disability status, gender identity or national origin. A new Federal Executive Order requires that employees of Federal contractors be fully vaccinated for COVID-19 by January 18, 2022. Accordingly, as a condition of employment with Celestar, employees will be required to provide proof of full vaccination against COVID-19 or have an approved exemption prior to starting employment. Job Type: Full-time",,17 reviews
https://www.indeed.com/viewjob?jk=85988adf76589b3c&from=web&vjs=3,10,,,,,,
