URL,page_count,job_title,company,location,job_Description,post_date,reviews
https://www.indeed.com/viewjob?jk=c9ff29e7732752fc&from=web&vjs=3,110,Principal /Sr. Principal Signal Image Processing Engineer,Northrop Grumman,"Morrisville, NC 27560","     Requisition ID: R10034192         Category:  Engineering      Location:  Morrisville, North Carolina, United States of America      Citizenship Required:  United States Citizenship      Clearance Type:  None      Telecommute:  Yes-May consider hybrid teleworking for this position      Shift:  1st Shift (United States of America)      Travel Required:  Yes, 10% of the Time      Positions Available:  2                At Northrop Grumman, our employees have incredible opportunities to work on revolutionary systems that impact people's lives around the world today, and for generations to come. Our pioneering and inventive spirit has enabled us to be at the forefront of many technological advancements in our nation's history - from the first flight across the Atlantic Ocean, to stealth bombers, to landing on the moon. We look for people who have bold new ideas, courage and a pioneering spirit to join forces to invent the future, and have fun along the way. Our culture thrives on intellectual curiosity, cognitive diversity and bringing your whole self to work — and we have an insatiable drive to do what others think is impossible. Our employees are not only part of history, they're making history.     The qualified candidate will become part of Northrop Grumman's Algorithms, Architecture and Software Defined Everything group in Mission Systems focused in signal processing, communications, radar, EO/IR, computer vision, machine learning, and artificial intelligence. This position is located in  Morrisville, NC .          Researches, designs, develops and verifies signal and image collection systems, and defines and develops processing and dissemination computer algorithms. Develops requirements analysis, system architecture, and integrates new signal and image processing technology systems. Designs, develops and analyzes systems for the extraction of information from signal and image sensors. Systems utilization includes detection and estimation theories, speech processing, and neural networks; electromagnetic and acoustic effects on signals; and/or implementation of signal processing with advanced computer architectures. Work products may include written reports, presentations, and project proposals. Occasional travel for meetings may be required.      Support applied research efforts in developing advanced machine learning capabilities. Work in an agile manner to support multiple efforts including, but not limited to, RF system exploitation (e.g. cognitive radio, radar, communications), multi-agent optimal scheduling algorithms, multi-modality image exploitation (e.g. EO, IR, SAR), and general automation tasks. Tasks may include phenomenology modeling, Monte Carlo analysis, machine learning algorithm development, mission integration, and algorithm deployment in cloud and embedded applications. Understanding and communicating trade-offs between machine learning approaches as applied to various missions. Work with cross-disciplinary team to rapidly develop and deploy novel capabilities for customers. Responsibilities will require strong technical skills, agility to perform across diverse projects, collaborative skills with cross-disciplinary and cross-site teams, and communication skills to present to customers and develop technical proposals.      This position can also be filled by an Principal/Sr. Principal AI SW Engineer depending on qualifying skillsets. US Citizenship with the ability to obtain a clearance required.      Principal Sig Proc Engineer  Basic Qualifications:           Five (5) years of experience with Bachelors in Science; Three (3) years of experience with Masters; Zero (0) years of experience with PhD in Electrical Engineering, Computer Science, Applied Physics, Applied Mathematics, or related technical fields and with applicable work experience in DSP development and/or in the design and implementation of software for DSP/SIGINT systems.       Applicable work experience in DSP development and/or in the design and implementation of software for DSP/SIGINT systems.       A demonstrated ability to perform innovative, applied research and develop sophisticated algorithms under computational or other resource constraints.       Proven experience with Monte Carlo analysis and physical modeling of systems.       Experience with conventional software engineering principles, including code maintenance, coding standards, and version control.       Experience with algorithm implementations in MATLAB and software development in C, C++ and/or Python.          Sr. Principal Sig Proc Engineer Basic Qualifications:           Bachelor's degree in a STEM discipline with 9 years’ experience, Master’s degree with 7 years’ experience, 4 years’ experience with PhD in Electrical Engineering, Computer Science, Applied Physics, Applied Mathematics, or related technical fields and with applicable work experience in DSP development and/or in the design and implementation of software for DSP/SIGINT systems.       Applicable work experience in DSP development and/or in the design and implementation of software for DSP/SIGINT systems.       A demonstrated ability to perform innovative, applied research and develop sophisticated algorithms under computational or other resource constraints.       Proven experience with Monte Carlo analysis and physical modeling of systems.       Experience with conventional software engineering principles, including code maintenance, coding standards, and version control.       Experience with algorithm implementations in MATLAB and software development in C, C++ and/or Python.          Preferred Qualifications:           Proven experience with formulating innovative solutions to algorithm development, initiating and fostering client relationships, and executing projects in compliance with cost, schedule, and technical requirements.       Proven experience in developing rapid prototype solutions from concept to design, implementation, initial testing, and integration.       Proven experience with open source computer vision and machine learning libraries       Unix/Linux operating systems, and multi-threaded/parallel computing is of additional benefit.       Proven experience with presenting and speaking at customer demonstrations, symposia, and conferences.       US Citizen with an active or current TS/SCI.          As a full-time employee of Northrop Grumman Mission Systems, you are eligible for our robust benefits package including:           Medical, Dental & Vision coverage       401k       Educational Assistance       Life Insurance       Employee Assistance Programs & Work/Life Solutions       Paid Time Off       Health & Wellness Resources       Employee Discounts          https://totalrewards.northropgrumman.com/      This positions standard work schedule is a 9/80. The 9/80 schedule allows employees who work a nine-hour day Monday through Thursday to take every other Friday off.  ""                   Salary Range:  $106,500 USD - $159,700 USD           Salary Range 2:  $132,100 USD - $198,100 USD                 Employees may be eligible for a discretionary bonus in addition to base pay. Annual bonuses are designed to reward individual contributions as well as allow employees to share in company results. Employees in Vice President or Director positions may be eligible for Long Term Incentives. In addition, Northrop Grumman provides a variety of benefits including health insurance coverage, life and disability insurance, savings plan, Company paid holidays and paid time off (PTO) for vacation and/or personal business.                   The health and safety of our employees and their families is a top priority. With the continuing impacts of COVID-19 around the world, we are taking action to protect the health and well-being of our colleagues and maintain the safety of the communities where we operate. As a federal contractor, and consistent with Executive Order 14042 (https://www.saferfederalworkforce.gov/contractors/) we require all newly hired employees in the United States to be fully vaccinated by their start date. Federal guidance allows for disability/medical and religious accommodations with respect to the vaccine requirement. Any requested accommodations must be reviewed and approved (if applicable) in advance of your start date.      Northrop Grumman is committed to hiring and retaining a diverse workforce. We are proud to be an Equal Opportunity/Affirmative Action Employer, making decisions without regard to race, color, religion, creed, sex, sexual orientation, gender identity, marital status, national origin, age, veteran status, disability, or any other protected class. For our complete EEO/AA and Pay Transparency statement, please visit http://www.northropgrumman.com/EEO. U.S. Citizenship is required for most positions.        ",30+ days ago,"6,212 reviews"
https://www.indeed.com/viewjob?jk=cf2c58b3672df399&from=web&vjs=3,110,"Data Architect, Hybrid Cloud",IBM,"Research Triangle Park, NC 27709","         Introduction      At IBM, work is more than a job - it's a calling: To build. To design. To code. To consult. To think along with clients and sell. To make markets. To invent. To collaborate. Not just to do something better, but to attempt things you've never thought possible. Are you ready to lead in this new era of technology and solve some of the world's most challenging problems? If so, lets talk.              Your Role and Responsibilities               Job Duties:      In this unique role, you’ll have an incredible opportunity to lead the development and execution of strategies that will transform our hybrid cloud platform (named ""Cirrus"") and portfolio of IBM applications using your world-class knowledge of data, analytics, and automation. You’ll develop data models, dashboards, reports, and automation that drive hybrid cloud platform adoption. You’ll work with platform teams to understand their data sources and determine how to produce insights from that data. You’ll provide clarity and direction to teams that are adopting the platform by providing views into data that will help shape behaviors.            As a member of the Cirrus platform team, you are a leader and catalyst for change. You’ll energize others around you who are willing to follow you in evolving the way we operate, communicate, and collaborate. You’ll also develop a great understanding of the needs of platform teams, application teams, and IBM’s business, and facilitate each component’s contribution to our hybrid cloud transformation.             Responsibilities include:            Lead a team data engineers to scale our platform data architecture strategy, designing for interoperability, ease of integration, and transparency        Lead the design, development, and application of tooling and metrics to accelerate hybrid cloud adoption in collaboration with development teams        Define the strategy to ""bake in"" intelligence and self-awareness into our platform architectures        Track key metrics, using them to adjust strategy and approach accordingly        Search for patterns using data and uncover tasks that can be automated        Discover ways to measure metrics related to value, efficiency, cost, best practices, and compliance        Collaborate with our Hybrid Business Management team to provide analysis of hybrid cloud adoption hard and soft benefits        Use data in an open way to iterate, innovate, and inspire        Act as the primary technical coordinator for data and automation collaboration within platform teams        Provide technical leadership and direction within the Cirrus Architecture Chapter        Understand and promote the CIO Hybrid Cloud Platforms strategy and IBM’s strategy as the Hybrid Cloud and AI company, and participate and contribute to promote these strategies by collaborating with other organizations within IBM as opportunities arise                    Required Technical and Professional Expertise                Bachelor’s degree in Computer Science, Mathematics, Statistics, or related technical field, or equivalent experience       Demonstrated experience with relevant programming languages such as Python, R, and/or Java       Demonstrated SQL experience (NoSQL experience is a plus)       Experience working with machine learning frameworks       Experience with MapReduce, either with Hadoop or Spark       Expertise with ETL and data visualization tools. Splunk experience is a plus       Expertise in data analysis and managing large, complex datasets       Familiarity with cloud infrastructure and application development concepts       Experience in program delivery with a strong focus on Agile methodologies and alignment across a global, matrixed team environment       Demonstrated ability to manage multiple work streams while maintaining attention to detail and solid instincts in business strategy matched with deep analytical thinking       Passion for leadership, paired with the ability to inspire your team to understand business objectives, solve customer problems, and deliver measurable outcomes       Possess confident creative problem-solving, critical thinking, and interpersonal skills       Experience managing delivery of high-quality, high-visibility products and features       People management experience               Preferred Technical and Professional Expertise                Experience working with Kubernetes-based cloud platforms such as Red Hat OpenShift       Experience working with IBM Cloud Pak for Data                           About Business Unit      The IBM Finance organization is responsible for driving enterprise performance and transformation. We are the financial stewards of IBM, delivering IBM’s financial strategy, developing new business models, and mitigating enterprise risk. Do you have a passion for creating business value? Join our team in accounting, financial planning, pricing, business controls, tax, treasury, business development (acquisitions & divestitures), and global financing.               This job requires you to be fully COVID-19 vaccinated prior to your start date, where legally permissible. Proof of vaccination status will be required. If you are unable to be vaccinated due to medical, pregnancy or religious reasons, we offer accommodations in accordance with applicable law.                      Your Life @ IBM      Are you craving to learn more? Prepared to solve some of the world's most unique challenges? And ready to shape the future for millions of people? If so, then it's time to join us, express your individuality, unleash your curiosity and discover new possibilities.          Every IBMer, and potential ones like yourself, has a voice, carves their own path, and uses their expertise to help co-create and add to our story. Together, we have the power to make meaningful change – to alter the fabric of our clients, of society and IBM itself, to create a truly positive impact and make the world work better for everyone.          It's time to define your career.                      About IBM      IBM’s greatest invention is the IBMer. We believe that through the application of intelligence, reason and science, we can improve business, society and the human condition, bringing the power of an open hybrid cloud and AI strategy to life for our clients and partners around the world.          Restlessly reinventing since 1911, we are not only one of the largest corporate organizations in the world, we’re also one of the biggest technology and consulting employers, with many of the Fortune 50 companies relying on the IBM Cloud to run their business.           At IBM, we pride ourselves on being an early adopter of artificial intelligence, quantum computing and blockchain. Now it’s time for you to join us on our journey to being a responsible technology innovator and a force for good in the world.                      Location Statement      IBM offers a wide range of resources for eligible IBMers to thrive both inside and outside of work. In addition to a competitive benefits program consisting of medical and life insurance, retirement plans, and time off, eligible employees may also have access to:                    12 weeks of paid parental bonding leave. Family care options are also available to support eligible employees during COVID-19.      World-class training and educational resources on our personalized, AI-driven learning platform. IBM's learning culture supports your restless attitude to grow your skills and build the depth and scale of knowledge needed to achieve your career goals.      Well-being programs to support mental and physical health.      Financial programs that empower you to plan, save, and manage your money (including expert financial counseling, 401(k), IBM stock discount, etc.).      Select educational reimbursement opportunities.      Diverse and inclusive employee resource groups where you can network and connect with IBMers across the globe.      Giving and volunteer programs to benefit charitable organizations and local communities.      Discounts on retail products, services, and experiences.          We consider qualified applicants with criminal histories, consistent with applicable law.          IBM will not be providing visa sponsorship for this position now or in the future. Therefore, in order to be considered for this position, you must have the ability to work without a need for current or future visa sponsorship.                      Being You @ IBM      IBM is committed to creating a diverse environment and is proud to be an equal opportunity employer. All qualified applicants will receive consideration for employment without regard to race, color, religion, gender, gender identity or expression, sexual orientation, national origin, genetics, pregnancy, disability, age, veteran status, or other characteristics. IBM is also committed to compliance with all fair employment practices regarding citizenship and immigration status.     ",6 days ago,"31,329 reviews"
https://www.indeed.com/viewjob?jk=f721041c83719555&from=web&vjs=3,110,Forensic and Integrity Services - Data Analytics - Data Science Manager - Multiple Cities,EY,"Charlotte, NC 28202","At EY, you’ll have the chance to build a career as unique as you are, with the global scale, support, inclusive culture and technology to become the best version of you. And we’re counting on your unique voice and perspective to help EY become even better, too. Join us and build an exceptional experience for yourself, and a better working world for all. Charlotte (Primary), Boston, Iselin, NY Businesses are increasingly making critical decisions based on data, which often means working with large datasets from disparate data sources. When our clients need to organize, visualize and utilize the massive amounts of information flowing from their systems, they know we have the expertise to provide them with solutions like nobody else can.  The opportunity  Our Forensic Data Science team is growing exponentially, and as a Data Scientist Manager you’ll play a key role in that growth. Working with clients across all industries, you’ll develop innovative recommendations to some of the most challenging data issues around. Since we work with such a diverse portfolio of clients across industries, you can expect to take on a wide range of projects, making this a great place to develop your technical skills and business knowledge .  Your key responsibilities  It’s no exaggeration to say you’ll never be doing the same task for too long. You’re likely to balance your time between directly liaising with our clients to understand their needs and actively analyzing complex data. It’s all about using your technical skills to creatively assess and resolve our clients’ needs from the front lines. That means thinking differently about data-driven problem solving and speaking up with innovative ideas that challenge the status quo.  Skills and attributes for success  - Managing the key components of a portfolio of Forensic projects, including strategy, planning and execution - Developing long-term relationships across a network of existing and potential clients, understanding their businesses to provide tailored insights - Constantly developing your understanding of our clients’ industries, identifying trends, risks and opportunities for improvement - Developing your team through constant coaching and feedback, providing challenging goals and guaranteeing your people have the skills, knowledge and opportunities to grow  To qualify for the role you must have  - A graduate degree in computer science, engineering, statistics or computational linguistics, supported by significant work experience - Achieved, or be working towards a professional designation, such as CISA, CISSP, CISM,CFE, CFCE or EnCE - Excellent project management skills and the ability to prioritize when working on multiple engagements - Strong negotiation and influencing skills, and the confidence to communicate complex technical concepts to a wide range of audiences Ideally, you’ll also have  - Development experience in distributed programming paradigms (specifically, MapReduce) - Strong Java, Python and R - Working knowledge of the Apache Hadoop platform and Mahout - Knowledge of supervised, semi- supervised, and unsupervised machine learning algorithms and processes, including active learning  What we look for  We’re interested in passionate leaders, with the intellectual curiosity to actively pursue new data science knowledge. Naturally you’ll need a firm technical foundation, as well as the ability to translate complex information into meaningful, actionable insights. But we’re not just looking for strong technical skills – we’re interested in people that have the ability to nurture relationships, both internal and external, and are committed to intimately understanding our client’s needs. If you’re looking to become part of a community of advisors where you’ll make a measurable difference across some of the most prestigious businesses around, this role is for you .  What we offer We offer a competitive compensation package where you’ll be rewarded based on your performance and recognized for the value you bring to our business. In addition, our Total Rewards package includes medical and dental coverage, pension and 401(k) plans, and a wide range of paid time off options. Under our flexible vacation policy, you’ll decide how much vacation time you need based on your own personal circumstances. You’ll also be granted time off for designated EY Paid Holidays, Winter/Summer breaks, Personal/Family Care, and other leaves of absence when needed to support your physical, financial, and emotional well-being. Continuous learning:  You’ll develop the mindset and skills to navigate whatever comes next. Success as defined by you:  We’ll provide the tools and flexibility, so you can make a meaningful impact, your way. Transformative leadership:  We’ll give you the insights, coaching and confidence to be the leader the world needs. Diverse and inclusive culture:  You’ll be embraced for who you are and empowered to use your voice to help others find theirs. If you can demonstrate that you meet the criteria above, please contact us as soon as possible. The exceptional EY experience. It’s yours to build. EY | Building a better working world EY exists to build a better working world, helping to create long-term value for clients, people and society and build trust in the capital markets. Enabled by data and technology, diverse EY teams in over 150 countries provide trust through assurance and help clients grow, transform and operate. Working across assurance, consulting, law, strategy, tax and transactions, EY teams ask better questions to find new answers for the complex issues facing our world today. EY is an equal opportunity, affirmative action employer providing equal employment opportunities to applicants and employees without regard to race, color, religion, age, sex, sexual orientation, gender identity/expression, national origin, protected veteran status, disability status, or any other legally protected basis, including arrest and conviction records, in accordance with applicable law. EY is committed to providing reasonable accommodation to individuals with disabilities. If you are a qualified individual with a disability and either need assistance applying online or need to request an accommodation during the interview process, please call 1-800-EY-HELP3, type Option 2 (HR-related inquiries) and then type Option 1 (HR Shared Services Center), which will route you to EY’s Talent Shared Services Team or email SSC Customer Support at ssc.customersupport@ey.com.",30+ days ago,"8,231 reviews"
