URL,page_count,job_title,company,location,job_Description,post_date,reviews
https://www.indeed.com/viewjob?jk=629deb0846e336e8&from=web&vjs=3,10,Data Scientist - ProServe,"Amazon Web Services, Inc.","Center, NE"," Bachelor’s degree in a highly quantitative field (Computer Science, Machine Learning, Operational Research, Statistics, Mathematics, etc.) or equivalent professional or military experience  Experience with ML fields, e.g., natural language processing, computer vision, statistical learning theory  4+ years of industry experience in predictive modeling, data science, and analysis  Experience in an ML engineer or data scientist role building and deploying ML models or hands on experience developing deep learning models  Experience writing code in Python, R, Scala, Java, C++ with documentation for reproducibility  Experience handling terabyte size datasets, diving into data to discover hidden patterns, using data visualization tools, writing SQL, and working with GPUs to develop models  Experience writing and speaking about technical concepts to business, technical, and lay audiences and giving data-driven presentations  Want to help the largest global enterprises derive business value through the adoption of Artificial Intelligence (AI) and Machine Learning (ML)? Excited by using massive amounts of disparate data to develop ML models? Eager to learn to apply ML to a diverse array of enterprise use cases? Thrilled to be a part of Amazon who has been pioneering and shaping the world’s AI/ML technology for decades? At Amazon Web Services (AWS), we are helping large enterprises build ML models on the AWS Cloud. We are applying predictive technology to large volumes of data and against a wide spectrum of problems. AWS Professional Services works together with AWS customers to address their business needs using AI solutions. AWS Professional Services is a unique consulting team. We pride ourselves on being customer obsessed and highly focused on the AI enablement of our customers. If you have experience with AI, including building ML models, we’d like to have you join our team. You will get to work with an innovative company, with great teammates, and have a lot of fun helping our customers. A successful candidate will be a person who enjoys diving deep into data, doing analysis, discovering root causes, and designing long-term solutions. Inclusive Team Culture Here at AWS, we embrace our differences. We are committed to furthering our culture of inclusion. We have thirteen employee-led affinity groups, reaching 85,000 employees in over 190 chapters globally. We have innovative benefit offerings, and host annual and ongoing learning experiences, including our Conversations on Race and Ethnicity (CORE) and AmazeCon (gender diversity) conferences. Amazon’s culture of inclusion is reinforced within our 16 Leadership Principles, which remind team members to seek diverse perspectives, learn and be curious, and earn trust. Work/Life Balance Our team puts a high value on work-life harmony. Striking a healthy balance between your personal and professional life is crucial to your happiness and success here. We are a customer-obsessed organization—leaders start with the customer and work backwards. They work vigorously to earn and keep customer trust. As such, this is a customer facing role in a hybrid delivery model. Project engagements include remote delivery methods and onsite engagement that will include travel to customer locations as needed. Mentorship & Career Growth Our team is dedicated to supporting new members. We have a broad mix of experience levels and tenures, and we’re building an environment that celebrates knowledge sharing and mentorship. We care about your career growth and strive to assign projects based on what will help each team member develop into a better-rounded professional and enable them to take on more complex tasks in the future. This is a customer-facing role and you will be required to travel to client locations and deliver professional services as needed.  Major responsibilities include:   Assist customers by being able to deliver a ML project from beginning to end, including understanding the business need, aggregating data, exploring data, building & validating predictive models, and deploying completed models with concept-drift monitoring and retraining to deliver business impact to the organization  Use AWS AI services (e.g., Personalize), ML platforms (SageMaker), and frameworks (e.g., MXNet, TensorFlow, PyTorch, SparkML, scikit-learn) to help our customers build ML models  Research and implement novel ML approaches, including hardware optimizations on platforms such as AWS Inferentia  Work with our other Professional Services consultants (Big Data, IoT, HPC) to analyze, extract, normalize, and label relevant data, and with our Professional Services engineers to operationalize customers’ models after they are prototyped  Master’s degree of PhD in a highly quantitative field (Computer Science, Machine Learning, Operational Research, Statistics, Mathematics, etc.)  Ability to develop strategic, baselined, data modeling processes; ability to accurately determine cause-and-effect relationships.  Publications or presentations in recognized ML journals or conferences  Deep technical skills, consulting experience, and business savvy to interface with all levels and disciplines within our customers’ organization  Demonstrable track record of dealing well with ambiguity, prioritizing needs, and delivering results in a dynamic environment  Amazon is committed to a diverse and inclusive workplace. Amazon is an equal opportunity employer and does not discriminate on the basis of race, national origin, gender, gender identity, sexual orientation, protected veteran status, disability, age, or other legally protected status. For individuals with disabilities who would like to request an accommodation, please visit https://www.amazon.jobs/en/disability/us. For employees based in Colorado, this position starts at $114,700 per year. A sign-on bonus and restricted stock units may be provided as part of the compensation package, in addition to a range of medical, financial, and/or other benefits, dependent on the position offered.",30+ days ago,"76,982 reviews"
https://www.indeed.com/viewjob?jk=2962d7e82592c453&from=web&vjs=3,30,Applied Data Scientist,CyncHealth,"Omaha, NE","Position Summary The Applied Data Scientist will participate in the engineering and analytics lifecycle at CyncHealth, using big data, AI-driven methodologies to design, develop and implement solutions for real world health data challenges. This position requires the ability to apply data science, machine learning and/or graph analysis techniques to a variety of modeling and relevance problems involving health data use-cases. The Applied Data Scientist will apply statistical theory and methods to collect, interpret, and summarize data as well as make predictions and recommend actions based on data. Must be skilled in data analysis, statistical analysis, and can design, develop, and deploy algorithms in CyncHealth's information systems.  Responsibilities:   Knowledgeable in one or more of the following: machine learning, information retrieval, recommendation systems, and/or health data ecosystems  Develop machine learning pipelines, proof-of-concepts, and work on frameworks.  Apply machine learning algorithms and libraries  Deploy machine learning solutions to production  Build predictive models and machine-learning algorithms.  Identify gaps in data and use data science methodologies to overcome them.  Document all processes and research.   Education, Experience, & Skills:   M.S. or Ph.D. in Computer Science, Health Informatics, or equivalent degree with 2+ years of industry experience.  At least one-year prior experience working with health data required.  Extensive background in data mining and statistical analysis.  Designed and evaluated approaches for handling high-volume real-time data streams.  A strong technical advocate with a background in Python, JavaScript, and PySpark.  Basic understand of cloud-based machine learning application deployment  Experienced in operating Linux-based systems.  Knowledgeable of core CS concepts such as: common data structures and algorithms, profiling/optimization.  Passionate about working with large unstructured and structured data sets (for example multi-terabyte, daily transaction volumes, e.g. Spark, HBase)  Excellent problem-solving and analytic skills   Expectations:   Hours are generally Monday-Friday, 8:00 AM-5:00 PM, but may vary as necessary with possible extended working hours.  Ability to work on a computer for extended periods of time.  Ability to stand or sit for extended periods of time.  Light work requiring exertion up to 20 pounds of force occasionally, and/or up to 10 pounds of force frequently, and/or a negligible amount of force constantly to move objects.  Ability to work in the La Vista, NE office with reliable and predictable attendance.   Disclaimer: The above statements are intended to describe the general nature and level of work being performed by individuals assigned to this position. The statements are not intended to be construed as an exhaustive list of all responsibilities, duties and skills required for this position. Must be authorized to work in the United States.",28 days ago,
https://www.indeed.com/viewjob?jk=beb205e3a74fbcf4&from=web&vjs=3,30,"Data Scientist, Omaha",Rhombus Power,"Omaha, NE","Rhombus is purposefully transforming the nation's defense and national security enterprises with Guardian, its Artificial Intelligence platform for strategic, operational, and tactical decision-making at the speed of relevance.   We are looking for people who are driven by a sense of purpose. In this role, you will serve as a  Data Scientist  to solve our customer's uniquely complex problems. We expect you to be a systems-level thinker and a real doer. You will excel in this role if you are hungry to make a difference and are intellectually bold. And we sure hope that you smile when you hear our clients say, ""If we can dream it, Rhombus can do it.""  Come join our cross-disciplinary and world-class team of technologists who are working hard every day to deliver game-changing solutions to transform national security.   Job description  As a Data Scientist at Rhombus you will work with our Product team. You will design, develop, and launch efficient and reliable data pipelines to move, analyze, and model data and to provide intuitive analytics from Rhombus' large and complex datasets. A strong systematic mind is a priority, as well as the ability to communicate clearly in multiple technical contexts. The ideal candidate should be passionate about finding insights in large datasets, while maintaining attention to database architecture, data reliability, efficiency, and quality. As we are continually releasing new features and products, the ability to construct elegant system-level data architecture is expected.  Responsibilities   Discover datasets that could help in solution development  Data curation, analysis, quantitative modeling  Validation and quality assurance of data, models and results  Deploy and implement solutions in collaboration with product team  Interact with the product team on current and upcoming user requirements   Qualifications   Masters or Ph.D. in Sciences, Mathematics or Engineering, especially numerical methods and simulations – we have multiple openings  Strong background in database management solutions, familiarity with databases such as MySQL and Oracle  Large-scale data processing and implementing batch processing pipelines in HPC or cloud architecture  Background in Statistics is expected, and Experience with Machine Learning is a bonus  Experience with Cloud Computing environments (AWS, GCloud, Azure) is a plus   Location   Omaha, Nebraska   About Rhombus  Rhombus Power Inc. (Rhombus) is a NASA Research Park startup located in the heart of Silicon Valley. We use cutting-edge cross-disciplinary approaches to solve pressing Big Data and Sensing problems in security, energy and healthcare. Our advisory board includes two Nobel Laureates and a Draper Prize winner.  Rhombus compensates, motivates, and develops employees, who are trusted, empowered, and involved. Employees have clear roles and expectations – and their roles are flexible enough to move at the speed of innovation in order to meet and exceed client expectations. We have a unique culture of global purpose, rooted in the innovation and progress of Silicon Valley.  Rhombus knows that diversity is a condition for success. We are committed to hiring and retaining a diverse workforce. We are proud to be an Equal Opportunity/Affirmative Action Employer.",30+ days ago,
https://www.indeed.com/viewjob?jk=e1d8152690f48f79&from=web&vjs=3,30,,,,,,
https://www.indeed.com/viewjob?jk=904eb7ca190a7da2&from=web&vjs=3,30,Head of Machine Learning- Document Analysis and NLP,Recruiting From Scratch,"Omaha, NE 68144","Who is Recruiting from Scratch: Recruiting from Scratch is a premier talent firm that focuses on placing the best product managers, software, and hardware talent at innovative companies. Our team is 100% remote and we work with teams across the United States to help them hire. We work with companies funded by the best investors including Sequoia Capital, Lightspeed Ventures, Tiger Global Management, A16Z, Accel, DFJ, and more. If you are a fit, the team will reach out to you about this role or any others that may be a fit for our clients. Our Client Our client helps organizations globally to build trust and speed into their business by matching the Speed of PrivacyOps to the Speed of Dev/BusinessOps. Clients include Patreon, Twilio, Coinbase, Robinhood, and Samara. The Role Lead Natural Language Processing (NLP) and legal document analysis to deliver machine learning models and systems end to end. You partner with cross-functional stakeholders to design a high-value roadmap that scales the impact of ML for customers, and you make prioritization and architecture decisions to drive the execution of this roadmap. Given you are constructing the foundation on which our client's global data infrastructure will be built, you need to pay close attention to detail and maintain a forward-thinking outlook as well as scrappiness for the present needs. You lead by example to build a cohesive team culture of ownership, growth, transparency, and customer focus, and you attract and close top talent for your team. Responsibilities: Design, architect, manage and hire to lead a document analysis and NLP team Strategy: actively participate in customer engagements and partner with cross-functional stakeholders (legal product managers, customer success) to discover new opportunities to apply ML/NLP to solve critical problems and design a high-value roadmap that scales the impact of ML for customers Execution: make customer-centric prioritization decisions to balance between immediate impact and long-term bets with limited resources and partner with the team manager to drive alignment and collaboration with other engineering teams Design: deeply understand how everything fits together; architect systems to balance scrappiness for the current needs with a forward-thinking outlook to improve and scale our infrastructure; continuously look for opportunities to automate and build tools to lower operational barriers Hands-on problem solving: help the team solve its most complex problems with the simple, pragmatic solutions Culture: lead by example to build a cohesive team culture of ownership, growth, transparency, and customer focus Hiring: attract and close top ML/NLP engineers and software engineers for your team You are a good fit if you: Have an exceptional track record of successfully delivering large scale ML/NLP models and systems that result in substantial positive impact to customers across multiple organizations (7+ years) Have a track record of building teams that consistently deliver results and investing in the learning and growth of the people you lead Are a creative and strategic thinker with a change agent mindset who enjoys identifying business problems with the highest impact for customers and designing end-to-end ML/NLP models and systems to address them Have a “get stuff done” attitude and enjoy being hands-on and working alongside the team to solve its most pressing problems in a fast-paced, collaborative environment Are a skilled technical influencer with a track record of successfully influencing product direction through a strong perspective that motivates engineers to develop simple, pragmatic solutions to complex problems Are an expert communicator with clear and concise, active listening and empathy skills, and a respectful, collaborative approach that earns the trust of your peers Are a strong source of ML/NLP engineering and software engineering talent and are comfortable closing applicants for your team",1 day ago,
https://www.indeed.com/viewjob?jk=a13555b9f1d023ea&from=web&vjs=3,30,Machine Learning Engineer,Pearson,"Lincoln, NE","Pearson, the world's leading learning company, has global-reach and market leading businesses in education, business, and consumer publishing and is listed on the London and New York stock exchanges (UK: PSON; NYSE: PSO). For more information, visit www.pearson.com.  The Personalized Learning and Analytics team (PLA) in Pearson is responsible for software development of analytics and machine learning platforms. PLA is growing and we are looking for a new team member. Together with a highly multi-disciplinary team of engineers, scientists, strategic partners, product managers and subject domain experts you will work on building solutions powered by big data. You will work on a best-in-class cloud computing platform, with cutting edge big data tools at your disposal while having access to experts in education, engineering and data science.  Pearson is an Equal Opportunity and Affirmative Action Employer, and a member of E-Verify. All qualified applicants, including minorities, women, veterans, and people with disabilities are encouraged to apply.  RESPONSIBILITIES  :  Develop scalable data processing pipelines  Collaborate with other scientists and engineers to find effective solutions to technical challenges  Provide input for product road maps  Work closely with engineers to build, test, deploy and troubleshoot machine learning algorithms designed to enhance the learner’s experience  Work with product partners and stakeholders to communicate expectations and deliver on them  Research, design, and develop statistics or statistical models where applicable to monitor usage/performance and help make data driven decisions  Create machine learning microservices and have a willingness to maintain our Kubernetes cluster  Be involved in the development, maintenance and evolution of our services and products   QUALIFICATIONS  :  Bachelors degree in computer science, statistics, mathematics, physical science, engineering, or a comparable related technical field: or equivalent years of experience.  Desire to explore and develop solutions to questions that may or may not have a right answer  Demonstrated mastery in communication of technical ideas to non-technical audiences  Ability to translate customer goals into practical engineering solutions  Good understanding of foundational statistics concepts and algorithms: linear/logistic regression, random forest, boosting, NNs, etc.  Passion for learning (new problem domains, algorithms, tools etc.) and for analyzing data  Strong programming skills with fluency in at least one of Python, Java, Scala, C/C++ Familiar with industry standard software engineering practices and systems knowledge  Working knowledge of Unix/Linux systems  Ability to access, manage, transfer, integrate and analyze complex datasets, especially using SQL  Familiarity with libraries such as pandas, TensorFlow, scikit-learn   PREFERRED QUALIFICATIONS:  MS or higher in computer science, mathematics or a comparable related technical field  2+ years of industry experience in software engineering and data science  Experience with working on large data sets, especially with Spark  Experience with Python and Java  Experience with cloud computing platforms such as AWS or GCP  Experience with Kubernetes   The anticipated starting salary range for Colorado-based individuals expressing interest in this position is $75-144K. This position is eligible to participate in an annual incentive program.  Benefits available to eligible employees can be seen at: https://pearsonbenefitsus.com/  Learning is the most powerful force for change in the world. More than 20,000 Pearson employees deliver our products and services in nearly 200 countries, all working towards a common purpose – to help everyone achieve their potential through learning. We do that by providing high quality, digital content and learning experiences, as well as assessments and qualifications that help people build their skills and grow with the world around them. We are the world’s leading learning company. Learn more at pearsonplc.com.  Pearson believes that wherever learning flourishes, so do people. We are committed to being an anti-racist company in everything we do. We value the power of an inclusive culture and a strong sense of belonging. We promote a culture where differences are embraced, opportunities are accessible, consideration and respect are the norm, and all individuals are supported in reaching their full potential. Through our talent, we believe that diversity, equity, and inclusion make us a more innovative and vibrant place to work. People are at the center, and we are committed to a sustainable environment and workplace where talent can learn, grow, and thrive.  To learn more about Pearson’s commitment to a diverse and inclusive workforce, please click here:  http://www.pearson.com/careers/diversity-and-inclusion.html  Pearson is an Affirmative Action and Equal Opportunity Employer and a member of E-Verify. We are committed to building a team that represents a variety of backgrounds, perspectives, and skills. The more inclusive we are, the better our work will be. All employment is decided based on qualifications, merit, and business need. All qualified applicants will receive consideration for employment without regard to race, ethnicity, color, religion, sex, sexual orientation, gender identity, gender expression, age, national origin, protected veteran status, disability status, or any other group protected by law.  Job:  TECHNOLOGY  Organization:  Technology & Operations  Schedule:  FULL_TIME  Req ID:  707",30+ days ago,"2,696 reviews"
https://www.indeed.com/viewjob?jk=71d2427d00be9f6c&from=web&vjs=3,30,Senior SAS Data Analyst,Celerion,"621 Rose St, Lincoln, NE 68502","JOB DESCRIPTION  Celerion is committed to swift, exceptional clinical research through translational medicine.  Every day, we use our experience, agility, and innovative research strategies to help get drugs to market faster. Celerion offers one of the most experienced clinical pharmacology research networks in the industry.  Are you looking for an opportunity to support a business creating life-saving treatments? If so, we can't wait to meet you!  We are looking for a  Senior SAS Data Analyst . This full-time position can be located at either at our Phoenix, AZ or Lincoln, NE clinical trial facilities.  Purpose:  Provide SAS statistical programming support to project team for analysis and reporting of clinical data in early clinical research studies.  Essential Functions:   Independently develop, maintain and process SAS programs for complex studies that create: analysis data sets, statistical analyses, data listings, edit checks (clinical), tables, figures and electronic data transfers.  Consult with Biostatisticians and project team to implement statistical analysis and data validation programs.  Ensure compliance with department procedures with regard to table and listing formats, directory structure of SAS programs and Quality Control (QC) functions.  Assure that protocol specifications are reflected in SAS output.  Develop and implement utility SAS programs for the standard program directory.  Training of new SAS Data Analysts.   An attractive salary and benefits package is provided.  JOB REQUIREMENTS  Bachelor's in Statistics, Mathematical Science, Computer Science or related filed with 5+ years SAS programming experience and 3+yrs industry experience OR advanced degree with 2+yrs SAS programming experience and 1+ yrs industry experience, or equivalent required.  Excellent interpersonal skills required.  Demonstrated problem solving and decision making skills required.  Demonstrated teamwork and leadership ability required.  Demonstrated Multitasking skills required.   Our Mission: Translating Science to Medicine  Celerion Values: Integrity Trust Teamwork Respect  Celerion is an Equal Opportunity Employer. All qualified applicants will receive consideration for employment without regard to race, color, religion, sex, national origin, age, sexual orientation, gender identity, genetic information, marital status, qualified protected veteran status, or disability.",30+ days ago,133 reviews
