URL,page_count,job_title,company,location,job_Description,post_date,reviews
https://www.indeed.com/viewjob?jk=815ff51c61c3277e&from=web&vjs=3,120,"Product Analyst, Conversational AI",Ally Financial,"Charlotte, NC","                                   General information                                                      Career area                            Technology                                            Work Location(s)                            500 Woodward Avenue, Detroit, MI, 601 S. Tryon Street, Charlotte, NC                                            Remote?                            No                                            Ref #                            12298                                            Posted Date                            Tuesday, January 18, 2022                                            Working time                            Full-time                                                              Ally and Your Career                                                                  Ally Financial only succeeds when its people do - and that’s more than some cliché people put on job postings. We live this stuff! We see our people as, well, people - with interests, families, friends, dreams, and causes that are all important to them. Our focus is on the health and safety of our teammates as well as work-life balance and diversity and inclusion. From generous benefits to a variety of employee resource groups, we strive to build paths that encourage employees to stretch themselves professionally. We want to help you grow, develop, and learn new things. You’re constantly evolving, so shouldn’t your opportunities be, too?                                                                          The Opportunity                                                       At Ally, you get a startup feel, but experience the benefits of a company that’s worked out the kinks and is fulfilling its purpose. We’re always evolving and see that as a good thing. From owning our work to seeing its impact in the real world, our team is relentless in finding new ways technology can help make experiences better and help people. We are problem solvers, we value diverse thinking, we support one another, and we challenge ourselves to think bigger in the journey to deliver customer-obsessed tech solutions.                      As a Product Analyst with Ally, you will partner with product management and internal customers to provide key analytics to the Product team as they create, launch, and adopt of a new conversational AI Bot.                                                                                  The Work Itself                                                                              Collaborate with stakeholders to ensure digital vision and products align within team strategy and product requirements              Work alongside an agile team to plan releases, determine goals, and continually iterate on exciting products              Facilitate development of product specific KPIs once solution enters production and communicate regular tracking of KPIs to stakeholders against product strategy and vision               Write, prioritize, and manage a backlog of epics and stories              Coordinate product testing for Conversational AI projects & releases, ensuring an optimal customer experience              Own your product and its end-to-end development, stay up to date on industry trends to ensure products maintain their competitive advantage                                                                                              The Skills You Bring                                                                              3+ years of experience working on an IT or business project management team and enthusiasm for rapid development              Understanding of agile/SCRUM methodologies              Strong communication and interpersonal skills with ability to communicate complex technical concepts and align organization on decisions              Organized and thoughtful approaches to problem solving; structures business problems clearly and effectively to create and evaluate potential solutions              Desire to work within a diverse group of people and passion for challenging the status quo              Strong work ethic and drive with an enthusiasm for owning your work and driving developmen                                                                                                         How We'll Have Your Back                                                                  Ally's compensation program offers market-competitive base pay and pay-for-performance incentives (bonuses) based on achieving personal and company goals. But Ally’s total compensation – or total rewards – extends beyond your paycheck and is designed to support and enrich your personal and professional life, including:                           Time Away:  competitive holiday and flexible paid-time-off, including time off for volunteering and voting.               Planning for the Future:  plan for the near and long term with an industry-leading 401K retirement savings plan with matching and company contributions, student loan and 529 educational assistance programs, tuition reimbursement, and other financial well-being programs.               Supporting your Health & Well-being:  flexible health and insurance options including dental and vision, pre-tax Health Savings Account with employer contributions and a total well-being program that helps you and your family stay on track physically, socially, emotionally, and financially.               Building a Family:  adoption, surrogacy, and fertility support as well as parental and caregiver leave, back-up child and adult/elder day care program and childcare discounts.               Work-Life Integration:  other benefits including LifeMatters® Employee Assistance Program, subsidized and discounted Weight Watchers® program and other employee discount programs.               Who We Are:   Ally Financial is a customer-centric, leading digital financial services company with passionate customer service and innovative financial solutions. We are relentlessly focused on ""Doing it Right"" and being a trusted financial-services provider to our consumer, commercial, and corporate customers. For more information, visit www.ally.com.   Ally is an equal opportunity employer committed to diversity and inclusion in the workplace. All qualified applicants will receive consideration for employment without regard to age, race, color, sex, religion, national origin, disability, sexual orientation, gender identity or expression, pregnancy status, marital status, military or veteran status, genetic disposition or any other reason protected by law.   Where permitted by applicable law, must have received or be willing to receive the COVID-19 vaccine by date of hire to be considered, if not currently employed by Ally.   We are committed to working with and providing reasonable accommodation to applicants with physical or mental disabilities. For accommodation requests, email us at work@ally.com. Ally will not discriminate against any qualified individual who is capable of performing the essential functions of the job with or without reasonable accommodation.                                                         ",9 days ago,"1,063 reviews"
https://www.indeed.com/viewjob?jk=631f01a2a297907a&from=web&vjs=3,140,Databricks Data Architect,Accenture,"Raleigh, NC 27609","     We are:     We are a leading partner to the world’s major cloud providers. The formation of Accenture Cloud First, with a $3 billion investment over three years, demonstrates our commitment to deliver greater value to our clients when they need it most. Our Cloud First multi-service group of more than 70,000 cloud professionals delivers a full stack of integrated cloud capabilities like data, edge, integrated infrastructure and applications, deep ecosystem skills, culture of change along with pre-configured industry solutions to shape, move, build and operate our clients’ businesses in the cloud. We combine world-class learning and talent development expertise; deep experience in cloud change management; and cloud-ready operating models with a commitment to responsible business by design — with security, data privacy, responsible use of artificial intelligence, sustainability and ethics and compliance built into the fundamental changes Accenture helps companies achieve.     You are:     As part of our  Data & AI  group, you will lead technology innovation for our clients through robust delivery of world-class solutions. There will never be a typical day and that’s why people love it here. The opportunities to make a difference within exciting client initiatives are unlimited in the ever-changing technology landscape.     The work:     You will be part of a highly collaborative and growing network of technology and data experts, who are taking on today’s biggest, most complex business challenges using the latest data and analytics technologies. We will nurture your talent in an inclusive culture that values diversity. You will have an opportunity to work in roles such as Cloud Data Engineer, Data Modeler or Data Architect covering all aspects of Data including Data Management, Data Governance and Data Migration. Come grow your career in Technology at Accenture!            What you need:         Minimum of 4 year’s of experience in Databricks engineering solutions on one of the Cloud platforms (Azure, AWS or GCP)      Minimum of 4 year’s of experience in Data Architecture and delivery experience on one of the Cloud platforms (Azure, AWS or GCP)      Minimum of 7 year’s of experience years of experience in Big Data/Hadoop, database and data warehouse architecture and delivery      Bachelor’s degree or equivalent work experience (minimum of 12 years), or an Associate degree with a minimum of 6 years of equivalent work experience        Bonus points if you have:         Certifications: Lakehouse Fundamentals, Developer Foundations Capstone, Developer Essentials Capstone, etc.      Extensive hands-on experience implementing Lakehouse architecture using Databricks Data Engineering platform, SQL Analytics, Delta Lake, and Unity Catalog      Extensive hands-on experience implementing serverless real-time/near real-time architecture using Cloud native services (i.e., Azure, AWS or GCP Tech Stack), and Spark technologies (e.g., Spark Streaming, Spark ML)      Cloud data migration methodologies and processes including tools like Azure Data Factory, Event Hub, etc.      Familiarity with the Technology stack available in the industry for data management, data ingestion, capture, processing, and curation: Kafka, StreamSets, Qlik/Attunity, GoldenGate, Hadoop, Hive, Hbase, Cassandra, Spark, Flume, Hive, Impala, etc.      Familiarity with Networking, Windows/Linux virtual machines, Container, Storage, ELB, auto-scaling is a plus      Experience in data governance fields as lineage, quality, catalog etc.      Multi-cloud experience        As required by the Colorado Equal Pay Transparency Act, Accenture provides a reasonable range of compensation for roles that may be hired in Colorado. Actual compensation is influenced by a wide array of factors including but not limited to skill set, level of experience, and specific office location. For the state of Colorado  only , the range of starting pay for this role is  $119,880 - $197,900  and  information on benefits offered is here.         COVID-19 update:      The safety and well-being of our candidates, our people and their families continues to be a top priority. Until travel restrictions change, interviews will continue to be conducted virtually.      Subject to applicable law, please be aware that Accenture requires all employees to be fully vaccinated as a condition of employment. Accenture will consider requests for accommodation to this vaccination requirement during the recruiting process.      What We Believe      We have an unwavering commitment to diversity with the aim that every one of our people has a full sense of belonging within our organization. As a business imperative, every person at Accenture has the responsibility to create and sustain an inclusive environment.      Inclusion and diversity are fundamental to our culture and core values. Our rich diversity makes us more innovative and more creative, which helps us better serve our clients and our communities.  Read more here      Equal Employment Opportunity Statement      Accenture is an Equal Opportunity Employer. We believe that no one should be discriminated against because of their differences, such as age, disability, ethnicity, gender, gender identity and expression, religion or sexual orientation.      All employment decisions shall be made without regard to age, race, creed, color, religion, sex, national origin, ancestry, disability status, veteran status, sexual orientation, gender identity or expression, genetic information, marital status, citizenship status or any other basis as protected by federal, state, or local law.      Accenture is committed to providing veteran employment opportunities to our service men and women.      For details, view a copy of the  Accenture Equal Opportunity and Affirmative Action Policy Statement .      Requesting An Accommodation      Accenture is committed to providing equal employment opportunities for persons with disabilities or religious observances, including reasonable accommodation when needed. If you are hired by Accenture and require accommodation to perform the essential functions of your role, you will be asked to participate in our reasonable accommodation process. Accommodations made to facilitate the recruiting process are not a guarantee of future or continued accommodations once hired.      If you would like to be considered for employment opportunities with Accenture and have accommodation needs for a disability or religious observance, please call us toll free at  1 (877) 889-9009 , send us an  email  or speak with your recruiter.      Other Employment Statements      Applicants for employment in the US must have work authorization that does not now or in the future require sponsorship of a visa for employment authorization in the United States.      Candidates who are currently employed by a client of Accenture or an affiliated Accenture business may not be eligible for consideration.      Job candidates will not be obligated to disclose sealed or expunged records of conviction or arrest as part of the hiring process.      The Company will not discharge or in any other manner discriminate against employees or applicants because they have inquired about, discussed, or disclosed their own pay or the pay of another employee or applicant. Additionally, employees who have access to the compensation information of other employees or applicants as a part of their essential job functions cannot disclose the pay of other employees or applicants to individuals who do not otherwise have access to compensation information, unless the disclosure is (a) in response to a formal complaint or charge, (b) in furtherance of an investigation, proceeding, hearing, or action, including an investigation conducted by the employer, or (c) consistent with the Company's legal duty to furnish information.      ",17 days ago,"21,634 reviews"
https://www.indeed.com/viewjob?jk=c6d8ef8e29cfe71b&from=web&vjs=3,150,Senior Director/VP of Business Insights & Data Science,avidxchange,"Charlotte, NC 28206"," AvidXchange is a leading provider of accounts payable (“AP”) automation software and payment solutions for middle market businesses and their suppliers. By trade, we are a technology company, but if you ask anyone that works here, they’ll tell you our people are at the core of who we are. We are all entrepreneurs who love to innovate and win with a passion for serving our customers. While we take personal ownership of our everyday work, we recognize that we only win as a team. Since our founding in 2000 in Charlotte, NC, we’ve created a company of over 1,600 teammates working in one of our 7 offices across the U.S., or remotely. But we're building more than a tech company – we're building an experience. We remain committed to a culture where you can fully be 'you’ – connected with others, chasing big goals and making a meaningful impact. If you want to help us grow while realizing your potential and creating stories you'll tell for years, you've come to the right place.      JOB OVERVIEW      You'll be responsible for running the Business Insights & Data Science organization, supporting the growth of the company with AvidXchange’s bank and direct customer base. This person will act as the thought leader on strategy and vision for these groups. The goal of the group is to provide reporting, insights, and tools to measure effectiveness of revenue, customer delivery operations and various cost/efficiency drivers.      JOB RESPONSIBILITIES            Leads business insights and data science teams which deliver to all customers and operating units within AvidXchange.     Be the independent driver of insights, reports and efficacy of operations and deliver across business unit and AvidXchange.     Be the thought leader and resident expert in use of data science, data engineering, and insight generation that will help make the business more successful.     Be the spokesperson and salesperson inside AvidXchange and outside for leveraging data to drive decisions and strategy.     Define, establish, and lead a standardized data-driven operating model across company     In partnership with SVP, get buy in from executives and other key leaders, define core KPIs for each operating unit, lead team to generate insights against those core KPIs, deliver self-service BI to empower operating units to run the business using data daily, and deliver data science solutions to optimize operating units.     Analyze the competitive landscape and spot trends and opportunities that could impact our ability to build valuable insights and analytics across the organization.     Create, develop, coach, and lead a high performing team.     Collaborate with cross functional leaders and effectively work within the organization to improve our margin, spot new revenue opportunities, and find ways to use data and insights to improve our overall Customer Experience.     Deliver analysis, tools, and report to enhance the knowledge and decision-making ability of various business departments.     Be the strategic and analytical leader that supports the broader AvidXchange teams, stakeholders, and investors through your teams’ data deliverables.     Identify opportunities to leverage insights, data science, and data reporting to optimize internal and external customer experiences, optimize internal operations, and help the organization scale through the use of company data as an asset.     EXPERIENCE, QUALIFICATIONS & SKILLS      Required Experience, Qualifications, and Skills            Minimum 10 years of experience generating insight using various sources of data and feedback from customers and stake holders. Deep knowledge of analytics, reporting tools and using statistical models and other techniques to provide business insights.     Multiple years of experience with modern data platforms to deliver insights, data science, and data engineering solutions     Superior analytical skills and insatiable business curiosity. Passionate about turning data into actionable information to drive value.     Ability to be a strategic, entrepreneurial, and operational leader that is required to grow a startup into a large, thriving center for excellence within a fast-growing organization.     Significant experience/expertise with best practices in insight generation, modeling and use of analytics.     Exemplary business partnership, cross functional influencing skills and organizational management skills.     Ability to perform effectively in a fast-paced, demanding environment.     Unquestioned professional integrity.     Strong written and oral communication and presentation skills.     Ability to build and motivate teams to produce quality materials within tight timeframes.     Ability to simultaneously manage multiple projects.     AvidXchange is an equal opportunity employer. AvidXchange is committed to equal employment opportunity in accordance with applicable federal, state, and local laws. AvidXchange will not discriminate against applicants for employment on any legally recognized basis. This includes, but is not limited to veteran status, race, color, religion, sex, sexual orientation, gender identity, gender expression, national origin, age and physical or mental disability.",28 days ago,114 reviews
