URL,page_count,job_title,company,location,job_Description,post_date,reviews
https://www.indeed.com/viewjob?jk=7b28d01d3ce5cc5a&from=web&vjs=3,30,Senior Data Scientist,Good Parents Inc.,United States,"  Good Parents is an innovative startup headquartered out of San Francisco, developing health monitoring and connected care platforms for pediatrics. Kiddo is our continuous remote patient monitoring system, providing a care coordination tool between patients, families and providers. Kiddo is primarily deployed via health systems, benefits providers and health foundations, to help providers and parents manage chronic conditions in children. Founded by seasoned entrepreneurs and a highly experienced team, we are headquartered in San Francisco and backed by leading Bay Area investors. We are actively expanding our team and looking for passionate and motivated professionals who are keen to join us in our next phase of growth.   Senior Data Scientist    Location : San Francisco / Bay Area   The Opportunity  Good Parents, Inc. has developed a leading remote patient monitoring platform (Kiddo) focused on pediatric applications. We are looking for a full-stack Senior Data Scientist to join our team and help extend Kiddo’s application to more pediatric chronic conditions, build advanced analytics and machine learning solutions to improve the performance and value of our data-powered products and experiences. This is an exciting opportunity for an engineer/scientist with a passion for bringing better health and care to children, who is dedicated to excellence in job performance and enjoys communicating and working with others in a dynamic, fast-growing, technology and product-led company.   Responsibilities / What you will do       Apply expertise in signal processing, machine learning, sensor fusion and other areas of machine intelligence, to create impactful data-driven products and digital experiences for patients, families and providers    Guide and support the creation and maintenance of high-quality datasets for machine learning    Enrich and enhance data from third-party sources, electronic health records and partner databases, as well as using augmentation techniques    Process, clean, transform and verify the data used for analysis, modeling and reporting    Develop and deploy predictive models in research and production environments    Guide and support the design, development and execution of clinical/health research studies to test, validate and improve model accuracy and overall Kiddo experience    Develop self-service dashboards, reports and frameworks for data and model integrity monitoring    Establish success criteria and performance indicators, in partnership with clinical research, engineering and product teams    Contribute to the improvement of the overall system architecture, communication between sub-systems (edge devices, mobile and cloud platform)    Communicate technical information, methods and findings clearly and concisely to technical and non-technical teams, stakeholders and senior management     What You Bring / Candidate Profile  The ideal candidate has demonstrated experience at the intersection of biomedical sensing, machine learning and cloud platforms in the healthcare industry. The candidate needs to be curious, self-motivated and have strong interpersonal and communication skills.   _ Required Education/Experience _      Master’s degree or higher in Engineering, Computer Science, or a related technical field    5+ years of professional experience in advanced analytics, machine learning, ML infrastructure and services, preferably in the medical device, health or fitness industry    Demonstrated experience with cloud services (e.g. Amazon AWS), infrastructure,     REST APIs, data pipelines and annotation tools      Demonstrated expertise with SQL, Python, ETL and modeling workflows    Experience with machine learning frameworks like Scikit-learn, PyTorch, Keras or TensorFlow    Experience or familiarity with data exploration, analysis and visualization tools    Excellent communication, presentation, time-management and analytical skills     _ Preferred _      Experience working in health, fitness or related industries    Experience with sensor signals, time-series analyses and sequence modeling    Familiarity or experience with deployments across edge devices/firmware, mobile and cloud    Experience with medical devices and associated regulatory frameworks for software development and machine learning systems     Job Type: Full-time   Pay: From $110,000.00 per year   Benefits:      401(k)    Dental insurance    Flexible schedule    Health insurance    Paid time off    Vision insurance     Schedule:      Monday to Friday     Education:      Master's (Preferred)     Experience:      Python: 3 years (Required)     Work Location: Multiple Locations ",,
https://www.indeed.com/viewjob?jk=005d901f8a29b992&from=web&vjs=3,30,"Computational Finance Sr. Associate, Deals Tech & Data",PRICE WATERHOUSE COOPERS,"Oklahoma City, OK 73102","A career in Technology and Data Solutions practice, within Deals Transaction Services, provides the opportunity to help organizations realize the potential of mergers, acquisitions, divestitures and capital markets. You will have the opportunity to leverage technology and data to drive better Deal decisions and execute transactions more effectively, helping companies originate, create, execute, and realize value from deals. Our team consists of well-rounded creative professionals who have a passion and aptitude for building technology driven solutions and pushing the boundaries of innovation in Deals. We are industry leaders in embedding technology, leveraging data analysis, machine learning, and artificial intelligence for a broad range of Deal-focused solutions. To really stand out and make us fit for the future in a constantly changing world, each and every one of us at PwC needs to be a purpose-led and values-driven leader at every level. To help us achieve this we have the PwC Professional; our global leadership development framework. It gives us a single set of expectations across our lines, geographies and career paths, and provides transparency on the skills we need as individuals to be successful and progress in our careers, now and in the future. As a Senior Associate, you'll work as part of a team of problem solvers, helping to solve complex business issues from strategy to execution. PwC Professional skills and responsibilities for this management level include but are not limited to: Use feedback and reflection to develop self awareness, personal strengths and address development areas. Delegate to others to provide stretch opportunities, coaching them to deliver results. Demonstrate critical thinking and the ability to bring order to unstructured problems. Use a broad range of tools and techniques to extract insights from current industry or sector trends. Review your work and that of others for quality, accuracy and relevance. Know how and when to use tools available for a given situation and can explain the reasons for this choice. Seek and embrace opportunities which give exposure to different situations, environments and perspectives. Use straightforward communication, in a structured way, when influencing and connecting with others. Able to read situations and modify behavior to build quality relationships. Uphold the firm's code of ethics and business conduct. Demonstrates thorough abilities and/or a proven record of success as a model developer with a detailed understanding of the model development lifecycle, and in applying quantitative analysis for development and maintenance of statistical models. In addition, demonstrates thorough abilities and/or a proven record of success in the following: Analyzing complex financial services data, leveraging programming skills and computational techniques for large data sets and quantitative analyses; Conducting research and building econometric, statistical, and analytical models to solve real world problems; Designing and developing models for strategic decision support and scenario analysis - including simulation modeling and optimization techniques; Utilizing quantitative techniques to analyze complex client problems and develop solutions; Conducting pertinent client, industry, or technical research to solve clients’ problems; Communicating the results of analysis to all stakeholders, technical as well as non-technical; Possessing thorough level of ability with quantitative programming skills (Python, R) to develop and deploy financial models; Possessing considerable knowledge of probability and statistics principles; Possessing thorough level of ability with a wide range of regression and classification modeling techniques: logistic/linear regression, time series modeling, hazard rate modeling, decision tree analysis, segmentation/cluster analysis etc; Possessing thorough level of ability with simulation modeling algorithms and techniques; Possessing considerable ability with optimization techniques; and, Possessing thorough level of ability with machine learning/AI algorithms. At PwC, our work model includes three ways of working: virtual, in-person, and flex (a hybrid of in-person and virtual). Visit the following link to learn more: https://pwc.to/ways-we-work.  PwC does not intend to hire experienced or entry level job seekers who will need, now or in the future, PwC sponsorship through the H-1B lottery, except as set forth within the following policy: https://pwc.to/H-1B-Lottery-Policy.  All qualified applicants will receive consideration for employment at PwC without regard to race; creed; color; religion; national origin; sex; age; disability; sexual orientation; gender identity or expression; genetic predisposition or carrier status; veteran, marital, or citizenship status; or any other status protected by law. PwC is proud to be an affirmative action and equal opportunity employer.  For positions based in San Francisco, consideration of qualified candidates with arrest and conviction records will be in a manner consistent with the San Francisco Fair Chance Ordinance.  For positions in Colorado, visit the following link for information related to Colorado's Equal Pay for Equal Work Act: https://pwc.to/coloradoadvisoryseniorassociate.  #LI-Remote",30+ days ago,"7,977 reviews"
https://www.indeed.com/viewjob?jk=9265ce23af9f1cf6&from=web&vjs=3,30,Staff Data Scientist,Lifespark,United States,"Lifespark’s Product and Engineering team is growing! We are having great success building custom solutions for our teammates in order to bring to light the first-ever community based population health platform. Our focus, and our passion is to provide holistic Lifecare, not just healthcare, to help people age magnificently. Come join us and be a part of building something truly meaningful from the ground up with a diverse team of committed, humble, awesome people — all fully remote from anywhere in the country!  Lifespark, headquartered in Minneapolis, Minnesota (with our engineering team spread across the country), has been sparking lives for 15 years and it is time to take our “Whole Person Senior Care” model to a greater reach. To do that, we need you to come and help us build the “best in class” platform for whole-person health. Lifespark has an award-winning culture - LeadingAge 'Excellence in the Workplace' 2015 award winner, and Star Tribune Top 100 Workplace 2014. We are focused on breaking the roller coaster of the health care crisis by stopping re-hospitalizations. With our Lifespark ExperienceTM, we are improving the journey for people in the second half of life, using proactive guidance and just the right level of support to create a pathway to living a more meaningful and gratifying life. In short, we spark lives. To find out more, visit  www.lifespark.com . As our most senior data scientist, you will provide leadership across our data science and analytics efforts. With your expertise, we will create predictive and prescriptive insights to support Lifespark Complete, our unique approach to holistic senior health. In this new role, you will be laying the foundations of how we unlock the insights hidden within all our data. In partnership with our new Director of Data and Analytics, you will help to define our strategies around data governance, security, analysis, and AI/ML. You will bring your passion for how data can transform lives. This hands-on role will require the development of solid processes around data cleanliness, feature building, analysis, and machine learning life cycle management. Have your favorite toolset? We would love to hear about how you have done this in the past. This role requires excellent communication skills, you will be a fantastic storyteller as you identify new business questions, develop analytical methods to answer those questions, and conduct experiments to validate our assumptions. All while being hyper-focused on quality outcomes for our members. Come use your superpowers for good and join us in Sparking Lives. How will you spend your days:  Building solutions for our model - Identification systems, clinical decision support, predictive, survival analysis, etc. Working closely with data engineering to develop features, predictive and prescriptive models that have a solid impact on senior’s lives Delivering and supporting the delivery of retroactive analysis in order to provide a deeper understanding of the Lifespark Complete initiatives. Leveling us up on MLOps and the Machine Learning production lifecycle Working closely with business partners throughout the population health organization in order to closely align data products with actionable insights that drive interventions and lead to improved outcomes Building and testing machine learning models that increase population health efficacy Presenting compelling reports that support the business with powerful stories and statistically sound analysis Leveling up all those around you in how to think about data science and analysis What you’ll bring to the team:  MS in Statistics, Mathematics, Computer Science, Economics, or equivalent. Proven experience as a technical leader 10+ years professional experience 5+ years of applied data science/data modeling experience. Ability to analyze large amounts of structured and unstructured data and determine suitability for modeling. Broad understanding and demonstrated history of applying various methods to bring tremendous value to people. Strong modeling foundation – hands-on expertise with data mining and statistical modeling techniques such as clustering, classification, regression, tree-based methods, neural nets, support vector machines, anomaly detection. Build, test, and maintain the infrastructure and tools to facilitate the consistent and automated AI software solution development and release process. Experience with production Machine Learning life cycle management Expertise in modern advanced analytical tools and programming languages such as Python or R. Efficient in SQL, PIG, Hive, SparkSQL, etc. Experience with Graph databases and NLP in Healthcare and Population health context is a strong plus! A deep understanding of Data Governance and Lifecycle management Proven track record with reports, presentations, and other storytelling methodologies. A commitment to testing and quality. Come teach us a thing or two about your approach toward quality. A bias toward action. You love to push things forward and find creative ways to work around blockers. A positive and energetic attitude Deep experience as a remote contributor. We are fully distributed throughout the US; come help us make it better. Willingness and ability for travel and off-hours support - we need to get together every once in a while, and see each other's smiling faces, let’s meet in your hometown! IT HAS BEEN AND WILL CONTINUE TO BE OUR POLICY TO PROVIDE EQUAL EMPLOYMENT OPPORTUNITIES TO ALL EMPLOYEES AND APPLICANTS WITHOUT REGARD TO RACE, COLOR, CREED, RELIGION, SEX, GENDER IDENTITY, PREGNANCY, NATIONAL ORIGIN, CITIZENSHIP, MARITAL STATUS, FAMILIAL STATUS, AGE, SEXUAL ORIENTATION, VETERAN STATUS, DISABILITY, PUBLIC ASSISTANCE STATUS, GENETIC INFORMATION OR ANY OTHER STATUS PROTECTED BY FEDERAL, STATE, OR LOCAL LAW. #LSCORP",27 days ago,4 reviews
