URL,page_count,job_title,company,location,job_Description,post_date,reviews
https://www.indeed.com/viewjob?jk=a074ae14de799267&from=web&vjs=3,40,Director of the Center for Biomedical Data Sciences,Oklahoma Medical Research Foundation,"Oklahoma City, OK 73104","    Overview:        OMRF’s excellence can only be fully realized by individuals who share our commitment to diversity, equity and inclusion. Successful candidates will demonstrate commitment to these values. OMRF strives for an inclusive environment and we especially encourage those that identify as women, or a member of an underrepresented minority to apply.              Benefits           We offer competitive salaries and comprehensive benefits including, medical, dental, and vision insurance, minimum 8% company retirement contribution, vacation and sick leave, paid holidays, onsite café, free onsite fitness center with access to personal trainer, free parking and much more! Relocation assistance available for those located 50 miles outside of Oklahoma City metro and out of state. Learn more about our benefits here.    Responsibilities:        The Oklahoma Medical Research Foundation (OMRF) seeks an inaugural Director for its new Center for Biomedical Data Sciences. The Director will have significant support and resources to establish this new center. OMRF is one of the oldest independent medical research institutes in the U.S. Its internationally recognized scientists conduct laboratory and patient-oriented research in autoimmunity, cardiovascular biology, cell biology, genetics and genomics, aging and metabolism, and other topics.              Center Mission:     The amount and types of data generated in biomedical research are expanding at an unprecedented pace. From large-scale genomic sequencing to metabolomic and high-dimensional imaging analyses, expertise and leadership are needed to enable more effective integrated, systems-level analyses to gain biologically and clinically meaningful insight from complex data. Comprehensive data analytics involving biostatistical methods, data modeling, and visualization tools are utilized in all types of research at OMRF, from basic model organism studies to clinical investigations. The mission of the Center is to bring cutting-edge, integrated data analytic knowledge and support to the OMRF community. First, the Center will serve as a hub for recruiting experts who will work collaboratively across a range of scientific disciplines in all research programs to develop and deploy innovative data science support. This activity will expand collaboration between and within research programs at OMRF. Second, the Center will function as an educational resource to train the OMRF scientific community on how to implement data analytic tools to advance their scientific goals. Third, the Center will provide leadership in organizing computational and related resources, in strategic planning to support basic and clinical research, and in expanding the research opportunities at OMRF.              Center Director Position Description:     The Director of the Center for Biomedical Data Sciences will work with senior leadership to develop and execute a comprehensive strategy for advancing biomedical data analytics with research teams throughout OMRF. The Director will report to the VP of Research and the VP of Clinical Affairs and will be responsible for fulfilling the mission of the Center, recruiting and managing Center members, overseeing research-focused computational and analytic resources, and contributing to strategic planning at OMRF. The Director will work closely with OMRF’s program chairs and investigators to build a team of collaborative Center members that support diverse, biomedical research programs. The Director and Center members will be evaluated through a new collaborative data science career ladder emphasizing multi-investigator and co-investigator activity. As the founding Director, the successful candidate is expected to provide leadership in defining the best practices for high-dimensional data utilization and required resources (tools and training) to help OMRF thrive in an expanding data-intensive research environment. The ideal candidate will be a driving force for collaborative, multi-investigator funding initiatives.              Duties include:           Participates in establishing strategic plans and objectives. Provides high-level guidance and support to Center team members and OMRF scientists. Regularly interacts with leadership on matters affecting the organization.      Anticipates and recognizes data analytic challenges and makes recommendations for solutions and allocation of resources needed to meet the research goals of OMRF investigators.      Maintains a nationally-recognized reputation in biomedical data sciences through collaborative scholarly activity, including multi-investigator publications and extramural funding, participation in national meetings, and development of new data analytic techniques and approaches.      Leads, mentors, evaluates, and recruits a motivated and talented team, including biostatisticians, computational scientists, and data visualization experts.      Works closely with information technology and other relevant technology cores.      Develops strong partnerships with regional research-intensive universities and undergraduate-focused institutions to foster collaborations, develop local talent pipelines, and grow biomedical data science resources in Oklahoma.           Learn more about the role specifications here.    Minimum Qualifications:        Associate Professors or other mid-career individuals from the non-profit or industry sectors who seek a leadership position that values team-based research utilizing data analytic tools and expertise to strengthen and expand biomedical discoveries preferred. However, candidates at all career levels will be considered.              Typically requires a minimum of 12 years of related experience, including at least 5 years of successful leadership experience and a Ph.D. in bioinformatics, statistics, clinical science, biological science, or equivalent combination of education and experience.              Proven track record of contributions demonstrated by successful completion of multiple collaborative projects addressing a variety of biological problems, highly cited publications, impactful tools, products, or data sets used by the scientific community, presentations at international conferences, and awards.          Track record of successful NIH and/or other extramural grant applications (including multi-investigator) in relevant fields.           Deep understanding of systems biology, bioinformatics, clinical informatics, and/or modern statistical and machine-learning tools for analysis of various datasets.          Exceptional communication skills with the ability to collaborate, seek constructive feedback, build relationships, promote teamwork, and remain flexible and adaptable to change.              OMRF has mandated the COVID-19 vaccine for all employees, excluding those with an approved medical or religious accommodation, as a condition of employment. Applicants must have received, or be willing to receive, a COVID-19 vaccine by their start date to be considered for employment.     ",30+ days ago,30 reviews
https://www.indeed.com/viewjob?jk=945ec9a1bcd9b04e&from=web&vjs=3,40,Assistant Staff Scientist / Associate Staff Scientist / Staff Scientist - COVID Immunology,Oklahoma Medical Research Foundation,"Oklahoma City, OK 73104","Assistant Staff Scientist / Associate Staff Scientist / Staff Scientist - COVID Immunology  Overview OMRF is an independent, not-for-profit biomedical research institute adjacent to the University of Oklahoma Health Sciences Center (OUHSC) campus in Oklahoma City. Oklahoma City offers a dynamic and flourishing downtown area, with low cost of living, short commute times and a diversified economy. The Oklahoman newspaper ranked OMRF as Oklahoma's #1 large workplace in their annual Best Places to Work survey for 2017 and 2019. OMRF supports a comprehensive postdoctoral training program (https://omrf.org/about-omrf/education-outreach/postdoctoral-programs/). OMRF's excellence can only be fully realized by individuals who share our commitment to diversity, equity and inclusion. Successful candidates will demonstrate commitment to these values. OMRF is an Equal Opportunity/Affirmative Action Employer. All qualified applicants will receive consideration for employment without regard to gender, sexual orientation, gender identity, race, color, national origin, age, religion, disability, veteran status or any other legally protected characteristic.   Benefits  We offer competitive salaries and comprehensive benefits including, medical, dental, and vision insurance, minimum 8% company retirement contribution, vacation and sick leave, paid holidays, onsite cafe, free onsite fitness center with access to personal trainer, free parking and much more! Relocation assistance available for those located 50 miles outside of Oklahoma City metro and out of state. Learn more about our benefits here.    Responsibilities Are you ready to join the fight against COVID19? The James lab is hiring for an Assistant / Associate / Staff Scientist to design and conduct research experiments; prepare reports and papers for publication, presentation and future research; assists with grant writing; and oversee and/or manage research projects, summarize and present results, as well as guiding/leading graduate students, postdocs, and lab staff; may manage staff.  Knowledge, Skills, and Abilities: Knowledge of the principles and practices of scientific theory and research; demonstrates skill in formulating and testing hypotheses; ability to conduct scientific research experiments; to analyze and summarize data and results; to write technical, scientific papers; to write grants and to communicate effectively both orally and in writing; to mentor students and guide/direct the work of less senior scientists    Qualifications Ph.D. in Immunology preferred, but Molecular Biology, Pathology, Biostatistics, Cell Biology or a related field with some Immunology training or experience may be sufficient. Good written and oral communication skills necessary. Ability to communicate and write summaries of results required.Must be willing to serve as a project lead, assemble data, make summary slides, help with progress reports, assist with papers, etc.OMRF has mandated the COVID-19 vaccine for all employees, excluding those with an approved medical or religious accommodation, as a condition of employment. Applicants must have received, or be willing to receive, a COVID-19 vaccine by their start date to be considered for employment.   To apply, visit  https://careers-omrf.icims.com/jobs/1031/assistant-staff-scientist/job?in_iframe=1   OMRFs excellence can only be fully realized by individuals who share our commitment to diversity, equity and inclusion. Successful candidates will demonstrate commitment to these values. OMRF is an Equal Opportunity/Affirmative Action Employer. All qualified applicants will receive consideration for employment without regard to gender, sexual orientation, gender identity, race, color, national origin, age, religion, disability, veteran status or any other legally protected characteristic. jeid-37d24b6c5fd55e489ee911be8df26c1c",30+ days ago,30 reviews
https://www.indeed.com/viewjob?jk=6a051c27e5dce3bb&from=web&vjs=3,30,Data Science Manager-REMOTE,"CCI Systems, Inc.","Oklahoma City, OK 73102","         Why CCI?  CCI Systems, Inc. is an Employee-Owned solution provider specializing in telecommunications, comprehensive network assessments, industry-leading engineering, drafting and design services, and 24/7 support services. Come join our team of engineers and experts that guide our customers toward the right choices to future-proof their network for years to come. Our outstanding team-based work culture and environment has allowed us to grow, develop, and retain long-term employees. We value our employee’s hard work and determination and REWARD results all while having fun!      Our mission  is to make life better by connecting people through innovative communication systems.      We are seeking   a  Data Science Manager  to provide leadership and coaching for the Data Science team and act as a liaison for the business unit and project stakeholders. You will provide expert support and development to the data science environment through knowledge and experience of data model creation, machine learning, analytics, and automation. This key working management position works within the IT team to provide effective leadership and support in coordinating IT resources to achieve and maintain optimally performing data solutions to meet the needs of the enterprise. You will incorporate industry best practices and concepts in the design of data solutions and models that solve business challenges and optimize efficiency, visibility into data, and capability to scale as the company grows.          Responsibilities           In collaboration with senior management, determine all budgetary needs as they relate to you and your direct reports and your systems.       Ensure team and system observance of all development, security, and compliance standards.       Manage support tickets and ensure end user satisfaction while resolving incidents.       Lead and participate in requirements gathering, prioritization, and peer review to facilitate execution of standard development processes.       Architect, develop, and maintain technical tools and platforms needed to accomplish data science initiatives.       Design and develop data models to achieve business objectives including machine learning, predictive analytics, and automation.       Adjust, monitor, and maintain data models.       Provide technical and architectural oversight for assigned projects.       Understand potential performance impacts of system changes and help to ensure performance is maximized.       Participate as an expert resource in process improvement and automation initiatives.       Work closely with IT and Business Management to identify new potential solutions to streamline processes, reduce cost, and increase revenue generation.       Participate in requirements definition, analysis, and implementation of new data science deliverables.       Publish and communicate security and governance compliance with IT and business units.       Create and promote the company image through exercising sound and ethical business practices as related to employees, the public and customers. This includes ensuring that service and quality provided to customers is superior to that of our competition.       Ensure confidentiality of company information.       Perform other related duties as assigned by management.              Required skills we are looking for           Bachelor’s degree in mathmatics, data science/analytics, or computer science is required; Master’s degree in data science preferred.       5+ years’ experience working in a Data Science role with 2+ years in a lead/principal role required.       Experience building a data science program from scratch is preferred.       Experience selecting and implementing software and systems to facilitate data science initiatives and solutions is preferred.       Practical experience of data architecture concepts and best practices.       Practical experience working with relational databases and SQL.       Practical experience working with unstructured datasets.       Experience working with data analysis tools and languages such: Python, R, TensorFlow, and Hadoop.       Excellent computer skills including the use of Microsoft Office and various web-based applications.       Strong problem solving and creative solution development skills.       Proven ability to effectively prioritize and execute tasks in a high-pressure environment is crucial.       Effectively work independently and in a team-oriented, collaborative environment is essential.       Excellent written, oral, and interpersonal communication skills and ability to interface & communicate professionally.       Willingness to learn, adapt and accept increased responsibility.       Highly responsible, resourceful, accurate, dependable, and self-motivated.       Leadership with skills to positively influence others, collaborate with teammates, communicate on the level of others, listen, and understand people in circumstances common in the workplace.       The ability to embrace corporate values, understands the company mission, and exemplifies CCI leadership behaviors.              Shift is  Monday-Friday between the hours of 8:00 a.m. to 5:00 p.m. CST and must be able to work outside normal business hours when required.      ",20 days ago,78 reviews
https://www.indeed.com/viewjob?jk=33311fc9d4b97dd4&from=web&vjs=3,40,Medical Lab Scientist (MLS),Ascension,"Tulsa, OK 74145","    We Are Hiring:         Title:  Medical Lab Scientist     Department:Lab Microbiology         Schedule:  40 hours weekly, Full Time Day Shift M-F, weekend rotation       Location : RML 41st Mingo, Tulsa, Ok.     Regional Medical Laboratory Inc. (RML), part of Ascension St. John, is a nationally-renowned commercial reference laboratory that provides testing services for physicians and hospitals within a four-state region and performs more than 9 million procedures each year. RML provides services for multiple hospitals in the Oklahoma region and several satellite locations in Tulsa, northeastern and central Oklahoma and southeastern Kansas.  What You Will Do:        Performs routine diagnostic and analytic testing of laboratory specimens independently.           Perform, validate, interpret, document and report laboratory test results.      May collect and process specimens.      Perform instrument maintenance and troubleshooting.      Execute and evaluate quality control and quality assurance procedures.      Document and report as required by regulatory agencies.      Understand and participate in all aspects of clinical laboratory testing; pre-analytical, analytical, and post-analytical.      Anticipate and maintain required supplies for uninterrupted testing.      Assist with data collection or special projects as assigned.      Assist in documentation, evaluation and submission of all required laboratory, departmental and staff statistics/reports.      Assist in training and mentoring MLTs, new associates and students.     What You Will Need:        Licensure / Certification / Registration:           Medical Technologist (ASCP) credentialed from the American Society for Clinical Pathology Board of Certification (ASCP-BOC) preferred.      Medical Lab Scientist (ASCP) credentialed from the American Society for Clinical Pathology Board of Certification (ASCP-BOC) preferred.      Medical Tech credentialed from the American Board of Bioanalysis (AAB) preferred.      Medical Tech credentialed from the American Medical Technologists (AMT) preferred.           Education:           Bachelor's degree in medical technology, medical laboratory scientist, human sciences or education qualifications as stated per CLIA requirements.     Additional Preferences:        No additional preferences.    Why Join Our Team:        Beginning as a 50-bed hospital in 1926, Ascension St. John has expanded to include multiple hospital locations, incorporating the skills of more than 7,000 employees throughout northeastern Oklahoma. We offer generous paid time off for work-life balance, a collaborative work environment, professional development opportunities, and more to help our associates flourish personally and professionally. If you are looking for a rewarding career in healthcare, we invite you to apply today.          When you join Ascension, you join a team of over 150,000 individuals across the country committed to a Mission of serving others and providing compassionate, personalized care to all. Our inclusive culture, continuing education programs, career coaches and benefit offerings are just a few of the resources and tools that team members can use to create a rewarding career path. In fact, Ascension spent nearly $46 million in tuition assistance alone to support associate growth and development. If you are looking for a career where you can grow and make a difference in your community, we invite you to join our team today.       Equal Employment Opportunity Employer:        Ascension St. John is an Equal Employment Opportunity (EEO) and Affirmative Action employer. Associates and Applicants receive fair and impartial consideration without regard to race, color, religion, national origin, citizenship, gender identity, sexual orientation, age, physical or mental disability, veteran status, genetic data, or other legally protected status.          Pay Non-Discrimination Notice:           https://www.dol.gov/sites/dolgov/files/ofccp/pdf/pay-transp_%20English_formattedESQA508c.pdf          For further information regarding your EEO rights, click on the following link to the “EEO is the Law” poster:          http://www.dol.gov/ofccp/regs/compliance/posters/pdf/eeopost.pdf          EEO is the Law Poster Supplement          Please note that Ascension will make an offer of employment only to individuals who have applied for a position using our official application. Be on alert for possible fraudulent offers of employment. Ascension will not solicit money or banking information from applicants.    E-Verify Statement:        This employer participates in the Electronic Employment Verification Program. Please click the E-Verify link below for more information.          E-Verify     ",3 days ago,"7,518 reviews"
