URL,page_count,job_title,company,location,job_Description,post_date,reviews
https://www.indeed.com/viewjob?jk=893a31a68c2804b9&from=web&vjs=3,80,"Data Engineer, Analytics & Cognitive - Consultant (SQL/Python)",Deloitte,"127 Public Square Suite 3300, Cleveland, OH 44114","Data Engineer, Analytics & Cognitive - Consultant (SQL/Python)   The Team   Analytics & Cognitive  In this age of disruption, organizations need to navigate the future with confidence, embracing decision making with clear, data-driven choices that deliver enterprise value in a dynamic business environment.  The Analytics & Cognitive team leverages the power of data, analytics, robotics, science and cognitive technologies to uncover hidden relationships from vast troves of data, generate insights, and inform decision-making. Together with the Strategy practice, our Strategy & Analytics portfolio helps clients transform their business by architecting organizational intelligence programs and differentiated strategies to win in their chosen markets.  Analytics & Cognitive will work with our clients to:    Implement large-scale data ecosystems including data management, governance and the integration of structured and unstructured data to generate insights leveraging cloud-based platforms Leverage automation, cognitive and science-based techniques to manage data, predict scenarios and prescribe actions Drive operational efficiency by maintaining their data ecosystems, sourcing analytics expertise and providing As-a-Service offerings for continuous insights and improvements    Qualifications   Required:    2+ years of relevant technology consulting or industry experience to include experience in Information delivery, Analytics and Business Intelligence based on data  2+ years experience in Python and/or R  2+ years experience SQL  2+ years of hands on experience with data core modernization and data ingestion.  1+ years experience leading workstreams or small teams  Bachelor's Degree or equivalent professional experience  Travel up 50% (While 50% of travel is a requirement of the role, due to COVID-19, non-essential travel has been suspended until further notice  Limited immigration sponsorship may be available.    Preferred:  An advanced degree in the area of specialization is preferred.  Experience with Cloud using Amazon Web Services (AWS), Microsoft Azure, and/or Google Cloud Platform (GCP)  Experience with PySpark, Spark, Scala  Understanding of the benefits of data warehousing, data architecture, data quality processes, data warehousing design and implementation, table structure, fact and dimension tables, logical and physical database design, data modeling, reporting process metadata, and ETL processes.  Experience designing and implementing reporting and visualization for unstructured and structured data sets  Experience designing and developing data cleansing routines utilizing typical data quality functions involving standardization, transformation, rationalization, linking and matching  Knowledge of data, master data and metadata related standards, processes and technology  Experience working with multi-Terabyte data sets  Experience with Data Integration on traditional and Hadoop environments  Strong oral and written communication skills, including presentation skills (MS Visio, MS PowerPoint).  A&C_Consulting21  ANCCON",30+ days ago,"10,446 reviews"
https://www.indeed.com/viewjob?jk=e71abde166e4cb61&from=web&vjs=3,70,Statistician,Genesis Biotechnology Group,"Fairfield, OH 45014","STATKING Clinical Services (SCS) , a member of Genesis Biotechnology Group, is a full service contract research organization for the pharmaceutical and medical device industries located in Fairfield, OH, is seeking a  Statistician  to provide statistical support for clinical trials. The qualified individual will consult on clinical trial design, write statistical sections of clinical trial protocols, Statistical Analysis Plans, and other statistical documents, and review data analysis output. SCS has provided clinical trial services to our clients for over thirty years. At SCS you will be an integral part of our statistical team. You will work on several projects in a variety of drug, biologic, and medical device areas, providing support for new product development and regulatory submissions. This full-time position requires : A PhD in Statistics or Biostatistics, some experience preferred Excellent oral and written communication skills Ability to work both independently and in a team environment Proficiency with Microsoft Word Excellent SAS® programming skills The following characteristics would be a plus in considering applicants : Experience in the preparation of statistical documents for clinical trials, such as Statistical Analysis Plans 3-5 years of statistical consulting experience, particularly for clinical trials Knowledge of the submission process for NDAs/PMAs/BLAs We Offer: Competitive Salary Medical, Dental & Vision Insurance Short and Long Term Disability Life Insurance Dependent Care Flex Spending Account Voluntary Policies (Accident, Hospital Indemnity, Critical Illness & Supplemental STD) Legal Plan & Identity Theft Protection 401(k) Plan Paid Vacation & Holiday Business Casual Environment Credit Union STATKING is an equal opportunity employer.",5 days ago,43 reviews
https://www.indeed.com/viewjob?jk=512788dee1f4c9d5&from=web&vjs=3,70,Senior Data Analyst,Ryder System,"Cleveland, OH 44101","Current Employees:  If you are a current employee at Ryder (not a Contractor or temporary employee through a staffing agency), please click here (http://wd5.myworkday.com/ryder/d/task/1422$3.htmld) to log in to Workday to apply using the internal application process. To learn how to apply for a position using the Career worklet, please review this quick reference guide (https://rydersystems.service-now.com/sys\ attachment.do?sys\ id=a39f83621bd99050632a4223cd4bcb91) .   (https://ryder.com/job-applicant-privacy-policy)  You are the driving force behind our company.  Start your career with Ryder today!  Summary  The Senior Data Analyst role is to support delivery of final business solutions to the operation through Product Development. The Senior Data Analyst’s technical skills will be put to the test as they explore data and present crispy insights and a smooth user experience. The Senior Data Analyst is expected to be a supply chain data expert and their use cases. This position will work on cutting edge data technology as a key user on Ryder's Azure Data Lake driving the analytics initiatives as an expert in this field. Will be involved in data sourcing and designing data warehouses, data marts, critical analytical dashboards, reports and queries to drive strategic business decisions for internal Ryder teams and external customers. Dig deep into the core issues of business problems in order to drive a solution that gets at the heart of the causative problem. On this team, the Senior Data Analyst will get the chance to be the expert on data management, collaborating with Data Analysts, Engineers and Scientists and operations leadership, using all the skills in order to exploit data to drive the business forward. This will push the envelope of what is possible within the big data space; streaming live data into a data lake and experimenting with data in the data sandbox and be part of the future Ryder’s cutting-edge technologies.  Essential Functions  Gather and explore data by understanding operational processes and business needs, interpret and integrate data and translate this into usable outputs or visualizations to drive business decisions.  Work with Product Development team, evaluating their needs and ad-hoc requests to prioritize product efforts creating innovative solutions.  Enhance data maturity and integration to standardize the core value add functionality enabling a multiplier effect.  Experience working within a collaborative team. Mentor junior members and peers to achieve success.  Challenge the status quo and help guide entrepreneurial innovation in both analytical products and the curation of new data sources elevating analytics beyond data pulling and reporting to the delivery actionable insights and setting best practices.  Knowledge of the Ryder Business, understanding the complexity of the supply chain world and the role that data has within this ecosystem.  Additional Responsibilities  Performs other duties as assigned.  Skills and Abilities  Experience developing data and BI solutions with tools like:  Scrum methodology  Power BI  Tableau  Azure Data Factory  Exposure using tools like:  ETL tools (SSIS, Alteryx)  Data manipulation tools (SQL, Python). Expertise on transact-SQL commands including complex queries, views, functions, stored procedures, cursors and triggers on SQL server.  Object oriented development stacks (.net)  Strong verbal and written communication skills, with an ability to express complex technical concepts in business terms  Support product innovation, working closely with technology throughout the build, test, and release of the product using agile methodologies  Qualifications  Bachelor's degree required in Computer Science, Data Analytics or equivalent.  Master's degree preferred in Supply Chain, Data Analytics, Computer Science or equivalent.  Five (5) years or more Applied Project(s) experience in demonstrating, digital transformation, data management projects. Required  Two (2) years or more experience in creating dashboards for diagnostic analysis across the business. Experience working in a cloud environment. Required  Five (5) years or more working in an individual contributor role as a key member of the team that others rely on. Preferred  Travel 0-20%  Job Category:  Data Science & Analytics  Ryder is proud to be an Equal Opportunity Employer and Drug Free workplace. All qualified applicants will receive consideration for employment without regard to race, religion, color, national origin, sex, sexual orientation, gender identity, age, status as a protected veteran, among other things, or status as a qualified individual with disability.   (https://ryder.com/job-applicant-privacy-policy)  \#wd",17 days ago,"4,936 reviews"
https://www.indeed.com/viewjob?jk=1195ccb7f6c16d84&from=web&vjs=3,80,"Telco, Media & Entertainment- AI and Data Transformation Manager",Deloitte,"127 Public Square Suite 3300, Cleveland, OH 44114","Telco, Media & Entertainment- AI and Data Transformation Manager  Our Telecommunications, Media and Technology (TMT) industry clients include some of the most valued companies in the U.S. and many of the world's top global brands. We are poised to help clients shape their evolving business models, scale and transform their operations, modernize their processes and technologies, and constantly improve their customer experience. Our  Telecommunications, Media & Entertainment  sector includes the world leaders in telecommunications, media, entertainment, sports, business information services, and digital platform companies - for search, social, marketing, analytics, etc.   The Team Analytics & Cognitive In this age of disruption, organizations need to navigate the future with confidence, embracing decision making with clear, data-driven choices that deliver enterprise value in a dynamic business environment.  The Analytics & Cognitive team leverages the power of data, analytics, robotics, science and cognitive technologies to uncover hidden relationships from vast troves of data, generate insights, and inform decision-making. Together with the Strategy practice, our Strategy & Analytics portfolio helps clients transform their business by architecting enterprise programs and differentiated strategies to win in their chosen markets.  The Analytics& Cognitive team works with our clients to:  Implement large-scale data ecosystems including data management, governance and the integration of structured and unstructured data to generate insights leveraging cloud-based as well as client-owned platforms Deploy automation and cognitive and science-based techniques to manage data, predict scenarios and prescribe actions Drive operational efficiency by maintaining their data ecosystems, sourcing analytics expertise and providing As-a-Service offerings for continuous insights and improvements  Work you'll do At Deloitte you will manage and deliver components of client engagements that identify, design, and implement technology and creative business solutions for large companies. Key responsibilities will include:  Architect, Position, Design, Develop and Deploy enterprise solutions which include components across the Artificial Intelligence spectrum such as Chatbots, Virtual Assistants, Machine Learning, and Cognitive Services Manage teams in the identification of business requirements, functional design, process design (including scenario design, flow mapping), prototyping, testing, training, defining support procedures. Formulate planning, budgeting, forecasting and reporting strategies. Manage full life cycle implementations. Develop statements of work and/or client proposals. Identify business opportunities to increase usability and profitability of information architecture. Experience with program leadership, governance and change enablement. Develop and manage vendor relationships. Lead workshops for client education. Manage resources and budget on client projects. Assist and drive the team by providing oversight. As a  Manager,  you will lead and deliver small or components of large, complex client engagements that identify, design, and implement creative business and technology solutions for large companies.  Manager level responsibilities include:  providing service excellence by identifying key client business issues, determining client needs by supplementing the standard assessment techniques and tools with innovative approaches, evaluating and validating analysis and developing recommendations for the client in the context of the overall engagement. You will be expected to implement and oversee the quality of deliverables and effectively manage the team and day-to-day relationships to ensure exceptional performance. Managers participate in the development and presentation of proposals for business development activities.  Qualifications:  6+ years of experience working directly with, or serving clients in,  Telecommunications  including service providers, carriers, networks and broadcasters, infrastructure and equipment manufacturers. Or  Media  including internet, film/movies, electronic games, music, newspapers, publications, radio, television. Or  Entertainment  including professional and semi-professional sports clubs, leagues, and major sporting events and companies that produce or organize and promote live events. Industry experience is a must . 6+ years of relevant work experience within consulting or acting as an internal consultant serving within industry. 6+ years of experience delivering  AI and data transformation  projects 6+ years of experience with  data modernization and transformation using cloud-enabled platforms Expertise in defining  AI and Data strategy Experience architecting, designing, developing and deploying enterprise solutions, based on client or business vision, which include components across the Artificial Intelligence spectrum such as Advanced Analytics, Machine Learning and Data Science 4+ years of experience leading and managing project teams Ability to travel up to 50% Immigration: Limited sponsorship may be available  Preferred:  Strong experience running pursuits Ability to communicate complex quantitative analysis in a concise and actionable manner Ability to work independently, manage small engagements or parts of large engagements. Strong oral and written communication skills, including presentation skills (MS Visio, MS PowerPoint) Strong problem solving and troubleshooting skills with the ability to exercise mature judgment",30+ days ago,"10,446 reviews"
https://www.indeed.com/viewjob?jk=108bbc2135a033f5&from=web&vjs=3,80,Senior Data Analyst,Siemens,"2000 Eastman Dr, Milford, OH 45150","Position Summary: This role is responsible for getting a deep understanding and providing valuable insights and reports on key workplace performance data. This is an analytical role responsible for implementation and development of Business Intelligence reporting using the appropriate corporate tools to deliver accurate and reliable metrics that are used to inform strategic decision making on the corporate facilities portfolio. The role requires deep analytical thinking and a keen understanding of business processes and the ability to translate data into interactive and dynamic dashboards that are user friendly and reliable. Essential Functions: Develop interactive/dynamic dashboards with BI tools. Responsible for maintaining consistency across multiple dashboards and for optimizing user experience. Develops and improves work flows and business processes within the functional area to improve user experience, and improve overall quality. Gather and understand the needs from our internal stakeholders to provide analytic solutions and insights to improve business results Complete complex ad hoc analysis, ensuring that analysis is validated and answers immediate and future business needs. Champions data and tools that increase organizational access to data and ad hoc capabilities to help stakeholders drive data-informed decisions. Conduct continuous data exploration of data sources (internal/external), working with other teams to add to DISW data lake, validate and cleanse the data, and stage for analysis. Collaborate and share ideas with other analytics functions to maintain consistency and accuracy of analytical tools, algorithms, and methodologies. Conduct demonstrations on analytical tools and concepts. Effectively leads projects in order to produce desired results. Recommends and assists with implementing standard policies and procedures. Participates in systems testing, develops procedures/controls, and provides recommendations for the ongoing improvement of the updated process. Assists personnel (both internal and external) by answering questions, supplying information, and training. Develops and maintains an effective working relationship with key partners and stakeholders. Seeks to continuously improve tools and reports for the benefit of the organisation.  Skills and Abilities Required: Solid experience in a corporate environment preferably supporting Real Estate and/ or facilities as an analytics lead Experience in data, insights and analytics with increasing responsibility in a growth environment Experience in full lifecycle of analytics using Enterprise Tools: Tableau, QlikView, PowerBI Thorough knowledge of SQL with excellent hands-on exposure to database structures & principles, data models & dimensional models Proficient in MS Office Suite and Advanced Excel – pivot tables, macros, PowerPivots and advanced functions Excellent communication and interpersonal skills with demonstrated ability in engaging with senior leaders Excellent problem solving analytical skills with the ability to communicate complex results. Proficient in producing data flow diagrams and being able to do data storytelling.  Education and Experience Required: Bachelor’s degree in computer science or related field Evidence of continuous professional development 5-8 years’ experience working in similar role Analyst/ developer experience required with proven experience in operational analysis, data analysis, and problem resolution type activities. Data Warehousing and Data Migration knowledge Experience with design and use of DataMart’s, Dimensional Models, Aggregates,i-dimensional optimization technics in high volume environments  Siemens Industry Software Inc. is a technology supplier to the United States Federal Government. Recently  The White House issued an Executive Order requiring most federal workers, contractors and subcontractors who do business with the government to get vaccinated against COVID-19  unless granted an accommodation due to a disability or sincerely held religious belief or practice.  The Company has decided to pause enforcement of the vaccine mandate for the time being while the issue is addressed by the courts. We will be monitoring the situation closely and may lift the pause if required to do so in order to be in compliance with federal law. If this pause is lifted, you will be expected to be vaccinated against COVID-19. At Siemens we are always challenging ourselves to build a better future. We need the most innovative and diverse Digital Minds to develop tomorrow’s reality. Find out more about the Digital world of Siemens here: www.siemens.com/careers/digitalminds #LI-PLM #LI-AB1 Organization:  Digital Industries Company:  Siemens Industry Software Inc. Experience Level:  Experienced Professional Job Type:  Full-time Equal Employment Opportunity Statement Siemens is an Equal Opportunity and Affirmative Action Employer encouraging diversity in the workplace. All qualified applicants will receive consideration for employment without regard to their race, color, creed, religion, national origin, citizenship status, ancestry, sex, age, physical or mental disability unrelated to ability, marital status, family responsibilities, pregnancy, genetic information, sexual orientation, gender expression, gender identity, transgender, sex stereotyping, order of protection status, protected veteran or military status, or an unfavorable discharge from military service, and other categories protected by federal, state or local law.   EEO is the Law Applicants and employees are protected under Federal law from discrimination. To learn more, Click here.   Pay Transparency Non-Discrimination Provision Siemens follows Executive Order 11246, including the Pay Transparency Nondiscrimination Provision. To learn more, Click here.   California Privacy Notice California residents have the right to receive additional notices about their personal information. To learn more, click here.",30+ days ago,"10,006 reviews"
