URL,page_count,job_title,company,location,job_Description,post_date,reviews
https://www.indeed.com/viewjob?jk=51ff538bb455ffda&from=web&vjs=3,40,Post Doctoral Fellow,Oklahoma State University,"Stillwater, OK 74078","                             About Us:         Entomology involves everything from ""outdoor"" work in environmental issues (invasive species, emerging arthropod-borne disease), ecology, animal behavior, parasitology, insect-plant interactions to very ""high tech"" applications in biotechnology, molecular studies, forensics, and medical/veterinary entomology. Plant pathology uses knowledge, techniques, and expertise from a multitude of disciplines such as mycology, virology, bacteriology, nematology, biochemistry, bioinformatics, plant anatomy, plant physiology, genetics, microbial forensics, and epidemiology to study, understand, and manage plant diseases. For more information, visit:https://agriculture.okstate.edu/departments-programs/entomol-plant-path/    In coordination with both extension and research programming, the livestock entomology program conducts demonstration trials on insecticide products for both ticks and biting flies. Public health education is vital for the entomology extension program and this position communicates information with the Oklahoma Dept. of Health concerning issues related to vector-borne disease. In addition to running a diverse extension program, the Postdoctoral Extension/Research Scientist will be responsible for oversight on multiple research projects and students, including submission of competitive grant proposals in cooperation with Drs. Bruce Noden and Justin Talley. This position will also be responsible for extension programming related to both public health education related to vector-borne disease and parasitology programming for important livestock systems.                                                    Special Instructions to Applicants                            A resume, cover letter, and list of three professional references are required.                                      Education & Experience                                            Position Qualifications:                                  Required:         Ph.D. in entomology, parasitology, biology, or closely related field         Evidence of instructional/outreach experience in any capacity (community/commodity groups, University Teaching Assistantships, technical service advisor, Extension); demonstrated research experience/background in entomology/parasitology, and an understanding of molecular biology techniques.         Work may require standing/sitting at work both in a laboratory and outside for extended periods of time.         Work occasionally requires hot, outdoor environments in remote areas.         Preferred:          Required: Ph.D. in entomology, parasitology, biology, or closely related field  Experience as an educator and evidence of communication skills within different commodity-focused target groups; evidence of broad-based knowledge regarding external parasites of livestock including epidemiology life cycles, ecology, treatment, and prevention; successful manuscript writing experience, experience with arthropod rearing, livestock handling and livestock husbandry systems; experience with biting and non-biting flies and ticks of medical and veterinary importance; familiarity with livestock production systems; excellent verbal and written communication skills; strong recordkeeping; ability to work with other extension specialists to develop projects and organize extension meetings; effectively communicate with faculty, extension personnel, students, and staff; multitask and work cooperatively with others; analyze data and write reports; detail oriented with ability to organize tasks and prioritize work with minimal supervision; understanding and maintaining a safe working environment in the laboratory and at field research settings                                                   Oklahoma State University (OSU) strives to provide a safe study, work, and living environment for its faculty, staff, volunteers and students. To support this environment and comply with applicable laws and regulations, OSU conducts pre-employment background checks on final candidates. Offers of employment are contingent upon the successful completion of a background check. The type of background check conducted varies by position and can include, but is not limited to, criminal (felony and misdemeanor) history, sex offender registry, motor vehicle history, financial history, and/or education verification. Background checks will be conducted when required by law or contract and when, in the discretion of the university, it is reasonable and prudent to do so.         Oklahoma State University, as an equal opportunity employer, complies with all applicable federal and state laws regarding non-discrimination and affirmative action. Oklahoma State University is committed to a policy of equal opportunity for all individuals and does not discriminate based on race, religion, age, sex, color, national origin, marital status, sexual orientation, gender identity/expression, disability, or veteran status with regard to employment, educational programs and activities, and/or admissions. For more information, visit eeo.okstate.edu.                     ",30+ days ago,642 reviews
https://www.indeed.com/viewjob?jk=6305369f998f2b60&from=web&vjs=3,40,Entry Level Material & Process Engineer,BOEING,"Oklahoma City, OK 73135","At Boeing, we innovate and collaborate to make the world a better place. From the seabed to outer space, you can contribute to work that matters with a company where diversity, equity and inclusion are shared values. We’re committed to fostering an environment for every teammate that’s welcoming, respectful and inclusive, with great opportunity for professional growth. Find your future with us. We are  Boeing Research & Technology : Boeing's global research and development team creating and implementing innovative technologies that make the impossible possible and enabling the future of aerospace. We are engineers and technicians, skilled scientists and bold innovators. Join us and put your passion, determination, and skill to work building the future! At  Boeing , we create the future — of mobility, autonomy, speed, endurance, space access and exploration, undersea vehicles, cybersecurity, communication and much, much more. We connect people, products and ideas around the world. We protect people and nations. We explore the mysteries of the universe from seabed to space to cyberspace. We inspire future generations of innovators, dreamers and doers. Boeing Research & Technology (BR&T)  is looking for an  Entry Level Materials and Processes (M&P) Engineer  that provides support of integrated product teams (IPT's) serving a wide variety of aircraft programs at Boeing in  Oklahoma City, OK . Primary Responsibilities: Collects information to support definition of requirements for tools, equipment, materials, parts and processes used in the manufacture and engineering design of products. Incorporates changes to specifications and other documents to manage the deployment of materials, parts and processes. Performs tests to qualify new tools, equipment, materials, parts and processes to meet requirements. Assists with activities to qualify suppliers to applicable requirements. Conducts basic analysis to determine performance or reasons for failures of tools, materials, parts or processes. Assists in implementing corrective and preventive actions. Develops basic computer and production systems to satisfy user requirements. Uses project management tools to meet cost, technical, and schedule requirements. Incorporates environmental health and safety, LEAN and Quality principles into (1) materials and processes, (2) research, design and qualification, (3) work procedures and (4) labs and office areas. This position is expected to be onsite as needed to perform the necessary work statement. Some of the work statement may allow for hybrid (partially virtual) opportunities. This position requires the ability to obtain a U.S. Security Clearance for which the U.S. Government requires U.S. Citizenship.  An interim and/or final U.S. Secret clearance Post-Start is required. Basic Qualifications (Required Skills/Experience): Bachelor's Degree or higher from an accredited course of study in materials science, engineering, computer science, mathematics, physics or chemistry. Excellent oral and written communication skills and ability to communicate across multiple disciplines with internal and external customers. Computer proficiency and ability to use and navigate the internet and various computer software programs (e.g. Microsoft Office Suite). Knowledge and ability to understand and interpret technical data. Skill and ability to collect, organize, synthesize, and analyze data; summarize findings; develop conclusions and recommendations from appropriate data sources. Preferred Qualifications (Desired Skills/Experience): Knowledge and ability to understand and interpret engineering drawings. Work experience in aerospace involving structural/mechanical applications. Familiarity with industry and military specifications and standards. Prior engineering experience in a related field. Typical Education & Experience: Education/experience typically acquired through advanced technical education from an accredited course of study in materials science, engineering, computer science, mathematics, physics or chemistry (e.g. Bachelor) or an equivalent combination of technical education and experience. In the USA, ABET accreditation is the preferred, although not required, accreditation standard. Relocation: Relocation assistance is not a negotiable benefit for this position. Candidates must live in the immediate area or relocate at their own expense. Drug Free Workplace: Boeing is a Drug Free Workplace where post offer applicants and employees are subject to testing for marijuana, cocaine, opioids, amphetamines, PCP, and alcohol when criteria is met as outlined in our policies . Shift Work Statement: This position is for 1st shift Equal Opportunity Employer: Boeing is an Equal Opportunity Employer. Employment decisions are made without regard to race, color, religion, national origin, gender, sexual orientation, gender identity, age, physical or mental disability, genetic factors, military/veteran status or other characteristics protected by law.",2 days ago,"8,644 reviews"
https://www.indeed.com/viewjob?jk=58e65f5b9dc531a8&from=web&vjs=3,40,Environmental Scientist,Freese and Nichols,"Oklahoma City, OK","        Freese and Nichols is seeking an Environmental Scientist in Oklahoma City, OK. In this role, you will help support the State Water and Flood Plans. This role will include gathering large datasets and providing meaningful results to the client including developing innovative interactive dashboards.                     Conduct either independently or as part of a team, technical analyses and formulate results in a concise, well-written document. Proceed with analysis and report preparation with guidance and final review by the Group Manager or Project Manager.                    Ability to support population, demand and water supply availability analysis. Experience with water supply availability models such as RiverWare is a plus.                    Assist Group Manager or Project Manager in estimating study costs. Maintain an awareness of project budgets and endeavor to complete assignments with the budget.                    Draft proposals and statements of qualifications within the directives of company policy relating to marketing.                    Perform independent work on assigned tasks and projects. Develop approach to project evaluation for approval by the Group Manager. Proceed with analysis with general guidance and final review by Group Manager or Project Manager.                    Assist the Project Manager in the development and execution of assigned projects and assume various tasks necessary for project completion.                    Become acquainted with the procedures and techniques necessary to execute a sound and efficient project. On assigned projects, supervise any GIS technicians necessary for completion of a project and help expand their capabilities in project performance.                    Provide quality work within the scope of work, guidelines, manhours and schedules defined by the Project Manager. Provide the Project Manager with information and assist in the coordination of information between groups. Provide the Project Manager with information for decision-making related to the overall project.                    May serve as Project Manager for small projects                  Qualifications                     Bachelor's degree in environmental science or related natural or social science or equivalent                    3+ years' experience, including direct experience in the collection and analysis of data, application of standard techniques and procedures and report preparation for specific projects, with an environmental or natural resource department, agency or consulting firm                  Preferred Qualifications                     Master's degree                    Professional certification in appropriate field                  At Freese and Nichols, everyone on our team gets to make a meaningful difference in our communities. For more than 125 years, we have been planning and designing the infrastructure our society needs: developing water supplies, designing roadways and bridges, preparing for natural disasters, and much more. We’ve built our business on long-term relationships with clients and employees alike, resulting in financial stability, career opportunities, and a nationally recognized workplace culture.             We offer a comprehensive benefits package including health insurance, paid time off, 401(k) matching, paid overtime for salaried employees, tuition reimbursement, and much more. Our unique culture creates an environment for professional growth where we focus on caring for our clients, coworkers, and the communities where we work. Join our team of 1,000 employees as we continue to expand our services throughout the United States. Learn more about working here at         freese.com/careers    .             Freese and Nichols is a federal contractor subject to         President Biden's Executive Order 14042     requiring COVID vaccinations for employees of firms that have federal government contracts. All persons hired by Freese and Nichols are required to be fully vaccinated against COVID-19 or have a valid exemption. Proof of vaccination, an approved medical exemption form or an approved religious exemption form will be required.             Freese and Nichols is firmly committed to Equal Employment Opportunity (EEO) and prohibits employment discrimination for employees and applicants based on his or her age, race, color, pregnancy, gender, gender identity, sexual orientation, national origin, religion, marital status, citizenship, or because he or she is an individual with a disability, protected veteran or other status protected by federal, state, and local laws.           We recognize that our workforce reflects the increasingly diverse nature of our society, and we strive to take advantage of that diversity with both our external and internal customers. As a Federal Contractor, Freese and Nichols is an equal employment, affirmative action employer.     ",23 days ago,29 reviews
https://www.indeed.com/viewjob?jk=0374abd406585343&from=web&vjs=3,40,Chemist Job,Arkema,"Tulsa, OK","Position Summary: As a Chemist, you will work closely with R&D Scientist and Senior Product Development Manager primarily supporting product development, raw material characterization, and specification development for emulsifiers, adhesion promoters, warm mix additives, and other related chemistries. You will learn and execute a variety of manufacturing and testing procedures, including organic synthesis techniques. You will refine and development testing protocols for new chemistries. You will perform downstream product testing on the chemistry and to scale up products Primary Duties and Responsibilities: Utilize chemistry background to propose solutions to gaps in product and/or market for the segments, develop structure-property relationships. Develop test programs to achieve product performance targets relative to organic synthesis chemistries in emulsifiers, adhesion promoters and warm mix additives and related chemistries. Evaluate raw materials and manufacturing options for new and refined product formulations. Develop manufacturing and quality control protocols   for products and raw materials. Recommend changes as necessary. Support   plant manufacturing scale-up and on-going commercial production of products. Execute development activities within Arkema – Road Science achieving product performance objectives and robustness plan, deliverable milestones, roll-out timing to maintain costs that aligns with business needs. Communicate and interact with Arkema – Road Science Commercial team and Arkema peers to understand product performance requirements and needs. Create and Maintain Standard Lab Operating and plant quality control procedures to ensure manufacture of consistent product quality, execution of operational procedures and quality control data. Understand and Operate a Safe Laboratory Working Environment maintaining necessary training, organization, inventory, and cleanliness. Maintain and calibrate laboratory instrumentation and equipment. Provide consistently Clear and Concise Communication, in both written and verbal form, to internal and external customers. Support and participate in downstream laboratory testing programs properly support Product Development, including asphalt products and asphalt emulsions. Ensure all data and records are properly maintained. Create a collaborative product development environment. Maintain knowledge of specifications (AASHTO, ASTM, State DOT). Other duties, as assigned. Education and Experience Requirements: To be effective in the position from the outset, the following experience is preferred: Masters in Organic Chemistry or related Scientific Discipline (required) 3+ Years’ experience in organic synthesis testing or related surfactant formulations. Laboratory and plant operational support a plus",29 days ago,343 reviews
https://www.indeed.com/viewjob?jk=73e359b847e16ace&from=web&vjs=3,30,Senior Data Scientist - International,Indeed,United States,"       Your Job           As a Senior Data Scientist embedded in the International Team team, you will be tasked with building machine learning solutions to help improve the efficiency of software delivery at Indeed. You will work on interesting and important challenges that range from designing algorithms for quicker regression testing to building tools that can automate root cause analysis. Through your work, Indeed software developers will be able to quickly get their solutions into production, find and fix bugs, and improve the quality of their code.              The International Team works to make all of Indeed’s products effective at getting people hired, in every market and language. This involves translating the needs of specific markets into configuration patterns that let us scale those variations worldwide. We consider both sides of the experience, meaning that we internationalize employer-facing products (such as posting jobs and managing candidates) and jobseeker-facing products (such as mobile job search, updating profiles, and messaging-app based experiences). Most importantly, the team is expected to deliver results, and be able to demonstrate the impact our changes have on our business.              The role of Data Science at Indeed is to follow the data. We log, analyze, visualize, and model terabytes of job search data. Our Data Scientists build and implement machine learning models to make timely decisions. Each of us is a mixture of a statistician, scientist, machine learning expert, and engineer. We have a passion for building and improving Internet-scale products. We seek to understand human behavior via careful experimentation and analysis.          Who You Are           You're someone who wants to see the impact of your work making a difference every day. You find passion in the craft and are constantly seeking improvement and better ways to solve tough problems. You produce the highest quality Data Science solutions and help others to do the same.              Responsibilities               Work alongside other scientists and software engineers to expand Indeed's catalog of tools, techniques, and best practices to improve the software delivery life cycle.      Work across a wide range of related areas: data extraction and cleansing, feature engineering, machine learning, exploratory analysis, data quality analysis, experimental analysis.      BS in Computer Science, Statistics, Mathematics or a closely related quantitative field.      5+ years of industry experience, with expertise in Data Science, Machine Learning      Passion to answer Product/Engineering questions with data      Can develop production-grade data science solutions using Python or Java      Can communicate concisely and persuasively with engineers, product managers and other non-technical functions               We get excited about candidates who               Have full stack experience in data collection, analysis, visualization, modeling, model interpretation, productization, and monitoring of data science products      Are familiar with Spark or Presto and have strong SQL skills      Are familiar with AWS tools such as Athena and SageMaker      Can train and deploy deep learning models for natural language data      Can develop APIs to support data collection and enable product features           Who we are     We are a rapidly growing and highly-capable Engineering organization building the most popular job site on the planet. With engineering hubs in Seattle, San Francisco, Austin, Tokyo, Singapore, Hyderabad, Dublin, Aberdeen and Vancouver, we are improving people's lives all around the world, one job search at a time.       Our Mission           As the world’s number 1 job site*, our mission is to help people get jobs. We strive to cultivate an inclusive and accessible workplace where all people feel comfortable being themselves. We're looking to grow our teams with more people who share our enthusiasm for innovation and creating the best experience for job seekers.           (*comScore Total Visits, September 2021)          Salary Range Disclaimer           The base salary range represents the low and high end of the Indeed salary range for this position. Actual salaries will vary depending on factors including but not limited to location, experience, and performance. The range listed is just one component of Indeed's total compensation package for employees. Other rewards may include quarterly bonuses, Restricted Stock Units (RSUs), an open Paid Time Off policy, and many region-specific benefits.          Salary Range Transparency        US Remote 123,000 - 179,000 USD per year        Equal Opportunities and Accommodations Statement           Indeed is deeply committed to building a workplace and global community where inclusion is not only valued, but prioritized. We’re proud to be an equal opportunity employer, seeking to create a welcoming and diverse environment. All qualified applicants will receive consideration for employment without regard to race, color, religion, gender, gender identity or expression, family status, marital status, sexual orientation, national origin, genetics, neuro-diversity, disability, age, or veteran status, or any other non-merit based or legally protected grounds.              Indeed is committed to providing reasonable accommodations to qualified individuals with disabilities in the employment application process. To request an accommodation, please contact Talent Attraction Help at     1-855-567-7767 , or by email at TAhelp@indeed.com at least one week in advance of your interview.              Fair Chance Hiring           We value diverse experiences, including those who have had prior contact with the criminal legal system. We are committed to providing individuals with criminal records, including formerly incarcerated individuals, a fair chance at employment.          Our Policies and Benefits           View Indeed's Applicant Privacy and Accessibility Policies - https://www.indeed.com/legal/indeed-jobs          Learn about our global employee perks, programs and benefits - https://benefits.indeed.jobs/              Where legally permitted, Indeed requires all individuals attending or working out of Indeed offices or visiting Indeed clients to be fully vaccinated against COVID-19. For positions that can only be performed at an Indeed office, candidates must be fully vaccinated against COVID-19 and present acceptable proof of vaccination by the date of hire as a condition of employment. Indeed will consider requests for reasonable accommodation as required under applicable law. To qualify as being fully vaccinated against COVID-19 there should have been a two week period after receiving the second dose (or any government recommended booster shot) in a 2-dose COVID-19 vaccine series, or a two week period after receiving a single-dose (or any government recommended booster shot) in a single dose COVID-19 vaccine.          Reference ID: 31802   ",30+ days ago,975 reviews
