URL,page_count,job_title,company,location,job_Description,post_date,reviews
https://www.indeed.com/viewjob?jk=2bb019078219d0e6&from=web&vjs=3,30,Sr. Visual Data Analyst,Heartland,"Oklahoma City, OK 73127","        Every day, Heartland, a Global Payments Company, makes it possible for millions of people to move money between buyers and sellers using our products and unmatched services. Simply, we create meaningful technology centered experiences that enable our customers to prosper. If you want to work like an entrepreneur, support and serve entrepreneurs and bring your expertise to a dynamic team, then Heartland is for you. If it's in your nature to work with a passion to provide tangible solutions for everyone you interact with, then join us and let's see what we can do together.          The Sr. Visual Data Analyst will be primarily responsible for supporting the leaders of Heartland’s Operations teams with business process improvement, data analysis, and developing business intelligence (BI) tools. The Sr. Visual Data Analyst will work to gather, analyze, and translate data that has been collected regarding Heartland’s initiatives and production into a format to enable better business decisions.             Primary Responsibilities/Objectives:                     Coordinate with leadership team to identify critical data to capture and report on                    Consolidate and summarize data for business decision making and continuous improvements                    Create graphical representations of data/analysis for easy consumption                    Perform statistical analysis (correlation, regression, or time series analysis)                    Inspect and cleanse data for accuracy and quality                    Some data ETL/ELT responsibilities as needed                    Other responsibilities as assigned                   Core Competencies:                     Strong understanding of reporting requirements and structural hierarchies for reporting in a collaborative environment. Query, analyze and transform complex data sets to optimize dashboard flexibility and performance.                    Rationalize and identify use cases for developing data visualization, including identifying different personas for each use case.                    The Sr. Data Analyst will work with large amounts of data: facts, figures, and number crunching. The candidate will need to see through the data and analyze it to find conclusions. One needs to be strong in logic and mathematics.                    Communication Skills: Sr. Visual Data Analyst will be expected to present their findings or translate the data into an understandable document. This candidate will need to write and speak clearly, easily communicating complex ideas. Needs to possess the ability to work in a team environment as well as individually.                    Critical Thinking: Sr. Visual Data Analyst must look at the numbers, trends, and data and come to conclusions based on the findings.                    Presentation Skills: Ability to organize data and supporting information into visual representations that allow consumers to easily dissect and make decisions based on data provided.                    Attention to Detail: Data is precise. Data analysts have to make sure they are vigilant in their analysis to come to correct conclusions. Must make every effort not to only meet but also preempt customer needs.                    Strong experience with hands-on building and deploying Tableau, Qlik, PowerBI or Spotfire data visualizations and dashboards                    Strong understanding of data visualization concepts. Thoughtfully connects these concept business metrics and KPIs to achieve business goals.                    Experience in relational database concepts with a solid knowledge of SQL Server                    Google Suite Products: Advanced level with Google Sheets, Google Slides, and Google Docs                  Education/Experience                     Position requires knowledge typically associated with a Bachelor’s Degree in Computer Science, MIS, Economics, Business, Mathematics, Statistics, related technical field, or equivalent work experience.                    6+ years of applicable experience as a Data Analyst or similar role                    Advanced Tableau experience building robust dashboards                    Understanding of the Bankcard Industry or Commission Based Sales is a plus.                     Preferred Qualities:                     Motivated self-starter                    Detail oriented                    Cautious                    Consistent                    Tenacious                    Ability to manage a project                Heartland Qualities:                     Uncompromising honesty                    Approachable and willing to offer helpful solutions                    Ability to search relentlessly for better solutions                    Must handle constructive feedback well               Heartland is an equal opportunity employer. Heartland, a Global Payments Company, provides equal employment opportunities to all employees and applicants for employment without regard to race, color, religion, sex (including pregnancy), national origin, ancestry, age, marital status, sexual orientation, gender identity or expression, disability, veteran status, genetic information or any other basis protected by law. Those applicants requiring reasonable accommodation to the application and/or interview process should notify a representative of the Human Resources Department.             Except where prohibited by state law, Global Payments will give preference to candidates fully vaccinated against COVID-19. Team members are considered fully vaccinated after completing both primary vaccinations, if applicable, and after the requisite amount of time set by health authorities. Global Payments provides reasonable accommodations for medical or religious reasons or any other legally required reasons.     ",22 days ago,492 reviews
https://www.indeed.com/viewjob?jk=0b4bdd095de78869&from=web&vjs=3,30,Data Scientist/Machine Learning Engineer - Sr. Associate,PRICE WATERHOUSE COOPERS,"Oklahoma City, OK 73102","A career in Technology and Data Solutions practice, within Deals Transaction Services, provides the opportunity to help organizations realize the potential of mergers, acquisitions, divestitures and capital markets. You will have the opportunity to leverage technology and data to drive better Deal decisions and execute transactions more effectively, helping companies originate, create, execute, and realize value from deals. Our team consists of well-rounded creative professionals who have a passion and aptitude for building technology driven solutions and pushing the boundaries of innovation in Deals. We are industry leaders in embedding technology, leveraging data analysis, machine learning, and artificial intelligence for a broad range of Deal-focused solutions. To really stand out and make us fit for the future in a constantly changing world, each and every one of us at PwC needs to be a purpose-led and values-driven leader at every level. To help us achieve this we have the PwC Professional; our global leadership development framework. It gives us a single set of expectations across our lines, geographies and career paths, and provides transparency on the skills we need as individuals to be successful and progress in our careers, now and in the future. As a Senior Associate, you'll work as part of a team of problem solvers, helping to solve complex business issues from strategy to execution. PwC Professional skills and responsibilities for this management level include but are not limited to: Use feedback and reflection to develop self awareness, personal strengths and address development areas. Delegate to others to provide stretch opportunities, coaching them to deliver results. Demonstrate critical thinking and the ability to bring order to unstructured problems. Use a broad range of tools and techniques to extract insights from current industry or sector trends. Review your work and that of others for quality, accuracy and relevance. Know how and when to use tools available for a given situation and can explain the reasons for this choice. Seek and embrace opportunities which give exposure to different situations, environments and perspectives. Use straightforward communication, in a structured way, when influencing and connecting with others. Able to read situations and modify behavior to build quality relationships. Uphold the firm's code of ethics and business conduct. Job Requirements and Preferences :   Basic Qualifications :   Minimum Degree Required : Bachelor Degree   Required Fields of Study : Data Processing/Analytics/Science, Computer and Information Science, Computer Engineering, Computer Applications, Software App, Information Technology   Additional Educational Requirements : Other relevant fields of study may be considered. Minimum Years of Experience : 3 year(s)   Preferred Qualifications :   Degree Preferred : Master Degree   Additional Educational Preferences : Master Degree or Ph.D. in Computer Science, or a related quantitative field. Certification(s) Preferred : Certifications with cloud architectures and service offerings of major cloud providers (e.g. Azure, AWS, GCP) Preferred Knowledge/Skills : Demonstrates thorough abilities and/or a proven record of success in translating business questions into data problems, and building models and machine learning pipelines to solve those data problems. Demonstrates through abilities and/or a proven record of success in working out a solution independently when given an analytical business use case, building a Proof-of-Concept (PoC), documenting solutions and code, and communicating results to both technical and non-technical audiences, with an understanding of the assumptions and limitations of algon eithms being applied. Demonstrates thorough abilities and/or a proven record of success in building end-to-end machine learning systems and pipelines, and can read, understand, and change legacy machine learning and NLP code. Demonstrates thorough abilities and/or a proven record of success in the following areas: Possesses considerable ability with Python programming; Possesses considerable knowledge about data science concepts and principles; Possesses considerable ability with common machine learning libraries including scikit-learn, pandas, numpy, scipy, Spacy, NLTK, and PyTorch; Possesses considerable ability with a wide range of supervised and unsupervised machine learning algorithms, including regression, classification, clustering, anomaly detection, time series analysis, forecasting, dimensionality reduction, etc.; Possesses considerable level of ability with Predictive modeling; Possesses considerable level of ability with modern Natural Language Processing concepts and algorithms, including embeddings, transfer learning, transformers, and deep learning models for NLP; Possesses thorough level of knowledge about mathematical, statistical, and probabilistic frameworks underlying machine learning algorithms; Possesses considerable level of ability with building and fine-tuning machine learning solutions and leveraging specific machine learning architectures (e.g. deep neural networks, RNNs, CNNs, BERT, etc); Possesses considerable level of ability to learn, understand and work with new emerging technologies, methodologies, and solutions in the Cloud/IT technology space; Possesses thorough level of knowledge about abstract business problems, and executing technical and non-technical endeavors to solve them; Possesses considerable level of ability to communicate with both technologists and business partners; Possesses considerable level of ability to work as a solutions architect, technical product manager, software engineer or frontend/backend web developer for data products or web applications; Possesses considerable level of ability to be a “utility player” and take on various roles, as needed, throughout the solution development lifecycle; Possesses considerable ability to recognize opportunities to solve problems by developing applications or automations, and of identifying abstractions to turn applications into platforms; Possesses considerable ability to think critically and bring order to unstructured problems; Possesses considerable ability to identify and resolve blocking issues, exercise judgment in the face of ambiguity, and ask probing questions to understand problems; Possesses considerable ability to develop a backlog of work and communicate with software engineers; Possesses considerable ability to be hands-on with technical details of architecture and design where required; and, Possesses a thorough level of knowledge about the inner workings of a web application, exposure to systems administration or DevOps operations, automated testing and CI/CD pipelines. At PwC, our work model includes three ways of working: virtual, in-person, and flex (a hybrid of in-person and virtual). Visit the following link to learn more: https://pwc.to/ways-we-work.  PwC does not intend to hire experienced or entry level job seekers who will need, now or in the future, PwC sponsorship through the H-1B lottery, except as set forth within the following policy: https://pwc.to/H-1B-Lottery-Policy.  All qualified applicants will receive consideration for employment at PwC without regard to race; creed; color; religion; national origin; sex; age; disability; sexual orientation; gender identity or expression; genetic predisposition or carrier status; veteran, marital, or citizenship status; or any other status protected by law. PwC is proud to be an affirmative action and equal opportunity employer.  For positions based in San Francisco, consideration of qualified candidates with arrest and conviction records will be in a manner consistent with the San Francisco Fair Chance Ordinance.  For positions in Colorado, visit the following link for information related to Colorado's Equal Pay for Equal Work Act: https://pwc.to/coloradoadvisoryseniorassociate.  #LI-Remote",30+ days ago,"7,977 reviews"
https://www.indeed.com/viewjob?jk=a5b1a13e1b6762b8&from=web&vjs=3,30,"Director, ADAS Algorithms and R&D",Canoo Technologies Inc.,"Tulsa, OK","    About Canoo:         About Canoo           Canoo’s mission is to bring EVs to Everyone and build a world-class team to deploy this sustainable mobility revolution. We have developed breakthrough electric vehicles that are reinventing the automotive landscape with pioneering technologies, award-winning designs, and a unique business model that spans all owners in the full lifecycle of the vehicle. Canoo is starting production in 2022 and is distinguished by its pioneering and experienced team of technologists, engineers, and designers. With offices around the country, the company is scaling quickly and seeking candidates who love to challenge themselves, are motivated by purpose, and possess a strong desire to get things done.              The “Canoo Way”           Canoo’s success is the direct result of our disciplined application of our core operating principles and drills, which are based on three main principles: Think 80/20 (“Important versus less important”), Act 30/30 (“Reduce waste and increase output”), and Live 90/10 (“We have each other’s back”). We hire based on “MET” - Mindset, Equipment and willingness to Train - and seek individuals that take accountability and deliver results while being Humble, Hungry to succeed, and Hunting for opportunities to win. We train our team to engage with each other by modulating between their intellect (iQ) and emotional intelligence (eQ), applying Facts, Finesse, and Force when they communicate. The principles and drills of the CANOO Way have been fundamental to our success, our ability to grow, continuously improve, innovate and are at the core of our day-to-day operations.    Overview:        The Director will develop ADAS future strategies, roadmaps, and execution plans for Canoo.    Responsibilities:        Lead and mentor the following teams: algorithm development team, controls, driver monitoring system (DMS), sensor fusion, and R&D      Develop strategies for future ADAS feature development      Define ADAS roadmaps for Level 2+ and beyond      Develop key strategic partnerships with supplier and universities      Define and execute strategies for internal and external development      Grow team by attracting and maintaining talent for key competencies     Qualifications:       Required         BS in Electrical Engineering, Computer Science, or equivalent      Minimum 3 years director level experience      High level of oral and written communication skills      Strong interpersonal effectiveness and able to manage and escalate issues to management      Experience leading technical teams      Experience managing supplier relationships with agile software development      Experience with ADAS sensor technologies and software feature capabilities      Professional experience in ADAS or autonomous driving applications      Demonstrated performance in a position requiring engineering technical excellence      Occasional travel required        Preferred         MS in Electrical Engineering, Computer Science, or equivalent      Automotive OEM experience     What's Cool About Working Here...:        Meaningful, challenging work that will redefine automotive landscape and make EVs available to everyone      Comprehensive Health Insurance      Equity Compensation      Flexible Paid Time Off      Casual workplace with an unbelievable feeling of energy            Canoo is an equal opportunity-affirmative action employer and considers all qualified applicants for employment based on business needs, job requirements and individual qualifications, without regard to race, color, religion, sex, age, disability, sexual orientation, gender identity or expression, marital status, past or present military service or any other status protected by the laws or regulations in the locations where we operate.           We also consider qualified applicants with criminal histories consistent with applicable federal, state and local law.               Any unsolicited resumes or candidate profiles submitted in response to our job posting shall be considered the property of Canoo Inc. and its subsidiaries and are not subject to payment of referral or placement fees if any such candidate is later hired by Canoo unless you have a signed written agreement in place with us which covers the applicable job posting.               Canoo cares deeply about the safety of all candidates who may be asked to participate in an in-person interview. While the company remains operational, some of our positions are remote, while others require working on-site. Canoo is following the Covid-19 protocols set forth by local state and federal governance and the CDC guidelines. Candidates who are vaccinated will be asked to provide a copy of proof of vaccination upon arrival for the interview. Candidates who are not vaccinated will be asked to provide proof of a negative Covid-19 test that is no less than 48 hours old. We ask that you practice hand hygiene, social distance, and wear face coverings to reduce the risks of exposure to Covid-19. We appreciate your cooperation with our safety protocols while you explore your future with Canoo!      ",30+ days ago,
https://www.indeed.com/viewjob?jk=8b94d32e6c427ac3&from=web&vjs=3,30,OFRO Systems and Solutions Senior Manager Data Analyst,PRICE WATERHOUSE COOPERS,"Oklahoma City, OK 73102","A career in Risk Management, within Internal Firm Services, will provide you with the opportunity to advance and foster integrity based decision making and conduct by PwC professionals throughout our organisation. You’ll focus on promoting and monitoring compliance with applicable external laws and regulations as well as internal policies and procedures to help manage PwC’s regulatory, litigation, and reputational risk. Our Compliance team is responsible for oversight of all Compliance activities by our PwC professionals. As part of the team, you’ll help promote and monitor compliance with applicable external and internal policies, laws and regulations and subsequently, manage PwC’s regulatory, litigation and reputational risk. To really stand out and make us fit for the future in a constantly changing world, each and every one of us at PwC needs to be a purpose-led and values-driven leader at every level. To help us achieve this we have the PwC Professional; our global leadership development framework. It gives us a single set of expectations across our lines, geographies and career paths, and provides transparency on the skills we need as individuals to be successful and progress in our careers, now and in the future. As a Senior Manager, you'll work as part of a team of problem solvers, helping to solve complex business issues from strategy to execution. PwC Professional skills and responsibilities for this management level include but are not limited to: Encourage everyone to have a voice and invite opinion from all, including quieter members of the team. Deal effectively with ambiguous and unstructured problems and situations. Initiate open and candid coaching conversations at all levels. Move easily between big picture thinking and managing relevant detail. Anticipate stakeholder needs, and develop and discuss potential solutions, even before the stakeholder realises they are required. Contribute technical knowledge in area of specialism. Contribute to an environment where people and technology thrive together to accomplish more than they could apart. Navigate the complexities of cross-border and/or diverse teams and engagements. Initiate and lead open conversations with teams, clients and stakeholders to build trust. Uphold the firm's code of ethics and business conduct. Job Requirements and Preferences :   Basic Qualifications :   Minimum Degree Required : High School Diploma   Minimum Years of Experience : 6 year(s)   Preferred Qualifications :   Degree Preferred : Bachelor Degree   Preferred Knowledge/Skills : Demonstrates intimate abilities and/or a proven record of success as a team leader by: Demonstrating ability to work with large data sets and multiple data analysis tools and techniques; Using statistical tools to identify, analyze, and interpret patterns and trends in complex data sets; Performing analysis to assess the quality and validity of data; Utilizing client-facing ability to liaise with stakeholders, technical team, and project leads, as well as policy and other risk management functions to define requirements, resolving challenging problems and when appropriate, exercising initiative and independent judgment to resolve problems expeditiously; Working with developers, business users, and executive stakeholders to identify process improvement opportunities, proposing system modifications, and devising data governance strategies; Actively participating in the definition and implementation of data utilization/analytics strategy at the business unit level; Implementing ability to troubleshoot and perform root cause analysis to identify data or system issues; Proving ability to produce clear, concise, and detailed technical documentation; Showcasing experience with Agile development methodologies; Highlighting T-SQL query development competency; Utilizing experience working with NoSQL databases and JSON data; Demonstrating hands-on proficiency with Power BI reporting tools; and, Exhibiting Graph Database, SSAS, SSIS, SharePoint and Microsoft Teams understanding and/or experience is a plus. At PwC, our work model includes three ways of working: virtual, in-person, and flex (a hybrid of in-person and virtual). Visit the following link to learn more: https://pwc.to/ways-we-work.  PwC does not intend to hire experienced or entry level job seekers who will need, now or in the future, PwC sponsorship through the H-1B lottery, except as set forth within the following policy: https://pwc.to/H-1B-Lottery-Policy.  All qualified applicants will receive consideration for employment at PwC without regard to race; creed; color; religion; national origin; sex; age; disability; sexual orientation; gender identity or expression; genetic predisposition or carrier status; veteran, marital, or citizenship status; or any other status protected by law. PwC is proud to be an affirmative action and equal opportunity employer.  For positions based in San Francisco, consideration of qualified candidates with arrest and conviction records will be in a manner consistent with the San Francisco Fair Chance Ordinance.  For positions in Colorado, visit the following link for information related to Colorado's Equal Pay for Equal Work Act: https://pwc.to/coloradoifsseniormanager.  #LI-Remote",30+ days ago,"7,977 reviews"
