URL,page_count,job_title,company,location,job_Description,post_date,reviews
https://www.indeed.com/viewjob?jk=f4af87192f1c6955&from=web&vjs=3,10,Senior Data Scientist 2,Deloitte,"127 Public Square Suite 3300, Cleveland, OH 44114","The team  InSightIQ combines consumer data and advanced analytics with deep industry and domain expertise to curate powerful, relevant insights. It actively monitors and aggregates real-time consumer, macro, marketplace, competitive, and economic data to predict how and when brands can win in the marketplace-the outside-in perspective that turns insight to a competitive edge.   Work You'll Do:  This role will be aligned to the product development team of Deloitte's Strategy & Analytics Hybrid Solutions & Incubation (HS&I) practice.  As a Sr Data Scientist working in this practice, you will focus on developing client ready assets for the InSightIQ business. This role will lead a team with a diverse set of skills to harden existing InSightIQ assets and develop net new assets. You will be able to articulate a vision and define the correct tooling, technologies, and approach to guide a multi-disciplined engineering team towards execution.  This candidate will work closely with the broader InSightIQ team in order to understand capability specifications and provide leadership and guidance to drive the development of sophisticated machine learning models. You should have the ability to collaborate and align with technical and non-technical stakeholders.   Key Responsibilities:  Provide hands-on technical thought leadership to solve large & complex business problems through AI/ML capabilities Lead the development of AI/ML product capabilities in a production environment including hands on coding Stay abreast of AI/ML technologies, academic research, and analytical trends Drive the end-to-end process to turn ideas and requirements into product features to satisfy customer needs Evaluate different technical approaches to solve problems and articulate recommendations on the right methodologies that data scientists and engineers can follow Lead the development of proofs of concept to verify your hypotheses Interpret the AI/ML models that are being generated, and communicate the design and outcomes to technical and non-technical stakeholders Play a hands on role in in converting the business requirements from clients into technical requirements to develop InSightIQ assets  We Expect You to Have:  Bachelor's Degree in a relevant field from a top-tier university; Advanced Degree is a plus - equivalent work experience may act as a substitute to degree requirements 3+ years' experience leading/performing data science based analysis Analytical mind with proven ability to dissect problems, devise data science solutions, and drive business outcomes Knowledge of and experience working with data architectures, data models, and data security and data governance Experience developing, implementing and maintaining machine learning and advanced statistical algorithms Experience working with large quantitative and qualitative datasets both hands on and managing teams doing the work Experience using statistical computer languages (Python, SQL, etc.) to prepare data for analysis, visualize data as part of exploratory analysis, generate features, and other similar data science driven data handling Experience using Python to develop ML models Experience working across multiple stakeholders to bring an asset to life (legal, risk, technology, etc.) Experience working with data science tools, e.g., TensorFlow/Keras, PyTorch, Spacy Experience developing on GCP cloud platform Strong storytelling skills with experience presenting to large technical and non-technical audiences Willingness to travel (25%) periodically - as future will allow given current COVID19 restrictions  We'd Like You to Have:  Experience using web services: Redshift, S3, Spark, DigitalOcean, etc. Experience with distributed data/computing tools: Map/Reduce, Hadoop, Hive, Spark, Gurobi, MySQL, etc. A deep understanding of full stack development process including front-end, back-end, and database (SQL, NoSQL) Experience in new product development from ideation specification Experience in agile software development methodology, and use of agile software development productivity tools (i.e. JIRA, Confluence) Ability to juggle many competing priorities/deadlines Strong organizational skills Ability to work with both technical and functional resources #Product22",Today,"10,446 reviews"
https://www.indeed.com/viewjob?jk=c39f4fdb48eb7e18&from=web&vjs=3,10,Data Scientist - Bioinformatics,"UES, Inc.","Wright-Patterson AFB, OH 45433","UES is seeking a Data Scientist / Bioinformatics Analyst to support the Airmen Systems Directorate within the Human Performance Wing at Wright Patterson Air Force Base in Dayton, Ohio. This position will require a strong understanding of the analysis of large biological data sets with an emphasis on transcriptomics and proteomics data, optimal experimental design (focusing on statistical power and sample size), and the ability to tactfully advise primary investigators on their data acquisition. Concise communication of those statistical findings to primary investigators will be paramount. The Data Scientist will also serve as a technical expert who can provide early-guideline and detailed-requirements for both individual level sensors and their suit to various in-house project leads and collaborators. Strong written and verbal communication skills, a high level of organization, and close attention to detail will be required. A self-motivated individual with the ability to work in a team environment will be best for this role.   Requirements:  Master's degree in Applied Math, Statistics, Bioinformatics, or related field is required  Proficiency in technical writing and presentations  2 or more years of relevant experience is required  Fluency in standard MS Office software applications  This position is working within a government facility and requires U.S. Citizenship   Additional Information  UES, Inc. is an innovative science and technology company providing customers with superior research and development expertise since its inception in 1973. Our long-term success is a direct result of a strong commitment to the success of our employees. We look forward to reviewing your application.  UES, Inc. is committed to hiring and retaining a diverse workforce. We are proud to be an Equal Opportunity/Affirmative Action Employer, making decisions without regard to race, color, religion, creed, sex, sexual orientation, gender identity, marital status, national origin, age, veteran status, disability, or any other protected class. U.S. Citizenship is required for most positions.",20 days ago,
https://www.indeed.com/viewjob?jk=3ca8da9b42701016&from=web&vjs=3,10,Data Scientist (Remote),Avient,"Avon Lake, OH","Data Scientist (Remote)   -   ( 21001285 ) Description This position has the option to be 100% remote  Avient Corporation (NYSE: AVNT), with expected 2021 revenues of $4.6 to $4.7 billion, provides specialized and sustainable material solutions that transform customer challenges into opportunities, bringing new products to life for a better world. Examples include:  Barrier technologies that preserve the shelf-life and quality of food, beverages, medicine and other perishable goods through high-performance materials  Light-weighting solutions that replace heavier traditional materials which can improve fuel efficiency in all modes of transportation  Breakthrough technologies that minimize wastewater and improve the recyclability of materials and packaging across a spectrum of end uses   Avient employs approximately 8,400 associates and is certified ACC Responsible Care®, a founding member of the Alliance to End Plastic Waste and certified Great Place to Work®. For more information, visit www.avient.com.  WHY AVIENT:  At Avient, we strive for a culture of trust and engagement. Our associates are leading company initiatives such as Lead by Women, HYPE (Harnessing Young Professionals), Pride at Avient and Embrace to advance diversity in professional and personal development. We also provide our associates with robust development programs such as Avient Academy, Lean Six Sigma, and various leadership workshops to allow for career growth in a variety of ways. With workplace flexibility, health and wellness programs, casual dress days, and paid time off for community service, we are committed to building upon our positive momentum.  At Avient, we believe diversity of ideas and backgrounds gives us the creativity to be successful in a rapidly changing world. In support of this, we stress equality of opportunity for all qualified individuals in accordance with applicable laws. Decisions in hiring, promotion, development, compensation and advancement are based upon non-discriminatory factors such as, for example, qualifications, abilities, experience, and performance.  Job Summary   We are looking for a Data Scientist who will support our development, sales, leadership, operations, and marketing teams with insights gained from analyzing company data. The ideal candidate is adept at using large data sets to find opportunities for product and process optimization and using models to test the effectiveness of different courses of action. They must have strong experience using a variety of data mining/data analysis methods, using a variety of data tools, building and implementing models, using/creating algorithms and creating/running simulations. They must have a proven ability to drive business results with their data-based insights. They must be comfortable working with a wide range of stakeholders and functional teams. The right candidate will have a passion for discovering solutions hidden in large data sets and working with stakeholders to improve business outcomes.  Essential Functions  Use strong business acumen, as well as an ability to communicate findings, and mine vast amounts of data for useful insights  Use these insights to influence how an organization approaches business challenges  Use a combined knowledge of computer science and applications, modelling, statistics, analytics and math to solve problems  Extract data from multiple sources  Sift and analyze data from multiple angles, looking for trends that highlight problems or opportunities  Communicate important information and insights to business and IT leaders  Make recommendations to adapt existing business strategies  Other duties as assigned  Qualifications Education and Experience   We’re looking for someone with 5-7 years of experience manipulating data sets and building statistical models, has a Master’s or PHD in Statistics, Mathematics, Computer Science or another quantitative field.  Knowledge and experience in statistical and data mining techniques: GLM/Regression, Random Forest, Boosting, Trees, text mining, etc.  Experience querying databases and using statistical computer languages: R, Python, SQL, etc.  Experience creating and using advanced machine learning algorithms and statistics: regression, simulation, scenario analysis, modeling, clustering, decision trees, neural networks, etc.  Adept at visualizing/presenting data for stakeholders.   Additional Qualifications   Strong problem solving skills.  Strong Project Management skills.  Excellent written and verbal communication skills for coordinating across teams.  A drive to learn and master new technologies and techniques.   Competencies  Each position at Avient focuses on eight Core Competencies as a Leader of Self. Additionally, management positions focus on Leadership Competencies as a Leader of Others and/or a Leader of the Business. These competencies are designed to drive behavior that will ultimately help our associates excel at their current roles, while supporting individual and career development.  Avient Corporation is a drug free workplace. Avient is an equal opportunity employer. We maintain a policy of non-discrimination in providing equal employment to all qualified employees and candidates regardless of race, sex, sexual orientation, gender identity, age, color, religion, national origin, disability, genetic information, protected veteran’s status, or other legally protected classification in accordance with applicable federal, state and local law.  Primary Location :  United States Work Locations :  OH Avon Lake (Offices) Avon Lake 44012 Job :  Research and Development/Technical Job Posting :  Dec 3, 2021, 2:25:23 PM",30+ days ago,293 reviews
https://www.indeed.com/viewjob?jk=a10963412688623f&from=web&vjs=3,10,Data Scientist / Analyst (remote),LinQuest Corporation,"Beavercreek, OH 45431","LinQuest is seeking a Data Scientist / Analyst to join our team. This position can be worked remotely. US Citizenship and the ability to obtain a DoD Secret security clearance is required. LinQuest solves the toughest problems for our clients by extracting insight from data and delivering greater decision confidence. Our analysts are involved in a wide range of activities that range from understanding and transforming data, applying state of the art analytic techniques, and driving business impact through insight visualization. Our analysts are leveraged across of range of projects, such as advanced analytics, business intelligence, and application development. LinQuest analysts collaborate with Operations Research Analysts, Software Development Professionals, Data Architects, and DOD Subject Matter Experts. As a Data Scientist / Analyst, the candidate will be adept at using large data sets to find opportunities for business optimization and using models to test the effectiveness of different courses of action. The Data Scientist / Analyst candidate should have strong experience using a variety of data mining/data analysis methods, using a variety of data tools, building and implementing models, using/creating algorithms and/or creating/running simulations. Candidates must have a proven ability to generate data-driven insights. Candidates must be comfortable working with a wide range of stakeholders and functional teams and have a passion for discovering solutions hidden in large data sets and working with stakeholders to improve business outcomes. Responsibilities: Execute analytical experiments methodically to help solve various problems and make a true impact across various domains and industries Research state-of-the-art data mining methods and innovative statistical models Identify relevant data sources and sets to mine for client business needs, and collect large structured and unstructured datasets and variables Process, cleanse, and verify the integrity of data used for analysis Develop code for predictive/prescriptive models with applied machine learning and other modeling techniques Clearly document and present methodology, assumptions, and findings to stakeholders Required Skills: Strong analytical and problem-solving skills with hands on experience with driving analytic insights. Ability and motivation to self-teach in order to stay current with leading best practices in analytics. Ability to tackle difficult problems specifically working with unstructured textual data. Data wrangling skills. Expected to deliver in a fast-paced, team-oriented work environment. Must thrive in satisfying analytic requirements from diverse user base. Expected to be able to adapt quickly to changing needs across several core areas, including data wrangling, data exploration, data analysis, and data visualization. Must have the knowledge and communication skills to articulate trade-offs between analytic techniques, recommend a course of action to clients, and provide effective updates on project outcome uncertainty to leadership. Preferred Skills: Exploratory Data Analysis Solid understanding of applied machine learning methods and algorithms Applied statistics skills, such as distributions, statistical testing, regression, etc. Data-oriented personality with proficiency in using data query languages such as SQL and ability to understand various data structures and common methods in data transformation Ability to use data visualization to communicate value of insights Required Experience: Bachelor Degree Hands on experience performing analysis to solve problems. Manipulating data with Python or R Developing data pipelines to support Analytics Applying advanced analytics and machine learning techniques Documenting and communicating results of analysis Familiarity with SQL and BI Tools (Tableau, Qlik etc.) US Citizenship and the ability to obtain a DoD Secret clearance Preferred Experience: Current/Active government security clearance Text mining and unstructured data analysis techniques such as Named Entity Recognition and Text Classification NLP tools such as SpaCy and models such as BERT Graph Analysis tools such as Neo4J and Cypher Databricks, RDD, PySpark RShiny App Development Predictive and Prescriptive analysis Benefits:  LinQuest offers comprehensive and competitive benefit offerings to our team members to include medical, dental, vision, retirement, paid time off, company paid life insurance, and more! For additional information please visit: https://www.linquest.com/careers/our-benefits COVID-19 Compliance Guidelines:  As a federal contractor, all LinQuest team members may be required to comply with Executive Order 14042- Ensuring Adequate COVID Safety Protocols for Federal Contractors, which may include mandatory vaccination and ability to provide proof of vaccination status prior to start of employment. Additionally, team members are expected to comply with all safety protocols related to mask wearing and physical distancing while in covered contractor workplaces. If applicable, prospective or new employees may seek an exemption to the vaccination requirement through LinQuest Human Resources and must have an approved exemption prior to the start of their employment. Licenses & Certifications Required Ability to Obtain Equal Opportunity Employer/Protected Veterans/Individuals with Disabilities The contractor will not discharge or in any other manner discriminate against employees or applicants because they have inquired about, discussed, or disclosed their own pay or the pay of another employee or applicant. However, employees who have access to the compensation information of other employees or applicants as a part of their essential job functions cannot disclose the pay of other employees or applicants to individuals who do not otherwise have access to compensation information, unless the disclosure is (a) in response to a formal complaint or charge, (b) in furtherance of an investigation, proceeding, hearing, or action, including an investigation conducted by the employer, or (c) consistent with the contractor’s legal duty to furnish information. 41 CFR 60-1.35(c)",23 days ago,45 reviews
https://www.indeed.com/viewjob?jk=56e47d411768f307&from=web&vjs=3,10,Senior Data Scientist,Ascena,"Pataskala, OH 43062","ascena’s Advanced Analytics group is seeking an exceptional, highly motivated and self-directed Senior Data Scientist to be responsible for performing data-driven research, problem solving, and algorithm development through the systematic application of mathematics, statistics and computer science as well as cutting edge data technologies. This role will interact with and impact multiple enterprise-wide functions, including technology, marketing analytics, merchandise planning & allocation, digital, customer experience, store operations, performance marketing, supply chain and others as the organization modernizes and evolves data sciences.  In this role, you will: Build and deploy machine learning models to solve challenging and complex business problems. Perform and present exploratory and/or statistical analyses to provide insight to business leaders. Be an analytics thought leader within the department and larger analytics function. Work closely with business leaders to identify and design analytical solutions across multiple functions. Lead, coach and train junior data science resources domestically and offshore (technology & innovation center in Bangalore). Communicate results and recommendations to senior management. Research next-generation machine learning techniques.  Qualifications: 6-8 years working in data science field performing data analysis and building Machine Learning models. Solid foundation in Math, Statistics, or Computer Science. Strong programming skills in Python or R and SQL. Real world experience building and orchestrating Machine Learning pipelines (e.g. KubeFlow) a plus. Experience with MLOps a plus. Experience working in Cloud environment. Preferred experience with CI/CD, Docker & Kubernetes. Experience in retail a plus.  Education:  MSc or PhD in a STEM Field  Location:  Preference is for this role to be at our home office location; however remote work alternatives may be discussed if consistent with the needs of the business. #LI-RZ1 #LI-Remote",30+ days ago,481 reviews
