URL,page_count,job_title,company,location,job_Description,post_date,reviews
https://www.indeed.com/viewjob?jk=110447fe4a6302b6&from=web&vjs=3,40,"Senior Data Analyst, AWS-Elemental BI & Data Analytics Team",Elemental Technologies LLC,Oregon,"     5+ years of professional experience in business analytics     BS in Math, Statistics, Data Science, Data Analytics, Economics, Finance or related field     Experience designing and optimizing interactive Tableau workbooks     A passion for Data Visualization techniques and the understanding of when and how to use them     SQL competency (CTEs, Window functions)     Experience with cloud-based data warehousing systems (Redshift preferred)     Experience delivering analytical projects end-to-end     Strong ability to interpret and communicate analytical outcomes and insights     Good verbal and written communication skills to both business and technical audiences           Job summary    AWS-Elemental, a leading provider of Media production and distribution services, is looking for a Senior Analyst to join their BI and Data Analytics team. In this role you will work directly with Product and Business Teams across the organization to solve complex analytical challenges using in-house tools to produce and share outcomes, ideas, and insights that will have a profound impact on the business.         The right candidate will understand not only how to mine, assemble, and analyze complex data, but will be excellent at communicating complex outcomes through various mediums, including analytic documents and online interactive content.        Key job responsibilities    Reporting to the BI team lead, the analyst will independently own and balance multiple short- and long-term analytic projects, requiring the ability to:            Work with business partners to produce and transform ideas and asks into detailed requirements and actionable goals      Develop datasets using BI tools ( Tableau, QuickSight ) and/or direct  SQL  queries against disparate data sources both inside Elemental and across AWS      When needed, write data pipeline specifications for more complex data requirements      Apply  analytic and statistical methodologies  to produce answers, ideas, and insights that are easily communicated to the business for feedback and ongoing iterative refinement      Employ  rugged testing methodologies  to assess outcome validity      Work with your team to  transform one-time analysis into repeatable and reusable objects and workflows  that can be deployed to the Elemental Tableau site as interactive dashboards and visualizations      Efficiently communicate project status to both stakeholders and team leadership        About the team    The AWS-Elemental BI program provides data and analytic services and solutions to the entire Elemental organization. We have two primary functions: 1) Content and data development/enhancement of our BI and data warehousing solution 2) Deep analytic studies focused on reducing operational costs, increasing revenues, or both.         We’re strong believers in enabling basic analytic self-sufficiency in our user community. As part of our BI Community of Practice, you’ll have the opportunity to share your own analytic and reporting best practices with other analysts and Tableau power users throughout the Elemental organization.               Graduate degree in in Math, Statistics, Data Science, Data Analytics, Economics, Finance or related field      Experience with AWS data analytics and pipeline tools      Strong Tableau experience (custom data sources, advanced development skills)      Familiarity with data science techniques, ML approaches to data analysis, and predictive modeling      Experience with cloud-based product analytical scenarios      Familiarity with Python driven data analysis techniques      Professional familiarity Media and Entertainment industry and/or the Media Content packaging and delivery domain        Amazon is committed to a diverse and inclusive workplace. Amazon is an equal opportunity employer and does not discriminate on the basis of race, national origin, gender, gender identity, sexual orientation, protected veteran status, disability, age, or other legally protected status. For individuals with disabilities who would like to request an accommodation, please visit https://www.amazon.jobs/en/disability/us.  ",21 days ago,"81,488 reviews"
https://www.indeed.com/viewjob?jk=3e828c8a5fb3b440&from=web&vjs=3,40,Data Center Technology Solution Strategist - Xeon Accelerators,Intel,"Hillsboro, OR 97124","     Job Description     Be a part of the Technology Leadership team in the Xeon and Memory Group (XMG) organization within the Data Center and AI Group (DCAI). XMG is responsible for driving the business strategies and roadmap for Intel's largest data-centric business - Intel® Xeon®. You will play a central role in helping Intel develop exciting new Data Center opportunities by defining and delivering Xeon® technologies to our customers as a Data Center technology solution leader.    The Data Center Solution Technology Strategist position will lead a cross-Intel team of experts to identify and define the best technology solutions to intercept our product roadmap. This team will consist of internal representatives from software, enabling, ecosystem, customers, segments/verticals, architecture, design, IP, validation, go-to-market, and more. To assess technology solution needs and value, market and customer engagement is required and expected. This position demands strong leadership skills to drive the team to 1-voice decisions and direction that will be reviewed and ratified by product line and functional group GMs across Intel.    The Xeon Accelerators Strategist role will set the direction for our on-die Xeon® accelerators, with emphasis on the right workloads to accelerate, making the necessary trade-offs on performance vs. cost and market adoption. This also encompasses setting the strategy for accelerator integration and industry standardization/adoption of acceleration supporting capabilities (virtualization, ISA/programming, etc.) to enable Xeon® acceleration.        “Intel, the Intel logo and Xeon are trademarks of Intel Corporation or its subsidiaries.”     Primary Job Activities         Lead and manage cross-Intel teams      Define and prescribe solution direction and requirements      Identify customer needs and value propositions      Develop and defend investment business case      Make/recommend technology direction decisions      Manage complex feature, schedule, cost, and performance tradeoffs      Partner with internal and external stakeholders and customers           This position is not eligible for Intel immigration sponsorship.           Qualifications        Minimum Qualifications         Bachelor's Degree in Engineering or Computer Science. MBA preferred.      5+ years of experience in technology architecture, design, and/or product management of Data Center compute solutions      2+ years of additional experience defining business strategies and technical product requirements with successful execution.           Preferred Qualifications         Business strategy acumen and strategy development experience      Technical and product experience and depth with customer usages and solution stacks      Deep knowledge and experience in Data Center workloads, usages, and deployments      Strong product, technology, software and ecosystem background and experience      Program management capability and experience in team leadership      Customer and architecture engagement/requirements-gathering experience      Decision-making experience as driver/recommender to GM/VP product owners      Self-starter who can drive business needs and opportunities, translate into technical product requirements, and prioritize investments.      Excellent customer communication and collaboration skills.           Inside this Business Group     The Data Center & Artificial Intelligence Group (DCAI) is at the heart of Intel’s transformation from a PC company to a company that runs the cloud and billions of smart, connected computing devices. The data center is the underpinning for every data-driven service, from artificial intelligence to 5G to high-performance computing, and DCG delivers the products and technologies—spanning software, processors, storage, I/O, and networking solutions—that fuel cloud, communications, enterprise, and government data centers around the world.     Other Locations    US, California, Santa Clara        Intel strongly encourages employees to be vaccinated against COVID-19. Intel aligns to federal, state, and local laws and as a contractor to the U.S. Government is subject to government mandates that may be issued. Intel policies for COVID-19 including guidance about testing and vaccination are subject to change over time.        Posting Statement    All qualified applicants will receive consideration for employment without regard to race, color, religion, religious creed, sex, national origin, ancestry, age, physical or mental disability, medical condition, genetic information, military and veteran status, marital status, pregnancy, gender, gender expression, gender identity, sexual orientation, or any other characteristic protected by local law, regulation, or ordinance.     ",3 days ago,"5,618 reviews"
https://www.indeed.com/viewjob?jk=e4ab9c724c8640c1&from=web&vjs=3,40,AI Software Architect,Intel,"Hillsboro, OR 97124","     Job Description     Intel is shaping the future of technology to help create a better future for the entire world. Our work in pushing forward fields like AI, analytics, and cloud-to-edge technology is at the heart of countless innovations. Intel is actively seeking software architects to help design and drive architecture for accelerating AI systems. In addition, you will be collaborating with other engineering teams working on AI infrastructure, neural network designs and independent software vendors. With a career at Intel, you’ll have the opportunity to use technology to power major breakthroughs and create enhancements that improve our everyday quality of life. Join us and help make the future more wonderful for everyone.        Responsibilities will include, but not be limited to:         Architects, designs, and provides technical oversight of the development of Intel AI software.      Scope may span the entire stack including firmware, drivers, frameworks, protocols, algorithms, and/or applications.      Provides software structure and validation direction as required to enable Intel AI software solutions that integrate AI algorithms to solve applied problems in various disciplines (e.g., data analytics, computer vision) by utilizing current programming methodologies to translate machine learning models and data processing methods into software.      Responsible for pathfinding and providing technical direction for AI software development to solve applied problems across disciplines, including descriptive, diagnostic, predictive, and/or prescriptive models.      Interacts with technologists across Intel and within the industry to evaluate feasibility of requirements and determine priorities for development.           Qualifications     Minimum Qualifications:         Bachelor's Degree in Computer Science, Electrical Engineering or equivalent with 4+ years of experience or Master's Degree in Computer Science, Electrical Engineering or equivalent with 3+ years of experience.      Experience in Software or Firmware architecture including documentation, requirements, architectural simulations, etc.           Preferred Qualifications:         Experience in the following areas: AI/deep learning.      Compute acceleration of AI workloads on GPU, CPU or accelerators experience.      Computer Architecture and SW stacks.      Embedded systems.      Experience in Linux and Windows drivers.      Experience with WinML inferencing platforms           Inside this Business Group     The Internet of Things Group (IOTG) consists of ~4700 dedicated employees across 25 locations across the world. IOTG drives significant growth in the Internet of Things (IoT) market, capitalizing on the inflection and creation of edge computing, leveraging smart, connected devices and artificial intelligence (AI) to enable partners to transform their businesses. IOTG's vision is to lead the industry and enterprises to enhance the way we live and work by making it easier to create exciting, new IoT/edge solutions. IOTG's strategy includes creating unique differentiated silicon to consolidate workloads at the Edge, investing in video and AI inference as the killer app for the Edge, creating new developer tools and ecosystems, and establishing a dedicated vertical consultative sales team to add value to our partners across many verticals.     Other Locations    US, Arizona, Phoenix;US, California, Folsom;US, California, Santa Clara;US, Washington, Multiple Cities;Virtual US and Canada        Intel strongly encourages employees to be vaccinated against COVID-19. Intel aligns to federal, state, and local laws and as a contractor to the U.S. Government is subject to government mandates that may be issued. Intel policies for COVID-19 including guidance about testing and vaccination are subject to change over time.        Posting Statement    All qualified applicants will receive consideration for employment without regard to race, color, religion, religious creed, sex, national origin, ancestry, age, physical or mental disability, medical condition, genetic information, military and veteran status, marital status, pregnancy, gender, gender expression, gender identity, sexual orientation, or any other characteristic protected by local law, regulation, or ordinance.        Annual Salary Range for jobs which could be performed in US, Colorado:  $149,020.00-$223,560.00     Benefits:     We offer a total compensation package that ranks among the best in the industry. It consists of competitive pay, stock, bonuses, and benefit programs. Find more information about our Amazing Benefits here           Work Model for this Role         This role will be eligible for our hybrid work model which allows employees to split their time between working on-site at their assigned Intel site and off-site.    Intel is committed to a culture of accessibility. Intel provides accommodations to applicants and employees with disabilities. Find information and request accommodation here   ",6 days ago,"5,618 reviews"
https://www.indeed.com/viewjob?jk=897c664f52d44e93&from=web&vjs=3,40,"Senior Data Scientist, Financial Customer Analytics | (HYBRID)",First Tech Federal Credit Union,"Hillsboro, OR 97124","       Enterprise Data and Analytics Center of Excellence mission is to render First Tech both a data-driven and a member-centric organization. Advanced Analytics is on the front lines of this mission by providing robust research, data science and analytics. The Financial Services Customer Analytics Senior Data Scientist works with stakeholders to formulate, gauge and prioritize business use cases, designs experiments, develops predictive/prescriptive models on large-scale datasets (structured and unstructured) to address them, and uses statistics, complex analyses and machine learning models to drive member value and business success. In addition, the Senior Data Scientist collaborates with the Machine Learning and IT DevOps teams to ensure operationalization and productization of solutions generated at the Enterprise level.     Here's what you can expect from the job and what you need to be successful:     Job Duties         Practice causal data science, build predictive models, conduct simulations, create visualizations, and influence data science practice across the organization      Create experiments and prototype implementations of new learning algorithms and prediction techniques      Research, design, implement and validate cutting-edge algorithms/models to analyze diverse sources of data to achieve targeted outcomes with a focus on delivering business results including improved end-to-end customer experience and financial metrics      Process, cleanse, and verify the integrity of data and the data pipelines used for analysis      Provide meaningful insights through advanced analytics models and solutions targeted to respond to critical business issues and accelerate stakeholder growth and success      Initiate and drive consulting sessions with stakeholders regarding generation, gauging and prioritization of business use cases using advanced analytics. Establish and present metrics on the progress and success of advanced analytics initiatives      Partner with cross-functional team members to identify and prioritize actionable, high-impact insights across a variety of core business areas      Deliver informative and effective findings, results and recommendations from statistical analysis to stakeholders      Initiate and drive projects to completion, including supporting stakeholders in the integration of advanced analytics assets into their operational processes      Recommend ongoing improvements to methods and algorithms currently in production      Partner with Analysts and cross-functional business teams to provide expertise on mathematical concepts that are leveraged enterprise-wide      Act as a subject matter expert in providing technical guidance and mentorship to peer team members on analytics and analysis best practices, solution design, and lead code/design reviews        Essential Skills         Minimum 7 years’ professional experience in a data science role, working with large amounts of data, and implementing end-to-end (inception to productization) solutions preferably in the financial services industry      Expert knowledge and experience in data mining, NLP, predictive and prescriptive analytics approaches      Hands-on experience with A/B and multivariate testing, funnel analytics, multi-armed bandits, lifetime value, experimental design      Deep understanding of machine learning (ML) techniques including but not exhausted to clustering, generalized linear models, decision trees, support vector machines, genetic algorithms, anomaly detection, Bayesian networks, deep learning      Demonstrated experience with common business intelligence and data visualization tools (Tableau preferred)      Demonstrated experience with cloud-based Data Science platforms (Dataiku Data Science Studio preferred)      Demonstrated experience with cloud technologies (AWS, Azure, MLaaS, AIaaS)      Proficiency in the use of scripting languages and ML platforms (R, Python, TensorFlow, Spark)      Expert knowledge of SQL and databases. Experience with Snowflake preferred      Demonstrated experience with containers (Kubernetes, Docker), Git      Expert command of the English language, persuasive written and verbal communication and an ability to effectively tell stories with data      Comfortable with ambiguity and yet able to steer analytics projects toward clear business goals, testable hypotheses and action-oriented outcomes      Ability to anticipate needs and prioritize projects in a fast-paced environment with tight deadlines and high-volume peaks while producing high-quality work      Exemplary communication skills; oral and written, with ability to translate complex statistical and quantitative analysis into simple real-real world inferences for both technical and non-technical audiences      Expert level analytical and problem-solving skills with attention to detail      Ability to function effectively in cross-functional teams that include business and technical contributors      Ability to translate business objectives into actionable analyses      Demonstrated effective time management skills and the ability to work independently or in a collaborative team environment      Minimum Education:  Master’s or PhD degrees in Mathematics, Statistics, Data Science, Econometrics, or relevant fields      Certification/License : Data Science related certifications required        Location:  Hillsboro, OR 97124 (HYBRID)     What makes First Tech different? Click  here  to learn more!        Equal Opportunity Employer/Protected Veterans/Individuals with Disabilities     The contractor will not discharge or in any other manner discriminate against employees or applicants because they have inquired about, discussed, or disclosed their own pay or the pay of another employee or applicant. However, employees who have access to the compensation information of other employees or applicants as a part of their essential job functions cannot disclose the pay of other employees or applicants to individuals who do not otherwise have access to compensation information, unless the disclosure is (a) in response to a formal complaint or charge, (b) in furtherance of an investigation, proceeding, hearing, or action, including an investigation conducted by the employer, or (c) consistent with the contractor’s legal duty to furnish information. 41 CFR 60-1.35(c)   ",30+ days ago,182 reviews
