URL,page_count,job_title,company,location,job_Description,post_date,reviews
https://www.indeed.com/viewjob?jk=97f048e4efe00977&from=web&vjs=3,40,Labs - Data Scientist - Senior Associate,PRICE WATERHOUSE COOPERS,"Portland, OR 97205","PwC Labs is focused on standardizing, automating, delivering tools and processes and exploring emerging technologies that drive efficiency and enable our people to reimagine the possible. Process improvement, transformation, effective use of innovative technology and data & analytics, and leveraging alternative delivery solutions are key areas of focus to drive additional value for our firm. The AI Lab focuses on implementing solutions that impact efficiency and effectiveness of our technology functions. Process improvement, transformation, effective use of technology and data & analytics, and leveraging alternative delivery are key areas to drive value and continue to be recognized as the leading professional services firm. AI Lab is focused on identifying and prioritizing emerging technologies to get the most out of our investments. To really stand out and make us fit for the future in a constantly changing world, each and every one of us at PwC needs to be a purpose-led and values-driven leader at every level. To help us achieve this we have the PwC Professional; our global leadership development framework. It gives us a single set of expectations across our lines, geographies and career paths, and provides transparency on the skills we need as individuals to be successful and progress in our careers, now and in the future. As a Senior Associate, you'll work as part of a team of problem solvers, helping to solve complex business issues from strategy to execution. PwC Professional skills and responsibilities for this management level include but are not limited to: Use feedback and reflection to develop self awareness, personal strengths and address development areas. Delegate to others to provide stretch opportunities, coaching them to deliver results. Demonstrate critical thinking and the ability to bring order to unstructured problems. Use a broad range of tools and techniques to extract insights from current industry or sector trends. Review your work and that of others for quality, accuracy and relevance. Know how and when to use tools available for a given situation and can explain the reasons for this choice. Seek and embrace opportunities which give exposure to different situations, environments and perspectives. Use straightforward communication, in a structured way, when influencing and connecting with others. Able to read situations and modify behavior to build quality relationships. Uphold the firm's code of ethics and business conduct. Job Requirements and Preferences :   Basic Qualifications :   Minimum Degree Required : Bachelor Degree   Additional Educational Requirements : In lieu of a Bachelor Degree, 12 years of professional experience involving technology-focused process improvements, transformations, and/or system implementations Minimum Years of Experience : 2 year(s)   Preferred Qualifications :   Degree Preferred : Master Degree   Preferred Fields of Study : Computer and Information Science, Mathematics, Computer Engineering, Artificial Intelligence and Robotics, Statistics, Data Processing/Analytics/Science   Preferred Knowledge/Skills : Demonstrates thorough abilities and/or a proven record of success as a team leader in the following areas: Evaluating new technologies to quickly determine their long term viability within PwCs enterprise wide technology stack, serving 50k+ professionals; Understanding a business problem and being able to translate the problem into a hypothesis that can be tested using various data science techniques; Conducting research in a lab environment and publishing work through AI institutes and journals; Demonstrating thorough understanding of complex machine learning algorithms, data analysis techniques, and data science tools, to address a variety of challenging business problems in the areas of natural language understanding, computer vision, and unsupervised learning; Building a variety of machine learning models and more importantly, knowing when and why it is appropriate to use each technique: KNN, Logistic Regression, Naive Bayes, Random Forests, Support Vector Machines, XGBoost, Deep Neural Networks, K-means and Hierarchical Clustering, etc.; Building machine learning models, data pipelines, and autonomous systems, interpreting their output, and communicating the results to a non technical audience; and, Performing DevOps/engineering tasks in publishing and deploying AI assets in live production environments suitable for large scale adoption for 55k+ professionals throughout the US. Demonstrates thorough abilities and/or a proven record of success with a subset of the following technologies: Programming including Python, R, Java, JavaScript, C++, Unix Hardware, sensors, robotics, GPU enabled machine learning, FPGAs, and Raspberry Pis, etc.; Data Storage Technologies including SQL, NoSQL, Hadoop, cloud-based databases such as GCP BigQuery, and different storage formats (e.g. Parquet, etc.); Data Processing Tools including Python (Numpy, Pandas, etc.), Spark, and cloud-based solutions such as GCP DataFlow; Machine Learning Libraries including Python (scikit-learn, gensim, etc.), TensorFlow, Keras, PyTorch, and Spark MLlib; NLP and text extraction techniques including document topic analysis, document clustering and classification, named entity extraction/resolution, creating word/sentence embeddings (numerical vector representations), sentiment analysis etc.; Visualization including Python (Matplotlib, Seaborn, Plotly, bokeh, etc.), and JavaScript (d3); and, Code management, model productionization and containerization technologies including GitHub, Flask, Docker, and Kubernetes. At PwC, our work model includes three ways of working: virtual, in-person, and flex (a hybrid of in-person and virtual). Visit the following link to learn more: https://pwc.to/ways-we-work.  PwC does not intend to hire experienced or entry level job seekers who will need, now or in the future, PwC sponsorship through the H-1B lottery, except as set forth within the following policy: https://pwc.to/H-1B-Lottery-Policy.  All qualified applicants will receive consideration for employment at PwC without regard to race; creed; color; religion; national origin; sex; age; disability; sexual orientation; gender identity or expression; genetic predisposition or carrier status; veteran, marital, or citizenship status; or any other status protected by law. PwC is proud to be an affirmative action and equal opportunity employer.  For positions based in San Francisco, consideration of qualified candidates with arrest and conviction records will be in a manner consistent with the San Francisco Fair Chance Ordinance.  For positions in Colorado, visit the following link for information related to Colorado's Equal Pay for Equal Work Act: https://pwc.to/coloradoifsseniorassociate.  #LI-Remote",2 days ago,"7,977 reviews"
https://www.indeed.com/viewjob?jk=c7dae52a02e70626&from=web&vjs=3,40,Senior Data Analyst,Trupanion,"Portland, OR 97035","Trupanion is a leading provider of medical insurance for cats and dogs in North America. Our mission is to help the pets we all love receive the veterinary care they need. At Trupanion, we offer a collaborative, casual, and pet-friendly environment where everyone is encouraged to be themselves. Position Summary: The Customer Insights team at Trupanion is looking for a curious and pet loving analyst to join our team. We need a driven analyst who can creatively come up with data-focused solutions to problems through inquiry, data collection, analysis and collaboration with leaders in customer experience and marketing to drive change. Successful candidates will have unbridled curiosity, enjoy solving complex problems and share our love of data and pets! Candidates for this position have the option to work remotely from anywhere in the US, or out of our Seattle office, depending on their preference. Key Responsibilities Include: Foster effective working relationships with fellow analysts and business partners to create an environment of knowledge sharing Ability to see to the core of a problem, understanding the “why” behind a question Observant and inquisitive, discovering opportunities to use data to better understand our customers Extract and reconcile data from our robust data warehouse or identify and strategize new data to be collected through third party partnerships, surveys and more Conduct primary and secondary customer research with focus on both quantitative and qualitative analysis Apply advanced statistical and analytical techniques to derive meaning from data with a focus on impact Present findings to business partners, often collaborating to develop and implement action plans Monitor results through performant dashboards, rinse and repeat Qualifi cations Please include a cover letter with your application. Experience: 5+ years’ experience of data extraction and manipulation (eg SQL), statistical analysis and other modeling techniques 3+ years leading or mentoring junior analysts 3+ years using data to drive strategy Skills, Knowledge & Abilities: Comfortable working on complex and ambiguous problems Highly driven and motivated to work in a fast-paced, high-growth environment Advanced experience with data analysis including applying statistical methods and modeling techniques Advanced experience with data visualization platforms (Tableau preferred) Experience with research and survey methodology preferred Flexible to work independently and in a team-based environment Benefits and Perks: Bonus opportunities Full medical, dental, and vision benefits at no cost to the employee Four weeks paid time off and 9 paid float holidays (you can decide which days are most important to you!) Five-week sabbatical after five years of employment Restricted Stock Units Open, casual, pet-friendly, and fun office environment Free medical health insurance for your pet (1 dog or cat) Paid time off to volunteer at nonprofit organizations Seattle Office Amenities: Free on-site gym, free dog walking services for office pets during business hours, free parking, and paid ORCA cards. About Trupanion: We’re all about helping pets. We promote a cohesive and nimble team environment, and we hire, develop and promote team members. We trust each other. We are transparent and honest. We care about one another and want to see our team members succeed, personally and professionally. We strive to promote from within and reduce bureaucracy to allow creative thinking. We’re focused on providing continuous training and support to all team members to encourage long-term happiness and success. Take a look inside our office and see for yourself: https://www.facebook.com/Trupanion/videos/10155423763702974/ We’re more than insurance – we’re a tech company too! Learn more about how you can use Trupanion to pay your vet directly here: https://www.youtube.com/watch?v=vdWZ4KHiPTQ Trupanion Team DNA: At Trupanion, we achieve great things together when we are: Caring:  We are kind to each other and assume positive intent. Collaborative:  We work together to achieve company goals (we not me). Courageous:  We are determined, take risks, and make bold moves. Curious:  We seek new information to continually better ourselves and our work. Honest:  We believe candid communication leads to successful teamwork. Inclusive:  We welcome and value all people and perspectives. Nimble:  We readily adapt and evolve in pursuit of progress and innovation. For more information about Trupanion, visit http://trupanion.com/about Trupanion is an equal opportunity employer and embraces diversity. We are committed to building a team that represents a variety of backgrounds, abilities, perspectives, and skills. We will ensure that individuals are provided reasonable accommodation to participate in the job application or interview process, perform essential job functions, and receive other benefits and privileges of employment. Please contact us to request accommodations.",30 days ago,57 reviews
https://www.indeed.com/viewjob?jk=b2e7b493c9dcaa9a&from=web&vjs=3,40,"Data Scientist (Portland, OR) #107523",PacifiCorp,"Portland, OR 97232","                                       PacifiCorp is seeking customer-centric candidates to grow and sustain our commitment to a culture of customer service excellence, environmental sustainability and diversity, equity and inclusion.                     General Purpose                   Provides technical leadership on the most complex and business critical engineering projects related to wildfire mitigation. Facilitates internal training for engineers and technicians in subject area; acts as company subject matter expert. Develops presentations for senior management and recommends and implements changes to benefit the company. Develops engineering studies, plans, specifications, calculations, evaluations, design documents, and performance assessments associated with the planning, design, licensing, construction, operation, and maintenance of the Company’s generation, transmission, distribution, telecommunication, or other utility facilities/systems.                     Responsibilities                         Independently conduct highly complex engineering research studies and technical analyses in areas of specialized expertise not commonly available or obtainable in the competitive engineering market.        Ability to work effectively with engineering, operations, dispatch and regulatory teams to analyze complex problems, identify issues, innovate and deliver solutions consistent with schedules established.        Lead or support project teams in the development of critical wildfire mitigation solutions.        Provide technical expertise across business in the area of wildfire mitigation and data analysis.        Ability to coordinate or otherwise support fire data analysis and fire investigations.        Serve as the Company expert in the discipline and provide authoritative consultation and recommendations to senior management.        Develop detailed computational analysis, including data science, computer modeling, and scripting and tool development, and integrate methods and products within and across company software products.        Ensure analysis data and programming code meet regulatory and company standards and are consistently structured to extend across toolsets for efficient programming, reporting and code review        Participate in government, industry, collegiate and other applicable associations or work groups which have the ability to influence or set policy impacting the future of our utility.        Determine methods and techniques for obtaining results.        Lead technical/project manager for wildfire mitigation based technical projects required by regulations including annual California Wildfire Mitigation Plans.        Strong customer service focus.                          Requirements                         Bachelor’s degree in Engineering, Analytics, Data Science, Math, or Physics from an accredited college/university.        A minimum of 10 or more years’ power/utility engineering experience as a practicing engineer, including experience performing highly technical work of a specialized nature; and        A minimum of 5 years of experience in data mining and data exploitation including:        Coding knowledge and experience in one or more languages (Java, C, C++),        Scripting knowledge and experience in one or more languages (R, Python, Bash, Spark),        Some knowledge and experience in statistical and data mining techniques,        Big Data Querying from one or more languages/platforms (SQL, NoSQL, R, Graph),        Experience using libraries of advanced analytics techniques (statistics, machine learning, calculus, etc.),        Experience using one or more 3rd party analytics tools (such as PowerBI),        Experience visualizing/presenting data for stakeholders.        Project management and leadership skills including the ability to work as a team member, maintain project timelines, budgets, and deliver on commitments.        Ability to perform effectively in high-pressure situations while maintaining focus and calmness.        Highest level of communication and interpersonal skills involving the ability to work cross-functionally to understand requirements, present alternatives, and recommendations.                          Preferences                         Project Management Professional (PMP) designation.        Professional Engineering license.        Knowledge of applicable federal, state, and local laws regulations and electrical codes.        Understanding of the Company’s business and relevant policies, procedures, and practices.                          Additional Information                   Req Id: 107523  Company Code: PacifiCorp  Primary Location: PORTLAND  Department: Pacific Power  Schedule: FT  Personnel Subarea: Exempt  Hiring Range: 110,300 - 129,800  This position is eligible for an annual discretionary performance incentive bonus of up to 15.00% of salary.            Employees must be able to perform the essential functions of the position with or without an accommodation.            At PacifiCorp, we encourage everyone to work together. We embrace diversity and value the distinct perspectives of all our employees. We strive to cultivate a workplace that connects each employee to the organization and enables all individuals to participate and contribute to their full potential.            It is PacifiCorp's policy to provide and promote equal employment opportunity to all employees and applicants in accordance with local, state and federal laws and regulations governing personnel activities. In accordance with federal guidelines, PacifiCorp is committed to a program of affirmative action. All qualified applicants will receive consideration for employment without regard to race, color, religion, sex, disability, veteran status, national origin, sexual orientation or gender identity.            All offers of employment are contingent upon the successful completion of a background check and drug screening          ",30+ days ago,136 reviews
https://www.indeed.com/viewjob?jk=0eceea550b0d35eb&from=web&vjs=3,40,Data Platforms Group College Graduate Rotation Program Professional,Intel,"Hillsboro, OR 97124","     Job Description     Come innovate and solve technology challenges that positively impact the world for one of the largest semiconductor companies in the world! The Data Platforms Group (DPG) college graduate rotation program is an immersive experience for emerging college professions looking join the tech industry workforce to build their business acumen and technical skill while learning about Intel's Data Platforms Group business.    About the Data Platforms Group  The Data Platforms Group (DPG) is at the heart of Intel's transformation from a PC company to a company that powers the cloud and billions of smart, connected computing-devices. The data center is the hub for every data-driven service - from artificial intelligence to 5G to high-performance computing that fuels the cloud, communication, enterprise, and governments around the world.    About this role  College graduates hired full-time into this program will complete (3) 7-month rotations prior to final placement within DPG. Rotation professionals will work alongside a combination of DPGs world-class teams gaining exposure to DPG's product portfolio and business processes.  Rotation assignments will range from working on customer centric solutions, smart connected devices at the edge, silicon development, 5G and data center connectivity, strategy, marketing, business planning and more. Internship focus will vary in nature from software, hardware, and business.    In this role you will work on challenging technical and business projects that help drive critical business and organizational goals         Learn about Intel's Data Centric products and business      Build a robust technical and business acumen      Attend intern exclusive events that provide countless professional development and networking opportunities      Receive coaching and mentoring from our internal network of professionals        The candidate should exhibit the following behavioral traits:         Effectively balance technical skills with relationship-building capabilities      Drive for results, a passion to win, the desire to collaborate and ability to build strong, influential relationships      Communication skills (oral and written)        Qualifications     You must possess the below minimum qualifications to be initially considered for this position. Preferred qualifications are in addition to the minimum requirements and are considered a plus factor in identifying top candidates. Experience listed below would be obtained through a combination of your schoolwork/classes/research and/or relevant previous job and/or internship experiences. This is an entry level position and will be compensated accordingly.        Minimum Requirements:     The candidate must have a Bachelor's, Master's or PhD's degree in Electrical Engineering, Computer Engineering, Computer Science or a related field.     6+ months of experience in the following areas:         Programming (VHDL, Verilog, C/C++, Perl, Python, TCL, Linux or Bash).      Digital Logic, digital circuit design, Makefile and networking domains, kernel OS subsystems, communication protocols: TCP,IPv4/6,IPSec,Ethernet, kernel drivers, artificial, deep, and machine learning, source-code management such as Git, Linux/Windows OS, RTL, SoC, Pre-silicon verification of CPUs or verification methodologies such as OVM/UVM.        This position is not eligible for Intel immigration sponsorship        Preferred Requirements:     Previous internship experience        Inside this Business Group     The Data Center Group (DCG) is at the heart of Intel’s transformation from a PC company to a company that runs the cloud and billions of smart, connected computing devices. The data center is the underpinning for every data-driven service, from artificial intelligence to 5G to high-performance computing, and DCG delivers the products and technologies—spanning software, processors, storage, I/O, and networking solutions—that fuel cloud, communications, enterprise, and government data centers around the world.     Other Locations  Virtual US and Canada; US, Pennsylvania, Allentown; US, New Jersey, Multiple Cities; US, California, Santa Clara; US, Arizona, Phoenix;           Intel strongly encourages employees to be vaccinated against COVID-19. Intel aligns to federal, state, and local laws and as a contractor to the U.S. Government is subject to government mandates that may be issued. Intel policies for COVID-19 including guidance about testing and vaccination are subject to change over time.        Posting Statement  All qualified applicants will receive consideration for employment without regard to race, color, religion, religious creed, sex, national origin, ancestry, age, physical or mental disability, medical condition, genetic information, military and veteran status, marital status, pregnancy, gender, gender expression, gender identity, sexual orientation, or any other characteristic protected by local law, regulation, or ordinance.        Annual Salary Range for jobs which could be performed in US, Colorado:  $84,060.00-$126,320.00     Benefits:     We offer a total compensation package that ranks among the best in the industry. It consists of competitive pay, stock, bonuses, and benefit programs. Find more information about our Amazing Benefits here    Intel is committed to a culture of accessibility. Intel provides accommodations to applicants and employees with disabilities. Find information and request accommodation here  ",30+ days ago,"5,618 reviews"
