URL,page_count,job_title,company,location,job_Description,post_date,reviews
https://www.indeed.com/viewjob?jk=a4b5d7e3b578de64&from=web&vjs=3,50,Data Scientist/Machine Learning Engineer - Sr. Associate,PRICE WATERHOUSE COOPERS,"201 East Fifth Street, Portion of Suite 2300 & Suite 2400, Cincinnati, OH 45202","A career in Technology and Data Solutions practice, within Deals Transaction Services, provides the opportunity to help organizations realize the potential of mergers, acquisitions, divestitures and capital markets. You will have the opportunity to leverage technology and data to drive better Deal decisions and execute transactions more effectively, helping companies originate, create, execute, and realize value from deals. Our team consists of well-rounded creative professionals who have a passion and aptitude for building technology driven solutions and pushing the boundaries of innovation in Deals. We are industry leaders in embedding technology, leveraging data analysis, machine learning, and artificial intelligence for a broad range of Deal-focused solutions. To really stand out and make us fit for the future in a constantly changing world, each and every one of us at PwC needs to be a purpose-led and values-driven leader at every level. To help us achieve this we have the PwC Professional; our global leadership development framework. It gives us a single set of expectations across our lines, geographies and career paths, and provides transparency on the skills we need as individuals to be successful and progress in our careers, now and in the future. As a Senior Associate, you'll work as part of a team of problem solvers, helping to solve complex business issues from strategy to execution. PwC Professional skills and responsibilities for this management level include but are not limited to: Use feedback and reflection to develop self awareness, personal strengths and address development areas. Delegate to others to provide stretch opportunities, coaching them to deliver results. Demonstrate critical thinking and the ability to bring order to unstructured problems. Use a broad range of tools and techniques to extract insights from current industry or sector trends. Review your work and that of others for quality, accuracy and relevance. Know how and when to use tools available for a given situation and can explain the reasons for this choice. Seek and embrace opportunities which give exposure to different situations, environments and perspectives. Use straightforward communication, in a structured way, when influencing and connecting with others. Able to read situations and modify behavior to build quality relationships. Uphold the firm's code of ethics and business conduct. Job Requirements and Preferences : Basic Qualifications : Minimum Degree Required : Bachelor Degree Required Fields of Study : Data Processing/Analytics/Science, Computer and Information Science, Computer Engineering, Computer Applications, Software App, Information Technology Additional Educational Requirements : Other relevant fields of study may be considered. Minimum Years of Experience : 3 year(s) Preferred Qualifications : Degree Preferred : Master Degree Additional Educational Preferences : Master Degree or Ph.D. in Computer Science, or a related quantitative field. Certification(s) Preferred : Certifications with cloud architectures and service offerings of major cloud providers (e.g. Azure, AWS, GCP) Preferred Knowledge/Skills : Demonstrates thorough abilities and/or a proven record of success in translating business questions into data problems, and building models and machine learning pipelines to solve those data problems. Demonstrates through abilities and/or a proven record of success in working out a solution independently when given an analytical business use case, building a Proof-of-Concept (PoC), documenting solutions and code, and communicating results to both technical and non-technical audiences, with an understanding of the assumptions and limitations of algon eithms being applied. Demonstrates thorough abilities and/or a proven record of success in building end-to-end machine learning systems and pipelines, and can read, understand, and change legacy machine learning and NLP code. Demonstrates thorough abilities and/or a proven record of success in the following areas: Possesses considerable ability with Python programming; Possesses considerable knowledge about data science concepts and principles; Possesses considerable ability with common machine learning libraries including scikit-learn, pandas, numpy, scipy, Spacy, NLTK, and PyTorch; Possesses considerable ability with a wide range of supervised and unsupervised machine learning algorithms, including regression, classification, clustering, anomaly detection, time series analysis, forecasting, dimensionality reduction, etc.; Possesses considerable level of ability with Predictive modeling; Possesses considerable level of ability with modern Natural Language Processing concepts and algorithms, including embeddings, transfer learning, transformers, and deep learning models for NLP; Possesses thorough level of knowledge about mathematical, statistical, and probabilistic frameworks underlying machine learning algorithms; Possesses considerable level of ability with building and fine-tuning machine learning solutions and leveraging specific machine learning architectures (e.g. deep neural networks, RNNs, CNNs, BERT, etc); Possesses considerable level of ability to learn, understand and work with new emerging technologies, methodologies, and solutions in the Cloud/IT technology space; Possesses thorough level of knowledge about abstract business problems, and executing technical and non-technical endeavors to solve them; Possesses considerable level of ability to communicate with both technologists and business partners; Possesses considerable level of ability to work as a solutions architect, technical product manager, software engineer or frontend/backend web developer for data products or web applications; Possesses considerable level of ability to be a “utility player” and take on various roles, as needed, throughout the solution development lifecycle; Possesses considerable ability to recognize opportunities to solve problems by developing applications or automations, and of identifying abstractions to turn applications into platforms; Possesses considerable ability to think critically and bring order to unstructured problems; Possesses considerable ability to identify and resolve blocking issues, exercise judgment in the face of ambiguity, and ask probing questions to understand problems; Possesses considerable ability to develop a backlog of work and communicate with software engineers; Possesses considerable ability to be hands-on with technical details of architecture and design where required; and, Possesses a thorough level of knowledge about the inner workings of a web application, exposure to systems administration or DevOps operations, automated testing and CI/CD pipelines. For positions in Colorado, visit the following link for information related to Colorado's Equal Pay for Equal Work Act: https://pwc.to/coloradoadvisoryseniorassociate. All qualified applicants will receive consideration for employment at PwC without regard to race; creed; color; religion; national origin; sex; age; disability; sexual orientation; gender identity or expression; genetic predisposition or carrier status; veteran, marital, or citizenship status; or any other status protected by law. PwC is proud to be an affirmative action and equal opportunity employer. PwC does not intend to hire experienced or entry level job seekers who will need, now or in the future, PwC sponsorship through the H-1B lottery, except as set forth within the following policy: https://pwc.to/H-1B-Lottery-Policy For positions based in San Francisco, consideration of qualified candidates with arrest and conviction records will be in a manner consistent with the San Francisco Fair Chance Ordinance. 299096 Please note that, at this time, to be in-person at a PwC office, client location or PwC-sponsored events, you must be fully vaccinated against COVID-19.   #LI-Remote",1 day ago,"7,852 reviews"
https://www.indeed.com/viewjob?jk=6325e9a5566304e2&from=web&vjs=3,40,Digital Ecosystem Data Scientist,Midmark Corporation,"Cincinnati, OH","JOB SUMMARY: Honorable purpose serving patients and pets: Join Midmarkâ€™s Digital Team, where we improve the lives of patientsâ€”human and furryâ€”in the areas of medical, dental, and animal health. We are looking for a talented Data Scientist to work with product development and sustaining teams to develop and maintain analytic rules and machine learning models. Identify nuances in product data, optimizing continuous learning models, work with internal and external teams to build data science solutions, and automate complex cognitive analysis. Work closely with product teams, product owners, software development teams, and customer support teams to evaluate measurement anomalies when observed by customers. Work with all functions of the company to help guide the organization towards the company vision. ESSENTIAL/PRIMARY DUTIES: • Interpret data, analyze results using statistical techniques.• Provide advanced informational analysis support on data delivered by Midmarkâ€™s connected products in customer environments.• Handle complex issues and problems and refer only the most complex issues to higher-level staff. Possesses comprehensive knowledge of subject matter.• Perform work under minimal supervision.• Mine and analyze complex and unstructured data sets using advanced statistical methods for use in data driven decision making.• Performs research, analysis, and modeling on organizational data.• Develop and apply algorithms or models to key business metrics with the goal of improving operations or answering business questions. Provides findings and analysis for use in decision making. Use statistical methodology and machine learning techniques to create machine learning models.• Actively work with product teams across the company to understand telemetry trends and find new ways in which to look at data in order to find new models; communicating and working in collaboration with the team throughout the process.• Use machine learning tools to build, monitor, maintain, and improve analytic models.• Work with internal and external data science experts to further Midmark's data analytic capabilities.• Assist with running projects from creation to delivery of the solution.• Work with large data sets using analytic tools.• Create data visualizations to effectively communicate trends and analysis.• Present to teams recommendations based on the results of the analysis or targeting models.• Work with other members of the analytics team to perform statistical analysis as needed.• Drive business results with data-based insights.• Investigate and drive resolution of data anomalies.• Provide advanced examination of data and advise teammates on optimization opportunities.• Actively participant in quality assurance testing and validation of new reporting features and platforms.• Work closely with internal and external teams to identify needs, define and develop new and/or enhanced reporting metrics.• Provide support in the clinical evaluation of new products or new product technologies.• Escalation support for Midmark Data Analytics Services on data analytics related inquiries.• Interpret data, analyzing results using statistical techniques.• Participate in quality assurance testing EDUCATION and/or EXPERIENCE: • Bachelorsâ€™ or mastersâ€™ degree in Data Science, Computer Science, Mathematics or Statistics or statistical data analysis related field [or equivalent industry experience]• 2+ years of business/data analytics experience• Experience with machine learning or statistics• Experience with telemetry data models• A strong background in data science and tagging• Intermediate to expert understanding of the popular data analysis tools and databases.• Experience with databases â€” such as SQL, MySQL, Vertica, etc.• Experience with querying databases and using statistical computer languages (R, Python, etc.);• Experience with statistical and data mining techniques (Regression, Random Forest, Boosting, Trees, text mining, social network analysis, etc.);• Demonstrated expertise with developing and implementing data management strategies, processes, and technical solutions. COMPETENCY/SKILL REQUIREMENTS: • Diplomatic, professional approach to problem solving• Ability to manage several tasks and projects concurrently and to prioritize work effectively• Strong data organization skills• Ability to solve problems in innovative ways• Must be a self-starter and detail oriented• Demonstrated experience in handling large data sets and relational databases.• Passion for data and understanding human and product behaviors• Sound data analysis and informational/statistical troubleshooting skills and attention to detail.• Understanding of database reporting technologies.• Solid SQL knowledge for executing ad-hoc analysis queries.• Ability to work with stakeholders to assess potential risks and product improvements.• Ability to analyze existing tools and databases and provide software solution recommendations.• Understanding of addressing and metadata standards.• Ability to quickly learn tools, new technology and processes.• Exceptional interpersonal and communication (verbal and written) skills, particularly with technical subjects.• Ability to complete responsibilities timely and accurately.• Capacity and willingness to travel (~5%).   #LI-Remote  Midmark is the only clinical environment design and manufacturing company that enables a better care experience at the point of care in medical, dental and animal health. By harmonizing space, technologies and workflows, we enhance interactions between patients and caregivers resulting in more efficient care and better outcomes. By living our corporate values, our 2,000 teammates worldwide make this possible. EO/AA Employer Minorities/Females/Protected Veterans/Disabled",30+ days ago,73 reviews
https://www.indeed.com/viewjob?jk=bc2f3b2db4f722ec&from=web&vjs=3,40,CCB - Quantitative Modeling/Data Science - Associate,"JPMorgan Chase Bank, N.A.","Columbus, OH","The CCB Business Modeling Center of Excellence  is a team of data scientists focused on quantitative modeling for marketing, finance and operations. We are an intellectually diverse team of economists, statisticians, engineers, and other analytics professionals, focused on quantitative modeling within CCB at JPMorgan Chase & Co. The team answers complex and unique questions, utilizing cutting edge quantitative and computational techniques and leveraging one of the world's largest repositories of consumer data. We work closely with our partners throughout JPMorgan Chase to assess and execute critical business decisions. Responsibilities: In this role, you will build models to answer questions and create forecasts for teams across the Finance organization at JPMorgan Chase. Your duties will include: Lead a modeling engagement from understanding the business objective and evaluating the model's business impact, through data sourcing and analysis, to model development and implementation Building statistical models for key business drivers, including forecasting deposits, loans, and revenue Performing advanced quantitative and statistical analysis of large datasets to identify trends, patterns, and correlations that can be used to improve business performance Manage the relationship with business stakeholders and be proactive about changes in model performance, customer behavior, and the competitive landscape Communicating results across audiences throughout JPMorgan Chase Exploring alternative data sources and modeling methodologies Examples of projects that you could be working on include: Forecasting the performance of branches or bankers to improve the branch network Predicting credit card redemption patterns Optimizing pricing for mortgage loans Qualifications: Advanced degree in Statistics, Economics, Operations Research, Mathematics (or equivalent quantitative field), Ph.D. is preferred Hands-on experience with statistical modeling and Machine Learning applied to large datasets Demonstrated ability to set clear goals, plan ahead, deliver against tight timelines Strong analytical, interpretive, and problem-solving skills, with demonstrated ability of thinking outside the box Outstanding written and oral communication skills to present analytical findings and exercise influence across all levels of the organization Expertise in at least one of the following: Python, R Chase is a leading financial services firm, helping nearly half of America's households and small businesses achieve their financial goals through a broad range of financial products. Our mission is to create engaged, lifelong relationships and put our customers at the heart of everything we do. We also help small businesses, nonprofits and cities grow, delivering solutions to solve all their financial needs. We recognize that our people are our strength and the diverse talents they bring to our global workforce are directly linked to our success. We are an equal opportunity employer and place a high value on diversity and inclusion at our company. We do not discriminate on the basis of any protected attribute, including race, religion, color, national origin, gender, sexual orientation, gender identity, gender expression, age, marital or veteran status, pregnancy or disability, or any other basis protected under applicable law. In accordance with applicable law, we make reasonable accommodations for applicants' and employees' religious practices and beliefs, as well as any mental health or physical disability needs. The health and safety of our colleagues, candidates, clients and communities has been a top priority in light of the COVID-19 pandemic. JPMorgan Chase was awarded the ""WELL Health-Safety Rating"" for all of our 6,200 locations globally based on our operational policies, maintenance protocols, stakeholder engagement and emergency plans to address a post-COVID-19 environment. As a part of our commitment to health and safety, we have implemented various COVID-related health and safety requirements for our workforce.  Full vaccination is a requirement for this role for new hires joining JPMorgan Chase . Additional requirements include sharing information including your vaccine card in the firm's vaccine record tool and may include mask wearing and social distancing. Requirements may change in the future with the evolving public health landscape. JPMorgan Chase will consider accommodation requests as required by applicable law. Note: The requirement to be fully vaccinated to be hired for this role does not apply to roles with a work location in Arkansas, Florida, Iowa, Montana, and Tennessee. For applicants to these roles, JPMorgan Chase will consider all qualified applicants regardless of vaccination status, due to state and local laws. Equal Opportunity Employer/Disability/Veterans",14 days ago,"8,639 reviews"
https://www.indeed.com/viewjob?jk=b3d78679e5000756&from=web&vjs=3,40,"Data Scientist, FIS University Program",FIS Global,"8845 Governors Hill Dr, Cincinnati, OH 45249","Position Type : Full time Type Of Hire : Associate Development Program (Full Time Hire) Education Desired : Bachelor's Degree Travel Percentage : 0% Job Description Are you curious, motivated, and forward-thinking? At FIS you’ll have the opportunity to work on some of the most challenging and relevant issues in financial services and technology. Our talented people empower us, and we believe in being part of a team that is open, collaborative, entrepreneurial, passionate, and above all fun. Join the 2022 FIS University Program! As a 2022 FIS University Program full-time employee, you will have the opportunity to participate in team projects, community service activities, professional development seminars and work with a team that is invested in your growth, development, and success; including quarterly performance connects with your manager and bi-annual merit reviews. This two-year full-time program has start dates in January, March, June, and September with a dedicated “Learning Week” where you will; Learn how to work within a corporate environment Learn the structure of FIS and options for growth within the organization Hear from FIS leadership about their journey and participate in senior leader networking opportunities Build a network of your peers from across the organization This position is for a June 27, 2022 start. About The Team FIS Financial Crimes and Global Fraud Investigations Team provide fraud industry guidance to stakeholders on operations under the governance of Banking and Merchant Solutions; mitigating fraud losses for our customers and our organization. What You Will Be Doing Use quantitative and statistical methods to extract data and insights from structured and unstructured data. Leverage machine learning, statistical modeling, and quantitative analysis to create smarter, data-driven products. Review individual accounts via system notification to determine if fraudulent activity is present via several different fraud schemes. Employ machine learning and statistical modeling to create and enhance data-driven products Analyze and extract insights from internal and external transactional data Work with Big Data and transform complex datasets into more usable formats Work with a variety of data science tools and programming languages such as SAS, Python, R, Scala, SQL Work independently and collaborate with other groups to solve complex problems Create and present analyses to internal and external partners and clients Document models and write code to track and monitor models and product performance Understand the realities of model development and make pragmatic and business-aware choices when trading-off sophistication and accuracy versus implementation and performance costs Other related duties assigned as needed What You Bring Bachelor’s degree from job discipline Proficiency in Microsoft Office Suite Self-motivated and a willingness to learn Excellent communication and interpersonal skills Fraud Scheme/Industry Knowledge Added Bonus If You Have Internal FIS Business Knowledge Criminal Justice Degree Cyber Security certifications or associated industry degrees What We Offer You Competitive salary and excellent benefits The chance to work on some of the most challenging, relevant issues in financial services & technology A broad range of professional education and personal development possibilities – FIS is your final career step! Time to support charities and give back to your community A work environment built on collaboration, flexibility, and respect Student Loan Repayment Program: FIS will PAY OFF your principal loan balance over 10 years of service! Eligibility starts after one year of tenure in the program and is for U.S. participants Vaccination Requirements Notice to all US applicants: All employees must be fully vaccinated against COVID-19. Individuals with a disability (including a medical condition) or sincerely held religious beliefs or practices that prevent them from getting the vaccine may request an exemption from the vaccine requirement. Privacy Statement FIS is committed to protecting the privacy and security of all personal information that we process in order to provide services to our clients. For specific information on how FIS protects personal information online, please see the Online Privacy Notice. EEOC Statement FIS is an equal opportunity employer. We evaluate qualified applicants without regard to race, color, religion, sex, sexual orientation, gender identity, marital status, genetic information, national origin, disability, veteran status, and other protected characteristics. The EEO is the Law poster is available here supplement document available here For positions located in the US, the following conditions apply. If you are made a conditional offer of employment, you will be required to undergo a drug test. ADA Disclaimer: In developing this job description care was taken to include all competencies needed to successfully perform in this position. However, for Americans with Disabilities Act (ADA) purposes, the essential functions of the job may or may not have been described for purposes of ADA reasonable accommodation. All reasonable accommodation requests will be reviewed and evaluated on a case-by-case basis. Sourcing Model Recruitment at FIS works primarily on a direct sourcing model; a relatively small portion of our hiring is through recruitment agencies. FIS does not accept resumes from recruitment agencies which are not on the preferred supplier list and is not responsible for any related fees for resumes submitted to job postings, our employees, or any other part of our company. #pridepass",30+ days ago,"2,540 reviews"
