URL,page_count,job_title,company,location,job_Description,post_date,reviews
https://www.indeed.com/viewjob?jk=1bd537f67215f127&from=web&vjs=3,170,"AI/ML - iOS Platform Engineer, Siri and Language Technologies",Apple,"Seattle, WA","Summary  Posted: Oct 19, 2021  Role Number:  200181072  Play a part in the next revolution in human-computer interaction. Create groundbreaking technology for large scale systems, spoken language, big data, and artificial intelligence. And work with the people who created the intelligent assistant that helps millions of people get things done — just by asking. Join the Siri Conversation & Personalization team at Apple. We are looking for exceptional platform engineers passionate about delivering APIs to developers, enabling the development of delightful customer experience, by connecting cutting edge applications and technologies. We are a robust team looking for engineers excited about changing the future of conversational AI technology.  Key Qualifications  Good development experience at the application level with Objective-C, Swift, Cocoa, or C++  Experience developing platforms and delivering APIs in any programming language.  Outstanding communication and collaboration skills  Description  You will primarily be responsible for working within our engineering team to implement Conversational AI APIs. To succeed in this role, you must be a strong programmer who can take a set of specifications turn them into solid, well tested code. You will also be involved in cross functional discussions and brainstorming to help shape the future of the platform. You have a passion for building powerful and easy-to-use APIs, as well as for exceptional user experience. You enjoy learning new technologies and creating life-changing applications. You will possess strong skills in API design, object-oriented software design and programming. Performance analysis and tuning will also be a significant responsibility in your job. You are excited about developing new features, maintaining existing code, fixing bugs, and contributing to overall system design. You'll ship code that runs on the devices you use every day and powers products that are important to the lives of millions of users.  Education & Experience  B.S or M.S in Computer Science, or equivalent experience  Additional Requirements",30+ days ago,"10,579 reviews"
https://www.indeed.com/viewjob?jk=f452610216bdc5fa&from=web&vjs=3,170,Senior Data Analyst,Pearson,"Seattle, WA","Job Overview  This role directly supports the Enrollment & Customer Engagement department, located within Pearson Virtual Schools division, in which you will focus on producing and maintaining both ad-hoc analysis and the day-to-day reporting. This includes collaborating with internal partners to mine and analyze quantitative and qualitative workforce and operational data to generate reports and reveal insights that lead to great operational decisions.  Data Exploration  Supports in exploring data within one to two files to determine trends and relationships between variables  Assist with qualitative strategic projects by conducting independent research and collaborating with internal stakeholders  Mine and analyze large datasets, draw valid inferences, and present findings to leaders across Enrollment Experience and Customer Engagement teams.  Organizing and transforming information into comprehensible structures  Using tools and techniques to visualize data in easy-to-understand formats, such as diagrams and graphs  Communicating with stakeholders to understand data content and business requirements  Determine how critical data and KPIs are addressed in new systems or feature development and build analytics requirements into core systems to ensure comprehensive metrics are supported  Gathers operational data from various cross functional stakeholders to examine past business performance.  Identifies data patterns & trends, and provides insights to enhance business decision making capability in business planning, process improvement, solution assessment etc.   Reporting  Creates basic to sophisticated ad hoc report requests: Uses insights from data exploration to prepare basic visualizations and PowerPoint reports for clients requesting the data  Provide documentation and write business requirements to assist with the automation of reporting and data tools for quality, enrollment, & customer engagement teams.  Processing reports across multiple internal teams  Works with more senior staff to reach out to client to clarify asks, debrief with client to explain data insights, and confirm report  Contributes to periodic audits of data within business systems/platforms  Works with Analytics organization to ensure data quality and accuracy  Downloads required data and creates pre-defined reports as per defined schedule  Sends out reports to stakeholder group and answers basic questions pertaining to the report   Qualifications  Bachelor's degree or equivalent in Statistics, Mathematics, Economics, Finance, & Quantitative Psychology, or Applied Research  6+ years related experience in qualitative/quantatitive analysis, reporting, ad hoc analysis  Proficiency within at least one of the following: Alteryx, Tableau, CxEngage  Intermediate to advanced expertise in SQL  Experience with Python and Java Script a plus  Experience with or willingness to learn qualitative analysis software (e.g., NVIVO)  Experience working with disparate data sets, data mining, data/text visualization tools, and creation of dashboards  Experience working within CRMs specifically SalesForce  Expert knowledge in MS Office suite – specifically within Excel with Macros and advance formulas  Must have strong analytical, reporting skills & strong Excel skills, such as the ability to create macros  Basic knowledge or interest about apps support procedures, concepts and other technical areas.  Strong oral, written and interpersonal communication skills, must be capable of telling a story that is based on complex data/information to others.  Recommend solutions to improve performance based on analysis  Must have excellent organizational and time management skills  Ability and willingness to learn new technologies and methodologies.   Job:  RESEARCH AND DEVELOPMENT  Organization:  North America Connections  Schedule:  FULL_TIME  Req ID:  679",30+ days ago,"2,696 reviews"
https://www.indeed.com/viewjob?jk=8081a63687792a79&from=web&vjs=3,150,Sr Data Engineer AI/ML,Microsoft,"One Microsoft Way, Redmond, WA 98052","We are on a mission to make Azure the most reliable, distributed cloud on the planet. Data is a crucial part of realizing this mission. We interpret petabytes of data and create scalable solutions that impact millions of customers all over the planet. Join us and build a data-driven culture to help the organization make informed decisions that solve important problems.  The Azure Quality Initiative (AQI) team reports out of Azure Edge + Core Office of the CTO. We understand that driving meaningful impact means empowering and enabling others to achieve more. The AQI team accelerates projects that span the entirety of Azure, in partnership with senior members of leadership, to improve the quality of Azure. We combine our strengths to produce actionable insights from disperse data, to make Azure deployments more safe, reliable and, and secure. Responsibilities As a data engineer on the AQI team, you will have the incredible opportunity to work on business-critical initiatives that directly contribute to the future of Azure’s business. Some of your responsibilities include  Build and standardize high quality, performant, reliable, and cost-effective distributed data ingestion services at enterprise scale Manipulate and analyze complex, high-volume, high-dimensionality data from various sources using a variety of tools and data analysis techniques Build metrics and dashboards for our customers and stakeholders Partner with data scientists, analysts, software engineers, and product managers to measure and evaluate customer experience Select and apply appropriate statistical and machine learning techniques Standardize data modeling and design frameworks for analysis, design, building, testing and maintenance Design and build abstractions that hide the complexity of the underlying big data stack Data storytelling and visualization to drive customer and business insights with focus and speed Qualifications Required Qualifications:  MS/PhD in CS, Engineering, Statistics, Applied Math, or a related field or 5+ years industry experience Proficient coding in one or more of the following languages: Python, Java, Scala or similar Experience with large-scale services with big data stack and distributed processing (Spark, Hadoop, Hive, Databricks etc) Expertise in data modeling and developing SQL solutions Hands-on experience with data science, analytics, and an understanding of basic ML algorithms and approaches Track record maintaining a high bar for quality, and passionate about engineering rigor Preferred Qualifications  Data engineering in a cloud environment (Azure, AWS, GCP or similar) Experience with product and service telemetry systems, or other sources of large-scale data Experience with data engineering in support of ML: Anomaly detection in time series data, engineering work to productionize models developed by data scientists, etc. Prior knowledge of ETL/ELT, Data Modeling, and BI systems Ability to meet Microsoft, customer and/or government security screening requirements are required for this role. These requirements include but are not limited to the following specialized security screenings: Microsoft Cloud Background Check: This position will be required to pass the Microsoft Cloud background check upon hire/transfer and every two years thereafter. Microsoft is an equal opportunity employer. All qualified applicants will receive consideration for employment without regard to age, ancestry, color, family or medical care leave, gender identity or expression, genetic information, marital status, medical condition, national origin, physical or mental disability, political affiliation, protected veteran status, race, religion, sex (including pregnancy), sexual orientation, or any other characteristic protected by applicable laws, regulations and ordinances. We also consider qualified applicants regardless of criminal histories, consistent with legal requirements. If you need assistance and/or a reasonable accommodation due to a disability during the application or the recruiting process, please send a request via the Accommodation request form. Benefits/perks listed below may vary depending on the nature of your employment with Microsoft and the country where you work.",30+ days ago,"7,311 reviews"
https://www.indeed.com/viewjob?jk=adf6b7436ce56547&from=web&vjs=3,150,"Global Director, Data Engineering & Analytics",Facebook App,"Seattle, WA","We’re looking for a seasoned data engineering and analytics leader to lead and drive decisions behind all data infrastructure, partner graph and core data platforms for the Meta Business Group. This leader and their team will partner with all product and business teams within Meta, based out of the engineering org responsible for developing all enterprise tools and platforms supporting the business. We’re looking for someone to play a pivotal role in building highly differentiated products for our customers, setting the vision, strategy and roadmaps for the portfolio of projects and products. This leader will have a unique organization-wide view across all Meta businesses, and will need to be a collaborative problem solver who is focused on results.    Partner with leadership teams across engineering, product, product marketing, design, and business teams to build and strengthen a data-inspired culture where we are bringing innovative data insights into the key decisions for product success Inspire, lead and grow a globally distributed, multi-functional team of more than 100 people, including data engineers, technical data analysts, business analysts, data governance & quality teams, while aligning tightly with data science, product managers, and software engineers Apply expertise directly and through coaching the team to use the latest data frameworks to extract insights or influence overall strategy. Set and communicate a clear technical direction that supports our business goals, driving standards for engineering excellence that lead to scale and customer satisfaction Participate in design, architectural and operational decisions, driving engineering projects from definition to delivery and maintenance, working closely with Product Management and Design teams to determine what to build and why, maintaining high standards and best practices for engineering excellence Communicate and collaborate with internal customers and stakeholders and facilitate collaboration with other internal engineering and cross-functional teams Build organizational processes and structure for scale including recruiting, new hire onboarding, team operating rhythm and people programs Ability to lead a team through high-growth, change and adapting to ever changing legal and privacy landscape Be proactive with asking questions, ensuring that the right questions are being answered with appropriate level of rigor and that analyses lead to clear and actionable recommendations and impactful product and business changes    15+ years of work experience managing engineering, analytics teams, working collaboratively with Product and Go-to-Market teams, and guiding data-influenced product and business planning, prioritization and strategy development Demonstrated experience in hiring, retaining and scaling diverse, geographically dispersed, high-performing teams Experience influencing strategy and driving change across organization boundaries through clear and compelling communication of data-driven insights and analyses Experience with data warehouse tables, pipelines, models and analytical solutions, client identity, business logic, and metrics/attributes to drive business decisions and workflows Experience with both product analytics and business analytics applications    Experience with driving analytics for a brand-new or rapidly scaling business or product lines M.S. or Ph.D. in a quantitative field such as Mathematics, Computer Science, Economics, Statistics, Artificial Intelligence, Machine Learning, Physics, Operations Research, etc.   Facebook's mission is to give people the power to build community and bring the world closer together. Through our family of apps and services, we're building a different kind of company that connects billions of people around the world, gives them ways to share what matters most to them, and helps bring people closer together. Whether we're creating new products or helping a small business expand its reach, people at Facebook are builders at heart. Our global teams are constantly iterating, solving problems, and working together to empower people around the world to build community and connect in meaningful ways. Together, we can help people build stronger communities - we're just getting started.  Facebook is proud to be an Equal Opportunity and Affirmative Action employer. We do not discriminate based upon race, religion, color, national origin, sex (including pregnancy, childbirth, or related medical conditions), sexual orientation, gender, gender identity, gender expression, transgender status, sexual stereotypes, age, status as a protected veteran, status as an individual with a disability, or other applicable legally protected characteristics. We also consider qualified applicants with criminal histories, consistent with applicable federal, state and local law.Facebook is committed to providing reasonable accommodations for candidates with disabilities in our recruiting process. If you need any assistance or accommodations due to a disability, please let us know at accommodations-ext@fb.com.",24 days ago,642 reviews
https://www.indeed.com/viewjob?jk=168c0418eb8e5675&from=web&vjs=3,170,(USA) Staff Data Scientist,Walmart,"17432 Southeast 270th Place, Covington, WA 98042","Position Summary... What you'll do... Staff Data Scientist Data Strategy: Understands, articulates, and applies principles of the defined strategy to routine business problems that involve a single function. Data Source Identification: Supports the understanding of the priority order of requirements and service level agreements. Helps identify the most suitable source for data that is fit for purpose. Performs initial data quality checks on extracted data. Applied Business Acumen: Provides recommendations to business stakeholders to solve complex business issues. Develops business cases for projects with a projected return on investment or cost savings. Translates business requirements into projects, activities, and tasks and aligns to overall business strategy. Serves as an interpreter and conduit to connect business needs with tangible solutions and results. Recommends new processes and ways of working. Model Assessment & Validation: Identifies the model evaluation metrics. Applies best practice techniques for model testing and tuning to assess accuracy, fit, validity, and robustness for multi-stage models and model ensembles. Data Visualization: Generates appropriate graphical representations of data and model outcomes. Understands customer requirements to design appropriate data representation for multiple data sets. Work with User Experience designers and User Interface engineers as required to build front end applications. Presents to and influences the team and business audience using the appropriate frameworks and conveys clear messages through business and stakeholder understanding. Customize communication style based on stakeholder under guidance, and leverages rational arguments. Guide and mentor junior associates on story types, structures, and techniques based on context. Problem Formulation: Translates business problems within one's discipline to data related or mathematical solutions. Identifies what methods (for example, analytics, big data analytics, automation) would provide a solution for the problem. Shares use cases and gives examples to demonstrate how the method would solve the business problem. Analytical Modeling: Selects appropriate modeling techniques for complex problems with large scale, multiple structured and unstructured data sets. Selects and develops variables and features iteratively based on model responses in collaboration with the business. Conducts exploratory data analysis activities (for example, basic statistical analysis, hypothesis testing, statistical inferences) on available data. Identifies dimensions and designs of experiments and creates test and learn frameworks. Interprets data to identify trends to go across future data sets. Creates continuous, online model learning along with iterative model enhancements. Develops newer techniques (for example, advanced machine learning algorithms, auto ML) by leveraging the latest trends in machine learning, artificial intelligence to train algorithms to apply models to new data sets. Guides the team on feature engineering, experimentation, and advanced modeling techniques to be used for complex problems with unstructured and multiple data sets (for example, streaming data, raw text data). Model Deployment & Scaling: Deploys models to production. Continuously logs and tracks model behavior once it is deployed against the defined metrics. Identifies model parameters which may need modifications depending on scale of deployment. Code Development & Testing: Writes code to develop the required solution and application features by determining the appropriate programming language and leveraging business, technical, and data requirements. Creates test cases to review and validate the proposed solution design. Creates proofs of concept. Tests the code using the appropriate testing approach. Deploys software to production servers. Contributes code documentation, maintains playbooks, and provides timely progress updates. Drives the execution of multiple business plans and projects by identifying customer and operational needs; developing and communicating business plans and priorities; removing barriers and obstacles that impact performance; providing resources; identifying performance standards; measuring progress and adjusting performance accordingly; developing contingency plans; and demonstrating adaptability and supporting continuous learning. Provides supervision and development opportunities for associates by selecting and training; mentoring; assigning duties; building a team-based work environment; establishing performance expectations and conducting regular performance evaluations; providing recognition and rewards; coaching for success and improvement; and ensuring diversity awareness. Promotes and supports company policies, procedures, mission, values, and standards of ethics and integrity by training and providing direction to others in their use and application; ensuring compliance with them; and utilizing and supporting the Open Door Policy. Ensures business needs are being met by evaluating the ongoing effectiveness of current plans, programs, and initiatives; consulting with business partners, managers, co-workers, or other key stakeholders; soliciting, evaluating, and applying suggestions for improving efficiency and cost effectiveness; and participating in and supporting community outreach events. Minimum Qualifications... Outlined below are the required minimum qualifications for this position. If none are listed, there are no minimum qualifications. Option 1: Bachelors degree in Statistics, Economics, Analytics, Mathematics, Computer Science, Information Technology or related field and 4 years' experience in an analytics related field. Option 2: Masters degree in Statistics, Economics, Analytics, Mathematics, Computer Science, Information Technology or related field and 2 years' experience in an analytics related field. Option 3: 6 years' experience in an analytics or related field Preferred Qualifications... Outlined below are the optional preferred qualifications for this position. If none are listed, there are no preferred qualifications. Data science, machine learning, optimization models, PhD in Machine Learning, Computer Science, Information Technology, Operations Research, Statistics, Applied Mathematics, Econometrics, Successful completion of one or more assessments in Python, Spark, Scala, or R, Using open source frameworks (for example, scikit learn, tensorflow, torch) Primary Location... 17432 SE 270TH PL, COVINGTON, WA 98042-4962, United States of America",30+ days ago,"228,414 reviews"
