URL,page_count,job_title,company,location,job_Description,post_date,reviews
https://www.indeed.com/viewjob?jk=8fbf0775978310d9&from=web&vjs=3,140,"Principal Applied Scientist, Robotics AI",Amazon.com Services LLC,"Seattle, WA"," PhD in Computer Science (Machine Learning, AI, or equivalent);  5+ years of experience applying ML to solve complex problems for large-scale applications;  Ability to distill informal customer requirements into problem definitions, dealing with ambiguity and competing objectives;  Ability to manage and quantify improvement in customer experience or value for the business resulting from research outcomes  Job summary Do you want to create worldwide impact in Robotics? The Robotics AI team at Amazon builds high-performance, real-time robotic systems that can perceive, learn, and act intelligently alongside humans—at Amazon scale. Our mission is to enable robots to interact safely, efficiently, and fluently with the clutter and uncertainty of real-world fulfillment centers. Our AI solutions enable robots to learn from their own experiences, from each other, and from humans to build intelligence that feeds itself. We hire and develop subject matter experts in robotics with a focus on motion planning, computer vision, deep learning, intelligent control, semi-supervised and unsupervised learning. We target high-impact algorithmic unlocks in areas such as scene and activity understanding, closed-loop control, robotic grasping, and manipulation in high-contact environments—all of which have high-value impact for our current and future fulfillment networks. Key job responsibilities We are seeking hands-on, Applied Scientist who will be deep in code and algorithms; who has a wealth of robotics experience, and who is technically strong in building scalable ML solutions. As an Applied Scientist in Robotics AI, you will contribute to the research and development of advanced robotic systems; you will work along with other top-notch scientists and engineers to deliver the world's most scalable and robust robotic systems. In addition to coming up with novel solutions and prototypes, you will directly contribute to implementation. A successful candidate has excellent communication skills and a drive to achieve results in a collaborative team environment. You should enjoy the process of solving real-world problems that, quite frankly, haven’t been solved at scale anywhere before. Along the way, we guarantee you’ll get opportunities to be a fearless disruptor, prolific innovator, and a reputed problem solver—someone who truly enables AI and robotics to significantly impact the lives of millions of consumers. PhD and 7+ years of industry experience in Robotics, machine learning, computer vision, autonomous controls, sensing and/or field operations. Amazon is committed to a diverse and inclusive workplace. Amazon is an equal opportunity employer and does not discriminate on the basis of race, national origin, gender, gender identity, sexual orientation, protected veteran status, disability, age, or other legally protected status. For individuals with disabilities who would like to request an accommodation, please visit https://www.amazon.jobs/en/disability/us.",22 days ago,"76,966 reviews"
https://www.indeed.com/viewjob?jk=86363642cb4ecee2&from=web&vjs=3,140,Senior Machine Learning Scientist,Compass,Washington State,"At Compass, we envision a world where the experience of selling or buying a home is simple and pleasant for everyone. Founded in 2012, Compass provides an end-to-end platform that empowers residential real estate agents to deliver exceptional service to their seller and buyer clients, all in service of our mission to help everyone find their place in the world. About the Role:  Compass is looking for a Senior Machine Learning Scientist to help us build the future of real estate. Compass is building an end-to-end real estate technology platform that empowers agents and consumers. The AI team is responsible for using machine learning to build features which empower our agents through intelligent tools, and add intelligence to our consumer facing products. We are looking for someone with a proven track record of deploying and supporting machine learning models at scale in customer facing features.  Responsibilities:   Using your machine learning skills to explore and deeply understand Compass's data.  Architect machine learning products to solve business needs  Perform feature engineering and modelling tasks on top of this data to power customer facing features.  Collaborate with machine learning engineers to produce features in a production ready state.  Support machine learning features throughout the product life cycle.  Drive design and implementation of our in-house machine learning infrastructure.   What we look for:   Experience working on machine learning in a product oriented environment.  Ability to collaborate with scientists, product management and work with an engineering-focused, iterative team to build and establish product requirements.  Knowledge of machine learning frameworks and tooling, for example Spark, PyTorch, SciKit learn, etc.  Comfortable building prototypes from scratch  Experience working with a microservice based architecture.  Experience with AWS development.  BS or MS in Computer Science/Machine Learning or equivalent  5+ years experience is preferred.  Do your best work, be your authentic self.   At Compass, we believe that everyone deserves to find their place in the world — a place where they feel like they belong, where they can be their authentic selves, where they can thrive. Our collaborative, energetic culture is grounded in our Compass Entrepreneurship Principles and our commitment to diversity, equity, inclusion, growth and mobility. As an equal opportunity employer, we offer competitive compensation packages, robust benefits and professional growth opportunities aimed at helping to improve our employees' lives and careers.  Notice for California Applicants",30+ days ago,32 reviews
https://www.indeed.com/viewjob?jk=7fceb527656e24a4&from=web&vjs=3,140,Machine Learning Scientist,Flexport,"Bellevue, WA","The Opportunity  Flexport is looking for a creative, technically-minded Machine Learning Scientist (MLS) who is motivated to solve some of the world's most challenging ML problems in global trade.  Data is at the heart of our business, and as a Machine Learning Scientist, you will work to evaluate and provide insights into our physical and digital products. In collaboration with multidisciplinary product, engineering, user experience, and business/operations teams, you will apply advanced Machine Learning (ML) methods to deliver data-driven insights and automated decision solutions in Flexport's freight forwarding products.  Our business, product, and engineering teams collaborate closely with our Machine Learning Scientists to share domain knowledge, test hypotheses at scale, and develop promising solutions that can be quickly and widely deployed. In addition, we are passionate about providing effortlessly accessible intelligence and actionable insights to our end users. Thus, the ideal MLS candidate is: self-motivated, highly analytical, technically excellent at writing code, and passionate about delivering cutting-edge solutions.  You Will:  Work collaboratively with product, engineering, and business to:  Find opportunities to improve and enhance our forecasting technology products.  Understand Flexport's business and operations processes to identify impact opportunities.  Translate ambiguous business requirements into the right technical solution.  Design and build robust and scalable production forecasting solutions.  Perform R&D of new ML models and refactor ML solutions to support scalable production deployment.  Explore and work with large and complex data sets to implement robust feature and signal extraction models to identify signals that support better decision-making.  Deliver compelling data-driven estimation solutions to support automated decision-making at scale.  Research prior work to inform and develop rational hypotheses and quantify appropriate metrics & targets.  Work collaboratively with other scientists (e.g., operations research, optimization) to develop hybrid solutions that combine machine learning and optimization to automate decision-making.  Develop prototype data analysis/machine learning pipelines iteratively as needed to generate actionable insights.  Communicate findings to technical collaborators and business stakeholders.  Perform requirements gathering and data analysis.  You Should Have:  Minimum Qualifications  Masters degree in quantitative fields (e.g., computer science, mathematics, statistics, physics, engineering, etc.)  Experience and strong technical background in one or more of the following: Machine Learning, Natural Language Understanding, Computer Vision, Data Mining, Artificial Intelligence, Numerical Optimization, Data Engineering.  3+ years of industry experience building, iterating, validating, and deploying statistical and/or machine learning models.  Software development experience using general-purpose programming languages like Python, Java, or C/++, C#  Experience working with large data sets.  Strong verbal and written communication.  Experience training Machine Learning models on libraries such as Tensorflow, PyTorch, Scikit-learn.  Preferred Qualifications  Ph.D. in quantitative fields (e.g., computer science, mathematics, statistics, physics, engineering, etc.)  A strong theoretical background in machine learning/artificial intelligence, algorithms, distributed systems, or statistics.  Experience training machine learning models in a cloud computing environment like Amazon EC2, Google Cloud Platform, Microsoft Azure, etc.  Experience in machine learning and statistical techniques such as classification, clustering, regression, statistical inference, collaborative filtering, and experimental design.  Experience taking research prototypes to production.  Some knowledge of the transportation and logistics industry.  Proven object-oriented design and implementation skills (Python, Java, and C++),  Strong research track record with contributions to research communities via publications in top conferences and journals and code contributions in open source communities such as scikit-learn, CLTK, NLTK, etc.   #LI-TP2  About Flexport  We believe global trade can move the human race forward. That's why it's our mission to make global trade easier for everyone. We aim to do this by building the Operating System for Global trade - a strategic model combining advanced technology and data analytics, logistics infrastructure, and supply chain expertise. Flexport today connects almost 10,000 clients and suppliers across 109 countries, including established global brands like Georgia-Pacific as well as emerging innovators like Sonos. Started in 2013, we've raised over $1.3B in funding from SoftBank Vision Fund, Founders Fund, GV, First Round Capital, and Y Combinator. We're excited about the three big ways we're moving forward after our recent $1B investment from SoftBank Vision Fund in February 2019.  Are you worried about not having any freight forwarding experience?  Don't be! We're building the first Operating System for Global Trade. That's why it's crucial for us to bring people from diverse backgrounds and experiences together with our industry veterans to help move the freight forwarding industry forward.  What's freight forwarding, and why does it matter? Freight forwarding is the coordination and shipment of goods from one place to another, and it's what makes global trade possible. Flexport is on a mission to make global trade easier for everyone because we believe it can help connect the world and break down economic barriers.  We know this industry is complex. That's why we invest in education starting day one with Flexport Academy, a one-week intensive onboarding program explicitly designed to set every new Flexport employee up for success.   At Flexport, our ability to fulfill our mission of making global trade easy for everyone relies on having a diverse, dedicated, and engaged workforce. That is why Flexport is committed to creating and nurturing an environment where anyone can be their authentic self. All qualified applicants will receive consideration for employment regardless of race, color, religion, sex, national origin, age, physical and mental disability, health status, marital and family status, sexual orientation, gender identity and expression, military and veteran status, and any other characteristic protected by applicable law.",30+ days ago,14 reviews
https://www.indeed.com/viewjob?jk=157fe1ee7245ebac&from=web&vjs=3,140,Data Scientist,Axiologic Solutions,"National, WA","Overview:  Based in Northern, VA, Axiologic Solutions LLC has opportunities for you to become part of our high-quality team that delivers innovative solutions to key federal clients. We are currently seeking a Data Scientist to oversee and manage complex, state of the art, new unique programs and projects related to information technology.  Responsibilities:   Develop and presents issues, conclusions, and recommendations to senior leadership based on reviews and evaluations.  Directs and conducts analysis of requirements pertaining to Agency programs and objectives.  Examines policies to identify those affecting programs and determines approaches to resolving issues  Identify problem areas, define the nature and scope of the problem and objectives sought.  Work with a team to design, implement, and maintain new systems.  Provide guidance to the customer on best-practices.  Perform other duties as assigned.   Qualifications:   Must have an active/current TS/SCI and be able to pass a CI Poly.  Approximately ten (10) years of experience in information systems development, focused on processing large volume, near-real time data feeds to meet data analytics and security requirements.  Experience and knowledge of tools associated with counterintelligence and HUMINT collectors.  Bachelor's Degree in computer science, information systems management, mathematics, engineering, or other relevant discipline.  Knowledge of web services feeds.  Demonstrated work experience in architecting new system solutions using current technologies, as well as transitioning existing systems into modern technologies without negatively impacting operational and compliance requirements.  Demonstrated experience performing data assessment, data engineering, modeling and analytics to enable new methodologies for end user analysts, data scientists, etc.  Demonstrated experience as a SME to prioritize and meet tactical and strategic requirements for frameworks and systems to process data.  Demonstrated experience in information systems development across the IT lifecycle, with a focus on systems to perform high volume and velocity data processing on disparate data types/formats.  Demonstrated experience architecting and delivering automated and scalable data process monitoring and data quality systems and processes.  Must be a diverse thinker and be able to work in a large group setting.  Write and edit technical documents and reports;  Write, edit, and produce contents for contract deliverables: reports, training materials, presentation slides, letters, fact sheets, diagrams, and capability.  Effectively communicate project expectations to team members and stakeholders in a timely and clear fashion.  Communicate formally and informally through existing forums to stakeholders at all levels, including senior leadership.  AWS, Atlassian Suite products like Jira/Confluence and AWS Cloud experience desired.   Work Environment:   This is a full-time position, requiring 40 hours per week Monday through Friday within the contract hours of 6:00 a.m. to 6:00 p.m.   Travel Requirements:   Travel may be required both inside and outside the Washington National Capital Region (NCR).   Equal Opportunity Employer–minorities/females/veterans/individuals with disabilities/sexual orientation/gender identity.   Applicants with a physical or mental disability, who require a reasonable accommodation for any part of the application or hiring process, may e-mail their request to Jennifer.chavira@axiologicsolutions.com, call  571-758-3780 , or visit our office at 8280 Willow Oaks Corp. Dr. Suite 450, Fairfax Virginia for assistance. Determinations on request for reasonable accommodation will be made on a case-by-case basis.",30+ days ago,10 reviews
https://www.indeed.com/viewjob?jk=056347e109936e7b&from=web&vjs=3,140,,,,,,
https://www.indeed.com/viewjob?jk=34028a781417acae&from=web&vjs=3,140,Data Modernization Architect,Accenture,"1191 2nd Avenue, Suite 100, Seattle, WA 98101","We are: We are a leading partner to the world’s major cloud providers. The formation of Accenture Cloud First, with a $3 billion investment over three years, demonstrates our commitment to deliver greater value to our clients when they need it most. Our Cloud First multi-service group of more than 70,000 cloud professionals delivers a full stack of integrated cloud capabilities like data, edge, integrated infrastructure and applications, deep ecosystem skills, culture of change along with pre-configured industry solutions to shape, move, build and operate our clients’ businesses in the cloud. We combine world-class learning and talent development expertise; deep experience in cloud change management; and cloud-ready operating models with a commitment to responsible business by design — with security, data privacy, responsible use of artificial intelligence, sustainability and ethics and compliance built into the fundamental changes Accenture helps companies achieve. You are: As part of our  Data & AI  group, you will lead technology innovation for our clients through robust delivery of world-class solutions. There will never be a typical day and that’s why people love it here. The opportunities to make a difference within exciting client initiatives are unlimited in the ever-changing technology landscape. The work: You will be part of a highly collaborative and growing network of technology and data experts, who are taking on today’s biggest, most complex business challenges using the latest data and analytics technologies. We will nurture your talent in an inclusive culture that values diversity. You will have an opportunity to work in roles such as Cloud Data Engineer, Data Modeler or Data Architect covering all aspects of Data including Data Management, Data Governance and Data Migration. Come grow your career in Technology at Accenture!   What you need: Minimum of 10 years of engineering, technology architecture and delivery experience Minimum of 10 years of experience developing the strategy for and building data and analytics solutions Minimum of 5 years of experience in leading data strategy engagements involving the architecture of modern data platforms with technologies such as Big Data and Cloud Minimum of 5 years of management consulting experience Bachelor’s degree or equivalent work experience (minimum of 12 years), or an Associate degree with a minimum of 6 years of equivalent work experience. Bonus points if you have: Hands-on engineer with the ability to manage complex engineering projects with a “lean-in” leadership style Can speak with authority on the capabilities, strengths & weaknesses of the leading cloud platforms (Amazon Web Services, Azure, and Google Cloud). Extensive experience with enterprise data architecture for transactional systems, analytical platforms, master data management, data governance framework, data integration and large-scale data migration. Experience in DevOps Experience migrating applications and data to cloud platforms. Experience with relational and non-relational data platforms Experience with machine learning, artificial intelligence applications and Data Science development languages (R, Python, etc.). Understanding of data modeling principles, and Data Warehouse concepts (e.g., Kimball methodology for developing dimensional data models). Familiarity with data visualization and self-service BI/data warehousing/ advanced analytics tools. Methodologies for integration, data security, data governance and data sciences. As required by the Colorado Equal Pay Transparency Act, Accenture provides a reasonable range of minimum compensation for roles that may be hired in Colorado. Actual compensation is influenced by a wide array of factors including but not limited to skill set, level of experience, and specific office location. For the state of Colorado  only , the range of starting pay for this role is  $119,880 - $197,900  and  information on benefits offered is here. What We Believe We have an unwavering commitment to diversity with the aim that every one of our people has a full sense of belonging within our organization. As a business imperative, every person at Accenture has the responsibility to create and sustain an inclusive environment. Inclusion and diversity are fundamental to our culture and core values. Our rich diversity makes us more innovative and more creative, which helps us better serve our clients and our communities.  Read more here Equal Employment Opportunity Statement Accenture is an Equal Opportunity Employer. We believe that no one should be discriminated against because of their differences, such as age, disability, ethnicity, gender, gender identity and expression, religion or sexual orientation. All employment decisions shall be made without regard to age, race, creed, color, religion, sex, national origin, ancestry, disability status, veteran status, sexual orientation, gender identity or expression, genetic information, marital status, citizenship status or any other basis as protected by federal, state, or local law. Accenture is committed to providing veteran employment opportunities to our service men and women. For details, view a copy of the  Accenture Equal Opportunity and Affirmative Action Policy Statement . Requesting An Accommodation Accenture is committed to providing equal employment opportunities for persons with disabilities or religious observances, including reasonable accommodation when needed. If you are hired by Accenture and require accommodation to perform the essential functions of your role, you will be asked to participate in our reasonable accommodation process. Accommodations made to facilitate the recruiting process are not a guarantee of future or continued accommodations once hired. If you would like to be considered for employment opportunities with Accenture and have accommodation needs for a disability or religious observance, please call us toll free at  +91-XXXXXXXXXX , send us an  email  or speak with your recruiter. Other Employment Statements Applicants for employment in the US must have work authorization that does not now or in the future require sponsorship of a visa for employment authorization in the United States. Candidates who are currently employed by a client of Accenture or an affiliated Accenture business may not be eligible for consideration. Job candidates will not be obligated to disclose sealed or expunged records of conviction or arrest as part of the hiring process. The Company will not discharge or in any other manner discriminate against employees or applicants because they have inquired about, discussed, or disclosed their own pay or the pay of another employee or applicant. Additionally, employees who have access to the compensation information of other employees or applicants as a part of their essential job functions cannot disclose the pay of other employees or applicants to individuals who do not otherwise have access to compensation information, unless the disclosure is (a) in response to a formal complaint or charge, (b) in furtherance of an investigation, proceeding, hearing, or action, including an investigation conducted by the employer, or (c) consistent with the Company's legal duty to furnish information.",Today,"20,993 reviews"
