URL,page_count,job_title,company,location,job_Description,post_date,reviews
https://www.indeed.com/viewjob?jk=ad6635cf5ac8d533&from=web&vjs=3,170,Sales Specialist- Data and AI Solutions - Western Region,IBM,"1200 5th Ave, Seattle, WA 98101","Introduction Do you like helping clients implement innovative solutions driven by a focus on data and AI? Do you have the consultative and leadership skills to help public and health sector clients and partners succeed with IBM’s Analytics and Hybrid Cloud efforts  Your Role and Responsibilities IBM seeks an experienced software salesperson with proven sales success and experience in the Public/ SLED market and/or a technology skillset in Data warehousing, ETL, Data Science and/or data governance for a set of named account in the Western Region.  IBM is the leader in technology innovation being awarded the most U.S. patents for the 28th year in a row in 2020. IBM was also named the only leader in the enterprise cloud computing analysis of all Artificial Intelligence vendors by IDC. As IBM moves continues to help our customers to transform their businesses into digital powerhouses, you will be at the leading edge of our transformation and a key part of our strategic direction serving our most important customers in healthcare, life sciences and government accounts. IBM offers tremendous opportunities for advancement, highly competitive pay and is an Equal Opportunity Employer. We seek the best talent capable of leveraging the power of over 100 years of technology leadership worldwide.   Responsibilities As part of the Data and AI Solutions team in the Public Sector, you will cover a SLED territory selling IBM’s Data and AI software solutions. This includes solutions to help clients store, transform, govern and get value from their data. The portfolio of solutions includes databases, ETL tools, governance, data protection, and IBM’s premier open source based data science solution.  You will execute on your account plan and deliver maximum revenue for the solutions you sell as part of a highly integrated team to manage the complete and complex sales cycle from beginning to end. Your responsibilities will include prospecting, meeting with clients, preparing demonstrations, presenting to C-level executives, getting customers to IBM events, progressing opportunities and negotiating them to closure.  Position responsibilities will include:  understand the solutions you sell and grow in your ability to articulate their value report on all sales activity and revenue achievement and work hard to satisfy all customers keep accurate records and maintain good cadence hygiene utilize with proficiency and timeliness all IBM reporting tools Required Technical and Professional Expertise   Required Experience 5+ years of quota carrying software sales and account management experience Experience managing the sales cycle from business champion to C Level Track record of over-achieving quota in past positions Experience managing and closing complex sales-cycles- demonstrated ownership of all aspects of territory management Preferred Technical and Professional Expertise  Software experience with Database, ETL, Governance, Data Science software SaaS sales experience Sales Methodology experience Strong computer skills, including Microsoft Word, PowerPoint and Excel. bachelors degree preferred but not required About Business UnitIBM has a global presence, operating in more than 175 countries with a broad-based geographic distribution of revenue. The company’s Global Markets organization is a strategic sales business unit that manages IBM’s global footprint, working closely with dedicated country-based operating units to serve clients locally. These country teams have client relationship managers who lead integrated teams of consultants, solution specialists and delivery professionals to enable clients’ growth and innovation. By complementing local expertise with global experience and digital capabilities, IBM builds deep and broad-based client relationships. This local management focus fosters speed in supporting clients, addressing new markets and making investments in emerging opportunities. Additionally, the Global Markets organization serves clients with expertise in their industry as well as through the products and services that IBM and partners supply. IBM is also expanding its reach to new and existing clients through digital marketplaces. This job requires you to be fully COVID-19 vaccinated prior to your start date, where legally permissible. Proof of vaccination status will be required. If you are unable to be vaccinated due to medical, pregnancy or religious reasons, we offer accommodations in accordance with applicable law. Your Life @ IBMAre you craving to learn more? Prepared to solve some of the world's most unique challenges? And ready to shape the future for millions of people? If so, then it's time to join us, express your individuality, unleash your curiosity and discover new possibilities.  Every IBMer, and potential ones like yourself, has a voice, carves their own path, and uses their expertise to help co-create and add to our story. Together, we have the power to make meaningful change – to alter the fabric of our clients, of society and IBM itself, to create a truly positive impact and make the world work better for everyone.  It's time to define your career.  About IBMIBM’s greatest invention is the IBMer. We believe that through the application of intelligence, reason and science, we can improve business, society and the human condition, bringing the power of an open hybrid cloud and AI strategy to life for our clients and partners around the world.Restlessly reinventing since 1911, we are not only one of the largest corporate organizations in the world, we’re also one of the biggest technology and consulting employers, with many of the Fortune 50 companies relying on the IBM Cloud to run their business. At IBM, we pride ourselves on being an early adopter of artificial intelligence, quantum computing and blockchain. Now it’s time for you to join us on our journey to being a responsible technology innovator and a force for good in the world.  Location StatementIBM offers a wide range of resources for eligible IBMers to thrive both inside and outside of work. In addition to a competitive benefits program consisting of medical and life insurance, retirement plans, and time off, eligible employees may also have access to:   12 weeks of paid parental bonding leave. Family care options are also available to support eligible employees during COVID-19. World-class training and educational resources on our personalized, AI-driven learning platform. IBM's learning culture supports your restless attitude to grow your skills and build the depth and scale of knowledge needed to achieve your career goals. Well-being programs to support mental and physical health. Financial programs that empower you to plan, save, and manage your money (including expert financial counseling, 401(k), IBM stock discount, etc.). Select educational reimbursement opportunities. Diverse and inclusive employee resource groups where you can network and connect with IBMers across the globe. Giving and volunteer programs to benefit charitable organizations and local communities. Discounts on retail products, services, and experiences. This position is eligible for participation in an IBM sales incentive plan. Actual incentive opportunity will be based on performance and the eligible Target Incentive, as addressed in the applicable plan, all of which is subject to change.  We consider qualified applicants with criminal histories, consistent with applicable law.  IBM will not be providing visa sponsorship for this position now or in the future. Therefore, in order to be considered for this position, you must have the ability to work without a need for current or future visa sponsorship.  Being You @ IBMIBM is committed to creating a diverse environment and is proud to be an equal opportunity employer. All qualified applicants will receive consideration for employment without regard to race, color, religion, gender, gender identity or expression, sexual orientation, national origin, genetics, pregnancy, disability, age, veteran status, or other characteristics. IBM is also committed to compliance with all fair employment practices regarding citizenship and immigration status.",20 days ago,"31,022 reviews"
https://www.indeed.com/viewjob?jk=fd159cc4f443798e&from=web&vjs=3,150,Senior Principal Data Scientist - AI Services (JoinOCI),Oracle,"Seattle, WA","The  Oracle Cloud Infrastructure (OCI)  team can provide you the opportunity to build and operate a suite of massive scale, integrated cloud services in a broadly distributed, multi-tenant cloud environment. OCI is committed to providing the best in cloud products that meet the needs of our customers who are tackling some of the worldâ€™s biggest challenges. We offer unique opportunities for smart, hands-on engineers with the expertise and passion to solve difficult problems in distributed highly available services and virtualized infrastructure. At every level, our engineers have a significant technical and business impact designing and building innovative new systems to power our customerâ€™s business critical applications This role is available on the  OCI Cognitive Services.  We are addressing exciting challenges at the intersection of artificial intelligence and cutting-edge cloud infrastructure. We are building cloud services in Decision Support (Anomaly detection, Forecasting and Recommendations), natural language processing (NLP), Speech and, computer vision that work out of the box for enterprises. Our product vision includes ability for enterprises to be able to customize the services for their business and train them to specialize on their data by creating custom models that enhance the AI models for customer user cases.  What Youâ€™ll Do Design and build the world-class ML/Deep learning models for NLP/Decision-support/Speech/Vision . Build the necessary tooling for data acquisition, data cleaning, data augmentation, model training and visualization. Evaluate and Implement the ML/Deep learning models from research papers and other public internet resources. Develop production code for feature processing, model prediction, serving, and monitoring in both real-time and batch scenarios. Participate in the entire software lifecycle â€“ development, testing, CI and production operations Balance between product feature development and production operational concerns like writing run books, ops automation, structured logging, instrumentation for metrics and events Participate in on-call for the service with the team  Qualifications PhD or Masterâ€™s in Computer Science, Mathematics, Statistics, Physics or a related field with a dissertation centered in Machine Learning Techniques 10+ years w/Masters or 7+ years w/PhD of applying machine learning for solving real-world problems in industry Proficiency in Python or R Proficiency with at least one deep learning library (Pytorch, Tensorflow or Keras) with building and deploying DNN models in production Experience applying statistical models and developing Machine Learning solutions (regression, classification, clustering) Extensive experience with developing and serving large scale Deep learning models across different data domains. Experience in optimization and scaling of ML solutions for real world business use cases. Expertise in datamining and statistical concepts and experience with traditional ML libraries such as scikit-learn, statsmodels and pandas Past delivery of large-scale ML solutions for complex business problems Prior experience working on distributed systems Experience with production operations and good practices for putting quality code in production and troubleshoot issues when they arise Take initiative and be responsible for delivering complex software by working effectively with the team and other stakeholders Can easily communicate technical ideas verbally and in writing (technical proposals, design specs, architecture diagrams and presentations) Oracle is an Equal Employment Opportunity Employer. All qualified applicants will receive consideration for employment without regard to race, color, religion, sex, national origin, sexual orientation, gender identity, disability and protected veterans status or any other characteristic protected by law.    Design, develop, troubleshoot and debug software programs for databases, applications, tools, networks etc.  As a member of the software engineering division, you will take an active role in the definition and evolution of standard practices and procedures. Define specifications for significant new projects and specify, design and develop software according to those specifications. You will perform professional software development tasks associated with the developing, designing and debugging of software applications or operating systems.  Provide leadership and expertise in the development of new products/services/processes, frequently operating at the leading edge of technology. Recommends and justifies major changes to existing products/services/processes. BS or MS degree or equivalent experience relevant to functional area. 8 or more years of software engineering or related experience.  If you are a Colorado resident, Please Contact us or Email us at oracle-salary-inquiries_us@oracle.com to receive compensation and benefits information for this role. Please include this Job ID: 120937 in the subject line of the email.  Innovation starts with inclusion at Oracle. We are committed to creating a workplace where all kinds of people can be themselves and do their best work. Itâ€™s when everyoneâ€™s voice is heard and valued, that we are inspired to go beyond whatâ€™s been done before. Thatâ€™s why we need people with diverse backgrounds, beliefs, and abilities to help us create the future, and are proud to be an affirmative-action equal opportunity employer.   Oracle is an Equal Employment Opportunity Employer. All qualified applicants will receive consideration for employment without regard to race, color, religion, sex, national origin, sexual orientation, gender identity, disability and protected veterans status, age, or any other characteristic protected by law. Oracle will consider for employment qualified applicants with arrest and conviction records pursuant to applicable law.",30+ days ago,"6,409 reviews"
https://www.indeed.com/viewjob?jk=9a86bf15e9100b3d&from=web&vjs=3,170,Senior Machine Learning Scientist,Algonomy,"Seattle, WA 98121","Position : Senior Machine Learning Scientist  Experience : 2+ Years  Location : Seattle or San Francisco  Education : Preferred: MS/PhD in a STEM or statistical subject.  Interested in joining a highly technical, passionate, and close-knit team of data scientists and machine learning engineers working on state-of-the-art algorithms and technologies? In prototyping, live-testing, and helping productionize deep learning, online and reinforcement learning, natural language processing (NLP), and more? In working on high impact problems with enormous data sets while in an agile, friendly, small company environment? The Science team at Algonomy may be the ideal next step in your career.  You will be :  Identifying and solving machine learning problems involving Bayesian optimization, neural networks, NLP, computer vision, and more  Productionizing solutions at scale  Committing and reviewing code in Python, Tensorflow, and Java  Working with experimental and live data  Communicating and collaborating with engineering, product management, and client support teams   Requirements :  (NB: years of experience specified below may be concurrent)  2+ years professional experience implementing machine learning algorithms  2+ years professional experience writing production-quality code  Familiarity with probability, statistics, linear algebra  12+ months intensive experience with at least one of the following:    Bayesian optimization, Bandits, or Reinforcement Learning   Deep Learning, NLP, or computer vision  Experience with databases, distributed data, and data wrangling  Excellent communication, collaboration, and teamwork skills   About Algonomy  At Algonomy, we believe the future of our economy is Algorithmic, where businesses will develop resilient, adaptive and agile decisioning abilities that will constantly test and refine AI-driven actions to create the best personal experience for every individual customer at scale.  We aim to become the algorithmic bridge between consumers and brands/retailers, and to lead our customers through the Algorithmic transformation imperative. The name Algo-nomy signifies an expertise in algorithms. As technology evolves our lives (and our clients’) at hyper-speed, Algonomy stands as a bold, creative and agile brand; and these are also the very qualities that every digital-first business needs in order to be successful in the new normal. We are ambitious, we create category leading solutions in our markets, and we are constantly learning, inventing and adapting to stay ahead of our industry’s needs.",30+ days ago,
https://www.indeed.com/viewjob?jk=850c20084ef08a86&from=web&vjs=3,170,Big Data Machine Learning Engineer,Pinnacle Group,"Seattle, WA","Remote now but will need to be able to work in the office once situation lifted.  MUST HAVE 5 YEARS+ OF INFRASTUCTURE AND SOLRCLOUD EXPERIENCE AI/ML - Data Infrastructure Solr/Search Engineer, Siri Search & Knowledge Platform   Job Summary Data Infrastructure team within the Siri organization powers analytics, experimentation and ML feature engineering to power Siri we all love in our devices. The mission of the Data Infrastructure org is to provide our engineers and data scientists a cutting edge, reliable and easy to use infrastructure for ingesting, storing, processing and interacting with data and ultimately help the teams that build data intensive applications be successful. You will work with many cross functional teams and lead the planning, execution and success of technical projects with the ultimate purpose of improving Siri experience for customers. We are looking for engineers who want to bring their passion for infrastructure to build world class infrastructure products. Are you a passionate about building scalable, reliable, maintainable infrastructure and solving data problems at scale? Come join us and be part of the Data Infrastructure journey.   Key Qualifications  Passionate about Data Processing and Search Technologies  5+ years of experience configuring, scaling, and troubleshooting search infrastructure (Solr, Elastic Search, Lucene API, etc)  Experience with alerting, monitoring and remediation automation in a large scale distributed environment  Programming experience in Java, Python, or similar languages  Excellent communication and collaboration skills  Experience with AWS and Kubernetes is a big plus   Job Description You will be responsible for the Search Infrastructure that powers the Siri Data teams for analytics and machine learning. Our infrastructure supports millions of AI/ML users at 100+ PB scale. To run our environment efficiently, we drive for proper monitoring, alerting and automation. The team’s goal is to ensure the reliability and performance at the highest level.  Responsibilities include:  Manage and operate our search infrastructure that is built on top of SolrCloud  Collaborate across AI/ML teams to analyze and optimize their search and indexing needs for different forms of data  Diagnose, fix, improve, and automate complex issues across the search stack to ensure maximum uptime and performance  Establish SLA’s for all indexing and search use cases in production  Write code, documentation, participate in code reviews, and mentor other engineers   Education BS, MS, or PhD degree in Computer Science or equivalent experience   most important resource, our soul, is our people. benefits help further the well-being of our employees and their families in meaningful ways. No matter where you work at, you can take advantage of our health and wellness resources and time-away programs. We’re proud to provide stock grants to employees at all levels of the company, and we also give employees the option to buy stock at a discount — both offer everyone at the chance to share in the company’s success. You’ll discover many more benefits of working at, such as programs that match your charitable contributions, reimburse you for continuing your education and give you special employee pricing on products. benefits programs vary by country and are subject to eligibility requirements. is an equal opportunity employer that is committed to inclusion and diversity. We take affirmative action to ensure equal opportunity for all applicants without regard to race, color, religion, sex, sexual orientation, gender identity, national origin, disability, Veteran status, or other legally protected characteristics. is committed to working with and providing reasonable accommodation to applicants with physical and mental disabilities. is a drug-free workplace",30+ days ago,34 reviews
https://www.indeed.com/viewjob?jk=92fb364db274df8f&from=web&vjs=3,150,"Data Engineer Manufacturing, Sr. Consultant - Analytics and Cognitive",Deloitte,"821 Second Avenue Suite 200, Seattle, WA 98104","Data Engineer, Analytics & Cognitive - Senior Consultant ( Manufacturing )    The Team   Analytics & Cognitive  In this age of disruption, organizations need to navigate the future with confidence, embracing decision making with clear, data-driven choices that deliver enterprise value in a dynamic business environment.  The Analytics & Cognitive team leverages the power of data, analytics, robotics, science and cognitive technologies to uncover hidden relationships from vast troves of data, generate insights, and inform decision-making. Together with the Strategy practice, our Strategy & Analytics portfolio helps clients transform their business by architecting organizational intelligence programs and differentiated strategies to win in their chosen markets.  Analytics & Cognitive will work with our clients to:    Implement large-scale data ecosystems including data management, governance and the integration of structured and unstructured data to generate insights leveraging cloud-based platforms Leverage automation, cognitive and science-based techniques to manage data, predict scenarios and prescribe actions Drive operational efficiency by maintaining their data ecosystems, sourcing analytics expertise and providing As-a-Service offerings for continuous insights and improvements    Qualifications   Required:  3+ years of relevant technology consulting or industry experience to include experience in Information delivery, Analytics and Business Intelligence based on data 3+ years of experience engineering data pipelines, ETL jobs and logical data models that serve business analytics and visualization tools Experience building algorithm, automation and deployment code Experience working with Streaming data sources and building data analytic applications from event driven data sources Experience Optimizing Data Loads, Data Extractions, Queries and Stored Procedures 2+ years experience in Python and/or R  2+ years experience SQL  2+ years of hands on experience with data core modernization and data ingestion.  3+ years experience leading workstreams or small teams  Bachelor's Degree or equivalent professional experience  Travel up 50% (While 50% of travel is a requirement of the role, due to COVID-19, non-essential travel has been suspended until further notice  Limited immigration sponsorship may be available.     Preferred:  An advanced degree in the area of specialization is preferred.  Experience with Cloud using Amazon Web Services (AWS), Microsoft Azure, and/or Google Cloud Platform (GCP)  Experience with PySpark, Spark, Scala  Understanding of the benefits of data warehousing, data architecture, data quality processes, data warehousing design and implementation, table structure, fact and dimension tables, logical and physical database design, data modeling, reporting process metadata, and ETL processes.  Experience designing and implementing reporting and visualization for unstructured and structured data sets  Experience designing and developing data cleansing routines utilizing typical data quality functions involving standardization, transformation, rationalization, linking and matching  Knowledge of data, master data and metadata related standards, processes and technology  Experience working with multi-Terabyte data sets  Experience with Data Integration on traditional and Hadoop environments  Strong oral and written communication skills, including presentation skills (MS Visio, MS PowerPoint)     ANCCON   Smart Factory",30+ days ago,"10,338 reviews"
