URL,page_count,job_title,company,location,job_Description,post_date,reviews
https://www.indeed.com/viewjob?jk=d87e87344b436d0d&from=web&vjs=3,160,Data Analyst/Senior Data Analyst,Seagen,"Bothell, WA","Seagen is a global, multi-product biotechnology company dedicated to developing and commercializing transformative cancer medicines. As the industry leader in antibody-drug conjugate (ADC) technology, we pioneered a new generation in the science of harnessing antibodies to deliver cell-killing agents directly to cancer cells. Seagen’s dedication to improving the lives of cancer patients goes beyond science, and we believe that every employee has a role in contributing to this mission. By working together with a shared dedication and diverse perspectives, we are able to reach our full potential and make a real difference in the world. Seagen is a fast-growing company and has an abundance of opportunities available for you to grow your career. Put your passion to work at Seagen and join us! Summary: The Senior Data Analyst is responsible for the coordination and setup of GMP master data, testing, reporting, and manufacturing support of Oracle (ERP) and associated boundary systems to maintain a compliant, effective, and efficient operation that meets or exceeds site goals and objectives. Will own creation and management of GMP master data and ensuring the quality of the data, managing compliance to the data standards and policies as established by the quality assurance, and advocating for data use cases within the business. An effective data specialist maintains agreed-upon data definitions and formats, identifies data quality issues and ensures that business users adhere to specified data standards. Responsibilities: You will be working closely with Supply Operations, Manufacturing, QA, Finance, IT, Logistics, and other business functions to ensure master data accuracy for GMP operations in Oracle ERP Coordinate and maintain all master data promptly within ERP ensuring accuracy and consistency Create and run queries in ERP to periodically review and identify master data inconsistencies Develop and execute cGMP change controls and change requests for master data changes Maintain the Material BOM & Recipe in ERP meet manufacturing requirements and to maintain compliant, efficient, and reliable batch records and supporting data Provide direct internal customer support to manufacturing, site planning, inventory control, quality assurance, quality control, global master data management, and IT Provide department representation on site projects Work closely with various business functional teams to resolve master data issues as needed while ensuring compliance and consistency of master data across business systems Assist with continuous improvement of data management, resolve master data issues, link master data between systems and ensure quality, compliance, and consistency of master data Tenacity to tackle and problem solve to see challenges through beyond solving the issue, but also identify and help fix the cause of the issue Author and update standard operation procedures, work instructions, and workflow diagrams related to master data management Additional Responsibilities: Lead a cross-functional team to determine business requirements for the design of master data Establish a formalized process for gathering accurate master data elements in a timely manner from business partners in Supply Operations, QA, Manufacturing, Finance, IT, and other functional areas Develop communication tools to notify impacted groups when master data is created or updated Qualifications: 5-7 years experience as a Data Analyst (7+ years for Sr Master Data Analyst) Excellent analytical and project management skills Strong interpersonal, communication and stakeholder management skills Demonstrated ability to quickly develop rapport and collaborate effectively with a wide range of stakeholders Ability to build trust and engagement across all levels of an organization, including executive, management and front-line staff Able to make decisions of large scope in a timely manner Proficient in MS Word, PowerPoint, Outlook, and Excel Advanced written and verbal communication skills Ability to interpret / write technical documents Ability to work as a team Self-motivated, proactive, and able to work with minimal supervision Preferred Qualifications: BS/AD degree in Supply Chain/Operations Management, Business Management, or related field ERP/MRP Systems (i.e., SAP, Oracle, etc.) Oracle preferred Experience in pharma/med device/biotech or healthcare Intermediate knowledge of cGMP regulations As the leading employer in our industry in the Pacific Northwest, Seagen is proud to offer a competitive total compensation package as well as a comprehensive benefits program designed to support the whole lives of our employees and their families. Benefits include medical, vision and dental coverage, group and supplemental life insurance, 401(k) with company match, tuition reimbursement, relocation assistance and much more. To learn more about Seagen, please visit  www.seagen.com . Seagen is an equal opportunity employer. All qualified applications will receive consideration for employment without regard to race, age, gender identity, sexual orientation, color, religion, sex, marital status, national origin, protected veteran status, disability status, or any other status protected by federal, state, or local law. To prevent the spread of COVID-19, and as an integral part of its public health and safety measures, Seagen requires that all newly-hired employees be fully vaccinated against COVID-19 before commencing employment, subject to reasonable accommodation and other requirements of applicable federal, state, and local law.  #LI-KC1",30+ days ago,34 reviews
https://www.indeed.com/viewjob?jk=164acc908d1c1040&from=web&vjs=3,160,"Business Intelligence Engineer, Premium Support Product Team","Amazon Web Services, Inc.","Seattle, WA","Bachelor’s Degree or equivalent · 5 + years of hands-on experience in insights / analytics or related areas (e.g. SQL, Python, Tableau, etc.) · 3+ years of experience with data mining, analytics, and advanced modeling techniques · Excellent verbal and written communication skills to articulate complex analytical requirements and findings to a broader audience Job summary If you love driving critical thinking and insight into challenging, unstructured problems and working with leaders in the organization to bring those insights into action, this role is for you. This is a hands-on role, however, being a part of a small team gives opportunity to take ownership of the customer / business problem across the spectrum from ideation to setting it up for implementation in partnership with stakeholder teams.  Analytics topics include, but not limited to: 1. Product / Value Proposition design 2. Customer / Go-to-market 3. Customer Experience 4. Business Planning & Forecasting Key job responsibilities Develop and improve the current data quality, monitoring and data availability across Premium Support products. Collaborate with Data Scientist teams to implement advanced analytics algorithms that exploit our rich data sets for statistical analysis, prediction, clustering and machine learning Partner with BAs across teams to build and verify hypothesis to improve the AWS Support business. Help continually improve ongoing reporting and analysis processes, simplifying self-service support for customers Master’s degree in a quantitative field (engineering, economics, math, or statistics), business, etc or equivalent experience · Hands-on experience in Machine Learning / Predictive Analytics · Must be a self-starter, able to manage multiple tasks and projects simultaneously · Experience owning problem-solving end to end · Work well under pressure to meet ongoing and overlapping deadlines within short time constraints Amazon is committed to a diverse and inclusive workplace. Amazon is an equal opportunity employer and does not discriminate on the basis of race, national origin, gender, gender identity, sexual orientation, protected veteran status, disability, age, or other legally protected status. For individuals with disabilities who would like to request an accommodation, please visit https://www.amazon.jobs/en/disability/us.",19 days ago,"76,966 reviews"
https://www.indeed.com/viewjob?jk=3b0bd6e253fdeb14&from=web&vjs=3,160,,,,,,
https://www.indeed.com/viewjob?jk=212244410ff3127e&from=web&vjs=3,160,Data Science Lead - North America,Acceleration,"2501 Westlake Ave N, Seattle, WA 98109","Acceleration is WPP’s specialist practice for Google Marketing & Cloud Platforms. We are a curious team of highly skilled data and technology practitioners, inspired by experimentation and new ideas. This is the lifeblood of the future-forward solutions we deliver, that empower our clients to compete every day, in a dynamic environment. And it is the reason we have become trusted advisors to CEOs, strategic partners to CMOs, and operational partners to CIOs, around the globe. We help clients leverage the power of Google’s Marketing and Cloud platforms to transform their marketing organizations and accelerate growth. With access to expert consultancy services and a deep bench of specialized skills, we deliver what marketers need to compete effectively, increase efficiency, and drive growth. We are well known for our open, transparent, and honest relationships with clients. We identify opportunities for innovation while remaining firmly grounded in business reality. We demystify complex tasks and impart knowledge without hype or pretense, and we shape marketing ecosystems to drive growth through the intelligent application of data and technology. Most importantly, we speak in specifics and get the job done. Our contribution is measured by our clients’ success. We understand that speed to value is critical. This is why we release value at every step of the process. Every day we build our skills and hone our craft to get our clients the results they deserve. We are Acceleration: We turn bold ambition into business reality. ROLE   OVERVIEW : The Data Science Lead will have responsibility over a broad area of initiatives, tasked with developing solutions for our clients which drive business value. The candidate should be able to apply quantitative, analytical and data science skills to complex problems. They should be able to collaborate with internal and client teams to solution, implement, and analyze against the solution with the focus on the outcome to solve the business problem. The candidate is responsible for thought leadership and team development and ultimately developing data-centric solutions that increase the value we bring to our clients. AREA OF EXPERTIZE: Acceleration is part of WPP, the world’s largest advertising and marketing services group. Clients come to us to solve today’s biggest challenges, surrounding the use of data and technology, to support delivery of improved digital marketing experiences for their customers, across paid, owned and earned environments. Typically, their biggest area of investment is media, and using data and technology, to un-lock value in this area is critical. You will display a distinctive level of subject matter expertise on how to architect and deliver advertising / marketing technology and data strategies that accelerate client value, by increasing customer engagement and personalization in this area. Google is a key partner of ours, and a primary route to market – knowledge of the Google Marketing Platform as well as how Google Cloud can improve marketing efforts is a strong bonus. IDEAL CANDIDATE: The successful candidate will be eager to take on challenging business problems and apply solutions using platforms like Google Cloud Platform and open-sourced languages. The candidate will be able to design and implement end-to-end data pipelines using statistical, ML methods, and other tools on GCP. The candidate will be innovative and be able to translate statistical methods and results into everyday language for consumption and understanding by marketers and technical counterparts. Beyond GCP, the candidate will be able to create models and operationalize such models. The candidate will have experience with different data types and be able to orchestrate a data solution with the support of data engineers, implementation engineers, and solutions architects. The candidate must have extensive practical expertise and work experience with supervised and unsupervised Machine Learning. They also should have kept abreast of newer solutions like Deep Learning and how to use modern analytic and data tools. RESPONSIBILITIES: Design data pipelines with solutions architects and other stakeholders Supervise the technical direction of data science projects Contribute to product ideation and development Partner closely with Product, Engineering, and Analytics Translate data science outputs and insights to technical and non-technical audiences Create solutions within GCP and other systems that bring additional value to client projects Apply data mining techniques and statistical analysis to various types of internal and external data Work with engineering teams to operationalize Machine Learning models REQUIREMENTS: Demonstrated experience with the following: machine learning, data mining, computational analytics/optimization, application development, data mining, predictive modeling, deep learning Expertise in statistical frameworks, including causal media mix modeling, multi-touch attribution, causal inference, etc. Knowledgeable in using BigQuery, Cloud Dataproc, Google Data Studio, Cloud Dataflow, Spark, Hive, R, Python/Anaconda, TensorFlow a plus Advanced degree in analytical field (e.g. Applied Mathematics, Statistics, Data Analysis, Operations Research, Data Science) A strong passion for problem solving and innovation Strong aptitude for numerical detail and analysis Expertise working with engineering teams to activate and operationalize Machine Learning models Strong communication skills Passionate about working in an extremely fast-paced, demanding, and fluid start-up environment as well as having a desire to build a company up from an early stage",30+ days ago,
https://www.indeed.com/viewjob?jk=3bd179d4800307fc&from=web&vjs=3,160,"Director, WW Business Value Management– Data Modernization",Microsoft,"One Microsoft Way, Redmond, WA 98052","Data & Artificial Intelligence (AI) is one of the most strategic & fastest growing businesses worldwide at Microsoft. Given our mission to build THE hyper growth business for the company, there’s never been a more exciting & compelling time to be a part of the Data and AI Team! As the  Worldwide Director of Business Value Management for Data Modernization , you will partner with the Engineering, Marketing, Customer Success, Partner, and Services organizations to develop and drive the value propositions and messaging in alignment with the unified business strategy and be recognized as a thought leader for this solution space. We’re looking for an exceptional leader, sales execution driver, and cross-team collaborator to accelerate and grow the sales of our Azure Data offerings with a focus on modernizing the on-premises SQL Server, OSS RDBMS, and NoSQL databases to Azure as well as winning new applications onto the Azure Data platform. This role will serve as the subject matter expert, customer advocate, and driver of the business value engagement with customers for the Worldwide field on the overall solution space of Data Modernization to Azure. This role will own primary accountability for meeting or exceeding revenue and scorecard targets as well as building a healthy, sustainable, hyper-growth business for Azure Data. Responsibilities Drive the sales strategy and execution for the Data Modernization solutions. Coach the worldwide sales field including individual contributors and sales managers for effective execution of the business value engagement with customers Role model the seller behaviors and skill sets for successful execution of each sales play through customer engagement, deal coaching workshops, 1-many training events, and 1-1 engagement with sellers and sales managers Collaborate with the Engineering, Marketing, Customer Success, Partner, and Services orgs to develop business value content and messaging to deliver clear guidance for a simplified, consistent seller experience Review and sign-off the collateral for each sales play based on the customer perspective and focused on seller adoption Review and support the demand generation strategies and campaigns for maintaining a healthy pipeline for this solution space Unblock and accelerate deals for the field through regular office hours engagement, on-demand escalations, and win room support Active collaboration with the Global Partner Solutions team to manage a healthy and motivated partner ecosystem for this solution space both for driving business development and project implementation capabilities Partner with marketing teams and partners on demand generation strategies and campaigns for a healthy pipeline for this solution space Own the worldwide business results and insights for the Data & Apps Modernization solutions: Accountability for the growth and target attainment on the worldwide business for this solution space Actively manage the performance of the business on the leading indicators and KPIs for the business Pipeline management and analysis to review the health of the business at the geo, segment, and workload levels Identify, capture, and communicate customer, partner, and seller insights on this solution space to inform the sales strategy with actionable plans Demonstrate thought leadership internally and externally on this solution space to create impact through influence. Depth of knowledge on the problem space from the customer perspective as well as the Digital Transformation scenarios that can be unlocked by modernizing the Data estate. Learnings and insights on the strengths and weaknesses of competitive offerings and market trends related to this solution space Expertise on the seller perspective including the effectiveness of specific plays, guidance, and collateral as well as the keys to delivering a simplified, consistent seller experience for this solutions space Qualifications Technical Sales Business value selling and strategy development and landing.  Experience driving solution sales with Enterprise customers by leveraging business value engagements, preferably on Modernization to Cloud and Digital Transformation scenarios  required Enterprise customer experience in the Data Platform solutions . Experience engaging with enterprise customers either in the sales or technical architect or product marketing roles for Data Platform solutions in the cloud and on-premises  required SQL Server or other Relational Database or NoSQL database knowledge . The depth of knowledge on how Enterprise customers implement SQL Server or other RDBMS or NoSQL databases both on-premises and in the cloud  required Cloud Depth and Breadth . Deep knowledge and experience on conceptual or solutions architecture of cloud-based data platform workloads preferably across OLTP and Analytics workloads with Relational database solutions, and especially with SQL  required . Business Results accountability.  Experience in roles that had primary accountability for business results including revenue targets and KPI execution  required Strategy development and rollout.  Experience developing and landing sales strategies or other business strategies for data platform solutions  preferred. Leader Business Value modeling and communication . Knowledge and experience developing strategies and enabling sales through business value models and translation of technical value propositions to business value  required Market insights . Understanding of data platforms on-premises and in the cloud (AWS RDS, GCP, Oracle, DB2)  preferred Excellent   Communicator.  Strong people, negotiation, organizational, presentation, deep technical product demo, writing, and verbal communication skills  required . Market Maker . Strong leadership to influence key technical decision makers, influencers, business decision makers and peers  required . Consultative Technical Selling and Challenger mindset.  Validated experience in consultative technical selling approach, including bringing innovative ideas to customers problems and being customer focused  required Performer.  Highly driven passionate person who consistently exceeds goals and expectations  required. Lead.  Able to lead, inspire and mentor members of the Microsoft (or similar) sales, services, and marketing organizations and Microsoft (or similar) partners  required . Growth Mindset.  Experience and passion for learning (technical and soft skills); implementing practices from others; trying, failing and learning from that; sharing practices and knowledge for others’ benefit  required. Consummate Professional Experience . 10+ years of experience in technical pre-sales, value-selling, business development, and/or technical consulting roles  required . Bachelor's degree in Computer Science, Information Technology, or related field  preferred . Certification in domain-specific technologies (Data Engineer, SQL Server or other RDBMS certification)  required . Microsoft is an equal opportunity employer. All qualified applicants will receive consideration for employment without regard to age, ancestry, color, family or medical care leave, gender identity or expression, genetic information, marital status, medical condition, national origin, physical or mental disability, political affiliation, protected veteran status, race, religion, sex (including pregnancy), sexual orientation, or any other characteristic protected by applicable laws, regulations and ordinances. We also consider qualified applicants regardless of criminal histories, consistent with legal requirements. If you need assistance and/or a reasonable accommodation due to a disability during the application or the recruiting process, please send a request via the Accommodation request form. Benefits/perks listed below may vary depending on the nature of your employment with Microsoft and the country where you work.",30+ days ago,"7,311 reviews"
