URL,page_count,job_title,company,location,job_Description,post_date,reviews
https://www.indeed.com/viewjob?jk=77ceb9702060cef7&from=web&vjs=3,600,"AI Software Engineer, Associate",Alion Science and Technology,"Norfolk, VA","     Job Description     HII-TSD has been providing modeling and simulation software to the Navy Service Program for over 20 years, and the exciting work we do for this customer keeps growing with new and continued demand for our state-of-the-art modeling and simulation software that allows Navy sailors to simulate actual warfare scenarios. The demands for Artificial Intelligence, Machine Learning, and sophisticated Cloud technologies requires that we rise to the challenge to meet the need for years to come. Come be part of this challenging, exciting software development opportunity! Read on for more details:     Responsibilities/Qualification  The Software Engineer is responsible for the life-cycle software engineering of architecture, user interface, utilities, data modeling and development environment to meet Alion research and development objectives for internal research and development (IR&D) projects. In this role, you will work with on a suite of warfighter simulation systems called the Navy Training Baseline (NTB) and Joint Training Tools (JTT) to enhance and develop new capabilities for futuristic products. The IR&D Software Development team provides modeling and simulation application development, live, virtual and constructive systems integration support, in-service engineering support, and data analytics to US Fleet Forces (USFF), the Number Fleets, and Joint Staff. The Software Development team is directly responsible, in this context, for developing and maintaining technical solutions and standards to provide the greatest level of training capability to the warfighter, at the lowest possible cost, at the fastest pace achievable.     Preferred candidate will have a strong working knowledge and experience developing cloud software-based capabilities and data science related expertise including machine learning or artificial intelligence. Candidate should have an inquisitive nature, responsiveness, and excellent testing skills. Must also possess strong troubleshooting skills and the ability to work under pressure with multiple deadlines. Will work in a fast paced, business environment with our talented team.        Required Skills:              Bachelor's degree in technical discipline (i.e. computer science, engineering, mathematics, etc.).      0-2 years of experience as a Software Engineer working up and down the full stack.      Educational requirements may be adjusted for applicable work experience. Work experience may be adjusted for highly specialized knowledge or uniquely applicable experience.      Experience in Object Oriented Programming (OOP) paradigms      Experience in C/C++ is key for this role      Experience with the Linux operating system      Experience with configuration management tools (e.g. Git, Nexus, Maven)      Experience with the agile software lifecycle      Has a proven ability to learn quickly and works well both independently as well as in a team setting               Desired Skills:              Java or Python experience is a plus.      Machine learning, artificial intelligence, neural networks experience is a huge plus (e.g. Tensorflow)      Experience in RESTful web services      Experience with Joint Semi-Automated Forces (JSAF)            Security Clearance:  Must be able to obtain and maintain a DoD Secret Clearance        About Technical Solutions, A Division of Huntington Ingalls Industries:     Building on a legacy of more than a century of naval shipbuilding, Huntington Ingalls Industries’ Technical Solutions division is accelerating national security solutions to a wide variety of government and commercial customers worldwide. Comprising more than 7,000 professionals, our unique national security portfolio includes cyber and electronic warfare, fleet sustainment, ISR, live, virtual, constructive (LVC) solutions, nuclear and environmental services, and unmanned systems. For more information, visit tsd.huntingtoningalls.com.         Security Clearance: None    Telework - Not Eligible        Huntington Ingalls Industries is an Equal Opportunity/Vets and Disabled Employer.                   Employee Type:                 Full-Time                      Location:            Norfolk, VA                 Job Type:                 Information Technology                      Experience:                 Not Specified                      Date Posted:                 4/20/2022                      Job ID:                 39441                      Telework                 None           ",8 days ago,386 reviews
https://www.indeed.com/viewjob?jk=b2bebea7a4b660fb&from=web&vjs=3,600,Software Engineer,GridPoint,"Reston, VA 20190","     GridPoint is a smart building technology leader with a mission focused on enabling the world’s transition to an efficient and sustainable future through smart, grid-connected buildings. Our hardware-enabled subscription offerings bridge the gap between commercial businesses, utilities, and technology partners to support grid modernization and bring outdated energy infrastructure to the 21st century. Powered by the best data, our platform is designed to identify best-fit energy strategies, reduce waste, and make buildings smarter through controls, automation, and machine learning.        Job Description     GridPoint is looking for a few software developers to join our engineering team. We are a small company with a startup culture that has seen rapid expansion. This position is in the Software team responsible for managing and evolving our cloud-based SaaS platform capturing telemetry from more than 15,000 sites and managing these sites to achieve optimally balanced energy profiles.     If you’re passionate about         Building a clean, efficient energy future      Working with business, quality, and ops teams to deliver real customer/business value      Learning about and using new technologies and taking on new technical challenges      Working on cutting edge technologies        Then this might be the right job for you!     Essential Duties/Responsibilities         Design, develop, test, and deliver high quality code in an AWS environment      Help the team design and implement a range of complex software solutions for data ingestion, analytics, reporting, configuration management      Work independently and in conjunction with other software developers to construct high quality software components      Fully test all developed components individually and within the overall application context      Develop design documentation and feature specific documentation      Self-motivated and able to work independently or in close team environments        Minimum Qualifications         BS in Computer Science or related field      5+ years of professional experience in progressively more advanced software engineering roles      Excellent grasp of object-oriented software development; Java; XML/JSON; Postgres or SQL Server; complex application frameworks (e.g. J2EE, Spring, Hibernate); web services applications… especially ReSTful designs      Experience with continuous integration tools (Jenkins, Bamboo, Gradle), continuous deployment tools, code coverage tools      Enjoy tackling new problems and can produce quality code      Self-motivated and able to work independently      Experience with design and development of Linux solutions in an AWS environment        Desired Qualifications         Experience in building large scale Demand Response and/or Demand Side Management applications      Experience in building complex UI/UX solutions with Angular 2      Real world programming experience with Scala in production environments      Experience in building system architectures using technologies like Akka and Kafka      Experience in building event-driven distributed systems in a cloud infrastructure      Experience in building CI/CD pipelines for cloud infrastructure deploym      ",30+ days ago,16 reviews
https://www.indeed.com/viewjob?jk=c9d9786d785491db&from=web&vjs=3,570,"Staff Data Scientist - Opportunity for Working Remotely Reston, VA",VMware,"Reston, VA 20190","     The Security Analytics Engineering group is looking to hire a Sr. Data Scientist to help lead the development of cutting-edge machine learning models to better protect our users from malicious actors and improve our customer product experience. We are looking for a hands-on engineering leader with deep data science and software engineering expertise who can help architect and own the platform for deploying and tuning the machine learning models used to protect user authentication and security.        The teams focuses on using analytics, machine learning, and threat research on petabyte-scale data to deliver security value to millions of business users across thousands of businesses. The product portfolio is a part of the rapidly growing Carbon Black Cloud platform that delivers next-generation endpoint protection capabilities from the cloud. Now with the full resources of VMware, you have the opportunity to make an impact and build upon Carbon Black’s success.        Responsibilities include:         Lead the efforts to define the vision of how Data Science and Machine Learning will be used at Carbon black threat analytics and Alerts management .      Use analytical and statistical methods, programming, data modeling, simulation, and advanced mathematics to analyze large amounts of data, recognizing patterns, identifying opportunities, posing security questions, and making valuable discoveries      Develop algorithms to detect anomalies, assess risks/threat, classify and prioritize alerts, and group related entities for investigation enhancements      Document projects including business objectives, data gathering and processes, leading approaches, final algorithm, and detailed set of results and analytical metrics      Work with Data Engineers to design and maintain data processing pipelines to support new decision and scoring models.      Provide Architecture guidance and work closely to up-level the Data Science and ML engineering organization.      Evangelize the value of Machine Learning and Data Science to upper management and other Engineering teams within the organization.           What you bring:         Degree MS/PhD in Machine Learning, Computer Science, Electrical Engineering, Statistics, Applied Math, or other quantitative fields      7-10 plus years experience developing data models as a Data Scientist and experience building products backed up ML /AI.      Working experience in analytics, data mining, and/or predictive modeling, and data interpretation.      Proven track record in modifying and applying advanced algorithms to address security problems in core engineering work.      Experience implementing machine learning models, data pipelines and testing frameworks for production use      Hands on skills on industry-standard machine-learning stack (Jupyter, pandas, numpy, sklearn, Keras, Spark).      Working knowledge of AWS Sagemaker, Lambda, and API Gateway including production deployment           Bonus :         Experience in big data technologies. (Spark, Flink, MapReduce, HDFS, Hive, Presto, Avro, Parquet, Airflow, etc)      Experience in the Security domain is a plus.           Category :  Engineering and Technology   Subcategory:  Software Engineering   Experience:  Business Leadership   Full Time/ Part Time:  Full Time   Posted Date:  2022-04-01     VMware Company Overview: At VMware, we believe that software has the power to unlock new opportunities for people and our planet. We look beyond the barriers of compromise to engineer new ways to make technologies work together seamlessly. Our cloud, mobility, and security software form a flexible, consistent digital foundation for securely delivering the apps, services and experiences that are transforming business innovation around the globe. At the core of what we do are our people who deeply value execution, passion, integrity, customers, and community. Shape what’s possible today at http://careers.vmware.com.        Equal Employment Opportunity Statement: VMware is an Equal Opportunity Employer and Prohibits Discrimination and Harassment of Any Kind: VMware is committed to the principle of equal employment opportunity for all employees and to providing employees with a work environment free of discrimination and harassment. All employment decisions at VMware are based on business needs, job requirements and individual qualifications, without regard to race, color, religion or belief, national, social or ethnic origin, sex (including pregnancy), age, physical, mental or sensory disability, HIV Status, sexual orientation, gender identity and/or expression, marital, civil union or domestic partnership status, past or present military service, family medical history or genetic information, family or parental status, or any other status protected by the laws or regulations in the locations where we operate. VMware will not tolerate discrimination or harassment based on any of these characteristics. VMware encourages applicants of all ages. Vmware will provide reasonable accommodation to employees who have protected disabilities consistent with local law.  ",30+ days ago,935 reviews
https://www.indeed.com/viewjob?jk=c18844e72e752abc&from=web&vjs=3,600,Senior Software Engineer - Remote (Engineer Software 3),Alion Science and Technology,"Fairfax, VA 22033","     Job Description  Requisition Number: 5445       Required Travel: 0 - 10%     Employment Type: Full Time/Salaried/Exempt     Hours Per Week: 40     Security Clearance: Secret     Level of Experience: Senior     Employee Referral Bonus Amount: ERP Amount: $3,000     II         Job Description     HII-Defense & Federal Solutions, Inc. (HII-DFS) provides mission-critical engineering and technical service to Information Technology, Federal Civilian, and National Security, Aerospace & Defense and International government and commercial customers at over 100 locations worldwide.  HII – DFS is currently seeking a Senior Software Engineer with Configuration Management experience to work remotely and help us innovate and advance the software engineering products and services on our Force Risk Reduction (FR2) program. This mission critical program supports the Office of the Under Secretary of Defense for Personnel and Readiness in its mission to reduce accidents, mishaps, and injuries across all the military departments.             Essential Job Responsibilities     Duties and Responsibilities include, but not be limited to the following:         Work with business analysts and users to determine application and database requirements.      Design, build, and test applications and data processing programs for operational efficiency.      Contribute to architecture, code, and program reviews.              What You Will Need          5 years of experience and a completed Bachelor’s degree, preferably in Computer Science, but a degree in information systems/technology, mathematics, operations research, statistics, or engineering; 3 years relevant experience with Masters in a related field; 0 years experience with PhD or Juris Doctorate in a related field; or High School Diploma or equivalent and 9 years relevant experience.      Solid working knowledge and hands-on experience with key software platform architectures including one or more of SQL Server integration, Windows Server, Windows .net and three or more of ASP, JSP, Oracle, web servers, application servers, and relational databases.      Progressive experience in analysis, design or maintenance of complex software systems, including computer simulation, client/server architectures, networking techniques and protocols, databases, programming languages, and/or operating systems.      Experience designing and developing reports and dashboards connected to a database.      At least 3 years of experience in configuration management of software code; monitoring hardware or software changes; and support of operational requirements, quality assurance, and software development life cycle processes.      All candidates will be subject to a pre-employment background investigation and drug screening per HII requirements.      Ability to obtain and maintain a DoD Secret Security Clearance.              Bonus Points For          Demonstrated experience with software implications to protect HIPAA data.      Specialized experience related to architecture and design of data warehousing specific to safety and readiness task requirements and experience in design, implementation, and maintenance of Tableau.      Active DoD Secret Security Clearance            HII is a global engineering and defense technologies provider. With a 135-year history of trusted partnerships in advancing U.S. national security, HII delivers critical capabilities ranging from the most powerful and survivable naval ships ever built, to unmanned systems, ISR and AI/ML analytics. HII leads the industry in mission-driven solutions that support and enable a networked, all-domain force. Headquartered in Virginia, HII’s skilled workforce is 44,000 strong. For more information, please visit: hii.com.     HII’s Mission Technologies division develops integrated solutions that enable today’s connected, all-domain force. Capabilities include C5ISR systems and operations; the application of AI and machine learning to battlefield decisions; defensive and offensive cyberspace strategies and EW; unmanned, autonomous systems; LVC solutions; platform modernization; and critical nuclear operations. Together, HII's domain expertise and advanced technologies support mission partners anywhere around the globe. For more information, visit tsd.huntingtoningalls.com.     Huntington Ingalls Industries is an Equal Opportunity/Vets and Disabled Employer. U.S. Citizenship may be required for certain positions.                      Employee Type:                 Full-Time                      Location:            Fairfax, VA                 Job Type:                 Engineering                Information Technology                      Experience:                 Not Specified                      Date Posted:                 3/30/2022                      Job ID:                 866280100           ",16 days ago,386 reviews
https://www.indeed.com/viewjob?jk=d2fa09516218ef32&from=web&vjs=3,600,Cleared Data Scientist (SME),Kepora LLC,"McLean, VA","Description: The candidate will support a team that develops and manages data science programs and systems for data aggregation, data analytics, data summarization, and data visualization on structured and unstructured datasets. The team is supports the customer data science programs and systems in various facets: data architecture, data engineering, data science, data visualization, and documentation. TS SCI w/ Poly Required . Requirements: Required Skills: TS SCI w/ Poly Required 16+ years' of relevant technical experience required Strong Python development background experience with expertise in Python data analytics packages such as pandas, numpy, scipy, gensim, and scikit-learn Experience with database technologies, including Elasticsearch and SQL databases Experience with data pipelines and workflow technologies, such as Apache NiFi Experience with task tracking and version control technology, such as GitHub and JIRA Demonstrated artificial intelligence and machine learning technologies/packages, such as TensorFlow, PyTorch, and scikit-learn Practical experience with machine learning model development on text data and structured datasets Experience data visualization technologies and packages, such as Kibana, Bokeh, Leaflet/Folium, and Tableau Practical experience developing in a cloud environment, such as Amazon Web Services Desired Skills: Master’s degree in Computer Science, Mathematics, Data Science, Statistics, or a related field Professional experience with computer networks, digital forensics, or cybersecurity topics A current U.S. government security clearance and background investigation is required and therefore all candidates must be a U.S. Citizen",30+ days ago,
