URL,page_count,job_title,company,location,job_Description,post_date,reviews
https://www.indeed.com/viewjob?jk=cf47fac6a85c99e0&from=web&vjs=3,560,Assistant Professor in Geography,Virginia Tech,"Blacksburg, VA","           Job no:  518238         Work type:  Teaching & Research Faculty         Senior management:  Natural Resources         Department:  Geography         Location:  Blacksburg - Main Campus         Categories:  Instructional / Teaching Faculty                                  Job Description                      The Department of Geography at Virginia Tech is seeking applicants for a tenure-track position in Geographic Information Science at the Assistant Professor level. The department values diversity and continually strives to maintain and promote an inclusive learning and research environment that embraces all students, faculty, and staff. We encourage applications from all interested candidates and are particularly interested in applications from persons identifying with groups currently underrepresented in geospatial fields, including but not limited to Black, Indigenous, people of color, and underrepresented genders. This would include cis women, trans women, trans men, non-binary people, and those who are otherwise marginalized.    We seek a geographically-trained candidate specializing in the theory and application of Geographic Information Science to complement existing departmental strengths in geospatial science. The specific area of expertise within GIS is open. Preference will be given to candidates who can strengthen our teaching and research portfolio within one or more of the following areas: spatio-temporal modeling and/or simulation, big data analytics, geospatial data mining, geocomputation, machine learning, geospatial statistics, geographic quantitative methods, and web mapping. We welcome applicants engaged in interdisciplinary and applied research that would enhance existing department strengths in atmospheric science, environmental geography, biogeography, hazards, human-environment interactions, land change science, medical geography, sustainability, urban geography, water, and coastal geography.    This is a full-time, tenure-track, 9-month appointment with primary responsibilities in teaching, research, and service. The successful individual will teach undergraduate and graduate courses in GIS and supervise graduate students in our MS program and the interdisciplinary PhD program in Geospatial and Environmental Analysis based in the department's home, the College of Natural Resources and Environment, www.cnre.vt.edu. Participation in departmental, college and university affairs and collaboration with faculty both within and across the university is strongly encouraged and expected. Full information concerning the department and university can be found at www.geography.vt.edu and www.vt.edu.     Recognizing the critical importance of diverse teams, Virginia Tech is working to diversify its faculty by actively recruiting from groups that historically have been marginalized. Virginia Tech is a public land‐grant university, committed to teaching and learning, research, and outreach within the Commonwealth of Virginia, the nation, and the world. Building on its motto of Ut Prosim (that I may serve), the University is dedicated to serving in the spirit of community, diversity, and excellence - InclusiveVT. We seek candidates who adopt and practice efforts to increase access and inclusion to create a community that nurtures learning and growth for all.    Interested persons must apply at https://jobs.vt.edu/, posting number 518238, where they will submit (1) a two-three page cover letter highlighting research and teaching experience and interests and commitment to diversity, (2) current curriculum vitae, (3) teaching evaluations or other evidence of teaching effectiveness, and (4) contact information for three references. Review of applications will begin December 6, 2021 and continue until the position is filled. Inquiries can be made to Dr. Thomas Pingel, Search Committee Chair, Department of Geography, 225 Wallace Hall, Blacksburg, VA 20061. Email: tpingel@vt.edu. Phone:  (540) 231-0437 .                                Required Qualifications                      Required Qualifications  1. Ph.D. in Geography, Geospatial Science, or in a closely related discipline from an accredited university by the time of appointment (August 2022).  2. Demonstrated ability and interest in developing and teaching courses in GIS and candidate’s area of expertise.  3. Experience publishing in peer-reviewed journals.  4. Demonstrated potential to attract research funding adequate to support an active research program, including graduate students.  5. Demonstrated commitment to the principles and practices of nurturing a diverse and inclusive community.  6. Position requires occasional travel to attend conferences and meetings.                                Preferred Qualifications                      Preferred Qualifications  1. Ability and willingness to teach courses related to quantitative methods and/or spatial   statistics.  2. Demonstrated teaching effectiveness at the university level.  3. Research competencies that complement existing program strengths.  4. Record of attracting research funding to support an active research program.  5. Demonstrated record of research and/or teaching addressing needs of under-represented communities.  6. Experience developing or working in interdisciplinary research teams.                                Pay Band                      N/A                                Appointment Type                      Regular                                Salary Information                      Commensurate with Experience                                Review Date                      12/6/2021                                Additional Information                      The successful candidate will be required to have a criminal conviction check.          About Virginia Tech                                Dedicated to its motto,  Ut Prosim  (That I May Serve), Virginia Tech pushes the boundaries of knowledge by taking a hands-on, transdisciplinary approach to preparing scholars to be leaders and problem-solvers. A comprehensive land-grant institution that enhances the quality of life in Virginia and throughout the world, Virginia Tech is an inclusive community dedicated to knowledge, discovery, and creativity. The university offers more than 280 majors to a diverse enrollment of more than 36,000 undergraduate, graduate, and professional students in eight undergraduate colleges, a school of medicine, a veterinary medicine college, Graduate School, and Honors College. The university has a significant presence across Virginia, including the Innovation Campus in Northern Virginia; the Health Sciences and Technology Campus in Roanoke; sites in Newport News and Richmond; and numerous Extension offices and research centers. A leading global research institution, Virginia Tech conducts more than $500 million in research annually.                      Virginia Tech does not discriminate against employees, students, or applicants on the basis of age, color, disability, sex (including pregnancy), gender, gender identity, gender expression, genetic information, national origin, political affiliation, race, religion, sexual orientation, or military status, or otherwise discriminate against employees or applicants who inquire about, discuss, or disclose their compensation or the compensation of other employees or applicants, or on any other basis protected by law.       If you are an individual with a disability and desire an accommodation, please contact  Karen Bland  at  kbland@vt.edu   during regular business hours at least 10 business days prior to the event.         Advertised:  November 8, 2021    Applications close:     ",30+ days ago,651 reviews
https://www.indeed.com/viewjob?jk=429e5c79427a10fa&from=web&vjs=3,560,Senior Data Scientist,Leffler Consulting,"Chantilly, VA","Leffler Consulting is seeking a Senior Data Scientist to join our team at the National Reconnaissance Office (NRO) in Chantilly. The candidate will perform computational and statistical analyses, restructure complex and disparate data sources, extract insights from data, and build data visualization products. The position is an immediate fill position and requires an active Top Secret/SCI clearance with a CI polygraph.  Duties  Provide data science and analytical support to improve access and extraction of knowledge from data sets, data preparation for analysis, and presentation/visualization to inform high-level decisions in the organization  Provide data science and data visualization services with a unified approach to collect, structure, store, index, analyze, model, visualize, communicate, and deliver actionable decision support data products  Establish and deliver a process to conduct requirements analysis of customer needs for rapid development and delivery of timely and innovative advanced data analytic products  Provide expert advice and solutions to migrate from data calls and static reports to data pipelines and interactive dashboards with emphasis on data dimensionality reduction to reduce complexity of data computations  Work with the Government to identify, develop, and implement innovative data science processes and techniques to enhance support to cost estimation, IPM (Integrated Performance Management), and ATA (Acquisition Technical Assistance) functions  Develop and train entry and mid-level level contractor analysts  Work independently or as a contractor team lead and conduct assessments on program cost, technical, and schedule baselines, identify key cost and technical risk areas, and translate the risk areas into program cost impacts  Interact with customers and colleagues expertly and effectively when resolving problems  Apply leadership skills and the ability to manage competing priorities, multiple tasks and work requirements  Apply highly effective customer service skills, and work effectively with teams to foster a collaborative work environment across the organization  Required Education  Master’s degree in engineering, operations research, mathematics, statistics, computer science, or a similar quantitative field preferred. Years of experience may be considered in place of a master’s degree and determine the position level.  Required Experience  Minimum nine years experience. NRO experience preferred.  Desired Education  Refer to Required Experience   Founded in 2001, Leffler Consulting is a women-owned small business (WOSB) headquartered in Chantilly, Virginia. We provide financial management and life-cycle budget and cost support to our nation’s most critical programs in the Intelligence Community (IC) and Department of Defense (DoD). Leffler Consulting specializes in all areas of financial management, audit readiness, and process improvement and controls while also providing a broad array of support functions critical to supporting the mission requirements of our customers. We offer competitive salaries and a generous benefits package, including medical, dental, vision, and disability coverage, paid leave, paid holidays, an employee assistance program, and an employee referral program.",30+ days ago,
https://www.indeed.com/viewjob?jk=c3ff7bd8e85ecc5a&from=web&vjs=3,560,Chief Engineer,QinetiQ,"Lorton, VA"," Who Are We?      We are a world-class team of professionals who deliver next generation technology and products in robotic and autonomous platforms, ground, soldier, and maritime systems in 50+ locations world-wide. Much of our work contributes to innovative research in the fields of sensor science, signal processing, data fusion, artificial intelligence (AI), machine learning (ML), and augmented reality (AR).      QinetiQ Inc.’s dedicated experts in defense, aerospace, security, and related fields all work together to explore new ways of protecting the American Warfighter, Security Forces, and Allies. Being a part of QinetiQ Inc. means being central to the safety and security of the world around us. Partnering with our customers, we help save lives; reduce risks to society; and maintain the global infrastructure on which we all depend.      Why Join QinetiQ Inc.?      If you have the courage to take on a wide variety of complex challenges, then you will experience a unique working environment where innovative teams blend different perspectives, disciplines, and technologies to discover new ways of solving complex problems. In our diverse and inclusive environment, you can be authentic, feel valued, be respected, and realize your full potential. QinetiQ Inc. will support you with workplace flexibility, a commitment to the health and well-being of you and your family and provide opportunities to work with a purpose. We are committed to supporting your success in both your professional and personal lives.      QinetiQ is looking to hire a Chief Engineer to lead the development of new technologies aimed at advancing the capabilities of airborne C5ISR sensor systems, and will have responsibility in the following areas:      Lead the airborne C5ISR sensor systems engineering design, integration, flight testing and upgrade team in system RDT&E trades to include requirements definition and tracking, system and EO/IR, hyperspectral, RF/EW sensors tradeoff analyses, stabilized multi mission payload design and integration to airborne platforms to include fixe wing, rotary wing and UAV platforms, flight testing, Reliability, Maintainability and Failure analyses, system functionality and performance upgrades, and system transition to production.      Work with customers, domestic and international strategic partners on adaptation and integration of C5ISR multi mission payloads to airborne platforms, communication nodes and ground control systems.      Work with Program Management and senior Leadership to ensure the quality and overall performance of the engineering team and final product.      Lead trade studies, testing, and modeling and simulation of the system.        To Land This Job, You Need:    BS in Engineering, preferably Electrical Engineering, mechanical engineering or Computer Engineering. MS preferred.      10+ years' engineering experience in large C5ISR systems, preferably containing EO/IR, hyperspectral, RF/EW sensors, integrated with fixed swing, rotary wing and UAVs.      5+ years' experience leading engineering teams on a system design, integration, build and testing.      5+ years' experience in end-to end integrating of C5ISR sensor systems to communication nodes and ground control systems.      5+ years' experience as military officer with experience in airborne platforms preferred.        Job Type:  Full Time        Clearance Level Must Currently Possess:    DOD Secret      Why QinetiQ Inc.?      Your work will contribute to the protection of American Warfighters and Security Forces.      Opportunity to work with cutting edge technology.      Extensive opportunities for continuous learning, professional growth and advancement.      We only hire the best! No matter if you are entry or senior level, you will have the opportunity learn from some of the best in the industry.      We have fun! We regularly have company events, from luncheons and costume contests to golf tournaments.      We care about YOU and YOUR FAMILY. We offer competitive benefits and health insurance options.      No One Has Time for Long Job Applications!      We completely understand, that is why we have made the application process easy. We promise. This will be simple.        Accessibility/Accommodation:    If because of a medical condition or disability you need a reasonable accommodation for any part of the employment process, please send an e-mail to staffing@us.QinetiQ.com or call   (540) 658-2720  Opt. 4 and let us know the nature of your request and contact information.      QinetiQ Inc. is an Equal Opportunity/Affirmative Action employer. All Qualified Applicants will receive equal consideration for employment without regard to race, age, color, religion, creed, sex, sexual orientation, gender identity, national origin, disability, or protected Veteran status.",30+ days ago,346 reviews
https://www.indeed.com/viewjob?jk=a5a3a46a183fdf53&from=web&vjs=3,560,"PR Manager, AWS Public Sector","Amazon Web Services, Inc.","Arlington, VA","     Bachelor’s degree     7+ years of public relations experience     Experience in B2B technology PR           Job summary    PR Manager, AWS Public Sector        Since 2006, AWS has changed the way that organizations acquire and use technology by providing a highly-scalable, cost-effective, and flexible technology platform in the cloud. AWS is growing rapidly around the world with millions of active customers using the platform every month ranging from startups to Fortune 500 corporations.         Amazon Web Services (AWS) is the leading provider of cloud computing services, providing IT infrastructure offerings ranging from on-demand compute capacity to storage, content delivery, and database services, to machine learning, Internet of Things, server less technologies, and more. The AWS Public Relations team is at the forefront of shaping communications around the most advanced technologies on the planet and helping customers and AWS Partner Network (APN) Partners maximize the benefits of cloud computing.         To support this rapid growth, AWS is looking for a self-motivated and experienced public relations professional to join its U.S. Public Sector PR team. The purpose of this role is to drive awareness around the positive work AWS does in supporting state and local government customers, and how AWS technology helps governments innovate and meet their missions more efficiently.        In this role, you will have experience launching and driving programs, is adept in building and managing media relationships, have B2B and B2G PR experience, and have a proven ability working with and understanding law enforcement and public policy organizations. You are an expert at translating complex technology concepts into concise and well-written narratives, are able to advise business leaders on complex issues in narrow time frames, and have a demonstrated ability in working on cross-functional teams.         You enjoy diving deep into technology, understanding how it is shaping and redefining the world we live in and engaging top tier business, inside-the-beltway, and technology media. You are motivated by a dynamic, highly creative culture where the challenge of breaking new ground and redefining best practices is welcome. In this role, you will have the ability to work alongside a variety of internal teams and also support AWS customers. You must have excellent writing skills, have experience driving proactive campaigns and have a track record of utilizing good judgement in high pressure situations.         This role will be based in the greater Washington, D.C area and may require periodic travel.         Key job responsibilities            Work closely with AWS Public Sector customers, partners, and other 3Ps, to help them tell their stories about success with AWS and how cloud technology is helping them innovate and enhance mission success.      Develop and execute effective, long-term communications strategies for key AWS Public Sector SLG initiatives and programs.      Provide communications counsel to business leaders.      Work alongside PR colleagues around the world to share best practices and execute campaigns.      Write and edit press releases, pitches, PR plans, and related materials.      Establish and foster local, regional, and national media relationships by serving as a trusted source and educator about AWS.      Train and coach AWS executives for press engagements.                   An entrepreneurial spirit, including ability to work independently and autonomously      Good interpersonal skills      Excellent strategic thinking, analytical, and organizational skills, while also staying on top of tactical execution      Outstanding attention to detail, understanding of technology, and ability to communicate complex topics effectively      Experience working with and understanding of public policy      Analytical, data-driven, evidence-based - but creative and adaptive in developing solutions      Passionate about excellence in writing and verbal communications      Thrives in a collaborative environment and is willing to roll up their sleeves to get the job done      Strong judgement, a knack for diplomacy, and the confidence to engage and build consensus with functional leaders at all levels      Experience pitching proactive stories to technology and business publications      Current experience managing media relationships and a network of media contacts        Inclusive Team Culture     Here at Amazon, we embrace our differences. We are committed to furthering our culture of inclusion. We have ten employee-led affinity groups in over 190 chapters globally. We have innovative benefit offerings, and we host annual and ongoing learning experiences, including our Conversations on Race and Ethnicity (CORE) and AmazeCon (gender diversity) conferences. Amazon’s culture of inclusion is reinforced within our 16 Leadership Principles, which remind team members to seek diverse perspectives, learn and be curious, and earn trust.        Work/Life Balance     Our team also puts a high value on work-life balance. Striking a healthy balance between your personal and professional life is crucial to your happiness and success here, which is why we aren’t focused on how many hours you spend at work or online. Instead, we’re happy to offer a flexible schedule so you can have a more productive and well-balanced life—both in and outside of work.         Mentorship and Career Growth     Our team is dedicated to supporting new members. We have a broad mix of experience levels and tenures, and we’re building an environment that celebrates knowledge sharing and mentorship. We care about your career growth and strive to assign projects based on what will help each team member develop into a better-rounded professional and enable them to take on more complex tasks in the future.                        Amazon is committed to a diverse and inclusive workplace. Amazon is an equal opportunity employer and does not discriminate on the basis of race, national origin, gender, gender identity, sexual orientation, protected veteran status, disability, age, or other legally protected status. For individuals with disabilities who would like to request an accommodation, please visit https://www.amazon.jobs/en/disability/us.  ",2 days ago,"81,490 reviews"
https://www.indeed.com/viewjob?jk=b2c6d118bd86ceee&from=web&vjs=3,560,Machine Learning Engineer,"Computer Enterprises, Inc. (CEI)","Newport News, VA","  You must be able to work On-site in Newport News Virginia.   The Machine Learning Engineer develops and implements algorithms and related software to analyze and predict system / component health, machine performance, and application metrics for large mining haul trucks.   Responsibilities      Develops real time and post processing algorithms and related software used to analyze machine data for failure prediction of electrical and mechanical equipment used on large mining haul trucks    Develops algorithms and related software used to analyze machine performance, efficiency, and application metrics    Analyzes machine process data sets using deep learning techniques to discover potential algorithms    Ensures software development process compliance to internal standards    Organizes software structure to ensure stable operating system    Creates documentation to describe software design    Interfaces with other groups (Mechanical, Electrical, Software, Hydraulic, etc.) to create specifications that outline software functions    Evaluates alternative software programming tools and languages    Work within a requirements management process and infrastructure    Works independently and as a team member with other engineers, designers, and production personnel or on ad hoc projects    Participates in Engineering Development Program     Requirements      Experienced individual - with at least 4 or more years’ experience    Knowledge of Big Data techniques and tools    Knowledge and understanding of Engineering concepts    Knowledge of scripting languages (e.g. MATLAB, Python, Bash, etc.)    Ability to apply deep learning skills for developing neural networks, application of artificial intelligence (AI) and other techniques to derive algorithms    Must be willing and able to travel 10% – nationally and internationally to customer supplier sites     Preferences      Knowledge of heavy machinery or automotive preferred (nice to have)    A Master of Science Degree or Master of Engineering Degree (M.S. / M.E. in Computer Science, Computer Engineering or similar) is preferred, or a Bachelor of Science Degree (B.S. in Computer Science, Computer Engineering or similar)     Job Type: Full-time   Pay: From $73,000.00 per year   Benefits:      401(k)    Dental insurance    Health insurance    Life insurance    Paid time off    Relocation assistance    Tuition reimbursement    Vision insurance     Schedule:      Monday to Friday     Ability to commute/relocate:      Newport News, VA: Reliably commute or willing to relocate with an employer-provided relocation package (Required)     Experience:      Python: 1 year (Preferred)    MATLAB: 1 year (Preferred)    Bash: 1 year (Preferred)    Big Data: 1 year (Preferred)     Willingness to travel:      25% (Required)     Work Location: One location ",,
