URL,page_count,job_title,company,location,job_Description,post_date,reviews
https://www.indeed.com/viewjob?jk=330a4bd00659e146&from=web&vjs=3,410,Data Architect,Red Cedar Consultancy LLC,"McLean, VA 22102","     Red Cedar Consultancy, LLC, a fast growing IT services firm is currently looking for smart and self-motivated Data Archtiect with the ability to take on and overcome challenges in a dynamic and collaborative team environment. Provides technical knowledge and analyses for advanced scalable analytical capabilities and tools     Successful candidate will provide technical and subject matter expertise for continued maintenance and enhancement of the TSA Enterprise Information and Data Architecture capabilities. Candidate will have demonstrated capability in providing information and data architectural support services across solution architecture, segment architecture, and enterprise architecture. Key skills and job function includes:         Create, maintain, and guide conceptual and logical models at the enterprise, segment, and solution level, spanning multiple special domains (e.g., aviation security, biometrics, geospatial, cloud, mobile).      Create enterprise information/data views. Gather and analyze information and data to generate new or enhance existing enterprise views to convey as-is and to-be architecture.      Provide strategic information and data/architectural service. Research and analyze specific capabilities or technology areas including but not limited to semantic technologies, robotic process automation, machine learning, and artificial intelligence;      Provide enterprise information and data management support, to include:      Establish and enforce TSA information and data architectural principles and standards;      Provide enterprise information/data management support;      Provide services to enhance TSA EA information and data management maturity;      Identification of EA-related data and information;      Implement recommendations and best practices from the TSA Enterprise Information and Data Study;      Explore the application of technology to different problem sets;      Conduct pilots to demonstrate the power of ML/AI and other automation tools;      Create implementation roadmaps for successful automation pilots;      Provide support to stand up the TSA Chief Data Officer (CDO) function.      ",30+ days ago,
https://www.indeed.com/viewjob?jk=19d6fe229ba99ddc&from=web&vjs=3,410,Technical Product Manager (Remote Friendly),Mission Lane,"Richmond, VA","Mission Lane is revolutionizing access to financial tools to pave a clear way forward for millions of Americans on the path to financial success. We strive to create solutions no one ever has before, to redefine the financial industry for the better. Sound like a mission you could get behind? We are establishing a Machine Learning Operations (MLOps) Engineering team aimed at supporting our organization's growth and excellence in FinTech Machine Learning. Our MLOps team will be responsible for designing, building, and maintaining our Machine Learning (ML) platform on GCP supporting our Data Science team.  Our current Machine Learning stack is Python-based, and so far we have been relying on custom home-grown solutions for model serialization, deployment, and serving. We are in the process of modernizing these systems, and delivering the next generation MLOps infrastructure is a key component of Mission Lane's growth.  Mission Lane's  Engineering  organization is looking for a  Technical Product Manager - MLOps  to join our geographically diverse team.   The impact you'll make in this role:  This individual contributor role will drive the vision, roadmap and execution of our ML platform. You will apply your proven track record of driving mission critical platforms and your skills working with highly technical teams to define and deliver an ML platform that enables machine learning models that unlock growth. You will be part of a team who has a deep commitment to continuous discovery, testing, learning, and ongoing operational excellence.   As the Technical Product Manager, you will:   Establish and refine the vision, value propositions, and strategy of the MLOps platform  Partner with Data Science, Data Engineering, Platform Engineering, Marketing, Operations, and Product to define outcome-driven roadmaps and requirements to deliver a state-of-the-art ML platform  Establish metrics to track platform performance, health, and progress against the strategy  Act as Product Owner in the development process, creating epics and user stories, as well as prioritizing and refining the product backlog  Collaborate with your team in delivering capabilities in an iterative manner  Communicate key platform development stages with stakeholders   To set you up for success in this role from day one, Mission Lane is looking for candidates who have:   4+ years of product management experience for ML/infrastructure engineering platforms and/or ML/data products  Understanding of developing, testing, deploying, monitoring, and operationalizing machine learning models  Understanding of CI/CD pipelines for production machine learning deployments  Knowledge of data/model lifecycle management and governance  Experience with Agile/Lean product development methodologies  Knowledge of DevOps and cloud infrastructure; including Kubernetes  Able to handle fluid strategies and ambiguity  BS degree  You get bonus points for:   Previous experience as a data scientist or ML engineer  Knowledge of Snowflake or other data warehouse platforms  Knowledge of Spark or other parallel computation tools  Knowledge of Airflow or other workflow management platforms for data engineering pipelines  Lean/Agile product management certifications  Experience at a FinTech company or in a regulated industry  BS degree in Computer Science, Mathematics or equivalent practical experience At Mission Lane, we're looking for people who have the courage to take on new challenges. If you need accommodations to perform at your highest potential throughout the application and/or interview process, don't hesitate to reach out: We're committed to ensuring our team members have balance in their lives. Our comprehensive benefits package provides the support you need to thrive at work and at home.  Work:  An engaging culture with access to training programs and advancement opportunities  Life:  Full health, dental, and vision benefits, Flexible Spending Account (for medical and childcare expenses), paid parental leave, and a 401k Company Match  Balance:  Generous PTO, flexible schedules, a Calm App subscription, and more.  More about Mission Lane:  Mission Lane is based in the U.S., with offices in Richmond, Virginia & San Francisco, California. Founded in December 2018, we've rapidly grown to almost 2 million customers.  It all started with a realization: nearly fifty percent of the adult population in the U.S. doesn't have access to a clear line of credit. And by ""clear"" we mean credit without crazy fees that only increase debt. Most traditional credit card companies either overlook or overcharge this group because they have less-than-prime credit scores or no score at all. We decided this just wouldn't do.  We understand that everyone doesn't have the same opportunities. We also know that everyone joins us at different stages of their financial journeys. Providing access to clear credit was a critical first step, but our work isn't done. We are actively developing new products designed to meet our customers where they are, according to their needs.  We get it -  life happens . That's why Mission Lane is hard at work paving a better way forward.  Just like for our customers, Mission Lane creates opportunities for our employees to learn, grow, and prosper. We strive to create an environment that brings out the best in everyone, everyday.   Mission Lane is an Equal Opportunity Employer committed to diversity and inclusion in the workplace. All qualified applicants will receive consideration for employment without regard to sex, race, color, age, national origin, religion, physical and mental disability, genetic information, marital status, sexual orientation, gender identity/assignment, citizenship, pregnancy or maternity, protected veteran status, or any other status prohibited by applicable national, federal, state or local law.  Mission Lane is not currently sponsoring new applicant employment authorization for this position. And please, no third party recruiters.",30+ days ago,19 reviews
https://www.indeed.com/viewjob?jk=ee4b71e5b245cdad&from=web&vjs=3,410,Solutions Architect,Databricks,"Washington, VA","While candidates in the listed locations are encouraged for this role, candidates in other locations will be considered.  Solutions Architects at Databricks lead the growth of the Databricks Unified Analytics Platform. As a team, we have expertise in cloud platforms, data engineering, data analytics, and data science and machine learning. As a member of our team, you will exercise and develop expertise in those areas, using open-source projects such as Apache Spark, MLflow, and Delta Lake. This is a customer-facing role, where you will work with customers, your teammates, the product team, and our post-sales teams, to identify use cases for Databricks, develop architectures and solutions using our platform, and guide customers through the implementation, to accomplish value. In that process, you will build relationships with our customers, find and build champions, and become a trusted advisor. You will report to the Field Engineering Manager for the team.  The impact you will have:   Partner with the sales team to help customers understand how Databricks can help solve their business problems  Provide technical leadership for customers to evaluate and adopt Databricks  Consult on big data architecture, implement proof of concepts for strategic customer projects, data science and machine learning projects, and validate integrations with cloud services and other 3rd party applications  Build and present references architectures, how-tos, and demo applications for customers  Become an expert in, and promote Databricks inspired open-source projects (Spark, Delta Lake, MLflow, and Koalas) across developer communities through meetups, conferences, and webinars  Travel to customers in your region   What we look for:   3+ years in a customer-facing pre-sales, technical architecture, or consulting role  Experience designing and architecting distributed data systems  Comfortable programming in, and debugging, at least one of: Python, Scala, Java, SQL, or R  Experience supporting Public Sector clients  Have built solutions with public cloud providers such as AWS, Azure, or GCP  Expertise in at least one of the following:  Data Engineering technologies ( Ex: Spark, Hadoop, Kafka )  Data Warehousing ( Ex: SQL, OLTP/OLAP/DSS )  Data Science and Machine Learning technologies ( Ex: pandas, scikit-learn, HPO )  [Desired] Degree in a quantitative discipline (Computer Science, Applied Mathematics, Operations Research)   Benefits   Comprehensive health coverage including medical, dental, and vision  401(k) Plan  Equity awards  Flexible time off  Paid parental leave  Family Planning  Gym reimbursement  Annual personal development fund  Work headphones reimbursement  Employee Assistance Program (EAP)  Business travel accident insurance   About Databricks  Databricks is the data and AI company. Thousands of organizations worldwide — including Comcast, Condé Nast, Nationwide and H&M — rely on Databricks' open and unified platform for data engineering, machine learning and analytics. Databricks is venture-backed and headquartered in San Francisco, with offices around the globe. Founded by the original creators of Apache Spark™, Delta Lake and MLflow, Databricks is on a mission to help data teams solve the world's toughest problems. To learn more, follow Databricks on  Twitter ,  LinkedIn  and  Facebook .  Our Commitment to Diversity and Inclusion  At Databricks, we are committed to fostering a diverse and inclusive culture where everyone can excel. We take great care to ensure that our hiring practices are inclusive and meet equal employment opportunity standards. Individuals looking for employment at Databricks are considered without regard to age, color, disability, ethnicity, family or marital status, gender identity or expression, language, national origin, physical and mental ability, political affiliation, race, religion, sexual orientation, socio-economic status, veteran status, and other protected characteristics.  COVID-19 Vaccination Requirement  As a federal government contractor, Databricks requires new U.S. employees to be fully vaccinated against COVID-19. Proof of vaccination will be required as a condition of employment. Databricks will make reasonable accommodations based on medical conditions or religious grounds for qualified candidates in accordance with applicable law. About Databricks  Databricks is the data and AI company. More than 5,000 organizations worldwide — including Comcast, Condé Nast, H&M, and over 40% of the Fortune 500 — rely on the Databricks Lakehouse Platform to unify their data, analytics and AI. Databricks is headquartered in San Francisco, with offices around the globe. Founded by the original creators of Apache Spark™, Delta Lake and MLflow, Databricks is on a mission to help data teams solve the world’s toughest problems.",30+ days ago,3 reviews
https://www.indeed.com/viewjob?jk=f9d964967f64568d&from=web&vjs=3,410,Image Analyst,QinetiQ,"Lorton, VA"," Who Are We?      We are a world-class team of professionals who deliver next generation technology and products in robotic and autonomous platforms, ground, soldier, and maritime systems in 50+ locations world-wide. Much of our work contributes to innovative research in the fields of sensor science, signal processing, data fusion, artificial intelligence (AI), machine learning (ML), and augmented reality (AR).      QinetiQ Inc.’s dedicated experts in defense, aerospace, security, and related fields all work together to explore new ways of protecting the American Warfighter, Security Forces, and Allies. Being a part of QinetiQ Inc. means being central to the safety and security of the world around us. Partnering with our customers, we help save lives; reduce risks to society; and maintain the global infrastructure on which we all depend.      Why Join QinetiQ Inc.?      If you have the courage to take on a wide variety of complex challenges, then you will experience a unique working environment where innovative teams blend different perspectives, disciplines, and technologies to discover new ways of solving complex problems. In our diverse and inclusive environment, you can be authentic, feel valued, be respected, and realize your full potential. QinetiQ Inc. will support you with workplace flexibility, a commitment to the health and well-being of you and your family and provide opportunities to work with a purpose. We are committed to supporting your success in both your professional and personal lives.      QinetiQ Inc. is looking for an experienced Image Analyst to support programs at our Springfield, VA location. The selected candidate will be responsible for the following:      Conduct research in applied image processing and scientific analysis of imagery; knowledge of image formation, and associated discipline phenomenology.      You will support our customers with remote sensing expertise, understanding and training.      Provide imagery science support specifically related to the exploitation of optical and spectral imagery.      Analyze operational requirements and recommend optical or programming solutions to meet customer needs, or modifications to eliminate causes of malfunctions.      As new datasets and imagery modalities are created every day, the selected candidate will help educate, increase awareness, and train new users of specialized mission data and associated products.      This role is part time on site and part time remote.        To Land This Job, You Need:    B.S. in Physics, Applied Science, Computer Science, Software Engineering or applicable engineering or science field      5+ years' experience      Expertise using remote sensing imagery for analysis such as EO/IR, SAR, Hyperspectral, OPIR.      Working knowledge of applied physics, optics, higher mathematics; ability to solve complex problems and create innovative solutions.      Experience in algorithms development environments such as MATLAB, ENVI/IDL is a plus but not required.        Job Type:  Full Time        Clearance Level Must Currently Possess:    Top Secret/SCI      Why QinetiQ Inc.?      Your work will contribute to the protection of American Warfighters and Security Forces.      Opportunity to work with cutting edge technology.      Extensive opportunities for continuous learning, professional growth and advancement.      We only hire the best! No matter if you are entry or senior level, you will have the opportunity learn from some of the best in the industry.      We have fun! We regularly have company events, from luncheons and costume contests to golf tournaments.      We care about YOU and YOUR FAMILY. We offer competitive benefits and health insurance options.      No One Has Time for Long Job Applications!      We completely understand, that is why we have made the application process easy. We promise. This will be simple.        Accessibility/Accommodation:    If because of a medical condition or disability you need a reasonable accommodation for any part of the employment process, please send an e-mail to staffing@us.QinetiQ.com or call   (540) 658-2720  Opt. 4 and let us know the nature of your request and contact information.      QinetiQ Inc. is an Equal Opportunity/Affirmative Action employer. All Qualified Applicants will receive equal consideration for employment without regard to race, age, color, religion, creed, sex, sexual orientation, gender identity, national origin, disability, or protected Veteran status.",30+ days ago,346 reviews
https://www.indeed.com/viewjob?jk=90afd1c3668953ad&from=web&vjs=3,410,Associate Application Engineer,Appian Corporation,"McLean, VA","At Appian, our marketers have the opportunity to tell stories of impact and innovation across a multitude of industries. Being a marketer at Appian means working with cool tech. It means coming up with creative ways to stand above the noise, then making it happen. It means working with amazing customer brands at the forefront of digital. Software that has a real impact on companies and consumers? At Appian, it's more than an empty promise. It's what we do.  Are you passionate about emerging technologies, building on the cutting edge, and tackling challenging problems with apps and workflows? Do you like the idea of creatively conveying the art of the possible with a low-code automation platform, and building experiences that will have an impact on a global developer community? Appian is actively seeking an Associate Application Engineer to develop the apps and workflows that make up both the backbone and the end user experience of Appian Community Edition.  Appian Community Edition is an unlimited-time developer environment for all customers, prospects, partners and developers interested in either test driving Appian's low-code automation platform, or learning and getting Appian Certified. You will showcase how Appian helps organizations build apps and workflows rapidly, with the experiences you build as well as enable our internal teams with powerful tools, automations and analytics.   To be successful in this role, you need:   Crave creating and enhancing cutting-edge applications that convey Appian's value   A strong work ethic, working day-to-day with other developers to meet strategic releases   Interest and aptitude to drive developer engagement through hands-on experiences that inspire new Appian learners   Explore and test drive emerging product features and provide feedback to Engineering   Preferably, experience with Appian, UX Design, AI, Machine Learning, Robotic Process Automation, Process Mining, SQL, and APIs   Some of the tools and resources we will equip you with include:   We'll immerse you into our community rooted in respect starting on day one. Our community is strong and growing! Our affinity groups are a great place to start connecting with peers from all across the globe.   Appian offers a wide variety of growth and development opportunities such as: our in-house Appian MBA program for new managers, Appian University which is a full library of over 3,000 LinkedIn Learning and Udemy courses, Presentation Skills training, and tuition reimbursement for those seeking to further their education.   Basic Qualifications:   B.S. degree in Science, Technology, Engineering, or Math, or otherwise demonstrated aptitude for technology.   About Appian  Before Appian was a company, it was an idea. Not about a product or a market, but about the culture needed to sustain innovation and value. Today, we help businesses build apps and workflows rapidly, with a low-code automation platform.  Appian was founded on the belief that talented and passionate people, given the power and autonomy to excel, will deliver amazing impact. We have worked thoughtfully to create an inclusive, agile and collaborative work environment where employees feel challenged, and all voices are heard. We value and encourage cross-departmental collaboration, and actively seek opportunities to better ourselves and others. Creating impact to us means that when we deliver results, we're focused on lasting positive change.  Join us.",30+ days ago,50 reviews
https://www.indeed.com/viewjob?jk=6a0a3a48f5b8c5b8&from=web&vjs=3,410,Data Scientist (TS/SCI w/POLY REQUIRED),"Eleccion, LLC","McLean, VA","     Role Responsibilities    Involved in the analysis of unstructured and semi-structured data, including latent semantic indexing (LSI), entity identification and tagging, complex event processing (CEP), and the application of analysis algorithms on distributed, clustered, and cloud-based high-performance infrastructures. Exercises creativity in applying non-traditional approaches to large-scale analysis of unstructured data in support of high-value use cases visualized through multi-dimensional interfaces. Handle processing and index requests against high-volume collections of data and high-velocity data streams. Has the ability to make discoveries in the world of big data. Requires strong technical and computational skills - engineering, physics, mathematics, coupled with the ability to code design, develop, and deploy sophisticated applications using advanced unstructured and semi-structured data analysis techniques and utilizing high-performance computing environments. Has the ability to utilize advance tools and computational skills to interpret, connect, predict and make discoveries in complex data and deliver recommendations for business and analytic decisions. Experience with Cloud-based data analysis tools. Experience with machine learning, algorithm analysis, and data clustering.          Qualifications        Requires 3 to 8 years with BS/BA or 3 to 5 years with MS/MA or 0 to 2 years with PhD.         TS/SCI with Poly Required      Focus on design, implementation and operation of data management systems. Design how data is stored, consumed, integrated and managed by different entities and systems.      Experience with SQL, Python, Spark      Machine Learning technologies/packages (Sagemaker, DataBricks, PyTorch and the similar)      Statistical techniques for analyzing data and visualization techniques for summarizing complex data analyses.      ",30+ days ago,
