URL,page_count,job_title,company,location,job_Description,post_date,reviews
https://www.indeed.com/viewjob?jk=63e7a4ef6695a976&from=web&vjs=3,440,Data Analyst,Deloitte,"McLean, VA","    In this age of disruption, organizations need to navigate the future with confidence by tapping into the power of data analytics, robotics, and cognitive technologies such as Artificial Intelligence (AI). Our Strategy & Analytics portfolio helps clients leverage rigorous analytical capabilities and a pragmatic mindset to solve the most complex of problems. By joining our team, you will play a key role in helping to our clients uncover hidden relationships from vast troves of data and transforming the Government and Public Services marketplace.         Work you'll do                   Provide strategic and predictive data analytic support to include identification of data sources.      Employ data analytic methodologies and data science modeling, algorithms, and other techniques and tools to identify trends, provide analysis, make assessments, inform decision making, and incorporate insights into intelligence and other products by increasing data driven decision making.      Collect, analyze, and present data and trends in support of IC-demographic and IC-workforce reports and Congressional tasks.         The team         Deloitte's Government and Public Services (GPS) practice - our people, ideas, technology and outcomes-is designed for impact. Serving federal, state, & local government clients as well as public higher education institutions, our team of over 15,000+ professionals brings fresh perspective to help clients anticipate disruption, reimagine the possible, and fulfill their mission promise.         The GPS Analytics and Cognitive (A&C) offering is responsible for developing advanced analytics products and applying data visualization and statistical programming tools to enterprise data in order to advance and enable the key mission outcomes for our clients. Our team supports all phases of analytic work product development, from the identification of key business questions through data collection and ETL, and from performing analyses and using a wide range of statistical, machine learning, and applied mathematical techniques to delivery insights to decision-makers. Our practitioners give special attention to the interplay between data and the business processes that produce it and the decision-makers that consume insights.         Qualifications         Required:            3+ years of experience with data mining and predictive modeling, data analytics and digital data science      Bachelor's degree      Active certification: AWS Certified Solutions Architect      Must be legally authorized to work in the United States without the need for employer sponsorship, now or at any time in the future      Active TS/SCI with Polygraph security clearance required        Preferred:                   Bachelor's degree in Mathematics or Computer Science      Experience with developing and implementing advanced analytics on large datasets to identify threats and vulnerabilities on a network      Experience with the following technologies, systems, and tools: SQL, Python, Tableau, and Spark, Analytics and Modeling Tools              How you'll grow         At Deloitte, our professional development plan focuses on helping people at every level of their career to identify and use their strengths to do their best work every day. From entry-level employees to senior leaders, we believe there's always room to learn. We offer opportunities to help sharpen skills in addition to hands-on experience in the global, fast-changing business world. From on-the-job learning experiences to formal development programs, our professionals have a variety of opportunities to continue to grow throughout their career.  ",30+ days ago,"10,615 reviews"
https://www.indeed.com/viewjob?jk=d9665b5341ca7022&from=web&vjs=3,430,Lead React Engineer,Deloitte,"Rosslyn, VA 22209","    In this age of disruption, organizations need to navigate the future with confidence by tapping into the power of data analytics, robotics, and cognitive technologies such as Artificial Intelligence (AI). Our Strategy & Analytics portfolio helps clients leverage rigorous analytical capabilities and a pragmatic mindset to solve the most complex of problems. By joining our team, you will play a key role in helping to our clients uncover hidden relationships from vast troves of data and transforming the Government and Public Services marketplace.         Work you'll do         MissionStax is Deloitte's microservice approach to rapidly delivering modular and scalable software applications that meet critical mission needs. MissionStax operates at the intersection of proven commercial technologies and critical government missions. We are looking for an experienced Software Engineering Manager to serve as a Front-End Lead Engineer. The Technical Lead will architect our solutions and lead the development and implementation of amazing web applications for public sector clients.                As part of a cross-functional agile team, lead a team of front-end engineers (approx. 6 practitioners) to launch innovative products for Public Sector clients                Build, lead and serve an effective team of engineers through hiring, coaching, mentoring, feedback and hands-on career development                Establish shared vision with the development team and technical client team and by building consensus on architecture and technical approach                Achieve sprint goals with a team of world-class front-end, back-end, and DevOps engineers                Monitor and measure technical team member performance. Establish metrics, conduct code reviews, and coach and mentor developers                Understand Deloitte's strategic and competitive position and deliver products that are recognized as cutting-edge and best in the industry.         The team         Deloitte's Government and Public Services (GPS) practice - our people, ideas, technology and outcomes-is designed for impact. Serving federal, state, & local government clients as well as public higher education institutions, our team of over 15,000+ professionals brings fresh perspective to help clients anticipate disruption, reimagine the possible, and fulfill their mission promise.         The GPS Analytics and Cognitive (A&C) offering is responsible for developing advanced analytics products and applying data visualization and statistical programming tools to enterprise data in order to advance and enable the key mission outcomes for our clients. Our team supports all phases of analytic work product development, from the identification of key business questions through data collection and ETL, and from performing analyses and using a wide range of statistical, machine learning, and applied mathematical techniques to delivery insights to decision-makers. Our practitioners give special attention to the interplay between data and the business processes that produce it and the decision-makers that consume insights.         Qualifications         Required:            Bachelor's degree required      Must be legally authorized to work in the United States without the need for employer sponsorship, now or at any time in the future      Must be able to obtain and maintain the required clearance for this role      5+ Years of software engineering experience      Demonstrated expertise in JavaScript/TypeScript/React/Redux      Track record of building data-driven web application with RESTful APIs      Strong understanding of JSON Web Tokens and session cookies      Expertise in React state management with Redux              Preferred:                Some creativity and innovation - desire to learn and apply new technologies and products                Experience leading technical delivery as part of a scrum team                A product company mindset to design and lead development of reusable components                Expertise reviewing code of other developers and providing feedback         How you'll grow         At Deloitte, our professional development plan focuses on helping people at every level of their career to identify and use their strengths to do their best work every day. From entry-level employees to senior leaders, we believe there's always room to learn. We offer opportunities to help sharpen skills in addition to hands-on experience in the global, fast-changing business world. From on-the-job learning experiences to formal development programs, our professionals have a variety of opportunities to continue to grow throughout their career.        #LI-GPS        #IND:GPS  ",30+ days ago,"10,615 reviews"
https://www.indeed.com/viewjob?jk=e6de879e6203f851&from=web&vjs=3,440,Technology Consulting Director,Pariveda Solutions,"Arlington, VA 22209","    Overview:        Pariveda is not your average consulting firm. We're growing in Washington DC and looking to add a Technical Director (Principal cohort) to our dynamic and creative consulting team. Pariveda's people-centric model and mission to grow you towards your highest potential will pave the way to grow you from Principal to Vice President.                    Are you tired of feeling like a cog in a machine? Are you ready to make an impact and create change? Are you curious and energized by challenging problems? If you're answering yes to these questions, let's talk. Join our team and be a part of something great.              To learn more about our culture and what you can expect at Pariveda, review our Findamentals – the behaviors that show who we are.              You Can Expect To:           As a member of the Washington DC Leadership Team, you will play an integral role in building our office while developing yourself toward Vice President. At Pariveda, you can expect to:           Advance your career to become a Pariveda Vice President through clearly defined expectations, mentorship from executives, and regular opportunities for advancement      Lead Enterprise Solution Design and Implementation – intersection of business and technology, with focus in: Cloud across platforms (AWS, Azure, Google), Mobility, Data Analytics & Insights (Machine Learning), and User-Centered Design      Manage multiple project teams and oversee all aspects of the SDLC including estimation, sprint planning, requirements gathering, architecting, developing, testing, issue/risk management, change control and delivery      Diagnose complex technical and business problems and implement creative solutions that leverage Pariveda’s capabilities to meet our clients’ needs      Manage the account planning process at existing and prospective clients by identifying new or follow-on opportunities      Actively manage project profitability for both our firm and our clients by taking a leadership role in executing the sales process while understanding client and/or partner legal agreements affecting their teams' work      Support company growth by building and maintaining a strong professional network as well as contributing to the recruitment of new employees      Mentor junior colleagues by providing career development goals, meeting regularly, writing and deliver semi-annual reviews, and advocating for their career advancement      Actively represent our culture by leading and participating in efforts around continuous learning, personal and professional development, community service and team building               We Look For:           The successful candidate possesses the following critical qualifications:           8+ years of technical and/or management consulting experience architecting enterprise and application solutions      Working knowledge of Agile practices      Extensive client account and project management experience with demonstrated ability to plan and manage the execution of custom development projects and complex client engagements      Current or recent leadership of multiple internal and external teams      Strong local network of IT and business executives and business acumen across a variety of industries and business functions      Recognized as a valued trusted advisor in relationships with clients, colleagues, vendors, and other industry professionals      Ability to build consensus and achieve goals through influence      Passionate and successful in mentoring others and developing their careers      Legally authorized to work for any company in the United States without sponsorship               Pariveda Benefits            Transparent and Equitable Salary      Exceptional 401k – 4% company match      Company Ownership through Employee Stock Ownership Plan (ESOP) from your very first day at Pariveda      Plenty of paid time off - 4 weeks of vacation time plus 10 holidays      Paid sabbatical after 5 years of service for Principal levels and above      Paid parental leave      Excellent Healthcare and Wellness      100% company paid premiums for you and your family (medical, dental, vision)      Life Insurance      Short Term and Long Term Disability               Pariveda Solutions aspires that our employee diversity is representative of the markets in which we serve. Employment decisions are based solely on merit and business needs and not on race, color, religion, sex, sexual orientation, gender, gender identity, gender expression, pregnancy, marital status, national origin, citizenship status (if authorized to work in the U.S.), uniform service member, military or veteran status, ancestry, age (over 40), physical or mental disability including HIV or AIDS, medical condition, genetic information, political affiliation, or any other category protected by applicable federal, state, or local law.              #LI-JH1     ",3 days ago,15 reviews
https://www.indeed.com/viewjob?jk=014a7e01a0b0d0b6&from=web&vjs=3,440,Software Engineer,Leidos,"Reston, VA 20190","     Description         Job Description:     Are you ready to join Leidos all-star team? Through training, teamwork, and exposure to challenging technical work, let Leidos show how to accelerate your career path.        The Leidos Innovations Center has an exciting opening for you, our next Software Integration Engineer, to play a key role with the integration and deployment of software for the DOMEX Data Discovery Platform (D3P). The DOMEX Data Discovery Platform (D3P) program is a next generation machine learning pipeline platform providing cutting edge data enrichment, triage, and analytics capabilities to Defense and Intelligence Community members. Our team includes highly skilled systems engineers, software and data engineers, and data scientists and work in Reston, VA or Bethesda, MD.           Working closely with project team members, you will have the opportunity to be involved in the following activities:              Work with a team of system integration engineers to successfully deploy release candidates to production environment.      Participate in test, staging and production deployment.      Assist in the maintenance of services and procedures for a big data pipeline which includes Kafka, Elasticsearch, and several in house written python/java micro services running on Kubernetes      Integrate Docker containers using Kubernetes, Rancher, Helm and other DevOpsSec integration tools      Monitor automated system integration tests to identify failed modules and components      Manage individual project priorities, deliverables, and deadlines      Foster an environment of collaboration with the different team members in the goal of providing quality service and product to our customer                  This is you:              Bachelor’s degree in a related technical field and 4 + years of prior relevant Software Engineering experience or master’s degree with 2+ years of prior relevant experience      Must possess an Active Top Secret clearance and ability to obtain TS/SCI with Poly      At least 2 years of experience with Python      Experience with Docker      Experience with DevOps practices and tools including Continuous Integration/Continuous Delivery (CI/CD) tools and practices      Knowledge of message passing systems such as Kafka or Pulsar or any other messaging system      Experience with Agile practices      Experience with configuration management tools such as Git      Strong verbal and written communication skills      Ability to work in a team and a self-starter who can work on their own                  You will wow us even more if you have these skills:              Experience with ElasticSearch      Experience with NiFi      Experience with any of the following technologies:      o Jenkinsfiles and Groovy     o Make/Makefiles     o Kubernetes monitoring, e.g., Prometheus     o GPU-based Kubernetes     o SALT for deployment automation     o Elasticsearch, Kibana, and Logstash, specifically admin experience     o YAML     o Helm and Helmfile     o Cloudera usage, including Kafka topic creation/management, Zookeeper, Solr, and Flume     o Nexus          Leidos is a Fortune 500® information technology, engineering, and science solutions and services leader working to solve the world's toughest challenges in the defense, intelligence, homeland security, civil, and health markets. The company's 32,000 employees support vital missions for government and commercial customers. For more information, visit www.Leidos.com.        Pay and benefits are fundamental to any career decision. That's why we craft compensation packages that reflect the importance of the work we do for our customers. Employment benefits include competitive compensation, Health and Wellness programs, Income Protection, Paid Leave and Retirement.        Leidos will never ask you to provide payment-related information at any part of the employment application process. And Leidos will communicate with you only through emails that are sent from a Leidos.com email address. If you receive an email purporting to be from Leidos that asks for payment-related information or any other personal information, please report the email to spam.leidos@leidos.com .        All qualified applicants will receive consideration for employment without regard to sex, race, ethnicity, age, national origin, citizenship, religion, physical or mental disability, medical condition, genetic information, pregnancy, family structure, marital status, ancestry, domestic partner status, sexual orientation, gender identity or expression, veteran or military status, or any other basis prohibited by law. Leidos will also consider for employment qualified applicants with criminal histories consistent with relevant laws.        LInC  D3P        Pay Range:     #Featuredjob   ",30+ days ago,"1,314 reviews"
https://www.indeed.com/viewjob?jk=18c51333c6e426e0&from=web&vjs=3,440,DoD DevSecOps Engineer,Guidehouse,"McLean, VA 22102","    Overview:     Guidehouse is a leading global provider of consulting services to the public and commercial markets with broad capabilities in management, technology, and risk consulting. We help clients address their toughest challenges and navigate significant regulatory pressures with a focus on transformational change, business resiliency, and technology-driven innovation. Across a range of advisory, consulting, outsourcing, and digital services, we create scalable, innovative solutions that prepare our clients for future growth and success. The company has more than 10,000 professionals in over 50 locations globally. Guidehouse is a Veritas Capital portfolio company, led by seasoned professionals with proven and diverse expertise in traditional and emerging technologies, markets, and agenda-setting issues driving national and global economies. For more information, please visit: www.guidehouse.com.  Responsibilities:     Guidehouse is partnering with a DoD client to advise on and/or perform the following data science functions:         Data preparation and architecture,      Development of agile algorithmic solutions,      Evaluate and/or execute data governance and data maturity models; and      Conduct data analytics using state of the art mathematical and machine learning/artificial intelligence techniques           Overarching responsibilities will be to support the DoD with leveraging data to support, enhance and execute the mission. Team members will be conducting unique use cases, peer reviews, programmatic development, and technological assessments to provide capabilities that inform the decision-making process and enable data-driven decisions. Prospective candidates should understand the full life cycle of data use, to include acquisition, preparation, analytics and environment development, along with an understanding of DoD data standards.            The DevSecOps Engineer is a team product developer who develops and manages the CI/CD pipelines of a wide variety of applications. Obtains working knowledge of the Air Force PlatformONE ecosystem and experience working at a DoD software factory.    Qualifications:        The DevSecOps Engineer should have a passion for agile and DevSecOps methodologies, including experiencing in providing DevSecOps implementation using Jenkins, Gitlab, or similar tools. Experienced in developing, testing, and maintaining containerized applications. Working knowledge of source version control, build/release tools and methodologies, and CI/CD pipelines. Working knowledge of Software Build process. Should have a passion for building and maintaining CI/CD pipelines for a large enterprise that consists of hundreds of applications. Strong ""security first"" mindset.                    Clearance Requirement: Active security clearance required          Education Requirement: Four (4) year degree in engineering or business management related field from an accredited institution.    Additional Requirements:        The successful candidate must not be subject to employment restrictions from a former employer (such as a non-compete) that would prevent the candidate from performing the job responsibilities as described.              Due to our contractual requirements and an Executive Order from the White House, every federal government employee and onsite federal contractor will be asked to attest to their vaccination status. In the interest of health and safety during the continued unprecedented COVID-19 pandemic, anyone who does not attest to being fully vaccinated will be required to follow CDC guidelines which may include (subject to specific contractual requirements): wearing a mask on the job no matter their geographic location, physically distancing from all other employees and visitors, complying to any screening testing requirements. This requirement will apply to Guidehouse employees who work onsite for the federal government.           Disclaimer:     About Guidehouse     Guidehouse is an Equal Employment Opportunity / Affirmative Action employer. All qualified applicants will receive consideration for employment without regard to race, color, national origin, ancestry, citizenship status, military status, protected veteran status, religion, creed, physical or mental disability, medical condition, marital status, sex, sexual orientation, gender, gender identity or expression, age, genetic information, or any other basis protected by law, ordinance, or regulation.        Guidehouse will consider for employment qualified applicants with criminal histories in a manner consistent with the requirements of applicable law or ordinance including the Fair Chance Ordinance of Los Angeles and San Francisco.        If you have visited our website for information about employment opportunities, or to apply for a position, and you require an accommodation, please contact Guidehouse Recruiting at  1-571-633-1711  or via email at RecruitingAccommodation@guidehouse.com. All information you provide will be kept confidential and will be used only to the extent required to provide needed reasonable accommodation.        Guidehouse does not accept unsolicited resumes through or from search firms or staffing agencies. All unsolicited resumes will be considered the property of Guidehouse and Guidehouse will not be obligated to pay a placement fee.        Rewards and Benefits     Guidehouse offers a comprehensive, total rewards package that includes competitive compensation and a flexible benefits package that reflects our commitment to creating a diverse and supportive workplace.        Benefits include:         Medical, Rx, Dental & Vision Insurance      Personal and Family Sick Time & Company Paid Holidays      Position may be eligible for a discretionary variable incentive bonus      Parental Leave and Adoption Assistance      401(k) Retirement Plan      Basic Life & Supplemental Life      Health Savings Account, Dental/Vision & Dependent Care Flexible Spending Accounts      Short-Term & Long-Term Disability      Tuition Reimbursement, Personal Development & Learning Opportunities      Skills Development & Certifications      Employee Referral Program      Corporate Sponsored Events & Community Outreach      Emergency Back-Up Childcare Program      ",30+ days ago,401 reviews
