URL,page_count,job_title,company,location,job_Description,post_date,reviews
https://www.indeed.com/viewjob?jk=650272feef3caef6&from=web&vjs=3,40,"Data Scientist (1.0 FTE, Days)",Lucile Packard Children's Hospital,"725 Welch Rd, Palo Alto, CA 94304","Information Technology  1.0 FTE, 8 Hour Day Shift At Stanford Children's Health, we know world-renowned care begins with world-class caring. That's why we combine advanced technologies and breakthrough discoveries with family-centered care. It's why we provide our caregivers with continuing education and state-of-the-art facilities, like the newly remodeled Lucile Packard Children's Hospital Stanford. And it's why we need caring, committed people on our team - like you. Join us on our mission to heal humanity, one child and family at a time.  Job Summary This paragraph summarizes the general nature, level and purpose of the job. The Data Scientist role in the Enterprise Analytics group will develop sophisticated analytics to support insight driven interventions in a variety of settings at Stanford Children's Health. This position will apply principles of deep learning and predictive analytics and combine them with knowledge of clinical practice and operations to improve clinical and business outcomes most notably in the burgeoning area of Digital Health.  The position will involve being hands on with data analysis, curation, modeling and testing. The Data Scientist will mine and analyze complex structured and unstructured data sets and provide insights using advanced statistical models. The Data Scientist will collaborate with other like-minded individuals throughout Stanford Medicine to help operationalize predictive analytics and other machine learning solutions. The Data Scientist will help integrate solutions into clinical and business workflows leveraging systems such as the Electronic Medical Record. Essential Functions The essential functions listed are typical examples of work performed by positions in this job classification. They are not designed to contain or be interpreted as a comprehensive inventory of all duties, tasks, and responsibilities. Employees may also perform other duties as assigned. Employees must abide by all Joint Commission Requirements including but not limited to sensitivity to cultural diversity, patient care, patient rights and ethical treatment, safety and security of physical environments, emergency management, teamwork, respect for others, participation in ongoing education and training, communication and adherence to safety and quality programs, sustaining compliance with National Patient Safety Goals, and licensure and health screenings. Must perform all duties and responsibilities in accordance with the hospital's policies and procedures, including its Service Standards and its Code of Conduct.  Develop predictive and prescriptive models that can be applied in a healthcare setting  Implement machine learning solutions into existing workflows in Epic Electronic Medical Record Provide analysis of large, complex data sets including data emanating from our Digital Health program to provide key insights to leaders  Help implement the tools and architecture needed to support machine learning  Work with Data Architecture team to implement models into our Enterprise Data Warehouse  Develop machine learning solutions using established methods such as Bayesian statistical methods, Bayesian networks, NLP, graph models, textual analysis and contextual analysis  Work with Information Systems Clinical Applications team to adopt predictive models into Stanford Children's Health Epic system  Provide guidance into the data architecture and management strategy needed to support machine learning, including the required predictive analytics toolsets and software needed  Work with the Data Architecture team to implement tools in accordance with the machine learning roadmap  Develop and enhance the data architecture to support machine learning solution development, in collaboration with the Data Architecture and Database Management teams at SCH  Engage in governance/clearing house for prioritizing and overseeing machine learning solutions development and deployment processes  Liaise with the Digital Health group to perform deep analysis of data to provide insights into clinical and business aspects of program  Work with Analytics Information Delivery team to deploy data visualizations of machine learning and other data analytics  Minimum Qualifications  Any combination of education and experience that would likely provide the required knowledge, skills and abilities as well as possession of any required licenses or certifications is qualifying.  Education:  Master's or PhD degree in a related field such as Mathematics, Computer Science, Engineering, Statistics from an accredited college or University   Experience:  Four (4) years of experience working in analytical role. Two (2) years of experience working in a data scientist or similar role   License/Certification:  None required.  Knowledge, Skills, & Abilities  These are the observable and measurable attributes and skills required to perform successfully the essential functions of the job and are generally demonstrated through qualifying experience, education, or licensure/certification.  Knowledge and understanding of machine learning techniques and algorithms such as k-NN, Naïve Bayes, SVM, Decision Forests etc.  Strong programming experience in Python or R  Experience in data visualization tools, such as Tableau Ability to communicate and apply governance protocols with other Data Scientists within federated structure  Working knowledge of healthcare systems and terminology  Experience working with Hadoop or other big data technologies a plus Physical Requirements  The Physical Requirements and Working Conditions in which the job is typically performed are available from the Occupational Health Department. Reasonable accommodations will be made to enable individuals with disabilities to perform the essential functions of the job. Equal Opportunity Employer  L ucile Packard Children's Hospital Stanford strongly values diversity and is committed to equal opportunity and non-discrimination in all of its policies and practices, including the area of employment. Accordingly, LPCH does not discriminate against any person on the basis of race, color, sex, sexual orientation or gender identity, religion, age, national or ethnic origin, political beliefs, marital status, medical condition, genetic information, veteran status, or disability, or the perception of any of the above. People of all genders, members of all racial and ethnic groups, people with disabilities, and veterans are encouraged to apply. Qualified applicants with criminal convictions will be considered after an individualized assessment of the conviction and the job requirements, and where applicable, in compliance with the San Francisco Fair Chance Ordinance.",Just posted,244 reviews
https://www.indeed.com/viewjob?jk=db48dae41281436a&from=web&vjs=3,20,Data Scientist,Illumina,"San Diego, CA","Position Summary: Illumina’s Finance Performance Management group is seeking a Data Scientist to develop and engineer predictive models/algorithms for finance and business applications. The Finance Performance Management group is focused on developing predictive data products using financial and commercial datasets, with the goal of improving finance and business processes and driving efficiency. The right candidate will need to have a solid understanding of data science projects life cycle. Responsibilities:  Develop and engineer algorithms and end-to-end predictive data products that generate actionable insights and measurable business impacts. Engage and develop strategic partnerships across both the Data Science and many business stakeholders to identify and prioritize opportunities for advanced analytics projects with high business impact. Communicate data analysis/modeling results effectively by making compelling cases through storytelling and visualizations Approach and initiate data science projects with a goal of productionizing solutions. Develop scalable and efficient automated processes for models’ validation, implementation, and monitoring Identify and analyze the applicability and scalability of innovative data science methods, algorithms, and tools Partner with other data team on evangelizing Machine Learning and democratizing data analytics. Listed responsibilities are an essential, but not exhaustive list, of the usual duties associated with the position. Changes to individual responsibilities may occur due to business needs. Qualifications: 2-4 years min of practical experience with machine learning and predictive modeling.  Master's degree or PhD in Data Science, Computer Science, Engineering, Statistics or related quantitative field. Demonstrated experience in all phases of managing data science projects including problem definition, solution formulation, model building, productionizing, and delivering measurable impact. Proven experience with scripting languages for data processing and AI/ML model development (Python and R)  Deep knowledge of traditional ML concepts such as SVMs, trees, and boosting as well as more recent deep learning fundamentals. Understanding of data structures and software/data product design principles. Ability to work independently and collaboratively in an interdisciplinary team environment. Strong communicator with excellent verbal and written presentation skills - able to evangelize data informed decision-making at all levels. All listed requirements are deemed as essential functions to this position; however, business conditions may require reasonable accommodations for additional task and responsibilities.  Concerns regarding COVID-19 continue as positive cases are experienced in the communities in which we operate. Please be aware that, as a condition of employment, Illumina may require proof of COVID vaccination in accordance with local statutory requirements (subject to limited exceptions) beginning November 1, 2021. At Illumina, we strive to foster a diverse and inclusive workplace by cultivating an environment in which everyone contributes to our mission. Built on a strong foundation, Illumina has always been rooted in openness, collaboration, and seeking alternative views and perspectives to propel innovation in genomics. We are proud to confirm a zero-net gap in pay, regardless of gender, ethnicity, or race. We also have several Employee Resource Groups (ERG) that deliver career development experiences, increase cultural awareness, and demonstrate our collective commitment to diversity and inclusion in the communities we live and work. We are proud to be an equal opportunity employer committed to providing employment opportunity regardless of sex, race, creed, color, gender, religion, marital status, domestic partner status, age, national origin or ancestry, physical or mental disability, medical condition, sexual orientation, pregnancy, military or veteran status, citizenship status, and genetic information. If you require accommodation to complete the application or interview process, please contact accommodations@illumina.com.",4 days ago,246 reviews
https://www.indeed.com/viewjob?jk=17fa272da0365637&from=web&vjs=3,20,,,,,,
https://www.indeed.com/viewjob?jk=03701dc8cc99233c&from=web&vjs=3,20,Data Scientist I,Levi Strauss & Co.,"1155 Battery Street, San Francisco, CA","JOB DESCRIPTION You're an original. So are we  . We're a company of people who like to forge our own path. We invented the blue jean in 1873, and we reinvented khaki pants in 1986. We pioneered labor and environmental guidelines in manufacturing. And we work to build sustainability into everything we do. Our brands stand for freedom and self-expression around the world. Where we lead, others follow. For more than 160 years, we've used the strength of our brands to lead with our values and make an outsized impact on the world. We employ more than 15,000 people globally to support our great brands: Levi's®, Dockers®, Denizen® and Signature by Levi Strauss & Co.™ As a Data Scientist, you will work with different functions within the organization to help build strategic capabilities. You will implement Machine Learning and Deep Learning algorithms from ideation to deployment, including managing complex data science workflows. You will report to the Lead Data Scientist of the Americas region. About the Job Partner with team members across the organization to identify opportunities to use our data to serve our disruptive planning strategy. Build predictive models using Statistical Methods, Machine Learning and Deep Learning to substantially improve our processes and contribute to business growth. Assess and evaluate the potential and validity of Statistical, ML, and DL approaches and data sources. Manipulate large datasets with both structured and unstructured data. Develop proof-of-concept prototypes to evaluate hypotheses. Use experience with data gathering and cleaning, exploratory data analysis, data visualization, and advanced modeling to communicate applicable insights and findings to audiences with varying levels of technical sophistication. Continuously contribute to our data science culture and strategy. About You Desired Education and Work Experience Master's/ PhD degree (computer science, applied mathematics, applied statistics, data science, or similar) Overall 2+ years (with Bachelor's or Master's) or 1+ years (for PhDs) relevant professional experience in data science, applied statistics, computer science, and machine learning engineering in the consumer goods, tech, or retail industries. Required Technical Skills 2+ years of prior experience in a business-focused Data Scientist role 2+ years of hands-on experience analyzing data, drawing conclusions, defining recommended actions, building predictive models, and visualizing results. 2+ years of SQL development skills writing complex queries. 3+ years of experience with Python or R 3+ years of experience deploying Machine Learning algorithms in a production environment. Experience in Reinforcement Learning is a huge plus. 2+ years of experience with data visualization tools in Python or R. 2+ years of experience working with cloud environments in AWS, Azure, or GCP. Familiarity with containerization and distributed systems. Experience building web application and simple UI solutions. Experience in Data Engineering and DevOps preferred. We put a lot of thought into our programs to provide you with a benefits package that matters. Whether it is for medical care, taking time off, improving your health or planning for retirement, we've got you covered. Here's a small snapshot: 401K match: $1.25 for every $1.00 you contribute up to the first 6% of pay you save. Five hours of paid volunteer time per month with nonprofit organizations Product discount of 50% off regular-price merchandise Paid Family Leave #LI-Remote EOE M/F/Disability/Vets LOCATION Remote - USA FULL TIME/PART TIME Full time Current LS&Co Employees, apply via your Workday account.",30+ days ago,"2,774 reviews"
https://www.indeed.com/viewjob?jk=0374858e70564e1b&from=web&vjs=3,10,Data Scientist - Nationwide Opportunities,"Amazon Web Services, Inc.","San Diego, CA"," Bachelor’s degree in a highly quantitative field (Computer Science, Machine Learning, Operational Research, Statistics, Mathematics, etc.) or equivalent professional or military experience  Experience with ML fields, e.g., natural language processing, computer vision, statistical learning theory  4+ years of industry experience in predictive modeling, data science, and analysis  Experience in an ML engineer or data scientist role building and deploying ML models or hands on experience developing deep learning models  Experience writing code in Python, R, Scala, Java, C++ with documentation for reproducibility  Experience handling terabyte size datasets, diving into data to discover hidden patterns, using data visualization tools, writing SQL, and working with GPUs to develop models  Experience writing and speaking about technical concepts to business, technical, and lay audiences and giving data-driven presentations  Want to help the largest global enterprises derive business value through the adoption of Artificial Intelligence (AI) and Machine Learning (ML)? Excited by using massive amounts of disparate data to develop ML models? Eager to learn to apply ML to a diverse array of enterprise use cases? Thrilled to be a part of Amazon who has been pioneering and shaping the world’s AI/ML technology for decades? At Amazon Web Services (AWS), we are helping large enterprises build ML models on the AWS Cloud. We are applying predictive technology to large volumes of data and against a wide spectrum of problems. AWS Professional Services works together with AWS customers to address their business needs using AI solutions. AWS Professional Services is a unique consulting team. We pride ourselves on being customer obsessed and highly focused on the AI enablement of our customers. If you have experience with AI, including building ML models, we’d like to have you join our team. You will get to work with an innovative company, with great teammates, and have a lot of fun helping our customers. A successful candidate will be a person who enjoys diving deep into data, doing analysis, discovering root causes, and designing long-term solutions. Inclusive Team Culture Here at AWS, we embrace our differences. We are committed to furthering our culture of inclusion. We have thirteen employee-led affinity groups, reaching 85,000 employees in over 190 chapters globally. We have innovative benefit offerings, and host annual and ongoing learning experiences, including our Conversations on Race and Ethnicity (CORE) and AmazeCon (gender diversity) conferences. Amazon’s culture of inclusion is reinforced within our 16 Leadership Principles, which remind team members to seek diverse perspectives, learn and be curious, and earn trust. Work/Life Balance Our team puts a high value on work-life harmony. Striking a healthy balance between your personal and professional life is crucial to your happiness and success here. We are a customer-obsessed organization—leaders start with the customer and work backwards. They work vigorously to earn and keep customer trust. As such, this is a customer facing role in a hybrid delivery model. Project engagements include remote delivery methods and onsite engagement that will include travel to customer locations as needed. Mentorship & Career Growth Our team is dedicated to supporting new members. We have a broad mix of experience levels and tenures, and we’re building an environment that celebrates knowledge sharing and mentorship. We care about your career growth and strive to assign projects based on what will help each team member develop into a better-rounded professional and enable them to take on more complex tasks in the future. This is a customer-facing role and you will be required to travel to client locations and deliver professional services as needed.  Major responsibilities include:   Assist customers by being able to deliver a ML project from beginning to end, including understanding the business need, aggregating data, exploring data, building & validating predictive models, and deploying completed models with concept-drift monitoring and retraining to deliver business impact to the organization  Use AWS AI services (e.g., Personalize), ML platforms (SageMaker), and frameworks (e.g., MXNet, TensorFlow, PyTorch, SparkML, scikit-learn) to help our customers build ML models  Research and implement novel ML approaches, including hardware optimizations on platforms such as AWS Inferentia  Work with our other Professional Services consultants (Big Data, IoT, HPC) to analyze, extract, normalize, and label relevant data, and with our Professional Services engineers to operationalize customers’ models after they are prototyped  Master’s degree of PhD in a highly quantitative field (Computer Science, Machine Learning, Operational Research, Statistics, Mathematics, etc.)  Ability to develop strategic, baselined, data modeling processes; ability to accurately determine cause-and-effect relationships.  Publications or presentations in recognized ML journals or conferences  Deep technical skills, consulting experience, and business savvy to interface with all levels and disciplines within our customers’ organization  Demonstrable track record of dealing well with ambiguity, prioritizing needs, and delivering results in a dynamic environment  Amazon is committed to a diverse and inclusive workplace. Amazon is an equal opportunity employer and does not discriminate on the basis of race, national origin, gender, gender identity, sexual orientation, protected veteran status, disability, age, or other legally protected status. For individuals with disabilities who would like to request an accommodation, please visit https://www.amazon.jobs/en/disability/us. Pursuant to the San Francisco Fair Chance Ordinance, we will consider for employment qualified applicants with arrest and conviction records. Pursuant to the Los Angeles Fair Chance Ordinance, we will consider for employment qualified applicants with arrest and conviction records. For employees based in Colorado, this position starts at $114,700 per year. A sign-on bonus and restricted stock units may be provided as part of the compensation package, in addition to a range of medical, financial, and/or other benefits, dependent on the position offered.",30+ days ago,"77,982 reviews"
