URL,page_count,job_title,company,location,job_Description,post_date,reviews
https://www.indeed.com/viewjob?jk=0ecf6722d5e821fd&from=web&vjs=3,80,Data Scientist/Senior Data Scientist,Blizzard Entertainment,"Irvine, CA 92618","Team Name: Global Insights Job Title: Data Scientist/Senior Data Scientist Requisition ID: R008633 Job Description: It takes a Blizzard to make a Blizzard game, and that level of effort doesn’t end once the game is released; we support our games for years after they’re in the hands of gamers world-wide. Global Insights works closely with the game development, business and internal service teams at Blizzard to produce insights and models that enable us to make the most epic player experiences. The machine learning & AI (Artificial Intelligence) group within Global Insights focuses on applying the latest in key research areas to build lasting data products and tools for our game and business teams. We are looking for a Data Scientist/Senior Data Scientist who specializes in Machine Learning and Artificial Intelligence to join our Global Insights team. Blizzard data scientists design and deploy data-powered products and services that scale to the terabytes of data that Blizzard games generate every day. The ideal candidate is passionate about the latest innovations in machine learning, artificial intelligence and statistics; has expertise in designing highly scalable machine learning algorithms; with strong programming skill to help deploy and maintain them. Responsibilities Research and develop state-of-the-art machine learning solutions to enhance business and gameplay objectives. Work closely with data and software engineers to deploy, automate, and maintain models seamlessly on production systems. Effectively translate findings into sustainable live data products or actionable recommendations for game design and business teams. Communicate about machine learning models and products to both technical and non-technical audiences. Minimum Qualifications Master’s or PhD with a specialization in machine learning, artificial intelligence, computer vision/graphics, statistics, applied math, algorithm design, or a related quantitative field. Specialization in one of the following areas: predictive modeling, recommendation system, reinforcement learning, computer vision/graphics, procedural content generation, anomaly detection and natural language processing. Hands-on applied or research experience developing machine learning models on large scale data sets. Proficient in Python and experienced in at least one other higher-level programming languages like Java, C++, C#, Scala, etc. Preferred Qualifications A track record of original contributions to research communities of ML/AI, computer vision/graphics, statistics, applied math, etc. Experience with cloud computing services like AWS (Amazon Web Service), Azure or Google Cloud. Experience with SQL or NoSQL databases. Experience with data visualization tools like Tableau. Experience with video games Required Application Materials Resume Cover Letter which should include: Why you are interested in working at Blizzard. How you think data science can support game development and business What games you like to play if any **Submissions that do not contain Cover Letters will not be considered. Blizzard Entertainment is a global company committed to growing our employees along with the business. We offer generous benefits and perks with an eye on providing true work / life balance. We’ve worked hard to foster an intensely collaborative and creative environment, a diverse and inclusive employee culture, and training and opportunity for professional growth. Our people are everything. Our core values are real, and our mission has never changed. We are dedicated to creating the most epic entertainment experiences…ever. Join us! We are an Equal Opportunity Employer. All qualified applicants will receive consideration for employment without regard to race, color, religion, sex, sexual orientation, gender identity, gender expression, national origin, protected veteran status, or any other basis protected by applicable law, and will not be discriminated against on the basis of disability.",30+ days ago,232 reviews
https://www.indeed.com/viewjob?jk=0dda3592d49ea59a&from=web&vjs=3,80,Data Scientist - Operations Research (CPLEX/Gurobi),Nordstrom Inc,"Los Angeles, CA","Job Description ** The team for this role is located in Seattle. Candidates can work remotely if they live in Atlanta, Chicago, Denver or Los Angeles. You must be open to relocation to one of these cities, when we go back to the office, if you live elsewhere. ** Nordstrom is a fashion specialty retailer founded on a simple idea: offer each customer the best possible service, quality, value and selection. At Nordstrom, providing great customer service goes beyond the selling floor. It takes a team of individuals with different talents and skills to continuously improve service and our results. Our Advanced Analytics team works in partnership with other areas of the Company to develop insights, algorithms, and data products that support decision making, products, and technologies used throughout Nordstrom. When you join our team, you are welcomed into a family dedicated to creating memorable and rewarding shopping experiences for our customers. As an integral part of the Operations Research/Supply Chain Analytics team, the data scientist role will focus on the area of Operations Research and Supply Chain Optimization. The ideal candidate is a creative and passionate problem-solver who thinks big, acts quickly, and is motivated to develop new approaches to optimize Nordstrom’s supply chain using quantitative and cutting-edge technology. A day in the life… Perform data analysis on large scale data sets in the context of retail and supply chain operations. Develop optimization and/or statistical models and collaborate with stakeholders to deploy them to solve problems in areas such as network design, S&OP, transportation optimization, and inventory allocation, etc. Engage broadly with business to frame, structure and prioritize business requirements into practical analytical solutions. Communicate insights and recommend areas for improvements to stakeholders to drive impactful business results. Basic Qualifications A graduate degree in a quantitative field such as Operations Research, Industrial Engineering, Computer Science, Mathematics, or Statistics. 2+ years hands-on experience using optimization software such as Gurobi, Cplex, or Xpress. 2+ years hands-on experience with data modeling using SQL, Python, R, SparkSQL, etc. Solid understanding of basic statistics modeling techniques such as regression, classification, decision trees, etc. Excellent written and verbal communication skills to explain complex technical issues to both technical and non-technical audiences. Preferred Qualifications 2+ years industrial experience in solving supply chain problems such as network planning, S&OP, transportation, inventory optimization, and forecasting. Familiarity with machine learning algorithms such as clustering, classification, neural networks, collaborative filtering, survival analysis, etc. Experience with cloud computing solutions such as AWS, Azure preferred. Knowledge of visualization tools such as Tableau, d3.js, Shiny. Expertise in a computing language (Java/C++) and able to write production level data science code This range may vary for candidates hired to work in locations other than Colorado. Minimum = $70,600/annually Maximum = $112,700/annually We’ve got you covered… Our employees are our most important asset and that’s reflected in our benefits. Nordstrom is proud to offer a variety of benefits to support employees and their families, including: Medical/Vision, Dental, Retirement and Paid Time Away Life Insurance and Disability Merchandise Discount and EAP Resources A few more important points... The job posting highlights the most critical responsibilities and requirements of the job. It’s not all-inclusive. There may be additional duties, responsibilities and qualifications for this job. Nordstrom will consider qualified applicants with criminal histories in a manner consistent with all legal requirements. Applicants with disabilities who require assistance or accommodation should contact the nearest Nordstrom location, which can be identified at www.nordstrom.com. Nordstrom Careers Privacy Policy: https://careers.nordstrom.com/#/contact-us/privacy © 2021 Nordstrom, Inc. Current Nordstrom employees: To apply, log into Workday, click the Careers button and then click Find Jobs.",30+ days ago,"14,115 reviews"
https://www.indeed.com/viewjob?jk=dd749f9a65f53216&from=web&vjs=3,80,Machine Learning & NLP Data Scientist,HANUMAYAMMA INNOVATIONS AND TECHNOLOGIES,"San Francisco, CA","Location: San Francisco / Fremont / Sacramento, California or remote due to COVID-19 We are looking for data science & machine learning (ML) engineer with exclusive knowledge of Macroeconomic, Government Finance Analytics, Budgets, and develop ML models using Natural Language Processing (NLP) and quantitative techniques. As part of the role, deployment of ML models to worldwide consumption is highly desired ask. As part of the role, annotating & creating supervised data taking into global macroeconomic key indicators, agricultural yield performance, Labor statistics, Government Finance Statistics, and Micro Farm level P&L are the required skills. Skills: Identification of Key Macroeconomic Trends Codifying Government Finance Statistics & Annotation of Key Budget Documents Supervised, Unsupervised Learning Models (Classification Models, Regression Model & Time Series) Public Cloud Computing Machine Learning Cloud Analytics - Amazon Sage Maker, Microsoft Azure Machine Learning Studio, Google Agricultural Economics (Familiarity with USDA Datasets, World Organization, US Data.Gov and other countries agricultural strategies) Historical Agricultural analysis - Wheat, Rice, Dairy, Soy, Corn and other major fields Exposure to Federal Budgets Familiarity with agricultural imports/exports Per capita consumption Climate influence on agricultural output Jupyter Notebook    Skills and Experiences    Excellent people & leadership skills. (Optional) Exposure to Software, Hardware, Mobile Devices and Sensors. Good communication skills Care and Love for Humanity and beyond. (Optional) Paper based Data Collection & Sketching. A passion for innovation and outside box thinking  Please Submit your Resume to hiring manager skedari@hanuinnotech.com or hr@hanuinnotech.com",30+ days ago,
https://www.indeed.com/viewjob?jk=da4904482be2c226&from=web&vjs=3,80,"Data Scientist, Data Science and Analytics",QuestBridge,California,"QuestBridge is a national nonprofit program that connects outstanding low-income students with educational opportunities that can change their lives, as well as the demographics of our nation's leading educational institutions.  The Data Scientist position offers a unique opportunity for someone passionate about bringing their data and technical experiences to enhance educational programs and contribute to the growth of a far-reaching entrepreneurial social venture. Reporting to the Director of Data Science and Analytics (DSA), this person will lead, manage, and execute on data-related operations and initiatives, often working across multiple teams at QuestBridge.  Our Data Scientist will have the opportunity to collaborate with program, data, and engineering team members across other departments for thought partnership, feedback, and growth. In addition to technical experience, this position has a strong focus on rigor, communication, project management, and systems-thinking. If you will enjoy applying your skills to data projects that fuel QuestBridge's mission, we look forward to reviewing your application!  Role and Responsibilities  Success of this role is defined by achieving the following:   Accurate and efficient implementation of tools, models, and other data operations related to our College Programs, College Partnerships, and other programmatic efforts across QuestBridge  Improvements in QuestBridge's data consistency, accuracy, and usage  Detailed understanding of the limits and potential of QuestBridge data  Detailed understanding of data used in all analytics projects (including visualizations that help others gain clarity for decision-making)  Well-documented code that others can easily reuse and/or build upon  Timely and relevant analyses and reports for operational use  Completion of complex reporting and analysis requests  Creation and maintenance of documentation of QuestBridge data and data processes  Ability to support data-related operational tasks across the organization  Travel to events to interact and support students and apply these experiences to continuously improve programming  Read and evaluate student applications for the College Prep Scholars Program, National College Match, and other various opportunities  Other duties, as assigned  Minimum Qualifications  Relevant work experience or training of at least 4 years  Demonstrated experience working in a centralized role that requires collaboration with many teams across a given organization  Experience leading a project from ideation to implementation  Previous success in leading data initiatives for impact (scoping, managing stakeholders, visualization, insights, improved decision-making)  Ability to leverage best coding practices to conduct data cleaning, data wrangling, analyses, and build data products  Familiarity with some or all of the following: SQL  Python (Pandas, Scikit Learn, etc.)  R  Git  Statistics  Functional programming  Exceptional attention to detail, with ability to maintain focus on the larger picture  Strong written, and verbal communication skills  Ability to manage multiple projects from start to finish (organizing bandwidth, workflows, and multiple deliverables for on-time delivery) in fast-paced environments  Ability to incorporate feedback  Track record of taking initiative  Passion for QuestBridge's mission  Preferred Qualifications  Master's Degree in Computer Science, Statistics, Economics or another quantitative field  Experience working with data in the education sector  Track record of producing analyses that result in meaningful decision-making  Experience increasing efficiency of processes, and automation of analyses and reporting  Experience using CRM platforms and application  Experience with using data science and machine learning techniques to help teams and organizations better serve their constituents  Compensation  Competitive compensation is commensurate with experience and skills for the position.  Hours and Location of Work  This is a full-time position remote within the US. Employees will be expected to be engaged online and travel approximately once per quarter.  Application Process  Please include a thoughtful cover letter with your application, and a sample of past data-related projects and any relevant code from the project. Apply Now!  Thank you for your interest in employment with QuestBridge. QuestBridge is an equal opportunity employer.",30+ days ago,
https://www.indeed.com/viewjob?jk=0411d280fb3ba510&from=web&vjs=3,80,"Research Scientist, Embodied AI (PhD)",Facebook App,"Menlo Park, CA","Facebook is seeking a Research Scientist to join Facebook AI Research, a research organization focused on making significant progress in AI. Individuals in this role are expected to be recognized experts in identified research areas such as artificial intelligence, machine learning, computational statistics, and applied mathematics, particularly including areas such as deep learning, graphical models, reinforcement learning, computer perception, natural language processing and data representation. The ideal candidate will have a keen interest in producing new science to understand intelligence and technology to make computers more intelligent.    Perform research to advance the science and technology of intelligent machines with a physical or virtual embodiment (e.g. robots, egocentric personal assistants). Perform research that enables such embodied agents to ‘see’ (or more broadly, perceive their environment through vision or other senses), ‘talk’ (i.e. hold a natural language dialog grounded in their environment), ‘act’ (i.e. navigate and interact with their environment to accomplish goals), and ‘reason’ (i.e. consider and plan for the long-term consequences of their actions). Advance the science and engineering of such embodied agents in simulation (e.g. using FAIR’s Habitat simulator) and/or on robotic platforms, potentially but not exclusively via large-scale reinforcement or imitation learning, sim2real transfer, meta-learning, domain adaptation, etc. Contribute research that can be applied to Facebook product development.    Currently has or is in the process of obtaining a PhD degree or completing a postdoctoral assignment in Computer Science or a related field Publications in machine learning, robotics, computer vision, AI, computer science, statistics, applied mathematics, data science, or related technical fields Experience solving analytical problems using quantitative approaches Experience manipulating and analyzing data from varying sources Experience communicating research Coding experience in C++, Python, or other similar language Must obtain work authorization in country of employment at the time of hire and maintain ongoing work authorization during employment    Research and software engineer experience demonstrated via an internship, work experience, coding competitions   Facebook's mission is to give people the power to build community and bring the world closer together. Through our family of apps and services, we're building a different kind of company that connects billions of people around the world, gives them ways to share what matters most to them, and helps bring people closer together. Whether we're creating new products or helping a small business expand its reach, people at Facebook are builders at heart. Our global teams are constantly iterating, solving problems, and working together to empower people around the world to build community and connect in meaningful ways. Together, we can help people build stronger communities - we're just getting started.  Facebook is proud to be an Equal Opportunity and Affirmative Action employer. We do not discriminate based upon race, religion, color, national origin, sex (including pregnancy, childbirth, or related medical conditions), sexual orientation, gender, gender identity, gender expression, transgender status, sexual stereotypes, age, status as a protected veteran, status as an individual with a disability, or other applicable legally protected characteristics. We also consider qualified applicants with criminal histories, consistent with applicable federal, state and local law.Facebook is committed to providing reasonable accommodations for candidates with disabilities in our recruiting process. If you need any assistance or accommodations due to a disability, please let us know at accommodations-ext@fb.com.",30+ days ago,643 reviews
https://www.indeed.com/viewjob?jk=8517444f8400cb85&from=web&vjs=3,80,Data Scientist,Meredith Corporation,"Los Angeles, CA","Job Title Data Scientist Job Description Data Scientist Company: With over 25 million surveys collected annually from thousands of retailers worldwide, Bizrate Insights is one of the largest sources of verified customer-generated seller ratings and reviews, helping both retailers and consumers make informed decisions. Bizrate Insights’ core solutions cover online visitors and buyers as well as retail store buyers, allowing retailers of all sizes to build best-in-class customer experiences, gain competitive intelligence, and attract more qualified traffic. We believe in hard work, kindness, dedication, accountability, helping each other, never stop learning, and getting stuff done. If you share those values and want to be part of a team that is fast paced as a startup but with rock-solid support from an industry leader, come join a team of like-minded, skilled professionals where you can learn and share your knowledge! Los Angeles, CA candidates preferred, but we are open to Stamford, CT office if you are willing to work PST time zone hours. Bizrate Insights is a member of Synapse Group, Inc, which is a Meredith company. Why you should work with us: Our biggest investment is in people like you. At Meredith, we offer comprehensive health benefits and 401k matching, plus career-boosting opportunities like tuition reimbursement, learning sessions and attendance at tech conferences to help you thrive. For this role at Bizrate Insights, you can expect the fast-paced excitement of a startup with the rock-solid support from Meredith, an industry leader, with some nice perks on the side. If you are a passionate technologist who can get a lot done while having fun, come join a team of like-minded, skilled professionals where you can learn and share your knowledge! You will be: Participating in activities across the data science lifecycle: business case definition, data collection, cleaning, integration, analysis, visualization, feature engineering, modeling with machine learning algorithms, interpreting the models/results, and reporting. Communicating and coordinating effectively with product managers, software engineers, analytical groups and customer-facing teams in an agile environment. Working with data processing pipelines for analyzing gigabyte- to terabyte-scale data from multiple sources. Designing actionable data products based on statistical analysis and machine learning methods and working on their deployment to enterprise systems to move the needle for business at Meredith / Bizrate Insights. Learning continuously in the areas of data science, machine learning, ad technology, marketing operations, data ecosystems, content operations, social media analysis and industry standard measurements. You have: Degree in computer science, engineering, statistics, or other quantitative fields. (Master’s degree is preferred) Solid understanding of popular machine learning algorithms including supervised, un-supervised, and semi-supervised ones. What is the difference between algorithms? What algorithm would you choose for a given problem and why? What are the pros and cons of these algorithms? What is cross validation, hold-out sample, RMSE, overfitting, bias, …? Proficient in one or more core data science programming languages (Python) and the ability to become functional in emergent languages and APIs as needed (Java, Scala, …). Practical experience of building a full cycle machine learning engine from cleansing data to training and hyper parameter optimization to methods for evaluating the accuracy to identifying the ways to improve the accuracy of the model. Exposed to and experienced with state-of-the-art machine learning toolkits such as Spark ML, TensorFlow, scikit-learn, xgboost, NLP … preferably in Big Data frameworks (e.g. Apache Spark). A self-learner with capability to switch from the independent contributor and leader of the project to a collaborative contributor on the team (and vice versa) depending on the demand of the project and availability of the resources. Collaborate with stakeholders, partners and clients to ensure that all parties are aligned and supportive of the project's priorities, requirements, timeline and objectives. Familiarity with the MapReduce paradigm and Apache Spark project. Proficient with SQL as a means of gathering data from relational databases. Practiced data manipulation and mining of structured and unstructured data. Experience in visualizations for business stakeholders using a variety of visualization tools from MS Excel, libraries in Python. Familiarity with AWS ecosystem is a plus. It is the policy of Meredith to provide equal employment opportunity (EEO) to all persons regardless of age, color, national origin, citizenship status, physical or mental disability, race, religion, creed, gender, sex, sexual orientation, gender identity and/or expression, genetic information, marital status, status with regard to public assistance, veteran status, or any other characteristic protected by federal, state or local law. In addition, Meredith will provide reasonable accommodations for qualified individuals with disabilities. Accommodation requests can be made by emailing Meredith.Human.Resources@meredith.com . Meredith requires employees entering its workplaces or performing work offsite to verify and provide proof of full COVID-19 vaccination. This is a condition of employment unless an applicant is eligible, under applicable law, for a medical or religious accommodation, or as otherwise required under applicable law. Meredith participates in the federal E-Verify program to confirm the identity and employment authorization of all newly hired employees. For further information about the E-Verify program, please click here: http://www.uscis.gov/e-verify/employees #NMG#",30+ days ago,163 reviews
https://www.indeed.com/viewjob?jk=16e4329e5f63f7b6&from=web&vjs=3,80,,,,,,
