URL,page_count,job_title,company,location,job_Description,post_date,reviews
https://www.indeed.com/viewjob?jk=f54f3451c8151874&from=web&vjs=3,20,Dashboard Data Scientist,California State University,"Long Beach, CA","Chancellor's Office Statement  Join our team at the California State University, Office of the Chancellor, and make a difference in providing access to higher education. We are currently seeking experienced candidates for the position of  Dashboard Data Scientist . The CSU Chancellor's Office, located on the waterfront adjacent to the Aquarium of the Pacific in downtown Long Beach, is the headquarters for the nation's largest and most diverse system of higher education. The CSU Chancellor's Office offers a premium benefit package that includes outstanding vacation, health, and dental plans; a fee waiver education program; membership in the California Public Employees Retirement System (PERS); and 14 paid holidays a year.  Salary  The salary range for this classification is  $4,372 to $10,792  per month.  Classification  Analyst Programmer – Career  Position Information  The California State University, Office of the Chancellor, is seeking a  Dashboard Data Scientist  to provide data analytic technical support to the CSU Student Success Dashboard team, working under the direction of the Assistant Director, Student Success Dashboard Data Scientist. The incumbent will work with CO departments and campus users to determine functional report requirements, write technical specifications based on user requirements, update, test, and maintain databases supporting the Student Success dashboards for CSU and non-CSU campuses as well as implement and validate descriptive and predictive analytic algorithms as necessary in support of Graduation Initiative 2025.  Responsibilities  Under the general direction of the  Assistant Director, Student Success Dashboard Data Scientist , the  Dashboard Data Scientist  will:  Collaborate with CO Institutional Research and Analyses Department, CSU campuses and external agencies to collect new dashboard data in support of Graduation Initiative 2025.  Extract, clean, merge, manipulate, and manage annual and term-by-term source data to create dashboard datasets.  Generate statistical results and predictive models and communicate findings to dashboard team using commercial and open-source software (SAS, R, Python, Tableau, M-Plus, etc.).  Help configure the dashboard data for optimal presentation and analysis of campus data in support of Graduation Initiative 2025.  Validate and refine dashboard content and implementations assuring the quality and accuracy of Dashboard reports.  Problem-solve to meet dashboard reporting requirements.  Work with the Dashboard team to develop requirements for implementing and overseeing campus participation in the CSU Student Success Dashboard.  Participate in daily and other regular and ad-hoc dashboard-related meetings.  Qualifications  This position requires:  A Bachelor’s Degree in a social science (Education, Psychology, Psychometrics, Sociology, Public Health, Economics, etc.), science, mathematics, or information systems (Mathematics, Computer Science, Statistics, Business Intelligence, etc.) field.  2+ years of experience gathering, processing, cleaning, and developing reports, graphs, maps, and/or other visualizations  2+ years of experience developing, testing, and analyzing statistical and descriptive models for real-world applications.  Proficiency in a statistical programming/scripting language (R, SAS, STATA, SPSS, or others).  Ability to provide good judgment and decision-making, problem solving.  Ability to present complex findings and recommendations in a clear concise manner both in writing and verbally.  Active listening, critical thinking, good interpersonal skills and ability to multi-task.  Knowledge of qualitative content analytic techniques.  Knowledge and expertise in a variety of data collection methodologies    Preferred Qualifications  Master’s Degree in a social science (Education, Psychology, Sociology, Public Health, Economics, etc.), science, mathematics, or information systems (Mathematics, Computer Science, Statistics, Business Intelligence, etc.) field preferred.  Experience with large, complex datasets (e.g., Higher Ed/University student datasets, US Census micro data, High School and Beyond, etc.)  Experience with data analytic, predictive analytic, and other data-based forecasting methods  Experience with any of the following data programming languages: SQL, Python.  Experience in data visualization tools (Tableau, Plotly, or others)  Demonstrated experience working with cross-functional teams to deliver exceptional work preferred.    Application Period  Priority consideration will be given to candidates who apply by  January 21, 2022 . Applications will be accepted until the job posting is removed.  How To Apply  Please click ""Apply Now"" to complete the California State University, Chancellor's Office online employment application.  Equal Employment Opportunity  The university is an Equal Opportunity Employer and does not discriminate against persons on the basis of race, religion, color, ancestry, age, disability, genetic information, gender, gender identity, gender expression, marital status, medical condition, National origin, sex, sexual orientation, covered veteran status, or any other protected status. Reasonable accommodations will be provided for qualified applicants with disabilities who self-disclose by contacting the Senior Human Resources Manager at  (562) 951-4070 .  Title IX  Please view the Notice of Non-Discrimination on the Basis of Gender or Sex and Contact Information for Title IX Coordinator at: https://www2.calstate.edu/titleix  E-Verify  This position requires new hire employment verification to be processed through the E-Verify program administered by the Department of Homeland Security, U.S. Citizenship and Immigration Services (DHSUSCIS)' in partnership with the Social Security Administration (SSA).  If hired, you will be required to furnish proof that you are legally authorized to work in the United States.  COVID19 Vaccination Requirement  The CSU requires faculty, staff, and students who are accessing campus facilities to be immunized against COVID-19 or declare a medical or religious exemption. Any candidates advanced in a currently open search process should be prepared to comply with this requirement as a condition of employment. The systemwide policy can be found at https://calstate.policystat.com/policy/9779821/latest/  Background  The Chancellor's Office policy requires that the selected candidate successfully complete a full background check (including a criminal records check) prior to assuming this position.",4 days ago,"1,109 reviews"
https://www.indeed.com/viewjob?jk=5be963ac99565028&from=web&vjs=3,10,Data Scientist - Experimentation,Stitch Fix,California,"About the Team  The Experimentation and Inference Frameworks team leverages expert experimental design, statistical modeling, and causal inference to help Stitch Fix rigorously evaluate our actions and technology. Our team develops tools and frameworks to address complex experimental designs and observational analyses. We work closely with cross-functional partners both on the business side and within the Algorithms team to identify opportunities to improve and scale experimentation.  About the Role  In this role you will have the chance to build experimentation and inferential frameworks and drive research into human-in-the-loop behavior through experimental design, implementation, and analysis to drive strategic business decisions. You will have autonomy to help shape the direction of experimentation and inference at Stitch Fix through your ideas to improve what we do and how we do it.  You're excited about this opportunity because you will get the chance to…   Identify, develop, and evangelize tooling, approaches, and data products that raise the bar of validity in experiment design and analyses across the company  Frame slippery business problems and innovate a path forward  Research and implement statistical approaches to solve unique business challenges  Collaborate with multiple teams and functions to deliver deep-dive analyses and experiment design for new initiatives and high-priority business areas  Develop and iterate on our processes to empower more efficient and rigorous experimentation   We're excited about you because…   You have an advanced degree in a quantitative field with an emphasis on experimentation and/or inferential statistics  You have 3+ years of work experience in data science  You have experience designing/conducting experiments in an industry setting  You have experience partnering cross-functionally and enjoy gathering input from stakeholders  You are a proactive communicator who helps simplify and move complex problems forward  You have experience coding at a production level in Python or R  You are innovative and inspired to take on new challenges and you do not shy away from potential failure   Why You'll Love Working at Stitch Fix   We are a group of people who are bright, kind and motivated by challenge. You can be your authentic self here, and are empowered to encourage others to do the same!  We are a successful, fast-growing company at the forefront of tech and fashion, redefining retail for the next generation  We are a technologically and data-driven business  We are committed to our clients and connected through our vision of ""Transforming the way people find what they love""  We love solving problems, thinking creatively and trying new things  We believe in autonomy & taking initiative  We are challenged, developed and have meaningful impact  We take what we do seriously. We don't take ourselves seriously  We have a smart, experienced leadership team that wants to do it right & is open to new ideas  We offer competitive compensation packages and comprehensive health benefits  You will be proud to say that you work for Stitch Fix and will know that the work you do brings joy to our clients every day   About Stitch Fix  At Stitch Fix, we're about personal styling for everybody and we believe in both a service and a workplace where you can be your best, most authentic self. We're the first fashion retailer to combine technology and data science with the human instinct of a Stylist to deliver a deeply personalized shopping experience. This novel juxtaposition attracts a highly diverse group of talented people who are both thinkers and doers. All of this results in a simple, powerful offering to our customers and a successful, growing business serving millions of men, women, and kids. We believe we are only scratching the surface on our opportunity, and we're looking for incredible people like you to help us carry on that trend.  Please review Stitch Fix's Recruiting Privacy Policy here:  https://www.stitchfix.com/privacy/usrecruitingprivacy",Today,547 reviews
https://www.indeed.com/viewjob?jk=a9304d4666a8d06b&from=web&vjs=3,10,Data Scientist II,Inland Empire Health Plans,"10801 6th St, Rancho Cucamonga, CA 91730","Position Summary/Position Under the direction of the Data Science Systems Manager, the Data Scientist II is responsible for modeling complex institutional problems, discovering insights and identifying opportunities using statistical, algorithmic, mining and visualization techniques. In addition to advanced analytic skills, this role is also proficient at integrating and preparing large, varied datasets, architecting specialized database, and computing environments, and communicating results. Collaborating closely with Data Science Developers, this role will partner with our business stakeholders to identify ways to augment and enhance our data in order provide insight beyond what can be gleaned from the data we have today. Major Functions (Duties and Responsibilities) 1. Lead and drive cross functional data science projects from beginning to end: build relationships with partner teams, frame and structure questions, collect and analyze data. 2. Apply descriptive and predictive analytics to help drive insights and business decisions. 3. Apply a diverse set of tactics such as statistics, quantitative reasoning, and machine learning to research and produce insights. 4. Work with data engineering and data solutions teams to ensure proper data tracking is set up for features and support debugging and development of new ETL processes. 5. Build deep-dive analyses and eventually machine learning models to better forecast risk across the portfolio for our contracts and claims activity. 6. Support business operations, finance, quality systems, and other internal teams by building analytics and reporting to understand overall business performance and increase organizational efficiencies 7. Manage tests for specific provider and generate data to build out case studies and messaging strategies. 8. Designs experiments, test hypotheses, and build models. 9. Conducts data analysis and moderately complex algorithm. 10. Works with Institute stakeholders to identify the business requirements and the expected outcome. 11. Works with and alongside business analysts by suggesting other products of interest to the client. 12. Models and frames business scenarios that are meaningful and which impact on critical business processes and/or decisions. 13. Collaborates with Institute subject matter experts to select the relevant sources of information. 14. Recommends ongoing improvements to methods and algorithms that lead to findings, including new information. 15. Provides on-going tracking and monitoring of performance of decision systems and statistical models. 16. Communicate analysis and decisions to high-level stakeholders and executives in verbal, visual, and written formats. 17. Collaborate with business leaders, subject matter experts, and decision makers to develop success criteria and optimize new solutions, features, policies, and models. 18. Demonstrate a commitment to support IEHP’s strategic priorities to become a 5-Star Health Plan and incorporate LEAN principles into daily work. Supervisory Responsibilities Leading: Self Experience Qualifications Four or more (4+) years of experience in analytics, data science, and business intelligence. Experience in developing algorithms, predictive analytics, or statistical models. Experience in analyzing large data sets that have complex designs that are unstructured, structured, and semi-structured. Proven ability to facilitate cross-functional projects that depend on the contributions of others in a variety of disciplines. Fluency with data warehouse design practices, analytics, and visualization technologies. Experience in the use of statistical packages. Preferred Experience Experience in the areas of medical or health services is preferred. Education Qualifications Master Degree in Mathematics, Statistics or Computer Science, or related field from an accredited institution is required. Preferred Education Doctorate degree from an accredited institution preferred. Drivers License Required No Knowledge Requirement Strong understanding of Machine Learning theory with significant applied experience. Strong scientific Python skills using pandas, scikit-learn, and statsmodels, as well as strong understanding of model deployment patterns. Manipulating large datasets and using database and general-purpose programming language (such as Hadoop MapReduce, Python, JavaScript, or other big data frameworks, Java). Familiarity with basic principles of distributed computing and/or distributed databases. Demonstrable ability to quickly understand new concepts-all the way down to the theorems- and to come out with original solutions to mathematical issues. Good communication and interpersonal skills. Knowledge of one or more business/functional areas. Working knowledge of diagnosis and procedure coding, medical terminology, knowledge of managed care, claims payment processes, and insurance terminology required. Skills Requirement Strong analysis and critical thinking skills. Strong written and verbal communication skills. Excellent interpersonal/ communication skills. Abilities Requirement Ability to multi-task while maintaining careful attention-to-detail. Ability to handle multiple projects, data input, and strong problem-solving capability. Ability to build relationships and influence across the organization. Independent self-starter who is driven to success, takes great pride in accomplishments and works with a sense of urgency to meet deadlines and address competing priorities. Commitment to Team Culture The IEHP Team environment requires a Team Member to participate in the IEHP Team Culture. A Team Member demonstrates support of the Culture by developing professional and effective working relationships that include elements of respect and cooperation with Team Members, Members and associates outside of our organization. Working Conditions Word processing involving computer keyboard and screens. Willingness to be on call, 7x24x365 (less pre-approved exceptions) and attend to technical issues outside of normal business hours. Physical Requirements Keyboarding: Traditional - FREQUENTLY Keyboarding: Other - FREQUENTLY Use of computer mouse - FREQUENTLY Hearing: One-on-One - FREQUENTLY Communicate: Verbally engage with customer base - FREQUENTLY Side to side motion of the wrist - FREQUENTLY Up and down flexion of wrist - FREQUENTLY Communicate: Information/ideas verbally - FREQUENTLY Alternate Sit/Stand or Walk at Will - FREQUENTLY Near Visual Acuity - FREQUENTLY Develop and maintain positive work relationships - FREQUENTLY Sitting - CONSTANTLY Indoors - FREQUENTLY Lighting - CONSTANTLY Regular contacts: co-workers, supervisor - FREQUENTLY Problem Solving - FREQUENTLY Memory - FREQUENTLY Understand and follow direction - FREQUENTLY Regular and reliable attendance - CONSTANTLY  Starting Salary:  $119,100.80 - $151,860.80 Pay rate will commensurate with experience Inland Empire Health Plan (IEHP) is the largest not-for-profit Medi-Cal and Medicare health plan in the Inland Empire. We are also one of the largest employers in the region. With a provider network of more than 6,000 and a team of more than 2,000 employees, IEHP provides quality, accessible healthcare services to more than 1.2 million members. And our mission and core values help guide us in the development of innovative programs and the creation of an award winning workplace. As the healthcare landscape is transformed, we’re ready to make a difference today and in the years to come. Join our Team and Make a Difference with us! IEHP offers a Competitive salary and a benefit package with a value estimated at 35% of the annual salary, including medical, dental, vision, team bonus, and retirement plan.",25 days ago,152 reviews
https://www.indeed.com/viewjob?jk=f7d54e3ebeb29182&from=web&vjs=3,20,Lead Data Scientist - Customer Data Science,Hulu,"Santa Monica, CA 90404","Data scientists at Disney Streaming Services are the insights and modeling partners for the growth, content, marketing, product, and engineering teams at Disney+, Hulu and ESPN+. They use data to empower decision-makers with information, predictions, and insights that ultimately influence the experiences of millions of users worldwide. Scientists on the team build models, perform statistical analysis, and create visualizations to provide scalable, persistent capability that is iteratively improved through direct interaction with cross-functional business partners. WHAT YOU'LL DO Modeling: Design, build and improve machine learning models. Work end to end from data collection, feature generation and selection, algorithm development, forecasting, visualization and communicating of model results. Collaborate with engineering to productionize models. Drive experimentation to test impact of model based optimization. Deep analysis: Develop comprehensive understanding of subscriber and payment data structures and metrics. Mine large data sets to identify opportunities for driving growth and retention of subscribers. Visualization of Complex Data sets: Development of prototype solutions, mathematical models, algorithms, and robust analytics leading to actionable insights communicated clearly and visually. Partnership: Partner closely with business stakeholders to identify and unlock opportunities, and with other data teams to improve platform capabilities around data modeling, data visualization, experimentation and data architecture. WHAT TO BRING Master’s degree in a quantitative field (e.g. Computer Science, Engineering, Mathematics, Physics, Operations Research, Econometrics, Statistics) 7+ years of experience designing, building, and evaluating practical machine learning solutions 7+ years of experience with statistical programming language (e.g. Python, Spark, PySpark) and database languages (e.g. SQL) NICE TO HAVES Doctorate degree in a quantitative discipline Excellent analytical skills, advanced level of statistics knowledge Strong expertise with Python and libraries such as scikit-learn, SciPy Familiarity with Bayesian modeling and probabilistic programming packages such as PyMC Familiarity with data platforms and applications such as Databricks, Jupyter, Snowflake, Airflow, Github Familiarity with data exploration and data visualization tools such as Tableau, Looker Familiarity with designing and analyzing A/B testing and other experiment types Demonstrated skills in selecting the right statistical tools given a data analysis problem Ability to adapt quickly in a fast-moving environment with shifting priorities Strong communication skills, for both technical and non-technical audiences Ability to handle multiple tasks concurrently and in a timely manner, including large and complex ones Demonstrated leadership experience, including people and project management",30+ days ago,131 reviews
